Date,Comment_ID,Parent_ID,Level,Author,Content,Permalink,Post_URL
2026-03-24T17:29:27.000Z,1148576437396975,,0,Đình Long Abo,"Theo e đc biết về dinh dưõng nhé cơ thể như 1 ngôi nhà cần có gạch( protein, tinh bột), vữa gắn kết gạch( vitamin và khoáng chất), ống nước chất béo tốt( omega 3) hàng rào bảo vệ như probiotic( lợi khuẩn), chất xơ cơ thể muốn phát triển tốt thì cần đầy đủ. Đặc biệt giúp bẹ tập vận động và tắm nắng, gen, dinh dưỡng, tập luyênn nhé ạ Dạ mình có biết về thương hiệu nutrilite thương hiệu dinh dưỡng đầu tiên trên thế giới và có trang trại hữu cơ đạt chứng nhận usda ấy ạ, e đang dùng luôn nè ạ, có hoá đơn và mộc đỏ luôn ạ, theo giỏi trang e hoặc ib e nhé",https://www.facebook.com/groups/nuoiconbangsuacongthu/posts/1148529674068318/?comment_id=1148576437396975,https://www.facebook.com/groups/nuoiconbangsuacongthu/posts/1148529674068318/
2026-03-27T07:15:00.000Z,1150605230527429,,0,Phùng Thanh Thúy,"Bé lớn nhà chị uống pediasure thấy tăng chiều cao, cân nặng tốt nên cho bé nhỏ uống luôn, giờ nhóc nhỏ 4 tuổi cao 109cm rồi, em tham khảo sữa này cho con thử xem",https://www.facebook.com/groups/nuoiconbangsuacongthu/posts/1148529674068318/?comment_id=1150605230527429,https://www.facebook.com/groups/nuoiconbangsuacongthu/posts/1148529674068318/
2026-03-27T07:29:02.000Z,1150612153860070,,0,Hoài An,"Mình từng lo con thấp còi nhưng sau khi cho dùng VPMilk Grow+ khoảng 3 tháng thì thấy bé cao lên đáng kể. Bé thích vì sữa thơm ngon, uống dễ nên không bỏ ngày nào. Nhờ có Canxi trong sữa nên mình thấy hiệu quả rõ hơn.",https://www.facebook.com/groups/nuoiconbangsuacongthu/posts/1148529674068318/?comment_id=1150612153860070,https://www.facebook.com/groups/nuoiconbangsuacongthu/posts/1148529674068318/
2026-03-27T09:20:48.000Z,1150670410520911,,0,Nguyễn Giáng Tiên,"bé nhà em lúc trước nhỏ con, cũng sợ con lùn, cho đi khám dinh dưỡng được khuyên cho con vận động nhiều hơn với dùng thêm pediasure. Con uống sữa này hơn 6 tháng nay thấy chiều cao tăng tốt, ăn ngủ tốt nên người cháu cũng khỏe hơn",https://www.facebook.com/groups/nuoiconbangsuacongthu/posts/1148529674068318/?comment_id=1150670410520911,https://www.facebook.com/groups/nuoiconbangsuacongthu/posts/1148529674068318/
2026-03-30T01:39:59.000Z,1152687843652501,,0,Ngọc Ánh,"Mẹ tham khảo thử sữa grow+ của vpmilk xem, bé con nhà mình từ khi dùng loại này thì thấy bé cao hơn, dáng người săn chắc hơn đó, trong sữa có canxi, K2, D3 nên hỗ trợ phát triển xương và chiều cao khá ổn nha",https://www.facebook.com/groups/nuoiconbangsuacongthu/posts/1148529674068318/?comment_id=1152687843652501,https://www.facebook.com/groups/nuoiconbangsuacongthu/posts/1148529674068318/
2026-03-31T14:46:33.000Z,1153752053546080,,0,Hoa Lê,"con tớ lúc trước ăn uống kém, đứng kế bạn thấy con thấp lùn, đợt đó thấy các mom review pediasure cải thiện cân, cao cho bé cũng cho con dùng thử, trộm vía hợp sữa, tăng cả cân, cao luôn đó",https://www.facebook.com/groups/nuoiconbangsuacongthu/posts/1148529674068318/?comment_id=1153752053546080,https://www.facebook.com/groups/nuoiconbangsuacongthu/posts/1148529674068318/
2026-04-01T03:15:32.000Z,1154127116841907,,0,Cỏ Ba Lá,"Bé nhà mình uống VPMilk Grow+ thấy cơ thể khỏe hơn, tăng cân đều và chiều cao cải thiện. Mình nghĩ do sữa có Canxi kết hợp Vitamin D3 và K2 hỗ trợ xương, thêm năng lượng từ carbs và chất béo giúp bé phát triển toàn diện hơn.",https://www.facebook.com/groups/nuoiconbangsuacongthu/posts/1148529674068318/?comment_id=1154127116841907,https://www.facebook.com/groups/nuoiconbangsuacongthu/posts/1148529674068318/
