Date,Comment_ID,Parent_ID,Level,Author,Content,Permalink,Post_URL
2026-03-30T11:47:56.000Z,1152966190291333,,0,Diễm Thảo,"https://s.shopee.vn/163aLEnCq Mom tham khảo sữa Kidsmix của Pháp nha, đang được các Bs NĐ khuyên dùng ạ",https://www.facebook.com/groups/nuoiconbangsuacongthu/posts/1151565033764782/?comment_id=1152966190291333,https://www.facebook.com/groups/nuoiconbangsuacongthu/posts/1151565033764782/
2026-03-30T15:00:22.000Z,1153075050280447,,0,Trần Thu Thủy,A2 Platinum đi mom. Vị thanh nhạt giống sữa mẹ nè m . Uống song song với sữa mẹ tuần đầu lon nhỏ cũng đc .,https://www.facebook.com/groups/nuoiconbangsuacongthu/posts/1151565033764782/?comment_id=1153075050280447,https://www.facebook.com/groups/nuoiconbangsuacongthu/posts/1151565033764782/
2026-03-31T02:47:20.000Z,1153394110248541,,0,Hương,hipp nhé b. nhạt,https://www.facebook.com/groups/nuoiconbangsuacongthu/posts/1151565033764782/?comment_id=1153394110248541,https://www.facebook.com/groups/nuoiconbangsuacongthu/posts/1151565033764782/
2026-04-09T08:34:50.000Z,1160080972913188,,0,Quỳnh Nhi,"tui cũg từg phân vân z, sau chọn colosbaby lactoferrin vị thanh dễ uốg lắm",https://www.facebook.com/groups/nuoiconbangsuacongthu/posts/1151565033764782/?comment_id=1160080972913188,https://www.facebook.com/groups/nuoiconbangsuacongthu/posts/1151565033764782/
2026-04-12T11:55:45.000Z,1162259626028656,,0,An Bình,Sữa thanh m ạ cho e hỏi Sinh xong vết thâm ko hết hả các mom. híc! Có kem gì thoa mờ k ah,https://www.facebook.com/groups/nuoiconbangsuacongthu/posts/1151565033764782/?comment_id=1162259626028656,https://www.facebook.com/groups/nuoiconbangsuacongthu/posts/1151565033764782/
