Date,Comment_ID,Parent_ID,Level,Author,Content,Permalink,Post_URL
2026-04-17T04:55:59.000Z,1675776110275006,,0,Kim Oanh Kim,"🍼 Dưới 1 tuổi: sữa công thức gần như là nguồn dinh dưỡng chính, nên bắt buộc phải chọn loại phù hợp với nhu cầu của bé (trí não, tiêu hoá, đề kháng…) 🥛 Trên 1 tuổi: câu chuyện nó khác rồi 👉 Bé đã ăn dặm tốt, khẩu phần đa dạng hơn (cơm, thịt, cá, rau, trái cây…) 👉 Lúc này sữa không còn là nguồn chính nữa, mà chỉ là phần bổ sung thêm 👉 Và đây là lúc có thể dùng sữa tươi (sữa bò) 📌 Nhưng cần hiểu rõ sự khác nhau: 🌼 Sữa tươi 👉 Cung cấp dinh dưỡng nền: đạm, béo, đường lactose, canxi 👉 Năng lượng khá tốt, dễ uống, dễ dùng hằng ngày 👉 Nhưng: vi chất không được “thiết kế riêng” cho từng độ tuổi 🌼 Sữa công thức 👉 Ngoài đạm – béo – đường còn được bổ sung thêm: DHA, ARA, kẽm, sắt, lợi khuẩn, chất xơ… 👉 Công thức được nghiên cứu theo nhu cầu từng giai đoạn phát triển của bé 👉 Phù hợp hơn với các bé có nhu cầu đặc biệt: biếng ăn, tiêu hoá kém, cần tăng đề kháng… 👉 Nói đơn giản cho mẹ dễ hình dung: Sữa tươi là “dinh dưỡng cơ bản” Còn sữa công thức là “dinh dưỡng có thiết kế” 📌 Vậy trên 1 tuổi nên chọn gì? 👉 Nếu bé ăn tốt, đa dạng, tăng trưởng ổn → có thể dùng sữa tươi mỗi ngày 👉 Nếu bé ăn kém, nhẹ cân, hay ốm, tiêu hoá yếu → vẫn nên ưu tiên sữa công thức để hỗ trợ tốt hơn 👉 Quan trọng nhất không phải là chọn sữa nào “xịn hơn” Mà là chọn cái phù hợp với tình trạng thực tế của con 👍",https://www.facebook.com/groups/1113753773143912/posts/1675769546942329/?comment_id=1675776110275006,https://www.facebook.com/groups/1113753773143912/posts/1675769546942329/
2026-04-17T05:12:36.000Z,1675784686940815,,0,Anh Ngoc Nguyen,. Hóg,https://www.facebook.com/groups/1113753773143912/posts/1675769546942329/?comment_id=1675784686940815,https://www.facebook.com/groups/1113753773143912/posts/1675769546942329/
2026-04-17T05:30:54.000Z,1675794583606492,1675784686940815,1,Kim Oanh Kim,Anh Ngoc Nguyen bà tham khảo thông tin tui để ở cmt bên trên nha,https://www.facebook.com/groups/1113753773143912/posts/1675769546942329/?comment_id=1675784686940815&reply_comment_id=1675794583606492,https://www.facebook.com/groups/1113753773143912/posts/1675769546942329/
2026-04-17T05:31:03.000Z,1675794666939817,1675776110275006,1,Bảo Nữ,"Kim Oanh Kim ơi bé nhà mình sắp 1t và đang uống maeil. Khi bé 1t có thể cho bé uống aptamil pha sẵn kết hợp cùng đc ko, để bé làm quen dễ hơn sữa tươi sau này",https://www.facebook.com/groups/1113753773143912/posts/1675769546942329/?comment_id=1675776110275006&reply_comment_id=1675794666939817,https://www.facebook.com/groups/1113753773143912/posts/1675769546942329/
2026-04-17T06:23:03.000Z,1675819580270659,1675794666939817,2,Kim Oanh Kim,"Bảo Nữ dc nè bà, aptamil kid có nền 51% là sữa tươi á",https://www.facebook.com/groups/1113753773143912/posts/1675769546942329/?comment_id=1675776110275006&reply_comment_id=1675819580270659,https://www.facebook.com/groups/1113753773143912/posts/1675769546942329/
2026-04-18T23:45:42.000Z,1677145706804713,,0,Nguyễn Cao Thắng,"Canxi D3,k2 magie thì không thể thiếu trong chuyển hoá canxi và pt chiều cao mẹ nhé!",https://www.facebook.com/groups/1113753773143912/posts/1675769546942329/?comment_id=1677145706804713,https://www.facebook.com/groups/1113753773143912/posts/1675769546942329/
2026-04-19T02:39:31.000Z,1677229253463025,1677145706804713,1,Kim Oanh Kim,Nguyễn Cao Thắng,https://www.facebook.com/groups/1113753773143912/posts/1675769546942329/?comment_id=1677145706804713&reply_comment_id=1677229253463025,https://www.facebook.com/groups/1113753773143912/posts/1675769546942329/
2026-04-20T04:40:03.000Z,1678074216711862,,0,Hằng Thu,Mẹ cá e xin link mua sữa,https://www.facebook.com/groups/1113753773143912/posts/1675769546942329/?comment_id=1678074216711862,https://www.facebook.com/groups/1113753773143912/posts/1675769546942329/
2026-04-20T04:54:50.000Z,1678082016711082,1678074216711862,1,Kim Oanh Kim,Hằng Thu tui có Maeil á bà https://s.shopee.vn/4VVTdtDXZZ,https://www.facebook.com/groups/1113753773143912/posts/1675769546942329/?comment_id=1678074216711862&reply_comment_id=1678082016711082,https://www.facebook.com/groups/1113753773143912/posts/1675769546942329/
2026-04-23T06:54:32.000Z,1680515123134438,,0,Hường Nguyễn,nhà mình uống cả sữa tươi sữa hạt. ảnh thích sữa hạt pinkfong kiddiemeal lắm ý,https://www.facebook.com/groups/1113753773143912/posts/1675769546942329/?comment_id=1680515123134438,https://www.facebook.com/groups/1113753773143912/posts/1675769546942329/
2026-04-25T05:21:24.000Z,1682170206302263,,0,Vui Mai,..,https://www.facebook.com/groups/1113753773143912/posts/1675769546942329/?comment_id=1682170206302263,https://www.facebook.com/groups/1113753773143912/posts/1675769546942329/
2026-05-03T04:01:10.000Z,1688789385640345,1680515123134438,1,Hoài Thương,Hường Nguyễn mua ở đâu sữa hạt đó mom,https://www.facebook.com/groups/1113753773143912/posts/1675769546942329/?comment_id=1680515123134438&reply_comment_id=1688789385640345,https://www.facebook.com/groups/1113753773143912/posts/1675769546942329/
2026-05-10T17:12:59.000Z,1694944178358199,,0,Kim Yến,"C ơi , sữa cao năng lượng infatrini thì như nào ạ , bé e sinh non , ốm dậy e cho ún 1 lon thấy trvia , k biết uống lâu dài thì ntn , bé e ti mẹ hoàn toàn",https://www.facebook.com/groups/1113753773143912/posts/1675769546942329/?comment_id=1694944178358199,https://www.facebook.com/groups/1113753773143912/posts/1675769546942329/
2026-05-12T06:26:33.000Z,1696189408233676,,0,Bo Cong Anh,"Nhà e bs thêm sữa tươi luôn nè tối uống sct, ngày uống sữa kidsten",https://www.facebook.com/groups/1113753773143912/posts/1675769546942329/?comment_id=1696189408233676,https://www.facebook.com/groups/1113753773143912/posts/1675769546942329/
2026-05-12T06:27:16.000Z,1696189748233642,1696189408233676,1,Phạm Ngọc,Bo Cong Anh sữa của Hàn vị thanh nhạt dễ hợp tác m nhỉ,https://www.facebook.com/groups/1113753773143912/posts/1675769546942329/?comment_id=1696189408233676&reply_comment_id=1696189748233642,https://www.facebook.com/groups/1113753773143912/posts/1675769546942329/
