Date,Comment_ID,Parent_ID,Level,Author,Content,Permalink,Post_URL
2026-06-13T14:22:09.000Z,2203931120340590,,0,Trần Tường Vy,"mình thì cho con qua dùng sữa nan sup á, sữa có chứa đạm whey thủy phân 1 phần hỗ trợ tốt mấy vấn đề của mẫn cảm, kết hợp với 5hmo nên giúp con tăng cao sức đề kháng và bổ sung thêm lợi khuẩn tốt cho tiêu hóa nhé",https://www.facebook.com/groups/183774529022936/posts/2198916944175341/?comment_id=2203931120340590,https://www.facebook.com/groups/183774529022936/posts/2198916944175341/
2026-06-13T14:22:48.000Z,2203931747007194,,0,Nguyễn Sông Hà,"như bé nhà tui thì đang xài dòng sữa nan vàng nè, con mẫn cảm thì dòng nan này đã được chứng minh lâm sàng là rất tốt cho mấy vấn đề này đấy nha",https://www.facebook.com/groups/183774529022936/posts/2198916944175341/?comment_id=2203931747007194,https://www.facebook.com/groups/183774529022936/posts/2198916944175341/
2026-06-13T14:22:59.000Z,2203931877007181,,0,Bảo Xuân Phương,"mấy dòng sữa chất lượng như nan sup thuộc tập đoàn lớn nestle thì dùng không phải lo, chất lượng luôn giữ ở mức ổn định nè",https://www.facebook.com/groups/183774529022936/posts/2198916944175341/?comment_id=2203931877007181,https://www.facebook.com/groups/183774529022936/posts/2198916944175341/
2026-06-13T14:23:18.000Z,2203932090340493,,0,Đoàn Thị Chi Mai,"bé nhà em cũng đang tin dùng nan sup đó mom, sữa có đạm whey thủy phân 1 phần kết hợp với 5hmo nên hỗ trợ hệ tiêu hóa khỏe, giúp tăng đề kháng tốt, con uống vào bụng dạ êm, cơ thể cứng cáp rõ luôn á",https://www.facebook.com/groups/183774529022936/posts/2198916944175341/?comment_id=2203932090340493,https://www.facebook.com/groups/183774529022936/posts/2198916944175341/
2026-06-13T14:23:32.000Z,2203932293673806,,0,Linh Giang Vũ,"sữa nan supreme còn có chứa nhiều lợi khuẩn và đạm whey thủy phân một phần, rất tốt cho tiêu hóa, cùng với 5hmo giúp bé khỏe mạnh, đề kháng tốt, da dẻ lại mịn màng",https://www.facebook.com/groups/183774529022936/posts/2198916944175341/?comment_id=2203932293673806,https://www.facebook.com/groups/183774529022936/posts/2198916944175341/
2026-06-14T16:50:55.000Z,2204941446906224,,0,Sâu XInh,"bé nhà tớ ti nan a2 thụy sĩ trộm vía đỡ khò khè, sụt sịt, giờ sũa tăng thêm dưỡng chất hỗ trợ đề khág như này ưng lắm",https://www.facebook.com/groups/183774529022936/posts/2198916944175341/?comment_id=2204941446906224,https://www.facebook.com/groups/183774529022936/posts/2198916944175341/
2026-06-14T16:50:57.000Z,2204941476906221,,0,Duyên Phan,"bụng dạ con có êm thì cũng mới dễ hấp thu dễ tăng cân mẹ dặm thử nan cam xem vị sữa nhạt thanh thơm ngon dễ uống lắm, mua trên concung rồi lazada, sọp pe đều uy tín hết nhen",https://www.facebook.com/groups/183774529022936/posts/2198916944175341/?comment_id=2204941476906221,https://www.facebook.com/groups/183774529022936/posts/2198916944175341/
2026-06-14T16:51:14.000Z,2204941703572865,,0,Phạm Bảo Tuấn,"mình mới chuyển qua nan cam, thấy công thức cải tiến mới 6hmo giúp con khỏe hơn nhiều, ít ốm vặt, mẹ tk xem nhé",https://www.facebook.com/groups/183774529022936/posts/2198916944175341/?comment_id=2204941703572865,https://www.facebook.com/groups/183774529022936/posts/2198916944175341/
2026-06-14T16:51:56.000Z,2204942320239470,,0,Hoa Thủy Tiên,em chọn sữa nan cam bởi sữa thanh mát con dễ hợp tác mà tốt cho tiêu hóa con nữa nha,https://www.facebook.com/groups/183774529022936/posts/2198916944175341/?comment_id=2204942320239470,https://www.facebook.com/groups/183774529022936/posts/2198916944175341/
2026-06-14T16:52:03.000Z,2204942450239457,,0,Vu Thao,"mẹ thử cho con vài lon sữa nan cam đi ạ, sữa mát có đạm a2 htro tiêu hóa con được tốt hơn, ngoài ra mua nan ở sọp pe, lazada, tiktok shop cũng uy tín cực nè mẹ ơi",https://www.facebook.com/groups/183774529022936/posts/2198916944175341/?comment_id=2204942450239457,https://www.facebook.com/groups/183774529022936/posts/2198916944175341/
