Date,Comment_ID,Parent_ID,Level,Author,Content,Permalink,Post_URL
2026-06-11T06:52:42.000Z,2201817947218574,,0,Mạch Thanh Hoài,"tham khảo thử nan cam đi mom, dòng này tăng cường đề kháng khỏe hơn, sữa được bổ sung thêm hmo từ 5hmo lên 6hmo nè",https://www.facebook.com/groups/183774529022936/posts/2201626583904377/?comment_id=2201817947218574,https://www.facebook.com/groups/183774529022936/posts/2201626583904377/
2026-06-11T06:52:50.000Z,2201818077218561,,0,Đặng Ngọc Trâm,"sữa nan cam cứ an tâm dùng mom ah, nan này khỏe đề kháng nè, nay sữa đang dc tăng lên 6hmo giúp con khỏe đề kháng hơn nữa nhen nè",https://www.facebook.com/groups/183774529022936/posts/2201626583904377/?comment_id=2201818077218561,https://www.facebook.com/groups/183774529022936/posts/2201626583904377/
2026-06-11T06:52:54.000Z,2201818130551889,2201817947218574,1,Mạch Thanh Hoài,"đúng là chất lượng thiệt, nhờ có 6hmo nên hỗ trợ tiêu hóa khỏe, đề kháng mạh luôn ,sữa tốt cho tiêu hoá với đề kháng thì đây là nền tảng cho bé pt toàn diện đấy nhé chuyên gia dinh dưỡng với hơn 155 năm kinh nghiệm xịn sò chưa",https://www.facebook.com/groups/183774529022936/posts/2201626583904377/?comment_id=2201817947218574&reply_comment_id=2201818130551889,https://www.facebook.com/groups/183774529022936/posts/2201626583904377/
2026-06-11T06:53:00.000Z,2201818230551879,2201818077218561,1,Nguyễn Hoà,an tâm cả sữa có bổ sung lợi khuẩn kép b infantis & b lactis giúp bé dễ hấp thu hơn nữa nhé,https://www.facebook.com/groups/183774529022936/posts/2201626583904377/?comment_id=2201818077218561&reply_comment_id=2201818230551879,https://www.facebook.com/groups/183774529022936/posts/2201626583904377/
2026-06-11T06:53:03.000Z,2201818273885208,,0,Cấn Nhã Mai,"cho con ún nan a2 đúng trộm vía nhen con k còn bệnh vặt sụt sùi như trc nữa, kết công thức cải tiến từ 5hmo lên 6hmo này lắm thử đi",https://www.facebook.com/groups/183774529022936/posts/2201626583904377/?comment_id=2201818273885208,https://www.facebook.com/groups/183774529022936/posts/2201626583904377/
2026-06-11T06:53:05.000Z,2201818313885204,2201818077218561,1,Đặng Ngọc Trâm,"nên bé khỏe từ bên trong nhé, sữa này có tận 6hmo nên con cứng cáp lắm nè👍",https://www.facebook.com/groups/183774529022936/posts/2201626583904377/?comment_id=2201818077218561&reply_comment_id=2201818313885204,https://www.facebook.com/groups/183774529022936/posts/2201626583904377/
2026-06-11T06:53:07.000Z,2201818327218536,2201818077218561,1,Nguyễn Hoà,"đúng đó, v nên là mk dặm miết cho con luôn, con nhỏ nên ưu tiên 2 vấn đề này nhé",https://www.facebook.com/groups/183774529022936/posts/2201626583904377/?comment_id=2201818077218561&reply_comment_id=2201818327218536,https://www.facebook.com/groups/183774529022936/posts/2201626583904377/
2026-06-11T06:53:10.000Z,2201818457218523,,0,Kim Lan Hồ,"từ khi đổi sang nan a2 thụy sĩ, bé mình đỡ ốm vặt hẳn, sữa mới cải tiến từ 5hmo lên 6hmo luôn nha, mẹ thử cho bé xem",https://www.facebook.com/groups/183774529022936/posts/2201626583904377/?comment_id=2201818457218523,https://www.facebook.com/groups/183774529022936/posts/2201626583904377/
2026-06-11T06:53:12.000Z,2201818487218520,2201818273885208,1,Hương Mai Nguyễn,"cũng muốn thử ngay cho con dòng này vì nhìu mom khen quá, thấy bổ sung thêm lợi khuẩn chuyên biệt b infantis kết hợp với hmo 3fl giúp con tiêu hoá tốt vs nâng đk hơn",https://www.facebook.com/groups/183774529022936/posts/2201626583904377/?comment_id=2201818273885208&reply_comment_id=2201818487218520,https://www.facebook.com/groups/183774529022936/posts/2201626583904377/
2026-06-11T06:53:14.000Z,2201818507218518,2201818273885208,1,Cấn Nhã Mai,"sữa có lợi khuẩn kép b infantis vs b lactics cứ an tâm chọn m nha, nhà nestlé nữa quá uy tín",https://www.facebook.com/groups/183774529022936/posts/2201626583904377/?comment_id=2201818273885208&reply_comment_id=2201818507218518,https://www.facebook.com/groups/183774529022936/posts/2201626583904377/
2026-06-11T06:53:18.000Z,2201818553885180,2201818457218523,1,Lê Thị Bích Vân,"nan này đặc biệt có thêm lợi khuẩn kép b infantis vs b lactics nên hỗ trợ con tiêu hóa nhẹ nhàng, hấp thu tốt hơn đó c",https://www.facebook.com/groups/183774529022936/posts/2201626583904377/?comment_id=2201818457218523&reply_comment_id=2201818553885180,https://www.facebook.com/groups/183774529022936/posts/2201626583904377/
2026-06-11T06:53:20.000Z,2201818577218511,2201818457218523,1,Kim Lan Hồ,"sữa có tới 6hmo nên bé ti yên tâm khoản đề kháng lắm, mà dòng nestle hơn 155 năm kinh nghiệm, đúng là thương hiệu vàng trong làng sữa r nè mẹ",https://www.facebook.com/groups/183774529022936/posts/2201626583904377/?comment_id=2201818457218523&reply_comment_id=2201818577218511,https://www.facebook.com/groups/183774529022936/posts/2201626583904377/
2026-06-11T06:53:21.000Z,2201818607218508,2201818457218523,1,Lê Thị Bích Vân,con tăng cân được đều lại ị phân khéo thành khuôn một phần nhờ đạm a2 có trong nan này💪,https://www.facebook.com/groups/183774529022936/posts/2201626583904377/?comment_id=2201818457218523&reply_comment_id=2201818607218508,https://www.facebook.com/groups/183774529022936/posts/2201626583904377/
2026-06-11T06:53:45.000Z,2201818930551809,,0,Vũ Tuyết Trầm,mẹ bỉm biết nan a2 này chưa dòng sữa mát thiên về tiêu hóa của nhà nestlé có hàm lượng đạm a2 giúp con tiêu êm bụng,https://www.facebook.com/groups/183774529022936/posts/2201626583904377/?comment_id=2201818930551809,https://www.facebook.com/groups/183774529022936/posts/2201626583904377/
2026-06-11T06:53:51.000Z,2201819023885133,,0,Võ Minh Thúy,"dùng nan cam cũng đỡ phải lăn tăn đổi sữa, vì hỗ trợ tốt tiêu hóa lẫn miễn dịch, giờ lại cải tiến từ 5hmo lên 6hmo nữa",https://www.facebook.com/groups/183774529022936/posts/2201626583904377/?comment_id=2201819023885133,https://www.facebook.com/groups/183774529022936/posts/2201626583904377/
2026-06-11T06:53:53.000Z,2201819043885131,2201818930551809,1,Hạ Bảo Lan,"Vũ Tuyết Trầm đúng đó, hàm lượng đạm a2 này tốt cho tiêu hóa lại quý nữa bởi chỉ có trong giống bò thuần chủng",https://www.facebook.com/groups/183774529022936/posts/2201626583904377/?comment_id=2201818930551809&reply_comment_id=2201819043885131,https://www.facebook.com/groups/183774529022936/posts/2201626583904377/
2026-06-11T06:53:55.000Z,2201819067218462,2201818930551809,1,Vũ Tuyết Trầm,"phải nè nên bé min hy nhà mình cải thiện được tình trạng rối loạn tiêu hóa của bé hơn, out",https://www.facebook.com/groups/183774529022936/posts/2201626583904377/?comment_id=2201818930551809&reply_comment_id=2201819067218462,https://www.facebook.com/groups/183774529022936/posts/2201626583904377/
2026-06-11T06:53:57.000Z,2201819090551793,2201818930551809,1,Hạ Bảo Lan,nay trộm vía ít ốm vặt khi giao mùa đi khám ai cũng khen mẹ chăm,https://www.facebook.com/groups/183774529022936/posts/2201626583904377/?comment_id=2201818930551809&reply_comment_id=2201819090551793,https://www.facebook.com/groups/183774529022936/posts/2201626583904377/
2026-06-11T06:53:59.000Z,2201819117218457,2201819023885133,1,Phạm Dịu,"dòng này dùng ổn đó, có bs lợi khuẩn kép b infantis vs b lactics nên bé khỏe tiêu hóa và đề kháng",https://www.facebook.com/groups/183774529022936/posts/2201626583904377/?comment_id=2201819023885133&reply_comment_id=2201819117218457,https://www.facebook.com/groups/183774529022936/posts/2201626583904377/
2026-06-11T06:54:01.000Z,2201819140551788,,0,Bảo Hân,"nên chọn nan cam vì hỗ trợ tốt tiêu hóa với đề kháng cho bé, giờ còn tăng từ 5hmo lên 6hmo nên tốt hơn🤔",https://www.facebook.com/groups/183774529022936/posts/2201626583904377/?comment_id=2201819140551788,https://www.facebook.com/groups/183774529022936/posts/2201626583904377/
2026-06-11T06:54:02.000Z,2201819157218453,2201819023885133,1,Võ Minh Thúy,"sữa từ thụy sĩ dc nhà nestle phân phối trự tiếp tại vn đấy,sữa tốt cho tiêu hoá & đề kháng là nền tảng giúp cho bé pt toàn diện m nha",https://www.facebook.com/groups/183774529022936/posts/2201626583904377/?comment_id=2201819023885133&reply_comment_id=2201819157218453,https://www.facebook.com/groups/183774529022936/posts/2201626583904377/
2026-06-11T06:54:08.000Z,2201819250551777,2201819140551788,1,Mỹ Huyền Hồ,"chọn sữa này giúp con khỏe cả tiêu hóa đề kháng nè, có đạm a2, 6hmo và lợi khuẩn kép b infantis vs b lactics htr",https://www.facebook.com/groups/183774529022936/posts/2201626583904377/?comment_id=2201819140551788&reply_comment_id=2201819250551777,https://www.facebook.com/groups/183774529022936/posts/2201626583904377/
2026-06-11T06:54:10.000Z,2201819260551776,2201819140551788,1,Bảo Hân,dòng cao cấp của nhãn hiệu neslte đúng là chất lượng,https://www.facebook.com/groups/183774529022936/posts/2201626583904377/?comment_id=2201819140551788&reply_comment_id=2201819260551776,https://www.facebook.com/groups/183774529022936/posts/2201626583904377/
