Date,Comment_ID,Parent_ID,Level,Author,Content,Permalink,Post_URL
2026-06-18T07:55:43.000Z,2208124523254583,,0,Lê Mai Hiền,"bé em uống nan cam thấy ok nha, nan a2 cải tiến nên có tận 6hmo giúp bé khỏe đề kháng lắm đấy nè mom ơi",https://www.facebook.com/groups/183774529022936/posts/2207089036691465/?comment_id=2208124523254583,https://www.facebook.com/groups/183774529022936/posts/2207089036691465/
2026-06-18T07:55:51.000Z,2208124633254572,2208124523254583,1,Phan Mai Hân,"ưm, nan a2 có cả lợi khuẩn kép b infantis & b lactis nên bé tiêu em lắm đấy nha, nestlé là thương hiệu lâu đời nên mình tin tưởng hơn",https://www.facebook.com/groups/183774529022936/posts/2207089036691465/?comment_id=2208124523254583&reply_comment_id=2208124633254572,https://www.facebook.com/groups/183774529022936/posts/2207089036691465/
2026-06-18T07:55:59.000Z,2208124699921232,2208124523254583,1,Lê Mai Hiền,"với 6hmo con khỏe đề kháng lắm, sữa của nhà nestle đấy nhé 😊 chọn nan là chọn hơn 155 năm uy tín toàn cầu luôn đấy mẹ",https://www.facebook.com/groups/183774529022936/posts/2207089036691465/?comment_id=2208124523254583&reply_comment_id=2208124699921232,https://www.facebook.com/groups/183774529022936/posts/2207089036691465/
2026-06-18T07:56:06.000Z,2208124776587891,,0,Phan Yến,"tầm con nhà mk dạo này dặm qua nan cam vị nhạt thanhgần giống sữa mẹ con ti giỏi hẳn trộm vía lên cân khoa học out ị nè, mình thường để ý đến uy tín của nhà sản xuất trước khi tìm hiểu sản phẩm nha",https://www.facebook.com/groups/183774529022936/posts/2207089036691465/?comment_id=2208124776587891,https://www.facebook.com/groups/183774529022936/posts/2207089036691465/
2026-06-18T07:56:15.000Z,2208124853254550,,0,Nguyễn Hoa,"mk cho bé ti nan cam thấy con cứng cáp hơn nên mạnh dạn rv, nay dòng này còn được bổ sung thêm hmo 3fl thành 6hmo hỗ trợ đề kháng tốt hơn nè",https://www.facebook.com/groups/183774529022936/posts/2207089036691465/?comment_id=2208124853254550,https://www.facebook.com/groups/183774529022936/posts/2207089036691465/
2026-06-18T07:56:25.000Z,2208124963254539,2208124853254550,1,Phạm Nguyễn Lan Nhi,"cũng thấy nan a2 có bổ sung lợi khuẩn kép b infantis & b lactis giúp bé tiêu nhanh hấp thu tốt nữa đấy nhé, nan a2 làm mình có cảm giác an tâm hơn khi tìm hiểu nè",https://www.facebook.com/groups/183774529022936/posts/2207089036691465/?comment_id=2208124853254550&reply_comment_id=2208124963254539,https://www.facebook.com/groups/183774529022936/posts/2207089036691465/
2026-06-18T07:56:35.000Z,2208125093254526,2208124853254550,1,Nguyễn Hoa,"dr, sữa của nhà nestle chất lượng lắm, thương hiệu lâu năm hơn 150 năm rồi nhé ạ",https://www.facebook.com/groups/183774529022936/posts/2207089036691465/?comment_id=2208124853254550&reply_comment_id=2208125093254526,https://www.facebook.com/groups/183774529022936/posts/2207089036691465/
2026-06-18T07:56:43.000Z,2208125176587851,,0,Bùi Mỹ Nhân,"đợt này t dặm nan a2 thấy con khoẻ chịu ăn chịu chơi rồi nên tui ko đổi nữa, m có thể tk lon nhỏ 400g dùng thử nghen nè👍, mình khá thích việc nan a2 được phát triển dựa trên các nghiên cứu dinh dưỡng nè",https://www.facebook.com/groups/183774529022936/posts/2207089036691465/?comment_id=2208125176587851,https://www.facebook.com/groups/183774529022936/posts/2207089036691465/
2026-06-18T07:56:51.000Z,2208125283254507,,0,Hà Phương Nhã,"mẹ cho bé dùng nan cam giống bé e nè, thấy con ăn ngủ đều, ít ốm vặt hơn nhờ sữa nay được tăng cường dưỡng chất đề kháng, từ 5 lên 6hmo",https://www.facebook.com/groups/183774529022936/posts/2207089036691465/?comment_id=2208125283254507,https://www.facebook.com/groups/183774529022936/posts/2207089036691465/
2026-06-18T07:56:58.000Z,2208125349921167,2208125283254507,1,Phan Bảo Nguyên,"sữa tớ thấy còn giúp bé tiêu hóa ổn, dễ hấp thu hơn do có bs lợi khuẩn kép b infantis vs b lactics nữa, đọc thêm thông tin mới thấy quy trình sản xuất rất bài bản nha",https://www.facebook.com/groups/183774529022936/posts/2207089036691465/?comment_id=2208125283254507&reply_comment_id=2208125349921167,https://www.facebook.com/groups/183774529022936/posts/2207089036691465/
2026-06-18T07:57:06.000Z,2208125456587823,2208125283254507,1,Hà Phương Nhã,"tớ cũng cho con ti nan a2, sữa nestle có đến 155 năm kinh nghiệm nên mẹ tha hồ yên tâm",https://www.facebook.com/groups/183774529022936/posts/2207089036691465/?comment_id=2208125283254507&reply_comment_id=2208125456587823,https://www.facebook.com/groups/183774529022936/posts/2207089036691465/
2026-06-18T07:57:12.000Z,2208125529921149,,0,Nguyễn Thu Hân,"mom tham khảo sữa nan cam bé nhà tui con đang ti nè, trộm vía con tiêu hoá ổn áp và đề kháng khoẻ nha, sữa có công thức cải tiến lên tới 6hmo giúp con cứng cáp và ít ốm vặt hơn hẳn💪, mình thích cách nestlé liên tục đổi mới dựa trên các nghiên cứu khoa học nè",https://www.facebook.com/groups/183774529022936/posts/2207089036691465/?comment_id=2208125529921149,https://www.facebook.com/groups/183774529022936/posts/2207089036691465/
2026-06-18T07:57:25.000Z,2208125666587802,2208125529921149,1,Nguyễn Thu Linh,"con ti nan a2 trộm vía con bụng êm, hấp thu tốt, tiêu hoá khoẻ, em an tâm lắm nha, sữa của nhà nestle mà đã có thương hiệu lên tới 155 năm đó nên rất an tâm",https://www.facebook.com/groups/183774529022936/posts/2207089036691465/?comment_id=2208125529921149&reply_comment_id=2208125666587802,https://www.facebook.com/groups/183774529022936/posts/2207089036691465/
2026-06-18T07:57:31.000Z,2208125743254461,2208125529921149,1,Nguyễn Thu Hân,"sữa có bổ sung thêm lợi khuẩn chuyên biệt b infantis kết hợp với hmo 3fl giúp con tiêu hoá khoẻ, con hấp thu tốt và khoẻ từ bên trong mẹ an tâm, mấy sữa tốt cho đề kháng cả tiêu hóa thì ht giúp con pt toàn diện hơn nhiều nha",https://www.facebook.com/groups/183774529022936/posts/2207089036691465/?comment_id=2208125529921149&reply_comment_id=2208125743254461,https://www.facebook.com/groups/183774529022936/posts/2207089036691465/
2026-06-18T07:57:59.000Z,2208126126587756,,0,Lê Ánh Dung,"trc bé m hay ị phân dê cái đổi qua nan cam đâu đó chục ngày thì phân mềm nè, mình thích những loại sữa có nền khoa học rõ ràng",https://www.facebook.com/groups/183774529022936/posts/2207089036691465/?comment_id=2208126126587756,https://www.facebook.com/groups/183774529022936/posts/2207089036691465/
2026-06-18T07:58:06.000Z,2208126203254415,2208126126587756,1,Tòng Mi Na,"em chọn nan a2 làm chính, còn sữa nước a2 là dạng bổ sung thêm để trong tủ khi cần dùng nhanh cho bé. thấy phù hợp với gia đình bận rộn vì không phải lúc nào cũng pha sữa được",https://www.facebook.com/groups/183774529022936/posts/2207089036691465/?comment_id=2208126126587756&reply_comment_id=2208126203254415,https://www.facebook.com/groups/183774529022936/posts/2207089036691465/
2026-06-18T07:58:10.000Z,2208126266587742,2208126126587756,1,Lê Ánh Dung,"công nhận luôn, sữa nước với nền tảng a2 và hmo kế thừa từ nhà nan nên khi dùng cùng nan a2 thấy khá ổn, không bị thiếu nhịp dinh dưỡng",https://www.facebook.com/groups/183774529022936/posts/2207089036691465/?comment_id=2208126126587756&reply_comment_id=2208126266587742,https://www.facebook.com/groups/183774529022936/posts/2207089036691465/
2026-06-18T07:58:16.000Z,2208126346587734,2208126126587756,1,Tòng Mi Na,"bé hợp nên tiêu hóa ổn hơn, ăn uống cũng “êm” hơn trước",https://www.facebook.com/groups/183774529022936/posts/2207089036691465/?comment_id=2208126126587756&reply_comment_id=2208126346587734,https://www.facebook.com/groups/183774529022936/posts/2207089036691465/
2026-06-18T07:58:23.000Z,2208126429921059,,0,Nguyễn Hải Lâm,"mk đang dùng sữa nan cam là ko yên tâm lắm, dặm từ đó đến giờ luôn, tvia con êm bụng tiêu tốt hấp thu tốt mà cứng cáp lắm đấy nhé mom ạ, mình thích cách làm việc bền bỉ và nghiêm túc như vậy nè",https://www.facebook.com/groups/183774529022936/posts/2207089036691465/?comment_id=2208126429921059,https://www.facebook.com/groups/183774529022936/posts/2207089036691465/
2026-06-18T07:58:30.000Z,2208126499921052,2208126429921059,1,Vân Phi,"nhà em duy trì nan a2 đều mỗi ngày, còn sữa nước a2 thì dùng như phương án tiện lợi trong ngày cho bé. đặc biệt những lúc ra ngoài lâu thì rất hữu ích",https://www.facebook.com/groups/183774529022936/posts/2207089036691465/?comment_id=2208126429921059&reply_comment_id=2208126499921052,https://www.facebook.com/groups/183774529022936/posts/2207089036691465/
2026-06-18T07:58:33.000Z,2208126543254381,2208126429921059,1,Nguyễn Hải Lâm,"em thấy ổn nè, sữa nước với nền tảng a2 và hmo kế thừa từ nhà nan nên khi đi cùng nan a2 tạo cảm giác khá đồng bộ",https://www.facebook.com/groups/183774529022936/posts/2207089036691465/?comment_id=2208126429921059&reply_comment_id=2208126543254381,https://www.facebook.com/groups/183774529022936/posts/2207089036691465/
2026-06-18T07:58:39.000Z,2208126636587705,2208126429921059,1,Vân Phi,"bé hợp nên sinh hoạt ổn định hơn, không bị xáo trộn nhiều như trước",https://www.facebook.com/groups/183774529022936/posts/2207089036691465/?comment_id=2208126429921059&reply_comment_id=2208126636587705,https://www.facebook.com/groups/183774529022936/posts/2207089036691465/
2026-06-21T16:34:54.000Z,2211124116287957,,0,Trần Tuệ Uyển,"cho bé dùng nan xanh thụy sĩ thấy yên tâm hơn hẳn, sữa mát nên bé tiêu hóa tốt, không bị táo mà cân nặng tăng theo chuẩn con cứng cáp luôn đó, mom thử nha, điều khiến mk gắn bó với dòng này là sự tin tưởng chứ không phải theo trào lưu ❤️",https://www.facebook.com/groups/183774529022936/posts/2207089036691465/?comment_id=2211124116287957,https://www.facebook.com/groups/183774529022936/posts/2207089036691465/
2026-06-21T16:35:07.000Z,2211124286287940,,0,Khánh Quyên,"bé nhà mình đang dùng nan xanh plus, nhờ tỉ lệ đạm whey/casein gần giống sữa mẹ nên bé tiêu hóa dễ, bụng êm, không bị táo, cân nặng tăng đều, nhìn cũng cứng cáp hơn, lúc đầu mk cũng không nghĩ sẽ gắn bó lâu đâu 😅 mà bé hợp nên giờ dùng nan plus luôn nè",https://www.facebook.com/groups/183774529022936/posts/2207089036691465/?comment_id=2211124286287940,https://www.facebook.com/groups/183774529022936/posts/2207089036691465/
2026-06-21T16:35:17.000Z,2211124362954599,,0,Trần Khánh Linh,"từ khi chuyển qua nan thụy sĩ thấy bé tiêu hóa tốt hơn rõ, người mạnh khỏe hơn, không bị táo mà cân nặng cũng tăng đều nên mình yên tâm hơn hẳn, hồi mới tìm sữa cho bé m hoang mang lắm, mà thấy nan có 160 năm nghiên cứu từ thụy sĩ về sữa mát với optipro nên cũng yên tâm nè",https://www.facebook.com/groups/183774529022936/posts/2207089036691465/?comment_id=2211124362954599,https://www.facebook.com/groups/183774529022936/posts/2207089036691465/
2026-06-21T16:35:22.000Z,2211124439621258,2211124116287957,1,Hoàng Phương Ngô,"dòng này ổn thật, không biết thành phần có gì mà tốt vậy mẹ",https://www.facebook.com/groups/183774529022936/posts/2207089036691465/?comment_id=2211124116287957&reply_comment_id=2211124439621258,https://www.facebook.com/groups/183774529022936/posts/2207089036691465/
2026-06-21T16:35:23.000Z,2211124456287923,2211124116287957,1,Trần Tuệ Uyển,"sữa có lợi khuẩn hỗ trợ tiêu hóa cùng với tỉ lệ đạm whey/casein gần giống sữa mẹ nên bé hấp thu tốt hơn, 5hmo cho con khỏe đề kháng",https://www.facebook.com/groups/183774529022936/posts/2207089036691465/?comment_id=2211124116287957&reply_comment_id=2211124456287923,https://www.facebook.com/groups/183774529022936/posts/2207089036691465/
2026-06-21T16:35:24.000Z,2211124472954588,2211124116287957,1,Hoàng Phương Ngô,"nghe hợp lý quá, không biết sữa có dễ pha không mẹ",https://www.facebook.com/groups/183774529022936/posts/2207089036691465/?comment_id=2211124116287957&reply_comment_id=2211124472954588,https://www.facebook.com/groups/183774529022936/posts/2207089036691465/
2026-06-21T16:35:26.000Z,2211124489621253,2211124116287957,1,Trần Tuệ Uyển,"pha cũng đơn giản lắm, chỉ cần nước ấm khoảng 40 độ, lắc nhẹ là tan đều, không bị vón cục đâu mom",https://www.facebook.com/groups/183774529022936/posts/2207089036691465/?comment_id=2211124116287957&reply_comment_id=2211124489621253,https://www.facebook.com/groups/183774529022936/posts/2207089036691465/
2026-06-21T16:35:29.000Z,2211124536287915,2211124362954599,1,Hồng Vân Trần,dòng này còn hỗ trợ cả đề kháng nữa phải không mẹ,https://www.facebook.com/groups/183774529022936/posts/2207089036691465/?comment_id=2211124362954599&reply_comment_id=2211124536287915,https://www.facebook.com/groups/183774529022936/posts/2207089036691465/
2026-06-21T16:35:30.000Z,2211124556287913,,0,Huỳnh Diễm Trang,"mẹ tham khảo nan xanh plus nha, sữa mát có đạm optipro hỗ trợ tiêu hóa tốt, bé uống dễ tiêu, phân đẹp, hấp thu ổn nên tăng cân đều, 5hmo nên con khỏe mạnh hơn, mk thích những dòng sữa có nền tảng khoa học rõ ràng, đọc thêm về đạm optipro với HMO của em này thấy cũng yên tâm hơn 🍼",https://www.facebook.com/groups/183774529022936/posts/2207089036691465/?comment_id=2211124556287913,https://www.facebook.com/groups/183774529022936/posts/2207089036691465/
2026-06-21T16:35:32.000Z,2211124569621245,2211124362954599,1,Trần Khánh Linh,"đúng rồi, vì có tới 5hmo nên giúp bé tăng sức đề kháng, ít ốm vặt hơn",https://www.facebook.com/groups/183774529022936/posts/2207089036691465/?comment_id=2211124362954599&reply_comment_id=2211124569621245,https://www.facebook.com/groups/183774529022936/posts/2207089036691465/
2026-06-21T16:35:34.000Z,2211124599621242,2211124362954599,1,Hồng Vân Trần,vậy mua ở đâu để đảm bảo hàng chuẩn vậy mom,https://www.facebook.com/groups/183774529022936/posts/2207089036691465/?comment_id=2211124362954599&reply_comment_id=2211124599621242,https://www.facebook.com/groups/183774529022936/posts/2207089036691465/
2026-06-21T16:35:36.000Z,2211124639621238,2211124362954599,1,Trần Khánh Linh,"mua ở concung hay tiktok shop đều tiện, hàng chính hãng lại còn hay có ưu đãi nữa",https://www.facebook.com/groups/183774529022936/posts/2207089036691465/?comment_id=2211124362954599&reply_comment_id=2211124639621238,https://www.facebook.com/groups/183774529022936/posts/2207089036691465/
2026-06-21T16:35:40.000Z,2211124702954565,2211124556287913,1,Trương Uyển Lam,mình đang phân vân không biết bé có bị lạ sữa khi đổi sang không,https://www.facebook.com/groups/183774529022936/posts/2207089036691465/?comment_id=2211124556287913&reply_comment_id=2211124702954565,https://www.facebook.com/groups/183774529022936/posts/2207089036691465/
2026-06-21T16:35:41.000Z,2211124719621230,2211124556287913,1,Huỳnh Diễm Trang,"không lo đâu, vị sữa nhạt nhẹ gần giống sữa mẹ nên bé dễ làm quen lắm",https://www.facebook.com/groups/183774529022936/posts/2207089036691465/?comment_id=2211124556287913&reply_comment_id=2211124719621230,https://www.facebook.com/groups/183774529022936/posts/2207089036691465/
2026-06-21T16:35:43.000Z,2211124749621227,2211124556287913,1,Trương Uyển Lam,"vậy chắc mình thử cho bé dùng xem sao , bé nhà mk đang dùng nan plus 🍼 mk thấy hợp nên giữ luôn nè",https://www.facebook.com/groups/183774529022936/posts/2207089036691465/?comment_id=2211124556287913&reply_comment_id=2211124749621227,https://www.facebook.com/groups/183774529022936/posts/2207089036691465/
2026-07-01T11:16:55.000Z,2219908468742855,,0,Huỳnh Đức Khôi,"+1 máy cho abbott grow nha, con t ún từ nhỏ tới h tvia cao lêu nghêu mà ít ốm vặt lắm ý :D",https://www.facebook.com/groups/183774529022936/posts/2207089036691465/?comment_id=2219908468742855,https://www.facebook.com/groups/183774529022936/posts/2207089036691465/
2026-07-01T11:17:35.000Z,2219909152076120,,0,Ngô Hồng Linh,"sữa hươu abbott đúng là chân á để tăng đề kháng á mn, con e từ lúc ún là đỡ ốm vặt hẳn luôn :))))",https://www.facebook.com/groups/183774529022936/posts/2207089036691465/?comment_id=2219909152076120,https://www.facebook.com/groups/183774529022936/posts/2207089036691465/
2026-07-01T11:18:15.000Z,2219910018742700,,0,Trần Thiện Linh,"Bé nhà mih dùng grow abot thấy đề kháng tốt hẳn, đi ngoài mượt ko lo táo bón đâu mom ơi",https://www.facebook.com/groups/183774529022936/posts/2207089036691465/?comment_id=2219910018742700,https://www.facebook.com/groups/183774529022936/posts/2207089036691465/
2026-07-04T06:16:42.000Z,2222498978483804,,0,Bảo Anh,thử sữa hươu abbott đi mom sữa mát có chất xơ fos inulin nên con tiêu hóa tốt hấp thu dc nhìu chất r nhích kim đều á,https://www.facebook.com/groups/183774529022936/posts/2207089036691465/?comment_id=2222498978483804,https://www.facebook.com/groups/183774529022936/posts/2207089036691465/
2026-07-04T06:23:13.000Z,2222503328483369,,0,Ngọc Diệp,Con nhà e trvia hợp sữa hươu cao cổ lắm uống vào tiêu hóa ổn k bị táo bón mà tăng đề kháng rõ lun nha,https://www.facebook.com/groups/183774529022936/posts/2207089036691465/?comment_id=2222503328483369,https://www.facebook.com/groups/183774529022936/posts/2207089036691465/
2026-07-04T06:32:55.000Z,2222509675149401,,0,bích Phượng,sữa hươu quốc dân vị thanh dễ ún lắm bé nhà t trvia dùng cug nhích kim đều á mom :v,https://www.facebook.com/groups/183774529022936/posts/2207089036691465/?comment_id=2222509675149401,https://www.facebook.com/groups/183774529022936/posts/2207089036691465/
2026-07-04T06:34:48.000Z,2222510885149280,2222509675149401,1,Khánh My,bích Phượng đúng rùi á sữa hươu quốc dân mùi thơm k bị ngấy nên mấy bé hợp tác lắm nhỉ,https://www.facebook.com/groups/183774529022936/posts/2207089036691465/?comment_id=2222509675149401&reply_comment_id=2222510885149280,https://www.facebook.com/groups/183774529022936/posts/2207089036691465/
2026-07-04T06:37:45.000Z,2222512791815756,,0,Thanh vân,Chọn abbott grow nè mom ơi sữa này có đạm clc giúp con tăng cân lành mạnh mà k lo táo đâu nha,https://www.facebook.com/groups/183774529022936/posts/2207089036691465/?comment_id=2222512791815756,https://www.facebook.com/groups/183774529022936/posts/2207089036691465/
2026-07-04T06:47:07.000Z,2222519681815067,,0,Bảo Anh,trộm vía bé nhà t dùng sữa hươu abbott từ lúc 1 tuổi tới h thấy con cứng cáp mà ít ốm vặt lắm 🥰,https://www.facebook.com/groups/183774529022936/posts/2207089036691465/?comment_id=2222519681815067,https://www.facebook.com/groups/183774529022936/posts/2207089036691465/
2026-07-04T06:56:09.000Z,2222525161814519,,0,hồng anh,Mom thử sữa hươu cao cổ đi bột sữa mịn tơi mà giá cug vừa túi tiền nữa tốn xiền mua sữa mẹ k tiếc đâu ^^,https://www.facebook.com/groups/183774529022936/posts/2207089036691465/?comment_id=2222525161814519,https://www.facebook.com/groups/183774529022936/posts/2207089036691465/
2026-07-04T07:01:03.000Z,2222528048480897,,0,Huyền thoại,sữa hươu quốc dân này có tiếng hơn 2 chục năm r nên mom cứ yên tâm cho con dùng nha chất lượng chuẩn mỹ á,https://www.facebook.com/groups/183774529022936/posts/2207089036691465/?comment_id=2222528048480897,https://www.facebook.com/groups/183774529022936/posts/2207089036691465/
2026-07-04T07:01:57.000Z,2222528581814177,,0,uyển mi,Cho con ún abbott grow ik mom ơi con nhà mình ún loại này output mượt lắm k bị bón tí nào,https://www.facebook.com/groups/183774529022936/posts/2207089036691465/?comment_id=2222528581814177,https://www.facebook.com/groups/183774529022936/posts/2207089036691465/
2026-07-04T07:04:29.000Z,2222530308480671,,0,Nhi Phương,e cug đổi sữa 7749 loại r cuối cùng chốt sữa hươu abbott vì con ăn ngon ngủ tốt mà nhích cân hẳn =)),https://www.facebook.com/groups/183774529022936/posts/2207089036691465/?comment_id=2222530308480671,https://www.facebook.com/groups/183774529022936/posts/2207089036691465/
2026-07-04T07:10:57.000Z,2222534338480268,,0,Tuệ châu,Abbott grow vị nhạt thanh giống sữa mẹ nên bé dễ chuyển đổi lắm nha mom ko lo bị lạ bụng đâu nè,https://www.facebook.com/groups/183774529022936/posts/2207089036691465/?comment_id=2222534338480268,https://www.facebook.com/groups/183774529022936/posts/2207089036691465/
2026-07-04T07:13:22.000Z,2222535808480121,,0,vân an,mua sữa hươu cao cổ cho con thử đi mom sữa này giàu dinh dưỡng mà còn hỗ trợ ptrien trí não nhạy bén nữa,https://www.facebook.com/groups/183774529022936/posts/2207089036691465/?comment_id=2222535808480121,https://www.facebook.com/groups/183774529022936/posts/2207089036691465/
2026-07-04T07:19:45.000Z,2222539925146376,,0,Khánh Chi,T tì hay mua abbott grow trên sàn tmđt cho rẻ mà vẫn chuẩn chính hãng nà dùng ok lắm mom ạa,https://www.facebook.com/groups/183774529022936/posts/2207089036691465/?comment_id=2222539925146376,https://www.facebook.com/groups/183774529022936/posts/2207089036691465/
2026-07-04T07:21:17.000Z,2222540935146275,,0,Phương Linh,sữa hươu quốc dân này hỗ trợ ptrien toàn diện cả chiều cao lẫn cân nặng lun đó mom thử liền ik 😋,https://www.facebook.com/groups/183774529022936/posts/2207089036691465/?comment_id=2222540935146275,https://www.facebook.com/groups/183774529022936/posts/2207089036691465/
2026-07-04T07:23:47.000Z,2222542538479448,,0,Nguyệt Nga,Bé nhà mình trvia sỉnh sữa từ hồi dùng abbott grow á trộm día nhìn con có da có thịt hẳn lun :)))),https://www.facebook.com/groups/183774529022936/posts/2207089036691465/?comment_id=2222542538479448,https://www.facebook.com/groups/183774529022936/posts/2207089036691465/
2026-07-04T07:30:09.000Z,2222546765145692,,0,Vân Thanh,sữa hươu cao cổ uống vào mát lắm ko lo bị nóng hay nổi mụn đâu con nhà tui uống là ghiền lun á,https://www.facebook.com/groups/183774529022936/posts/2207089036691465/?comment_id=2222546765145692,https://www.facebook.com/groups/183774529022936/posts/2207089036691465/
2026-07-04T07:30:56.000Z,2222547281812307,,0,Huyền trang,Giá sữa hươu quốc dân ổn áp nhất trong các dòng sữa ngoại rùi mom ptrien đề kháng cug đỉnh nữa 😍,https://www.facebook.com/groups/183774529022936/posts/2207089036691465/?comment_id=2222547281812307,https://www.facebook.com/groups/183774529022936/posts/2207089036691465/
2026-07-04T07:58:44.000Z,2222566115143757,,0,Dương huyền,Mom tham khảo abbott grow nha sữa này giúp con xương chắc khỏe mà thông minh lanh lẹ lắm á ^^,https://www.facebook.com/groups/183774529022936/posts/2207089036691465/?comment_id=2222566115143757,https://www.facebook.com/groups/183774529022936/posts/2207089036691465/
