Date,Comment_ID,Parent_ID,Level,Author,Content,Permalink,Post_URL
2026-06-18T08:08:48.000Z,2208134473253588,,0,Hồng Quyên,"bạn thử nan a2 chưa, giờ côg thức mới tăng lên 6hmo nên hỗ trợ đề kháng tốt cực,bé t ti ít ốm vặt lắm nè nghen",https://www.facebook.com/groups/183774529022936/posts/2207096890024013/?comment_id=2208134473253588,https://www.facebook.com/groups/183774529022936/posts/2207096890024013/
2026-06-18T08:09:12.000Z,2208134736586895,,0,Mơ Ánh,"mk thích nhất vẫn là nan cam, sữa này giúp con khỏe đề kháng, ít ốm vặt, giờ còn tăng từ 5hmo lên 6hmo hỗ trợ đề kháng tốt hơn",https://www.facebook.com/groups/183774529022936/posts/2207096890024013/?comment_id=2208134736586895,https://www.facebook.com/groups/183774529022936/posts/2207096890024013/
2026-06-18T08:09:34.000Z,2208134953253540,,0,Thùy Dương,"Sóc nhà mk cũng ti sữa ngoài từ hồi 1m bạn ấy ti nan a2 hợp tác lắm nha ai cũng khen m khéo chăm con ý mom ơi, mình đánh giá cao việc thương hiệu liên tục cải tiến đó á",https://www.facebook.com/groups/183774529022936/posts/2207096890024013/?comment_id=2208134953253540,https://www.facebook.com/groups/183774529022936/posts/2207096890024013/
2026-06-18T08:09:40.000Z,2208135036586865,,0,Hoàng Dung,"từ khi đổi qua sữa nan a2 có 6hmo thì con e đỡ bệnh vặt, tăng đề khág tốt hơn đó c, tham khảo xem nha mẹ😊",https://www.facebook.com/groups/183774529022936/posts/2207096890024013/?comment_id=2208135036586865,https://www.facebook.com/groups/183774529022936/posts/2207096890024013/
2026-06-18T08:09:56.000Z,2208135233253512,,0,Ngọc Uyên,"e cho con ti nan a2, thấy đề kháng tốt, con cứng cáp, nhờ công thức cải tiến từ 5 lên 6hmo nè, mẹ tìm hiểu coi😊",https://www.facebook.com/groups/183774529022936/posts/2207096890024013/?comment_id=2208135233253512,https://www.facebook.com/groups/183774529022936/posts/2207096890024013/
2026-06-18T08:10:19.000Z,2208135509920151,,0,Vy Khanh,"mẹ chọn sữa nan a2 cho con ti như bé nhà tui nè ưng lắm nha, con hợp tác lắm nha, sữa nay có cải tiến từ 5hmo lên tận 6hmo giúp con cứng cáp, con khoẻ mạnh hơn",https://www.facebook.com/groups/183774529022936/posts/2207096890024013/?comment_id=2208135509920151,https://www.facebook.com/groups/183774529022936/posts/2207096890024013/
2026-06-18T08:10:38.000Z,2208135739920128,,0,Hồng Khuê,"xài giống mk nè, chân ái vẫn là nan cam nhé, con ún thấy khỏe hẳn, nay sữa còn bs thêm 1hmo tăng từ 5hmo lên 6hmo nữa đấy mom👍",https://www.facebook.com/groups/183774529022936/posts/2207096890024013/?comment_id=2208135739920128,https://www.facebook.com/groups/183774529022936/posts/2207096890024013/
2026-06-18T08:10:45.000Z,2208135826586786,,0,Hoàng Chinh,"hay là sang nan cam thử nhé mẹ, con m ti sữa này đc gần nửa năm nay rùi tháng nào cũng lên cân nè👍, nền tảng khoa học lâu năm của nestlé là điều khiến mình chú ý nha",https://www.facebook.com/groups/183774529022936/posts/2207096890024013/?comment_id=2208135826586786,https://www.facebook.com/groups/183774529022936/posts/2207096890024013/
2026-06-18T08:11:18.000Z,2208136189920083,,0,Sa Hoài,"mom thử cho bé dùng nan cam như mk đi nè, sữa này hỗ trợ tiêu hóa lẫn đề kháng cực tốt, công thức có đạm a2, 6hmo và lợi khuẩn kép b infantis & b lactis nên bé uống vào bụng êm, con cứng cáp khỏe mạnh hẳn đó mẹ thử nha, nan a2 có nền tảng nghiên cứu lâu năm nên cũng đáng để tham khảo nha",https://www.facebook.com/groups/183774529022936/posts/2207096890024013/?comment_id=2208136189920083,https://www.facebook.com/groups/183774529022936/posts/2207096890024013/
2026-06-18T15:23:17.000Z,2208421163224919,,0,Vũ Vân,Nan được nhiều mẹ recommended dùng ạ https://s.shopee.vn/2qSInXiORB,https://www.facebook.com/groups/183774529022936/posts/2207096890024013/?comment_id=2208421163224919,https://www.facebook.com/groups/183774529022936/posts/2207096890024013/
