Date,Comment_ID,Parent_ID,Level,Author,Content,Permalink,Post_URL
2026-06-21T11:22:23.000Z,2210892412977794,,0,Trúc Quyên,"Mình chưa dùng NAN A2 nên không review trực tiếp được mom ạ. Nếu bé ăn uống ổn mà tăng cân chậm thì ngoài việc xem lại tốc độ tăng trưởng của bé, mom có thể tham khảo NAN Optipro Plus nhé. Sữa có đạm Optipro dễ tiêu hoá, vị nhạt dễ uống, hỗ trợ hấp thu và nhiều bé dùng tăng trưởng khá ổn. Bé nhà mình trộm vía tiêu hoá tốt, phân đẹp và tăng cân đều. Tuy nhiên mỗi bé sẽ có cơ địa khác nhau nên mom theo dõi thêm khi đổi sữa nha ❤️ Bên mình có share NAN Optipro Plus giá tốt do nhập số lượng nhiều cho con dùng, mom cần thì inbox mình nhé 🥰",https://www.facebook.com/groups/183774529022936/posts/2208791263187909/?comment_id=2210892412977794,https://www.facebook.com/groups/183774529022936/posts/2208791263187909/
2026-06-21T22:31:22.000Z,2211346179599084,,0,Khánh Nam Dương,"dùng cho con sữa nan a2 thụy sĩ đúng là đỡ hẳn ốm vặt, sữa này được bổ sung thêm hmo nâng lên 6hmo nên đề kháng bé tốt hơn nhé mẹ, mình thấy nan a2 có nhiều điểm cộng khi phía sau là nền tảng nghiên cứu từ nestlé á",https://www.facebook.com/groups/183774529022936/posts/2208791263187909/?comment_id=2211346179599084,https://www.facebook.com/groups/183774529022936/posts/2208791263187909/
2026-06-21T22:31:29.000Z,2211346259599076,2211346179599084,1,Nguyễn Vân,"đúng rùii, sữa này còn giúp bé hấp thu dễ hơn nhờ bộ lợi khuẩn kép b infantis & b lactis đó,sữa tốt cho tiêu hoá & đề kháng là nền tảng giúp cho bé pt toàn diện m nha dòng nestle thương hiệu hơn 155 năm rồi, có tiếng toàn cầu luôn đúng nè nè",https://www.facebook.com/groups/183774529022936/posts/2208791263187909/?comment_id=2211346179599084&reply_comment_id=2211346259599076,https://www.facebook.com/groups/183774529022936/posts/2208791263187909/
2026-06-21T22:31:34.000Z,2211346299599072,2211346179599084,1,Khánh Nam Dương,"dòng cao cấp của nhà nestle mà, chất lượg sữa thì cứ yên tâm khỏi lo nha đâu mom mom",https://www.facebook.com/groups/183774529022936/posts/2208791263187909/?comment_id=2211346179599084&reply_comment_id=2211346299599072,https://www.facebook.com/groups/183774529022936/posts/2208791263187909/
2026-06-21T22:31:39.000Z,2211346349599067,2211346179599084,1,Nguyễn Vân,"mà con ăn ti ngon miệng hấp thu tốt nên cân nặng nhỉnh đều luôn đó nhé nhé😊, mình thấy nan a2 có xuất xứ thụy sĩ nên cũng yên tâm hơn á",https://www.facebook.com/groups/183774529022936/posts/2208791263187909/?comment_id=2211346179599084&reply_comment_id=2211346349599067,https://www.facebook.com/groups/183774529022936/posts/2208791263187909/
2026-06-21T22:31:46.000Z,2211346406265728,,0,Nhung Nhung Hoàng,"chân ái của tớ nhá mẹ bỉm, dùng sữa nan cam này con tiêu hóa khỏe ăn ngon ngủ ngoan mà con cũng chịu sữa nên chả thấy có lo lắng gì hết",https://www.facebook.com/groups/183774529022936/posts/2208791263187909/?comment_id=2211346406265728,https://www.facebook.com/groups/183774529022936/posts/2208791263187909/
2026-06-21T22:31:55.000Z,2211346492932386,2211346406265728,1,Trịnh Thu Trúc,cũng nhờ dòng nan a2 thụy sĩ có thành phần đạm a2 tốt cho tiêu hóa con đó,https://www.facebook.com/groups/183774529022936/posts/2208791263187909/?comment_id=2211346406265728&reply_comment_id=2211346492932386,https://www.facebook.com/groups/183774529022936/posts/2208791263187909/
2026-06-21T22:31:59.000Z,2211346546265714,2211346406265728,1,Nhung Nhung Hoàng,"đúng v nah , đạm a2 này hơn hẳn loại đạm a1 thông thường nên giúp con dễ tiêu dễ hấp thu hơn thu, mình thích những thương hiệu nói ít làm nhiều như vậy nha",https://www.facebook.com/groups/183774529022936/posts/2208791263187909/?comment_id=2211346406265728&reply_comment_id=2211346546265714,https://www.facebook.com/groups/183774529022936/posts/2208791263187909/
2026-06-21T22:32:06.000Z,2211346629599039,2211346406265728,1,Trịnh Thu Trúc,con mk cũng chịu sữa ti ngoan k lo con bỏ cữ nha đâu m m,https://www.facebook.com/groups/183774529022936/posts/2208791263187909/?comment_id=2211346406265728&reply_comment_id=2211346629599039,https://www.facebook.com/groups/183774529022936/posts/2208791263187909/
2026-06-21T22:32:14.000Z,2211346722932363,,0,Hoài Thu Lê,"bé nhà mk hồi lúc mới sinh bụng vốn yếu nè, mk đã phải thử qua vài loại rồi mới tìm đc loại sữa thực sự hợp tiêu hoá bé hoá á",https://www.facebook.com/groups/183774529022936/posts/2208791263187909/?comment_id=2211346722932363,https://www.facebook.com/groups/183774529022936/posts/2208791263187909/
2026-06-21T22:32:26.000Z,2211346826265686,,0,Hồng Vũ,"nhà mk dùng nan cam mấy tháng nay thấy con ít ốm vặt khi giao mùa, tiêu êm phân đẹp, dung nạp tốt khỏe nên mẹ yên tâm lắm đó, mom cũng thử đi nha, thấy quy trình càng rõ ràng thì càng dễ tạo sự tin tưởng nè",https://www.facebook.com/groups/183774529022936/posts/2208791263187909/?comment_id=2211346826265686,https://www.facebook.com/groups/183774529022936/posts/2208791263187909/
2026-06-21T22:32:36.000Z,2211346892932346,2211346826265686,1,Hai Pham,"dòng này có đạm a2, bộ 6hmo cùng lợi khuẩn kép b infantis & b lactis, hỗ trợ tiêu hóa và đề kháng cho bé rất tốt luôn đó đó",https://www.facebook.com/groups/183774529022936/posts/2208791263187909/?comment_id=2211346826265686&reply_comment_id=2211346892932346,https://www.facebook.com/groups/183774529022936/posts/2208791263187909/
2026-06-21T22:32:44.000Z,2211346982932337,,0,Nguyễn Thu Thủy,"mk chọn nan cam vì có bộ ba đạm a2, 6hmo và lợi khuẩn kép b infantis & b lactis trg sữa kết hợp với nhau giúp con tiêu hóa ổn định, đề kháng vững vàng, mẹ tham khảo thử là hợp lý lắm nghen",https://www.facebook.com/groups/183774529022936/posts/2208791263187909/?comment_id=2211346982932337,https://www.facebook.com/groups/183774529022936/posts/2208791263187909/
2026-06-21T22:32:51.000Z,2211347042932331,2211346982932337,1,Truc Doan,"đúng thật, dùng rồi mới thấy, bé tiêu tốt, bụng khỏe, phân mịn đẹp nhìn rất thích lắm nha mom mom, mình khá thích cách nestlé âm thầm nâng cao tiêu chuẩn sản phẩm á",https://www.facebook.com/groups/183774529022936/posts/2208791263187909/?comment_id=2211346982932337&reply_comment_id=2211347042932331,https://www.facebook.com/groups/183774529022936/posts/2208791263187909/
2026-06-21T22:32:56.000Z,2211347096265659,2211346982932337,1,Nguyễn Thu Thủy,sức đề kháng bé tăng rõ rệt nên con khỏe khoắn hơn thấy rõ luôn đấy đó đó,https://www.facebook.com/groups/183774529022936/posts/2208791263187909/?comment_id=2211346982932337&reply_comment_id=2211347096265659,https://www.facebook.com/groups/183774529022936/posts/2208791263187909/
2026-06-21T22:33:03.000Z,2211347176265651,2211346982932337,1,Truc Doan,"cho con uống nan a2 đúng là khỏe từ trong ra ngoài, mẹ chăm con cũng nhàn hơn, yên tâm chăm bé rất nhiều😊",https://www.facebook.com/groups/183774529022936/posts/2208791263187909/?comment_id=2211346982932337&reply_comment_id=2211347176265651,https://www.facebook.com/groups/183774529022936/posts/2208791263187909/
2026-06-21T22:33:10.000Z,2211347249598977,,0,Ngoc Anh Tran,"review cho mom về nan cam nè, bé mk uống một tgian thấy cứng cáp hẳn, bụng khỏe, tiêu đều, hấp thu ổn định tốt lắm nha, mình thích những nhãn hàng chịu khó đầu tư cho nghiên cứu lâu dài á",https://www.facebook.com/groups/183774529022936/posts/2208791263187909/?comment_id=2211347249598977,https://www.facebook.com/groups/183774529022936/posts/2208791263187909/
2026-06-21T22:33:19.000Z,2211347329598969,2211347249598977,1,Thu Thi Bich Nguyen,"sữa còn bổ sung bộ lợi khuẩn kép b infantis & b lactis, rất tốt cho đường ruột và đề kháng của bé luôn đó nha mom mom",https://www.facebook.com/groups/183774529022936/posts/2208791263187909/?comment_id=2211347249598977&reply_comment_id=2211347329598969,https://www.facebook.com/groups/183774529022936/posts/2208791263187909/
2026-06-21T22:33:29.000Z,2211347429598959,,0,Linh Nguyễn,"con ti nan cam cho con ti ngay đi nha, bé mình con đang ti ok lắm nha, con tiêu êm, bụng luôn khoẻ, sữa được cải tiến từ 5hmo lên tận đến 6hmo giúp con tăng dưỡng chất htr đề kháng khoẻ, mom tham khảo nhé, với mình nan a2 khá nổi bật vì có cả nguồn gốc rõ ràng lẫn hậu thuẫn nghiên cứu nha",https://www.facebook.com/groups/183774529022936/posts/2208791263187909/?comment_id=2211347429598959,https://www.facebook.com/groups/183774529022936/posts/2208791263187909/
2026-06-21T22:33:39.000Z,2211347509598951,2211347429598959,1,Vũ Hoài Thương,nhà mình thường cho bé tham gia các trò chơi vận động tại khu vui chơi cuối tuần. hiện tại vẫn duy trì nan a2 kết hợp sữa nước a2 để đồng hành cùng con nhỏ,https://www.facebook.com/groups/183774529022936/posts/2208791263187909/?comment_id=2211347429598959&reply_comment_id=2211347509598951,https://www.facebook.com/groups/183774529022936/posts/2208791263187909/
2026-06-21T22:33:42.000Z,2211347519598950,2211347429598959,1,Linh Nguyễn,mình thích chỗ sữa nước với nền tảng a2 và hmo kế thừa từ nhà nan nên tạo cảm giác dùng rất tin tưởng,https://www.facebook.com/groups/183774529022936/posts/2208791263187909/?comment_id=2211347429598959&reply_comment_id=2211347519598950,https://www.facebook.com/groups/183774529022936/posts/2208791263187909/
2026-06-21T22:33:49.000Z,2211347569598945,2211347429598959,1,Vũ Hoài Thương,"bé hợp nên hệ tiêu hóa thuận lợi, ít làm mẹ lo lắng hơn nhiều",https://www.facebook.com/groups/183774529022936/posts/2208791263187909/?comment_id=2211347429598959&reply_comment_id=2211347569598945,https://www.facebook.com/groups/183774529022936/posts/2208791263187909/
2026-06-21T22:33:57.000Z,2211347632932272,,0,Thảo Đào Thanh,"nan a2 thụy sĩ ở đây có mom nào đang cho con dùng như con nhà em khum, công nhận là sữa này giúp con đề kháng khoẻ thật nha, cải tiến từ 5hmo lên 6hmo thích lắm mẹ, nestlé có bề dày nghiên cứu nên mình thấy khá yên tâm á",https://www.facebook.com/groups/183774529022936/posts/2208791263187909/?comment_id=2211347632932272,https://www.facebook.com/groups/183774529022936/posts/2208791263187909/
2026-06-21T22:34:04.000Z,2211347679598934,2211347632932272,1,Nguyễn Quỳnh Trang,bé nhà mình rất thích giúp mẹ lấy đồ hoặc sắp xếp những món đồ nhỏ trong nhà. mình thấy con ngày càng năng động nên vẫn duy trì nan a2 cùng sữa nước a2 đều đặn hằng ngày,https://www.facebook.com/groups/183774529022936/posts/2208791263187909/?comment_id=2211347632932272&reply_comment_id=2211347679598934,https://www.facebook.com/groups/183774529022936/posts/2208791263187909/
2026-06-21T22:34:09.000Z,2211347692932266,2211347632932272,1,Thảo Đào Thanh,mình đánh giá cao việc sữa nước được phát triển trên nền tảng a2 và hmo kế thừa từ nhà nan nè chuẩn,https://www.facebook.com/groups/183774529022936/posts/2208791263187909/?comment_id=2211347632932272&reply_comment_id=2211347692932266,https://www.facebook.com/groups/183774529022936/posts/2208791263187909/
2026-06-21T22:34:17.000Z,2211347759598926,2211347632932272,1,Nguyễn Quỳnh Trang,"bé dùng hợp nên hệ tiêu hóa ổn định, ăn uống cũng thoải mái hơn hẳn, shopee nhiều mã giảm giá cho mẹ bỉm nè, mua nan tính ra rẻ hơn hẳn mua ngoài nhá",https://www.facebook.com/groups/183774529022936/posts/2208791263187909/?comment_id=2211347632932272&reply_comment_id=2211347759598926,https://www.facebook.com/groups/183774529022936/posts/2208791263187909/
