Date,Comment_ID,Parent_ID,Level,Author,Content,Permalink,Post_URL
2026-06-21T05:28:32.000Z,2210657643001271,,0,Lê Thị Thảo,"dặm cho con ti sữa nan cam thấy con tiêu đều, cứg cáp hơn hẳn, nay còn khỏe đề kháng hơn nhờ sữa tăng lên 6hmo nữa đó nè nè , mình thích cách sữa được phát triển dựa trên nền khoa học rõ ràng",https://www.facebook.com/groups/183774529022936/posts/2208788026521566/?comment_id=2210657643001271,https://www.facebook.com/groups/183774529022936/posts/2208788026521566/
2026-06-21T05:28:41.000Z,2210657713001264,2210657643001271,1,Đăng Đào Quang,"phải đó, sữa có thêm bộ lợi khuẩn kép b infantis & b lactis nên con bụng khỏe hơn hẳn ra lun lun😊",https://www.facebook.com/groups/183774529022936/posts/2208788026521566/?comment_id=2210657643001271&reply_comment_id=2210657713001264,https://www.facebook.com/groups/183774529022936/posts/2208788026521566/
2026-06-21T05:28:46.000Z,2210657763001259,2210657643001271,1,Lê Thị Thảo,"bé mk cũng mới chuyển sang nan a2 dc nửa tháng nay nè, sữa chính hãng của nhà nestle nên yên tâm,sữa tốt cho tiêu hoá cả đề kháng, 2 yếu tố này chính là nền tảng vững chắc giúp bé phát triển toàn diện nha mom",https://www.facebook.com/groups/183774529022936/posts/2208788026521566/?comment_id=2210657643001271&reply_comment_id=2210657763001259,https://www.facebook.com/groups/183774529022936/posts/2208788026521566/
2026-06-21T05:28:55.000Z,2210657849667917,2210657643001271,1,Đăng Đào Quang,"có thêm thành phần 6hmo hỗ trợ tăng đề kháng bé ít ốm vặt khi trở trời hơi gió nên tăng cân mẹ cứ yên tâm vì nan có hơn 155 năm lịch sử lâu đời lắm đấy nghen nghen, nestlé là thương hiệu lâu đời nên mình tin vào độ ổn định của sữa nan a2",https://www.facebook.com/groups/183774529022936/posts/2208788026521566/?comment_id=2210657643001271&reply_comment_id=2210657849667917,https://www.facebook.com/groups/183774529022936/posts/2208788026521566/
2026-06-21T05:29:03.000Z,2210657926334576,,0,Hai Huyen Pham,vị sữa nan a2 thụy sĩ này nhẹ thanh hao hao như sữa mẹ nên dễ ti con mk mê lắm lại có đạm a2 nên con tiêu hóa dễ và hấp thu được tốt hơn,https://www.facebook.com/groups/183774529022936/posts/2208788026521566/?comment_id=2210657926334576,https://www.facebook.com/groups/183774529022936/posts/2208788026521566/
2026-06-21T05:29:14.000Z,2210658026334566,2210657926334576,1,Khang An Thiện,đạm a2 này ko những tốt còn quý vì nó đc lấy từ bò thuần chủng tinh tuyển đó,https://www.facebook.com/groups/183774529022936/posts/2208788026521566/?comment_id=2210657926334576&reply_comment_id=2210658026334566,https://www.facebook.com/groups/183774529022936/posts/2208788026521566/
2026-06-21T05:29:19.000Z,2210658116334557,2210657926334576,1,Hai Huyen Pham,"đúng rồi , đạm a2 chỉ sản sinh ra một cách tự nhiên ko có máy móc nào làm được nên con cũng dễ tiêu hóa hơn hẳn luôn đó👍, xuất xứ thuỵ sĩ làm mình thấy sữa nan a2 đáng tin hơn vì tiêu chuẩn bên đó khá cao",https://www.facebook.com/groups/183774529022936/posts/2208788026521566/?comment_id=2210657926334576&reply_comment_id=2210658116334557,https://www.facebook.com/groups/183774529022936/posts/2208788026521566/
2026-06-21T05:29:28.000Z,2210658219667880,2210657926334576,1,Khang An Thiện,con bé tố nhà mk ti con ko còn đi cầu lỏng lẻo như trước cứ êm ru nên mẹ cũng đỡ vất vả nhiều,https://www.facebook.com/groups/183774529022936/posts/2208788026521566/?comment_id=2210657926334576&reply_comment_id=2210658219667880,https://www.facebook.com/groups/183774529022936/posts/2208788026521566/
2026-06-21T05:29:46.000Z,2210658416334527,,0,Lưu An Kế,"rw cho mẹ tus sữa nan cam nha dòng này tốt cho đề kháng lắm, nay đang cải tiếntăng lượng hmo lên bộ 6hmo đề kháng khỏe hơn nhiều nhé👶",https://www.facebook.com/groups/183774529022936/posts/2208788026521566/?comment_id=2210658416334527,https://www.facebook.com/groups/183774529022936/posts/2208788026521566/
2026-06-21T05:29:55.000Z,2210658499667852,2210658416334527,1,Huỳnh Phương Mai,"sữa nay còn có thêm lợi khuẩn b lactis, lợi khuẩn tốt cho đường ruột, hỗ trợ giảm đến 58% các vấn đề tiêu hóa cho con nè, mình thấy nestlé có lợi thế lớn từ kinh nghiệm nghiên cứu lâu năm á",https://www.facebook.com/groups/183774529022936/posts/2208788026521566/?comment_id=2210658416334527&reply_comment_id=2210658499667852,https://www.facebook.com/groups/183774529022936/posts/2208788026521566/
2026-06-21T05:30:04.000Z,2210658626334506,2210658416334527,1,Lưu An Kế,"chưa kể còn có nguồn đạm a2 từ giống bò a2 thuần chủng, thân thiện với tiêu hoá của con nữa đấy chứ chứ",https://www.facebook.com/groups/183774529022936/posts/2208788026521566/?comment_id=2210658416334527&reply_comment_id=2210658626334506,https://www.facebook.com/groups/183774529022936/posts/2208788026521566/
2026-06-21T05:30:16.000Z,2210658733001162,,0,Lê Huy Bảo,"bé mk uống nan a2 thụy sĩ thấy bụng êm, ko bón, đề kháng tốt nên ít bệnh vặt, mẹ tham khảo dòng này cho bé nhá❤️ nghen",https://www.facebook.com/groups/183774529022936/posts/2208788026521566/?comment_id=2210658733001162,https://www.facebook.com/groups/183774529022936/posts/2208788026521566/
2026-06-21T05:30:25.000Z,2210658813001154,2210658733001162,1,Lê Ngọc Thảo,"công thức có lợi khuẩn kép, hỗ trợ t hoá trơn tru và tăng miễn dịch, con chắc khoẻ từ trong ra ngoài đó m chọn nan cho con nhờ hơn 155 năm kinh nghiệm dày dặn luôn nè đúng chưa ơi, đọc xong thấy thương hiệu này làm khá tốt về mặt chất lượng nè",https://www.facebook.com/groups/183774529022936/posts/2208788026521566/?comment_id=2210658733001162&reply_comment_id=2210658813001154,https://www.facebook.com/groups/183774529022936/posts/2208788026521566/
2026-06-21T05:30:34.000Z,2210658903001145,2210658733001162,1,Lê Huy Bảo,"đúng mẹ, nay sữa còn cải tiến với 6hmo, tăng gấp đôi dưỡng chất hỗ trợ đề kháng nè m,mấy sữa mà tốt cho tiêu hóa ,đề kháng thì ht con pt toàn diện tốt hơn nữa nhá nhá ha",https://www.facebook.com/groups/183774529022936/posts/2208788026521566/?comment_id=2210658733001162&reply_comment_id=2210658903001145,https://www.facebook.com/groups/183774529022936/posts/2208788026521566/
2026-06-21T05:30:47.000Z,2210659049667797,,0,Lê Nguyên,"bé mk ti nan cam, bụng êm, hấp thu tốt, đề kháng vững, ít ốm vặt, mẹ cứ thử cho bé",https://www.facebook.com/groups/183774529022936/posts/2208788026521566/?comment_id=2210659049667797,https://www.facebook.com/groups/183774529022936/posts/2208788026521566/
2026-06-21T05:30:55.000Z,2210659139667788,,0,Phan Lâm,"bé nhà mk uống nan cam thấy bụg êm, tiêu hoá trơn tru, đề kháng cải thiện rõ, mẹ tham khảo thử cho bé luôn nhen nhen , cảm giác nestlé luôn nỗ lực để hoàn thiện sản phẩm hơn mỗi ngày á",https://www.facebook.com/groups/183774529022936/posts/2208788026521566/?comment_id=2210659139667788,https://www.facebook.com/groups/183774529022936/posts/2208788026521566/
2026-06-21T05:31:11.000Z,2210659309667771,2210659139667788,1,Hương Võ,"nan a2 có đạm a2 từ bò thuần chủng, hợp với hệ tiêu hoá non nớt của bé, con hấp thu dễ, tiêu êm, bụng khoẻ lắm mẹ ơi à",https://www.facebook.com/groups/183774529022936/posts/2208788026521566/?comment_id=2210659139667788&reply_comment_id=2210659309667771,https://www.facebook.com/groups/183774529022936/posts/2208788026521566/
2026-06-21T05:31:20.000Z,2210659373001098,,0,Hoàng An,"mẹ cho bé thử nan a2 thụy sĩ công thức mới có 6hmo đi, thấy bé e ún đỡ ốm vặt, đề kháng lên rõ luôn🤔 vượt trội, mình khá ấn tượng vì phía sau nan a2 là hệ thống nghiên cứu của nestlé nè",https://www.facebook.com/groups/183774529022936/posts/2208788026521566/?comment_id=2210659373001098,https://www.facebook.com/groups/183774529022936/posts/2208788026521566/
2026-06-21T05:31:34.000Z,2210659563001079,2210659373001098,1,Trinh Lê,mình thích những lựa chọn giúp việc chăm con nhẹ nhàng hơn nên sau 1 tuổi có bổ sung thêm sữa nước a2 bên cạnh nan a2 cho bé. tới giờ thấy khá phù hợp lắm,https://www.facebook.com/groups/183774529022936/posts/2208788026521566/?comment_id=2210659373001098&reply_comment_id=2210659563001079,https://www.facebook.com/groups/183774529022936/posts/2208788026521566/
2026-06-21T05:31:39.000Z,2210659626334406,2210659373001098,1,Hoàng An,điều mình thích là sữa nước với nền tảng a2 và hmo kế thừa từ nhà nan nên tạo cảm giác dùng rất đồng bộ,https://www.facebook.com/groups/183774529022936/posts/2208788026521566/?comment_id=2210659373001098&reply_comment_id=2210659626334406,https://www.facebook.com/groups/183774529022936/posts/2208788026521566/
2026-06-21T05:31:47.000Z,2210659736334395,2210659373001098,1,Trinh Lê,"bé phát triển thể chất khá tốt, nhìn người khỏe khoắn và nhanh nhẹn hơn nhiều",https://www.facebook.com/groups/183774529022936/posts/2208788026521566/?comment_id=2210659373001098&reply_comment_id=2210659736334395,https://www.facebook.com/groups/183774529022936/posts/2208788026521566/
2026-06-21T05:31:57.000Z,2210659806334388,,0,Phạm Xuân Thoại,"nan a2 thụy sĩ mới này công thức cải tiến từ 5 lên 6hmo luôn nha, con e ún thấy khỏe hơn hẳn, c thử cho bé dùng xem, thấy nestlé luôn đầu tư cho nghiên cứu nên mình có thiện cảm á",https://www.facebook.com/groups/183774529022936/posts/2208788026521566/?comment_id=2210659806334388,https://www.facebook.com/groups/183774529022936/posts/2208788026521566/
2026-06-21T05:32:10.000Z,2210659933001042,2210659806334388,1,My Duyen Dao,nhà mình hay đưa bé đi chơi ngắn ngày nên mình khá thích việc có thêm sữa nước a2 bên cạnh nan a2. vừa tiện vừa giúp duy trì thói quen dinh dưỡng tốt cho con,https://www.facebook.com/groups/183774529022936/posts/2208788026521566/?comment_id=2210659806334388&reply_comment_id=2210659933001042,https://www.facebook.com/groups/183774529022936/posts/2208788026521566/
2026-06-21T05:32:16.000Z,2210659986334370,2210659806334388,1,Phạm Xuân Thoại,sữa nước được phát triển trên nền tảng a2 và hmo kế thừa từ nhà nan là điểm chính khiến mình yên tâm khi lựa chọn,https://www.facebook.com/groups/183774529022936/posts/2208788026521566/?comment_id=2210659806334388&reply_comment_id=2210659986334370,https://www.facebook.com/groups/183774529022936/posts/2208788026521566/
2026-06-21T05:32:25.000Z,2210660076334361,2210659806334388,1,My Duyen Dao,"bé hợp nên bụng dạ ổn định, khả năng hấp thu chất cũng khá tốt, con cưng thường xuyên có ưu đãi nè, mua nan ở đây mình tiết kiệm được khá nhiều luôn nha",https://www.facebook.com/groups/183774529022936/posts/2208788026521566/?comment_id=2210659806334388&reply_comment_id=2210660076334361,https://www.facebook.com/groups/183774529022936/posts/2208788026521566/
