Date,Comment_ID,Parent_ID,Level,Author,Content,Permalink,Post_URL
2026-06-27T02:06:12.000Z,2215890659144636,,0,Bichphuong Hoang,"mk rv nan a2 cho mom tham khảo, con uống vào bụng khoẻ, ko bị táo bón, sức đề kháng tốt nè mẹ ơi , mình thấy sữa được nghiên cứu kỹ nên yên tâm hơn",https://www.facebook.com/groups/183774529022936/posts/2214270119306690/?comment_id=2215890659144636,https://www.facebook.com/groups/183774529022936/posts/2214270119306690/
2026-06-27T02:06:22.000Z,2215890779144624,2215890659144636,1,Mạc Thùy,"mk cx đang cho tin uống nan này, mà sữa nay cải tiến lên 6hmo, công nghệ tiên phong này giúp nhân đôi dưỡng chất htro đề kháng cho bé nhé",https://www.facebook.com/groups/183774529022936/posts/2214270119306690/?comment_id=2215890659144636&reply_comment_id=2215890779144624,https://www.facebook.com/groups/183774529022936/posts/2214270119306690/
2026-06-27T02:06:26.000Z,2215890819144620,2215890659144636,1,Bichphuong Hoang,"đúng r á mom, mà sữa còn có đạm a2 với lợi khuẩn kép b infantis & b lactis nên bé uống tiêu hoá với hấp thu tốt nghen",https://www.facebook.com/groups/183774529022936/posts/2214270119306690/?comment_id=2215890659144636&reply_comment_id=2215890819144620,https://www.facebook.com/groups/183774529022936/posts/2214270119306690/
2026-06-27T02:06:30.000Z,2215890839144618,2215890659144636,1,Mạc Thùy,"cho bé uốg dòng này nay vị sữa còn bỏ dầu cá nên nhạt thanh, dễ uống, con chịu uống lắm nè mẹ tin dùng nan vì hơn 155 năm kinh nghiệm thực tiễn chuẩn luôn",https://www.facebook.com/groups/183774529022936/posts/2214270119306690/?comment_id=2215890659144636&reply_comment_id=2215890839144618,https://www.facebook.com/groups/183774529022936/posts/2214270119306690/
2026-06-27T02:06:44.000Z,2215890995811269,,0,Hoang Duyenanh,"bé mk uống nan a2 thấy ổn áp mẹ nè, dễ tiêu, êm bụng, dễ hấp thu, còn tăng sức đề khág, nan a2 có xuất xứ thụy sĩ nên mình thấy khá an tâm khi tìm hiểu nha",https://www.facebook.com/groups/183774529022936/posts/2214270119306690/?comment_id=2215890995811269,https://www.facebook.com/groups/183774529022936/posts/2214270119306690/
2026-06-27T02:06:51.000Z,2215891122477923,2215890995811269,1,Yên Ngọc Thắm,"sữa cải tiến mới với công thức 6hmo chiếm tới 58phần trăm lượng hmo tương tự sữa mẹ, lại kết hợp với lợi khuẩn kép b infantis & b lactis nên tiêu hoá lẫn đề kháng đều tốt nè",https://www.facebook.com/groups/183774529022936/posts/2214270119306690/?comment_id=2215890995811269&reply_comment_id=2215891122477923,https://www.facebook.com/groups/183774529022936/posts/2214270119306690/
2026-06-27T02:06:55.000Z,2215891182477917,2215890995811269,1,Hoang Duyenanh,"mà dòng này bột mịn, nay bỏ dầu cá nên vị sữa k còn bị tanh, dễ uống, con chịu ti lắm nhé",https://www.facebook.com/groups/183774529022936/posts/2214270119306690/?comment_id=2215890995811269&reply_comment_id=2215891182477917,https://www.facebook.com/groups/183774529022936/posts/2214270119306690/
2026-06-27T02:07:06.000Z,2215891289144573,,0,Mỹ Hồng,"bé mk uống nan a2 thấy ít ốm vặt, đề kháng tốt, bụng khoe nè mom, tham khảo xem nghen🤔, với mình xuất xứ thụy sĩ của nan a2 là một điểm cộng khá lớn á",https://www.facebook.com/groups/183774529022936/posts/2214270119306690/?comment_id=2215891289144573,https://www.facebook.com/groups/183774529022936/posts/2214270119306690/
2026-06-27T02:07:17.000Z,2215891399144562,,0,Chau Tran,"mình vote nan a2, cả tiêu hoá lẫn đề kháng đều ổn áp, bé mình dùng từ nhỏ tới giờ thấy hợp lắm, chưa có ý định đổi sữa luôn nè., cá nhân mình khá thích các sản phẩm như nan a2 vì có nguồn gốc rõ ràng nè",https://www.facebook.com/groups/183774529022936/posts/2214270119306690/?comment_id=2215891399144562,https://www.facebook.com/groups/183774529022936/posts/2214270119306690/
2026-06-27T02:07:25.000Z,2215891512477884,2215891399144562,1,Phương Hải,"đạm a2 trong sữa từ bò thuần chủng, giúp bé dễ tiêu, thân thiện với hệ tiêu hoá non nớt của bé mẹ nè.",https://www.facebook.com/groups/183774529022936/posts/2214270119306690/?comment_id=2215891399144562&reply_comment_id=2215891512477884,https://www.facebook.com/groups/183774529022936/posts/2214270119306690/
2026-06-27T02:07:30.000Z,2215891572477878,2215891399144562,1,Chau Tran,"chưa kể nay công thức đã cải tiến lên 6hmo, bổ sung thêm gấp đôi dưỡng chất hỗ trợ đề kháng tốt hơn cho bé nhé.",https://www.facebook.com/groups/183774529022936/posts/2214270119306690/?comment_id=2215891399144562&reply_comment_id=2215891572477878,https://www.facebook.com/groups/183774529022936/posts/2214270119306690/
2026-06-27T02:07:42.000Z,2215891725811196,,0,Candy Nguyen,"bé nhà mình đang ún nan a2 thuỵ sĩ, hiệu quả thấy rõ cả tiêu hoá lẫn đề kháng, mẹ tham khảo thử đi., nhìn chung mình thấy nan a2 được đầu tư khá bài bản nè",https://www.facebook.com/groups/183774529022936/posts/2214270119306690/?comment_id=2215891725811196,https://www.facebook.com/groups/183774529022936/posts/2214270119306690/
2026-06-27T02:07:53.000Z,2215891822477853,2215891725811196,1,Quyên Thu,"mình thích nhất là nay sữa bỏ dầu cá nên k bị tanh nữa, sữa bột mịn, tan nhanh, thơm nhẹ, bé ún dễ chịu.",https://www.facebook.com/groups/183774529022936/posts/2214270119306690/?comment_id=2215891725811196&reply_comment_id=2215891822477853,https://www.facebook.com/groups/183774529022936/posts/2214270119306690/
2026-06-27T02:08:02.000Z,2215891899144512,2215891725811196,1,Candy Nguyen,"nay công thức cải tiến mới còn nâng lên 6hmo, tăng gấp đôi dưỡng chất hỗ trợ đề kháng, bé mình đề kháng khoẻ hơn hẳn.",https://www.facebook.com/groups/183774529022936/posts/2214270119306690/?comment_id=2215891725811196&reply_comment_id=2215891899144512,https://www.facebook.com/groups/183774529022936/posts/2214270119306690/
2026-06-27T02:08:14.000Z,2215892015811167,,0,Thanh Diệp,"bé e ún nan a2 thấy tiêu hoá ổn, k bón, đề kháng khoẻ, ít bệnh vặt nè mẹ, thử tìm hiểu cho bé coi sao đi., xuất xứ thụy sĩ của nan a2 là điểm mình thấy khá yên tâm nha",https://www.facebook.com/groups/183774529022936/posts/2214270119306690/?comment_id=2215892015811167,https://www.facebook.com/groups/183774529022936/posts/2214270119306690/
2026-06-27T02:08:22.000Z,2215892099144492,2215892015811167,1,Quản Quyên,"dòng này nay cải tiến lên 6hmo, bổ sung thêm hmo 3fl, nâng tổng số lên 6 loại, tăng dưỡng chất hỗ trợ đề kháng gấp đôi đó.",https://www.facebook.com/groups/183774529022936/posts/2214270119306690/?comment_id=2215892015811167&reply_comment_id=2215892099144492,https://www.facebook.com/groups/183774529022936/posts/2214270119306690/
2026-06-27T02:08:34.000Z,2215892199144482,2215892015811167,1,Thanh Diệp,"sữa nestle nhập khẩu trực tiếp từ thuỵ sĩ, chất lượng uy tín nên cho bé ún rất yên tâm luôn mẹ nè.",https://www.facebook.com/groups/183774529022936/posts/2214270119306690/?comment_id=2215892015811167&reply_comment_id=2215892199144482,https://www.facebook.com/groups/183774529022936/posts/2214270119306690/
2026-06-27T02:08:45.000Z,2215892385811130,,0,Nguyễn Minh Vân,"cho con dùng sữa nan a2 ưng nha, sữa này giúp bé khỏe tiêu hóa đề kháng tốt, nay sữa cải tiến lên 6hmo đề kháng bé khỏe hơn đấy, mình thấy nguồn gốc nhập khẩu thụy sĩ của nan a2 là một lợi thế nè",https://www.facebook.com/groups/183774529022936/posts/2214270119306690/?comment_id=2215892385811130,https://www.facebook.com/groups/183774529022936/posts/2214270119306690/
2026-06-27T02:08:55.000Z,2215892452477790,2215892385811130,1,Van Cao,bé đầu nhà mình dùng nan a2 kết hợp sữa nước a2 khá ổn nên tới bé thứ hai mình cũng cứ áp dụng luôn cảm giác đỡ phải tìm hiểu quá nhiều dòng khác nhau nữa chi mệt :)) cứ một hệ mà đi thôi cho khỏe,https://www.facebook.com/groups/183774529022936/posts/2214270119306690/?comment_id=2215892385811130&reply_comment_id=2215892452477790,https://www.facebook.com/groups/183774529022936/posts/2214270119306690/
2026-06-27T02:09:00.000Z,2215892479144454,2215892385811130,1,Nguyễn Minh Vân,sữa nước có nền tảng a2 và hmo chất lượng nha m điểm cộng lớn cực kỳ luôn á nha mẹ nó,https://www.facebook.com/groups/183774529022936/posts/2214270119306690/?comment_id=2215892385811130&reply_comment_id=2215892479144454,https://www.facebook.com/groups/183774529022936/posts/2214270119306690/
2026-06-27T02:09:05.000Z,2215892542477781,2215892385811130,1,Van Cao,hai bé đều uống hợp nên hệ tiêu hoá khá tốt nhẹ bụng đi tiêu đều đặn nhẹ nhàng lắm cơ đó m,https://www.facebook.com/groups/183774529022936/posts/2214270119306690/?comment_id=2215892385811130&reply_comment_id=2215892542477781,https://www.facebook.com/groups/183774529022936/posts/2214270119306690/
2026-06-27T02:09:14.000Z,2215892652477770,,0,Tài Kevin,"t chỉ thích mỗi nan cam , sữa có htr cả tiêu hóa và đề kháng, trộm vía bi nhà em ti sữa giỏi mà cũng cứng cáp hơn nhiều, điều khiến mình chú ý là nan a2 được nhập khẩu nguyên lon từ thụy sĩ nè",https://www.facebook.com/groups/183774529022936/posts/2214270119306690/?comment_id=2215892652477770,https://www.facebook.com/groups/183774529022936/posts/2214270119306690/
2026-06-27T02:09:25.000Z,2215892812477754,2215892652477770,1,Nhã Ngũ Trà,nhà mình hay đưa bé đi học năng khiếu cuối tuần nên ngoài nan a2 ở nhà mình luôn chuẩn bị thêm sữa nước a2 trong chiếc balo cho con uống nhanh bổ sung năng lượng tức thì trên đường đi cho tiện,https://www.facebook.com/groups/183774529022936/posts/2214270119306690/?comment_id=2215892652477770&reply_comment_id=2215892812477754,https://www.facebook.com/groups/183774529022936/posts/2214270119306690/
2026-06-27T02:09:30.000Z,2215892885811080,2215892652477770,1,Tài Kevin,sữa nước có nền tảng a2 với hmo kế thừa từ chính nhà nan á mom ơi chất lượng đồng bộ với sữa bột ghê luôn á,https://www.facebook.com/groups/183774529022936/posts/2214270119306690/?comment_id=2215892652477770&reply_comment_id=2215892885811080,https://www.facebook.com/groups/183774529022936/posts/2214270119306690/
2026-06-27T02:09:38.000Z,2215893009144401,2215892652477770,1,Nhã Ngũ Trà,"bé dùng hợp nên khả năng hấp thu khá tốt êm bụng ăn bao nhiêu là hấp thu hết bấy nhiêu nè đó mom, con cưng hay có deal hời cho sữa nan nè, mình toàn canh lúc đó để mua cho bé nha",https://www.facebook.com/groups/183774529022936/posts/2214270119306690/?comment_id=2215892652477770&reply_comment_id=2215893009144401,https://www.facebook.com/groups/183774529022936/posts/2214270119306690/
