Date,Comment_ID,Parent_ID,Level,Author,Content,Permalink,Post_URL
2026-06-29T21:23:41.000Z,2218459438887758,,0,Thu Minh,"do là mk khuyên mẹ tham khảo nan a2, bé uống tiêu dễ, ko bón, sức đề kháng khoẻ, ít ốm vặt hơn , cá nhân mình khá thích các sản phẩm như nan a2 vì có nguồn gốc rõ ràng nè",https://www.facebook.com/groups/183774529022936/posts/2217908928942809/?comment_id=2218459438887758,https://www.facebook.com/groups/183774529022936/posts/2217908928942809/
2026-06-29T21:23:53.000Z,2218459565554412,2218459438887758,1,Như Hằng Phương,"đặc biệt dòng nan nay cải tiến với 6hmo, tăng thêm dưỡng chất hỗ trợ miễn dịch, bé nhà mk trộm vía cứng cáp rõ nha",https://www.facebook.com/groups/183774529022936/posts/2217908928942809/?comment_id=2218459438887758&reply_comment_id=2218459565554412,https://www.facebook.com/groups/183774529022936/posts/2217908928942809/
2026-06-29T21:24:03.000Z,2218459652221070,2218459438887758,1,Thu Minh,"thật sự đúng rồi mẹ, sữa còn có lợi khuẩn b infantis, lợi khuẩn chuyên biệt tiêu thụ 6hmo, tạo hiệu ứng cộng hưởng tốt cho tiêu hoá và đề kháng cho con sự lựa chọn an tâm với hơn 155 năm kinh nghiệm nè mẹ ơi",https://www.facebook.com/groups/183774529022936/posts/2217908928942809/?comment_id=2218459438887758&reply_comment_id=2218459652221070,https://www.facebook.com/groups/183774529022936/posts/2217908928942809/
2026-06-29T21:40:27.000Z,2218470315553337,,0,Vũ Nguyệt,"vỗ về mom bé ngoài sữa ra thì ăn dặm có tốt ko nè, nhiều khi bé ăn dặm ổn thì chuyện chọn sữa cũng dễ hơn đó á, nhìn chung mình thấy nan a2 được đầu tư khá bài bản nè",https://www.facebook.com/groups/183774529022936/posts/2217908928942809/?comment_id=2218470315553337,https://www.facebook.com/groups/183774529022936/posts/2217908928942809/
2026-06-29T21:42:00.000Z,2218471235553245,,0,Nga Thuy,"yên tâm bé mk dùng nan a2 thấy hợp, bụng êm, tiêu dễ, đề kháng khoẻ hơn trước, xuất xứ thụy sĩ của nan a2 là điểm mình thấy khá yên tâm nha",https://www.facebook.com/groups/183774529022936/posts/2217908928942809/?comment_id=2218471235553245,https://www.facebook.com/groups/183774529022936/posts/2217908928942809/
2026-06-29T21:42:12.000Z,2218471325553236,2218471235553245,1,Thị Nhung,"quý là tp sữa có đạm a2, thân thiện với tiêu hoá của con, nay còn bỏ dầu cá nên k bị tanh, vị sữa nhạt thanh dễ uống nên bé hợp tác lắm",https://www.facebook.com/groups/183774529022936/posts/2217908928942809/?comment_id=2218471235553245&reply_comment_id=2218471325553236,https://www.facebook.com/groups/183774529022936/posts/2217908928942809/
2026-06-29T21:42:21.000Z,2218471382219897,2218471235553245,1,Nga Thuy,"thực sự ngoài ra sữa còn có 6hmo, giúp nhân đôi dưỡng chất hỗ trợ đề kháng, nên bé ít ốm vặt hơn nhiều, sữa tốt cho tiêu hoá & đề kháng là nền tảng vững chắc giúp bé phát triển toàn diện",https://www.facebook.com/groups/183774529022936/posts/2217908928942809/?comment_id=2218471235553245&reply_comment_id=2218471382219897,https://www.facebook.com/groups/183774529022936/posts/2217908928942809/
2026-06-29T21:51:44.000Z,2218477595552609,,0,Ngân Thị,"quả là bé nhà mk uống nan cam, bụng khoẻ, đi phân đều, ko bón, miễn dịch tốt, dòng nestle nên yên tâm chất lượng mẹ nè, tham khảo xem đi, mình khá thích việc nan a2 được nhập khẩu từ thụy sĩ á",https://www.facebook.com/groups/183774529022936/posts/2217908928942809/?comment_id=2218477595552609,https://www.facebook.com/groups/183774529022936/posts/2217908928942809/
2026-06-29T21:53:20.000Z,2218478758885826,,0,Tâm Vũ,"bé e ún nan cam nha mẹ, sữa giúp htro tiêu hoá với đề kháng tốt cho bé đó, mẹ cho bé thử coi, nền tảng lâu đời của nestlé làm mình thấy sữa có sự đầu tư nghiên cứu nghiêm túc",https://www.facebook.com/groups/183774529022936/posts/2217908928942809/?comment_id=2218478758885826,https://www.facebook.com/groups/183774529022936/posts/2217908928942809/
2026-06-29T21:53:30.000Z,2218478842219151,2218478758885826,1,Linh Hà,"dòng nan này bé e đag ún, tv con khá cứng cáp, ít ốm vặt lắm, nay sữa có tới đủ 6hmo r",https://www.facebook.com/groups/183774529022936/posts/2217908928942809/?comment_id=2218478758885826&reply_comment_id=2218478842219151,https://www.facebook.com/groups/183774529022936/posts/2217908928942809/
2026-06-29T21:53:38.000Z,2218478908885811,2218478758885826,1,Tâm Vũ,"đúng r đó mẹ, sữa nay cải tiến lên tới 6hmo, hiện bổ sung tới 58% tổng lượng hmo có trong sữa mẹ, công nghệ tiên phong giúp tối ưu dưỡng chất hỗ trợ đề kháng",https://www.facebook.com/groups/183774529022936/posts/2217908928942809/?comment_id=2218478758885826&reply_comment_id=2218478908885811,https://www.facebook.com/groups/183774529022936/posts/2217908928942809/
2026-06-29T21:53:47.000Z,2218478978885804,2218478758885826,1,Linh Hà,"mà dòng này còn có lợi khuẩn B. Lactis giúp lợi khuẩn tốt cho đường ruột, hỗ trợ giảm 58% các vấn đề tiêu hóa nữa chứ, con ún k lo bón bủng gì nhiều đâu",https://www.facebook.com/groups/183774529022936/posts/2217908928942809/?comment_id=2218478758885826&reply_comment_id=2218478978885804,https://www.facebook.com/groups/183774529022936/posts/2217908928942809/
2026-06-29T22:09:43.000Z,2218488878884814,,0,Ngoc Anh,"dòng nan cam bé e ún thì con dễ tiêu, êm bụng, còn tăng sức đề kháng khá tốt đó mẹ, thử mẹ tham khảo, sữa nan a2 mình chọn vì thấy thuộc hệ nghiên cứu của nestlé nên khá tin tưởng",https://www.facebook.com/groups/183774529022936/posts/2217908928942809/?comment_id=2218488878884814,https://www.facebook.com/groups/183774529022936/posts/2217908928942809/
2026-06-29T22:09:55.000Z,2218488985551470,2218488878884814,1,Lê Diễm,"nan này có tp đạm a2 từ giống bò thuần chủng, nên thân thiện với hệ tiêu hoá của bé lắm",https://www.facebook.com/groups/183774529022936/posts/2217908928942809/?comment_id=2218488878884814&reply_comment_id=2218488985551470,https://www.facebook.com/groups/183774529022936/posts/2217908928942809/
2026-06-29T22:10:03.000Z,2218489108884791,2218488878884814,1,Ngoc Anh,"đúng r đó mẹ, ngoài ra còn có lợi khuẩn B. Lactis, là tp lợi khuẩn giúp hỗ trợ giảm 58% các vấn đề tiêu hóa cho bé, rất tốt cho đường ruột",https://www.facebook.com/groups/183774529022936/posts/2217908928942809/?comment_id=2218488878884814&reply_comment_id=2218489108884791,https://www.facebook.com/groups/183774529022936/posts/2217908928942809/
2026-06-29T22:10:10.000Z,2218489158884786,2218488878884814,1,Lê Diễm,"cho bé ún dòng này thì yên tâm nguồn gốc, chất lượng nè, sữa nhà nestle, chính hãng nhập khẩu trực tiếp từ thuỵ sĩ",https://www.facebook.com/groups/183774529022936/posts/2217908928942809/?comment_id=2218488878884814&reply_comment_id=2218489158884786,https://www.facebook.com/groups/183774529022936/posts/2217908928942809/
2026-06-29T22:13:29.000Z,2218490968884605,,0,Ngọc Diệp,"bé nhà mình ún nan cam a2, mình thấy cũng an tâm lắm, tiêu êm, out đều k bón, đề kháng tốt nên đỡ ốm vặt, mình ưu tiên sữa có quy trình kiểm soát nghiêm ngặt như vậy",https://www.facebook.com/groups/183774529022936/posts/2217908928942809/?comment_id=2218490968884605,https://www.facebook.com/groups/183774529022936/posts/2217908928942809/
2026-06-29T22:32:29.000Z,2218501512216884,,0,Hà Lan,"bé mình ún nan a2 thấy ổn lắm, bụng nhẹ, ko bón, đề kháng tốt, mẹ tham khảo nè, nestlé có lịch sử nghiên cứu lâu năm nên mình khá yên tâm nha",https://www.facebook.com/groups/183774529022936/posts/2217908928942809/?comment_id=2218501512216884,https://www.facebook.com/groups/183774529022936/posts/2217908928942809/
2026-06-29T22:32:40.000Z,2218501665550202,2218501512216884,1,Bảo Thy,nhà mình hay đưa bé về quê cuối tuần nên mình luôn muốn có thêm lựa chọn tiện lợi bên cạnh nan a2 vì thế từ lúc con hơn 1 tuổi mình có bổ sung thêm sữa nước a2 và thấy khá phù hợp với nhu cầu của bé,https://www.facebook.com/groups/183774529022936/posts/2217908928942809/?comment_id=2218501512216884&reply_comment_id=2218501665550202,https://www.facebook.com/groups/183774529022936/posts/2217908928942809/
2026-06-29T22:32:49.000Z,2218501745550194,2218501512216884,1,Hà Lan,điều khiến mình yên tâm là sữa nước được phát triển trên nền tảng a2 và hmo vượt trội kế thừa từ nhà nan,https://www.facebook.com/groups/183774529022936/posts/2217908928942809/?comment_id=2218501512216884&reply_comment_id=2218501745550194,https://www.facebook.com/groups/183774529022936/posts/2217908928942809/
2026-06-29T22:32:56.000Z,2218501812216854,2218501512216884,1,Bảo Thy,trộm vía bé vẫn phát triển đều chiều cao chiều cao và cân nặng tiến triển khá tốt,https://www.facebook.com/groups/183774529022936/posts/2217908928942809/?comment_id=2218501512216884&reply_comment_id=2218501812216854,https://www.facebook.com/groups/183774529022936/posts/2217908928942809/
2026-06-29T22:35:54.000Z,2218505342216501,,0,Nguyễn Trinh,"bé nhà mình ti nan cam bụng êm, tiêu hoá nhịp nhàng, đề kháng cải thiện thấy rõ, mẹ tham khảo thử cho nghen nè, nan a2 nhập khẩu từ thụy sĩ nên mình có cảm giác khá yên tâm nè",https://www.facebook.com/groups/183774529022936/posts/2217908928942809/?comment_id=2218505342216501,https://www.facebook.com/groups/183774529022936/posts/2217908928942809/
2026-06-29T22:36:06.000Z,2218505825549786,2218505342216501,1,On Oanh,bé nhà mình rất thích chạy theo anh chị trong nhà nên gần như lúc nào cũng vận động vì vậy mình khá chú trọng việc duy trì nan a2 kết hợp sữa nước a2 mỗi ngày cho con,https://www.facebook.com/groups/183774529022936/posts/2217908928942809/?comment_id=2218505342216501&reply_comment_id=2218505825549786,https://www.facebook.com/groups/183774529022936/posts/2217908928942809/
2026-06-29T22:36:14.000Z,2218506235549745,2218505342216501,1,Nguyễn Trinh,nhìn con khỏe khoắn và cứng cáp hơn trước là điều mình thấy rõ nhất luôn,https://www.facebook.com/groups/183774529022936/posts/2217908928942809/?comment_id=2218505342216501&reply_comment_id=2218506235549745,https://www.facebook.com/groups/183774529022936/posts/2217908928942809/
2026-06-29T22:36:22.000Z,2218506442216391,2218505342216501,1,On Oanh,"bé hợp nên tiêu hóa thuận lợi nhẹ bụng chuyện ăn uống cũng dễ dàng hơn nhiều, kidsplaza tư vấn nhiệt tình lắm nè, mình mua nan ở đây rất yên tâm luôn nhá",https://www.facebook.com/groups/183774529022936/posts/2217908928942809/?comment_id=2218505342216501&reply_comment_id=2218506442216391,https://www.facebook.com/groups/183774529022936/posts/2217908928942809/
2026-06-30T14:58:57.000Z,2219120942154941,,0,Hà An Thy,Cho con uống nubone plus nha mẹ ơi. con e uống thấy bé ht tốt dễ tiêu nữa. cân nặng với đề kháng đều khoẻ,https://www.facebook.com/groups/183774529022936/posts/2217908928942809/?comment_id=2219120942154941,https://www.facebook.com/groups/183774529022936/posts/2217908928942809/
2026-06-30T15:03:39.000Z,2219124365487932,,0,Hà My,"Mẹ bé ưu tiên nubone plus cho bé xem hợp ko ạ, con em hợp tác này. Cân cao nhỉnh kim rồi đấy",https://www.facebook.com/groups/183774529022936/posts/2217908928942809/?comment_id=2219124365487932,https://www.facebook.com/groups/183774529022936/posts/2217908928942809/
2026-06-30T15:09:09.000Z,2219128625487506,,0,Trần Phương Thảo,con e uống sữa nubone plus bé pt toàn diện ạ. tiêu hóa lẫn cân nặng đều cải thiện mom ạ. Tk cho bé ha,https://www.facebook.com/groups/183774529022936/posts/2217908928942809/?comment_id=2219128625487506,https://www.facebook.com/groups/183774529022936/posts/2217908928942809/
2026-06-30T15:16:34.000Z,2219133878820314,,0,Minh Nguyệt Đinh,"Sữa pttd thì mẹ thử sữa Nubone plus nha. Bé nhà e uống sữa này tiêu hoá khoẻ, nhỉnh cân, tăng cao ổn áp lắm",https://www.facebook.com/groups/183774529022936/posts/2217908928942809/?comment_id=2219133878820314,https://www.facebook.com/groups/183774529022936/posts/2217908928942809/
2026-06-30T15:23:18.000Z,2219139008819801,,0,Khánh Linh,Rcm mẹ sữa Nubone plus nha. Tăng cân đều mà con tiêu tốt,https://www.facebook.com/groups/183774529022936/posts/2217908928942809/?comment_id=2219139008819801,https://www.facebook.com/groups/183774529022936/posts/2217908928942809/
