Date,Comment_ID,Parent_ID,Level,Author,Content,Permalink,Post_URL
2026-06-30T01:02:48.000Z,2218587502208285,,0,Nguyễn Đức Minh,"công nhận nan cam giúp đề kháng bé tốt hơn hẳn, nay còn cải tiến từ 6hmo lên 6hmo nữa đấy nhé , điều mình ấn tượng là nestlé vẫn không ngừng cập nhật các nghiên cứu mới nha",https://www.facebook.com/groups/183774529022936/posts/2217823782284657/?comment_id=2218587502208285,https://www.facebook.com/groups/183774529022936/posts/2217823782284657/
2026-06-30T01:02:58.000Z,2218587585541610,2218587502208285,1,Nguyễn Tuyết Hạnh,"vâng, có tận 6hmo nên hỗ trợ đề kháng khỏe rõ luôn đó mom ơi ,sữa tốt cho tiêu hoá vs đề kháng, chính là nền tảng vững chắc giúp bé phát triển toàn diện đó mom ơi",https://www.facebook.com/groups/183774529022936/posts/2217823782284657/?comment_id=2218587502208285&reply_comment_id=2218587585541610,https://www.facebook.com/groups/183774529022936/posts/2217823782284657/
2026-06-30T01:03:04.000Z,2218587652208270,2218587502208285,1,Nguyễn Đức Minh,tiêu hóa cũng ổn định hơn nhờ sữa bổ sung lợi khuẩn kép b. infantis & b. lactics nữa mẹ ơi,https://www.facebook.com/groups/183774529022936/posts/2217823782284657/?comment_id=2218587502208285&reply_comment_id=2218587652208270,https://www.facebook.com/groups/183774529022936/posts/2217823782284657/
2026-06-30T01:03:10.000Z,2218587682208267,2218587502208285,1,Nguyễn Tuyết Hạnh,cho con ti thấy con khỏe bụng khỏe người pt tốt lắm mom nhé,https://www.facebook.com/groups/183774529022936/posts/2217823782284657/?comment_id=2218587502208285&reply_comment_id=2218587682208267,https://www.facebook.com/groups/183774529022936/posts/2217823782284657/
2026-06-30T01:03:40.000Z,2218587955541573,,0,Tài Văn,"bún nhà em con ti nan a2 thấy con tiêu hoá khoẻ, con hấp thu tốt và sữa có công thức cải tiến từ 6hmo lên 6hmo giúp con tăng thêm dưỡng chất htr con đề kháng khoẻ nha, mẹ nên thử đi nè, cảm giác thương hiệu đang cố gắng tạo sự an tâm cho người dùng á",https://www.facebook.com/groups/183774529022936/posts/2217823782284657/?comment_id=2218587955541573,https://www.facebook.com/groups/183774529022936/posts/2217823782284657/
2026-06-30T01:03:49.000Z,2218588025541566,2218587955541573,1,Nguyễn HồngMến,"công nhận nha, sữa uy tín và chất lượng lắm nha sauwx là dòng sữa chĩnh hãng nhà nestle và có thương hiệu tới 155 năm mẹ an tâm cho con ti đi nghen nè",https://www.facebook.com/groups/183774529022936/posts/2217823782284657/?comment_id=2218587955541573&reply_comment_id=2218588025541566,https://www.facebook.com/groups/183774529022936/posts/2217823782284657/
2026-06-30T01:03:55.000Z,2218588068874895,2218587955541573,1,Tài Văn,"sữa có bổ sung lọi khuẩn chuyên biệt b infantis với 1hmo 3fl giúp con tiêu hoá ổn áp, con hấp thu và khoẻ miễn dịch nhé",https://www.facebook.com/groups/183774529022936/posts/2217823782284657/?comment_id=2218587955541573&reply_comment_id=2218588068874895,https://www.facebook.com/groups/183774529022936/posts/2217823782284657/
2026-06-30T01:03:58.000Z,2218588102208225,2218587955541573,1,Nguyễn HồngMến,"con chịu sữa là do sữa này dễ ti nè, sữa nhạt thanh con thích nè❤️",https://www.facebook.com/groups/183774529022936/posts/2217823782284657/?comment_id=2218587955541573&reply_comment_id=2218588102208225,https://www.facebook.com/groups/183774529022936/posts/2217823782284657/
2026-06-30T01:04:01.000Z,2218588135541555,2218587955541573,1,Tài Văn,"ưm, đạm này tương tự đạm trog sữa mẹ nên htro tiêu hóa con hiệu quả hơn đấy mom",https://www.facebook.com/groups/183774529022936/posts/2217823782284657/?comment_id=2218587955541573&reply_comment_id=2218588135541555,https://www.facebook.com/groups/183774529022936/posts/2217823782284657/
2026-06-30T01:04:04.000Z,2218588148874887,2218587955541573,1,Nguyễn HồngMến,"chuẩn luôn, con tiêu hóa khỏe, ít ốm vặt hơn do sữa có tận 6hmo đó m",https://www.facebook.com/groups/183774529022936/posts/2217823782284657/?comment_id=2218587955541573&reply_comment_id=2218588148874887,https://www.facebook.com/groups/183774529022936/posts/2217823782284657/
2026-06-30T01:04:23.000Z,2218588335541535,,0,Thuydiem Nguyen,"hay mom thử sữa nan cam như mình nè, sữa này giúp con khỏe cả tiêu hóa và đề kháng nhé, sữa cso đạm a2, 6hmo và lợi khuẩn kép b. infantis & b. lactis nên bé bú vào bụng khỏe con khỏe mạh hơn hẳn đó mom, mình khá thích những sản phẩm có nền tảng khoa học rõ ràng nè",https://www.facebook.com/groups/183774529022936/posts/2217823782284657/?comment_id=2218588335541535,https://www.facebook.com/groups/183774529022936/posts/2217823782284657/
2026-06-30T01:04:34.000Z,2218588455541523,2218588335541535,1,Nguyen Dieu,"con ún nan này thây con hợp sữa khỏe bụg, khỏe người lắm đấy mom ơi",https://www.facebook.com/groups/183774529022936/posts/2217823782284657/?comment_id=2218588335541535&reply_comment_id=2218588455541523,https://www.facebook.com/groups/183774529022936/posts/2217823782284657/
2026-06-30T01:04:41.000Z,2218588525541516,2218588335541535,1,Thuydiem Nguyen,con khỏe bụg đi tiêu đều hấp thu cugx dễ dàng đấy mom nha,https://www.facebook.com/groups/183774529022936/posts/2217823782284657/?comment_id=2218588335541535&reply_comment_id=2218588525541516,https://www.facebook.com/groups/183774529022936/posts/2217823782284657/
2026-06-30T01:04:44.000Z,2218588555541513,2218588335541535,1,Nguyen Dieu,"đkháng khỏe nên con khỏe mạnh thấy con đỡ hẳn ốm vặt luôn đấy mom nhé,sữa tốt cho tiêu hóa & đề kháng thì ht bé pt toàn diện tốt hơn nè",https://www.facebook.com/groups/183774529022936/posts/2217823782284657/?comment_id=2218588335541535&reply_comment_id=2218588555541513,https://www.facebook.com/groups/183774529022936/posts/2217823782284657/
2026-06-30T01:05:02.000Z,2218588948874807,,0,Nguyễn Trang,"mẹ t/khảo nan a2 cho bé nha, sữa này vừa hỗ trợ tiêu hóa vừa tăng đề kháng tốt đó mom, nhờ công thức đạm a2 kết hợp 6hmo cùng lợi khuẩn kép b. infantis & b. lactis mẹ, nan a2 được phát triển từ nền tảng khoa học của nestlé nên mình thấy đáng tin nha",https://www.facebook.com/groups/183774529022936/posts/2217823782284657/?comment_id=2218588948874807,https://www.facebook.com/groups/183774529022936/posts/2217823782284657/
2026-06-30T01:05:11.000Z,2218589025541466,2218588948874807,1,Tran MinhNhung,"nên dùg nan này thấy bé hấp thu khỏe, bụng êm, con cứng cáp hơn nhiều luôn đó",https://www.facebook.com/groups/183774529022936/posts/2217823782284657/?comment_id=2218588948874807&reply_comment_id=2218589025541466,https://www.facebook.com/groups/183774529022936/posts/2217823782284657/
2026-06-30T01:05:15.000Z,2218589078874794,2218588948874807,1,Nguyễn Trang,"phải nha, bé uốg nan này thấy con khỏe từ bên trong ra bên ngoài đúng ý mẹ đó😊",https://www.facebook.com/groups/183774529022936/posts/2217823782284657/?comment_id=2218588948874807&reply_comment_id=2218589078874794,https://www.facebook.com/groups/183774529022936/posts/2217823782284657/
2026-06-30T01:05:35.000Z,2218589272208108,,0,Phạm ChâuAnh,"e chưa thử dòng này cho bé nên k rõ, nhưng có nan cam bé e ún htro tiêu hóa với hấp thu tốt do có đạm a2 đó, mình thường để ý đến uy tín của nhà sản xuất trước khi tìm hiểu sản phẩm nha",https://www.facebook.com/groups/183774529022936/posts/2217823782284657/?comment_id=2218589272208108,https://www.facebook.com/groups/183774529022936/posts/2217823782284657/
2026-06-30T01:05:49.000Z,2218589405541428,2218589272208108,1,Nguyen Minh Anh,bé nhà mình hiếu động lắm nên những lúc đi chơi xa mình luôn luôn mang theo sữa nước a2 bên cạnh nan a2 đầy đủ,https://www.facebook.com/groups/183774529022936/posts/2217823782284657/?comment_id=2218589272208108&reply_comment_id=2218589405541428,https://www.facebook.com/groups/183774529022936/posts/2217823782284657/
2026-06-30T01:05:53.000Z,2218589452208090,2218589272208108,1,Phạm ChâuAnh,thích nhất là sữa nước vẫn có chứa a2 với hmo kế thừa từ nhà nan hoàn toàn,https://www.facebook.com/groups/183774529022936/posts/2217823782284657/?comment_id=2218589272208108&reply_comment_id=2218589452208090,https://www.facebook.com/groups/183774529022936/posts/2217823782284657/
2026-06-30T01:05:57.000Z,2218589508874751,2218589272208108,1,Nguyen Minh Anh,trộm vía cả cân nặng với chiều cao đều tăng tốt đều đặn,https://www.facebook.com/groups/183774529022936/posts/2217823782284657/?comment_id=2218589272208108&reply_comment_id=2218589508874751,https://www.facebook.com/groups/183774529022936/posts/2217823782284657/
