Date,Comment_ID,Parent_ID,Level,Author,Content,Permalink,Post_URL
2026-06-29T16:31:44.000Z,2218266965573672,,0,Hà Minh Nguyệt,"do là bé nhà mk dùng nan a2 thấy cả tiêu hoá lẫn đề kháng đều ổn định, mẹ tham khảo thử cho bé dùng xem đi , cảm giác thương hiệu đang cố gắng tạo sự an tâm cho người dùng á",https://www.facebook.com/groups/183774529022936/posts/2217908722276163/?comment_id=2218266965573672,https://www.facebook.com/groups/183774529022936/posts/2217908722276163/
2026-06-29T16:31:54.000Z,2218267052240330,2218266965573672,1,Xuân Bùi,"đặc biệt bé e đang uống nè, sữa nay công thức cải tiến 6hmo, giúp tăng % tương đồng với hmo trong sữa mẹ cao hơn so với trước đây á",https://www.facebook.com/groups/183774529022936/posts/2217908722276163/?comment_id=2218266965573672&reply_comment_id=2218267052240330,https://www.facebook.com/groups/183774529022936/posts/2217908722276163/
2026-06-29T16:32:03.000Z,2218267258906976,2218266965573672,1,Hà Minh Nguyệt,"thật sự sữa nay có tới 6hmo nên lượng dưỡng chất hỗ trợ đề kháng cũng nhân đôi, bé uống vào trộm vía đề kháng cx khoẻ hơn, mấy sữa tốt cho tiêu hóa & đề kháng thì ht con pt toàn diện hơn nha chọn nan là chọn hơn 155 năm uy tín toàn cầu luôn đấy",https://www.facebook.com/groups/183774529022936/posts/2217908722276163/?comment_id=2218266965573672&reply_comment_id=2218267258906976,https://www.facebook.com/groups/183774529022936/posts/2217908722276163/
2026-06-29T16:35:00.000Z,2218269622240073,,0,Trần Thị Loan,"vỗ về mẹ tus nếu bé kén sữa thì có thể tập cho bé uống lúc bé hơi đói chút nha, nhiều bé lúc đó dễ hợp tác hơn á, mình khá thích những sản phẩm có nền tảng khoa học rõ ràng nè",https://www.facebook.com/groups/183774529022936/posts/2217908722276163/?comment_id=2218269622240073,https://www.facebook.com/groups/183774529022936/posts/2217908722276163/
2026-06-29T16:35:28.000Z,2218269925573376,,0,Thanh Yogi,"yên tâm bé nhà m uống nan a2 thụy sĩ nên yên tâm cả tiêu hoá lẫn đề kháng, chất lượng chính hãng nên mẹ có thể yên tâm thử cho bé, nan a2 được phát triển từ nền tảng khoa học của nestlé nên mình thấy đáng tin nha",https://www.facebook.com/groups/183774529022936/posts/2217908722276163/?comment_id=2218269925573376,https://www.facebook.com/groups/183774529022936/posts/2217908722276163/
2026-06-29T16:35:41.000Z,2218270058906696,2218269925573376,1,Hà Thu,"quý là nan này có tp đạm a2 từ bò thuần chủng giúp bé tiêu hoá dễ, ko bón, vị sữa thì thanh mát, bỏ dầu cá nên thơm nhẹ, bé uống ngon lành lắm đó",https://www.facebook.com/groups/183774529022936/posts/2217908722276163/?comment_id=2218269925573376&reply_comment_id=2218270058906696,https://www.facebook.com/groups/183774529022936/posts/2217908722276163/
2026-06-29T16:35:49.000Z,2218270222240013,2218269925573376,1,Thanh Yogi,"thêm nữa ngoài ra còn có lợi khuẩn kép nữa mẹ, vừa giúp hỗ trợ đường ruột vừa tăng sức đề kháng cho con đó nhá",https://www.facebook.com/groups/183774529022936/posts/2217908722276163/?comment_id=2218269925573376&reply_comment_id=2218270222240013,https://www.facebook.com/groups/183774529022936/posts/2217908722276163/
2026-06-29T16:42:32.000Z,2218276298906072,,0,Hà Hồng,"quả là mk vote nan cam nha, bé mk uống hợp, tiêu hoá ổn định, bụng khoẻ, đề kháng tốt, ít ốm vặt hẳn đấy, cảm giác thương hiệu này luôn cố gắng làm tốt hơn mỗi ngày nè",https://www.facebook.com/groups/183774529022936/posts/2217908722276163/?comment_id=2218276298906072,https://www.facebook.com/groups/183774529022936/posts/2217908722276163/
2026-06-29T16:42:43.000Z,2218276412239394,2218276298906072,1,Kim Phụng,"song song đó, sữa mới nay có 6hmo giúp tăng thêm dưỡng chất đề kháng, con mình đi học ít bị bệnh vặt hơn",https://www.facebook.com/groups/183774529022936/posts/2217908722276163/?comment_id=2218276298906072&reply_comment_id=2218276412239394,https://www.facebook.com/groups/183774529022936/posts/2217908722276163/
2026-06-29T16:42:52.000Z,2218276488906053,2218276298906072,1,Hà Hồng,"sữa nay còn có lợi khuẩn kép, đồng thời giúp hỗ trợ cả tiêu hoá lẫn đ kháng cho bé đó",https://www.facebook.com/groups/183774529022936/posts/2217908722276163/?comment_id=2218276298906072&reply_comment_id=2218276488906053,https://www.facebook.com/groups/183774529022936/posts/2217908722276163/
2026-06-29T16:46:29.000Z,2218279258905776,,0,Xuân Linh,"bé mình đang ún nan cam, thấy con tiêu hoá tốt, bụng khoẻ, còn khá tăng cường đề kháng rõ rệt đó, nền tảng nghiên cứu giúp mình yên tâm hơn khi chọn sữa cho bé",https://www.facebook.com/groups/183774529022936/posts/2217908722276163/?comment_id=2218279258905776,https://www.facebook.com/groups/183774529022936/posts/2217908722276163/
2026-06-29T16:46:39.000Z,2218279412239094,2218279258905776,1,Phương Lam,"sữa bột mịn, dễ tan, bỏ dầu cá nên vị rất thơm nhẹ, k còn tanh, bé ún hợp tác, cữ nào pha cũng hết sạch bình",https://www.facebook.com/groups/183774529022936/posts/2217908722276163/?comment_id=2218279258905776&reply_comment_id=2218279412239094,https://www.facebook.com/groups/183774529022936/posts/2217908722276163/
2026-06-29T16:46:47.000Z,2218279502239085,2218279258905776,1,Xuân Linh,"trong thành phần sữa nay còn có lợi khuẩn kép, nhờ đó vừa giúp con dễ tiêu, bụng êm, vừa tăng sức đề kháng, nên con đỡ hẳn bệnh vặt hơn",https://www.facebook.com/groups/183774529022936/posts/2217908722276163/?comment_id=2218279258905776&reply_comment_id=2218279502239085,https://www.facebook.com/groups/183774529022936/posts/2217908722276163/
2026-06-29T23:08:38.000Z,2218525728881129,,0,Lê Thảo Trang,"nan a2 mình thấy khá ổn, bé ún vào tiêu dễ, k bón bủng gì, còn đ kháng khoẻ, ít ốm hơn, mình khá thích khi nan a2 có nền tảng nghiên cứu từ nestlé phía sau á",https://www.facebook.com/groups/183774529022936/posts/2217908722276163/?comment_id=2218525728881129,https://www.facebook.com/groups/183774529022936/posts/2217908722276163/
2026-06-29T23:09:00.000Z,2218525905547778,2218525728881129,1,Hoàng Ngọc Hân,"dòng này ngoài tp đạm a2 thì còn có lợi khuẩn kép hỗ trợ giúp con vừa tiêu hoá tốt, còn củng cố đ kháng",https://www.facebook.com/groups/183774529022936/posts/2217908722276163/?comment_id=2218525728881129&reply_comment_id=2218525905547778,https://www.facebook.com/groups/183774529022936/posts/2217908722276163/
2026-06-29T23:19:12.000Z,2218531345547234,,0,Hoàng Mai Lan,"mình vote nan cam nha, nè, công thức mới tốt cho cả tiêu hoá và đ kháng của bé đó, mẹ tham khảo thử, đọc thông tin thấy thương hiệu này làm khá kỹ ở phần kiểm định đó nha",https://www.facebook.com/groups/183774529022936/posts/2217908722276163/?comment_id=2218531345547234,https://www.facebook.com/groups/183774529022936/posts/2217908722276163/
2026-06-29T23:19:34.000Z,2218531502213885,2218531345547234,1,Trương Huyền,"sữa nay e thấy bột mịn, dễ tan, hương thơm rất nhẹ, đặc biệt bỏ dầu cá nên bé ún k bị ngại mùi tanh như trước, sữa tốt cho tiêu hoá & đ kháng là nền tảng cho bé pt toàn diện nha mẹ",https://www.facebook.com/groups/183774529022936/posts/2217908722276163/?comment_id=2218531345547234&reply_comment_id=2218531502213885,https://www.facebook.com/groups/183774529022936/posts/2217908722276163/
2026-06-29T23:24:12.000Z,2218533688880333,,0,Hồng Nhung,"bé mình ún nan a2 bụng khoẻ, tiêu đều, đề kháng vững, ít ốm vặt, mẹ tham khảo thử nè, mình khá thích định hướng phát triển dựa trên khoa học của nestlé nha",https://www.facebook.com/groups/183774529022936/posts/2217908722276163/?comment_id=2218533688880333,https://www.facebook.com/groups/183774529022936/posts/2217908722276163/
2026-06-29T23:24:25.000Z,2218533788880323,2218533688880333,1,Hoàng Khánh Vy,"bé nhà mình khá hiếu kỳ, lúc nào cũng muốn khám phá mọi thứ xung quanh nên tiêu hao năng lượng cũng nhiều vì vậy hiện tại mình vẫn duy trì nan a2 kết hợp sữa nước a2 mỗi ngày",https://www.facebook.com/groups/183774529022936/posts/2217908722276163/?comment_id=2218533688880333&reply_comment_id=2218533788880323,https://www.facebook.com/groups/183774529022936/posts/2217908722276163/
2026-06-29T23:24:31.000Z,2218533818880320,2218533688880333,1,Hồng Nhung,sữa nước đc phát triển trên nền tảng a2 và hmo chuẩn chỉnh kế thừa từ nhà nan nên mình đánh giá khá cao,https://www.facebook.com/groups/183774529022936/posts/2217908722276163/?comment_id=2218533688880333&reply_comment_id=2218533818880320,https://www.facebook.com/groups/183774529022936/posts/2217908722276163/
2026-06-29T23:24:41.000Z,2218533895546979,2218533688880333,1,Hoàng Khánh Vy,cả chiều cao cân nặng đều có sự cải thiện tích cực nên mình rất vui lòng 🥰,https://www.facebook.com/groups/183774529022936/posts/2217908722276163/?comment_id=2218533688880333&reply_comment_id=2218533895546979,https://www.facebook.com/groups/183774529022936/posts/2217908722276163/
2026-06-29T23:29:48.000Z,2218536432213392,,0,Vũ Thị Kim Huệ,"nhà mình dùng nan a2 thuỵ sĩ, tiêu hoá trơn tru, bụng dễ chịu, đề kháng chắc khoẻ, mẹ tham khảo xem nghen, mình đánh giá cao việc kiểm soát chất lượng ngay từ nguyên liệu nha",https://www.facebook.com/groups/183774529022936/posts/2217908722276163/?comment_id=2218536432213392,https://www.facebook.com/groups/183774529022936/posts/2217908722276163/
2026-06-29T23:30:01.000Z,2218536562213379,2218536432213392,1,Hải Yến,mình từng lo con nhận dinh dưỡng không đồng đều do có những ngày ăn uống thất thường nhưng từ khi duy trì nan a2 cùng sữa nước a2 thì cảm giác yên tâm hơn phần nào,https://www.facebook.com/groups/183774529022936/posts/2217908722276163/?comment_id=2218536432213392&reply_comment_id=2218536562213379,https://www.facebook.com/groups/183774529022936/posts/2217908722276163/
2026-06-29T23:30:07.000Z,2218536602213375,2218536432213392,1,Vũ Thị Kim Huệ,bé phát triển khá tốt thể chất nhìn khỏe mạnh và cứng cáp hơn trước,https://www.facebook.com/groups/183774529022936/posts/2217908722276163/?comment_id=2218536432213392&reply_comment_id=2218536602213375,https://www.facebook.com/groups/183774529022936/posts/2217908722276163/
2026-06-29T23:30:19.000Z,2218536732213362,2218536432213392,1,Hải Yến,"bé dùng hợp nên hệ tiêu hóa ổn định bụng dạ ít gặp những vấn đề khiến mẹ phải lo lắng, đặt nan trên shopee mall là quyết định đúng đắn nhất nè, vừa rẻ vừa chất nhá",https://www.facebook.com/groups/183774529022936/posts/2217908722276163/?comment_id=2218536432213392&reply_comment_id=2218536732213362,https://www.facebook.com/groups/183774529022936/posts/2217908722276163/
