Date,Comment_ID,Parent_ID,Level,Author,Content,Permalink,Post_URL
2026-06-29T14:34:22.000Z,2218161162250919,,0,Gia Mỹ,"dùng sữa nan a2 thấy bé khỏe đề khág, ít ốm vặt hơn đó, nay dòng này còn dc tăng từ 5hmo lên 6hmo nữa nha mẹ nè nghen , mình thấy xuất xứ của nan a2 là một trong những yếu tố đáng quan tâm nha",https://www.facebook.com/groups/183774529022936/posts/2218126958921006/?comment_id=2218161162250919,https://www.facebook.com/groups/183774529022936/posts/2218126958921006/
2026-06-29T14:34:34.000Z,2218161278917574,2218161162250919,1,San San,"sữa này dc nhập từ thụy si do nhà nestle đúng là chất lượg nha, nhà này có hơn 155 năm ls đó mom ơi yt đi ạk mẹ",https://www.facebook.com/groups/183774529022936/posts/2218126958921006/?comment_id=2218161162250919&reply_comment_id=2218161278917574,https://www.facebook.com/groups/183774529022936/posts/2218126958921006/
2026-06-29T14:34:46.000Z,2218161548917547,2218161162250919,1,Gia Mỹ,"cũng có cả bs lợi khuẩn kép b infantis & b lactis giúp bé hấp thu tốt con khỏe từ bên trong nè mẹ,sữa tốt cho tiêu hoá vs đề kháng, chính là nền tảng vững chắc giúp bé phát triển toàn diện đó mẹ nhé😊 hơn 155 năm là lời cam kết chất lượng từ nan luôn mẹ ạ",https://www.facebook.com/groups/183774529022936/posts/2218126958921006/?comment_id=2218161162250919&reply_comment_id=2218161548917547,https://www.facebook.com/groups/183774529022936/posts/2218126958921006/
2026-06-29T14:34:54.000Z,2218161665584202,2218161162250919,1,San San,"trvia từ đợt uống qua dòng này vừa tiêu êm, lại đỡ ốm vặt hơn nữa chứ m",https://www.facebook.com/groups/183774529022936/posts/2218126958921006/?comment_id=2218161162250919&reply_comment_id=2218161665584202,https://www.facebook.com/groups/183774529022936/posts/2218126958921006/
2026-06-29T14:41:41.000Z,2218167715583597,,0,Trần Hoa,"e thì chưa thử mấy sữa đó cho bé, nhỏ giờ con đang uống nan a2 ấy, tiêu hóa tốt, k bón, lên cân tốt nè mẹ tk, xuất xứ thuỵ sĩ làm mình thấy sữa nan a2 đáng tin hơn vì tiêu chuẩn bên đó khá cao",https://www.facebook.com/groups/183774529022936/posts/2218126958921006/?comment_id=2218167715583597,https://www.facebook.com/groups/183774529022936/posts/2218126958921006/
2026-06-29T14:41:51.000Z,2218167838916918,2218167715583597,1,Loan Vũ,dòng nan a2 tp có đạm a2 gần với đạm trong sữa mẹ này mẹ,https://www.facebook.com/groups/183774529022936/posts/2218126958921006/?comment_id=2218167715583597&reply_comment_id=2218167838916918,https://www.facebook.com/groups/183774529022936/posts/2218126958921006/
2026-06-29T14:42:01.000Z,2218168002250235,2218167715583597,1,Trần Hoa,"đúng đó, mà đạm a2 trong nan a2 vừa tốt lại còn quý",https://www.facebook.com/groups/183774529022936/posts/2218126958921006/?comment_id=2218167715583597&reply_comment_id=2218168002250235,https://www.facebook.com/groups/183774529022936/posts/2218126958921006/
2026-06-29T14:42:09.000Z,2218168135583555,2218167715583597,1,Loan Vũ,do đạm a2 này được chọn lọc từ giống bò thuần chủng chỉ sản sinh ra đạm a2 một cách tự nhiên nên k chỉ tốt mà còn quý đấy nhé👍,https://www.facebook.com/groups/183774529022936/posts/2218126958921006/?comment_id=2218167715583597&reply_comment_id=2218168135583555,https://www.facebook.com/groups/183774529022936/posts/2218126958921006/
2026-06-29T14:45:48.000Z,2218171412249894,,0,Như Hằng Phương,"đợt này t chuyển qua nan a2 dặm cho sóc tui được khen là mẹ mát tay chăm con khéo luôn đó, trộm vía con bụ bẫm, cảm giác sữa được kiểm soát nghiêm ngặt nên mình an tâm hơn",https://www.facebook.com/groups/183774529022936/posts/2218126958921006/?comment_id=2218171412249894,https://www.facebook.com/groups/183774529022936/posts/2218126958921006/
2026-06-29T14:47:00.000Z,2218172522249783,,0,Trang Bảo,"mom tham khảo dòng dễ tiêu với dễ hấp thu chút cho bé, như nan a2 bé e đag ti có đạm a2 bé ti tiêu êm, hấp thu tốt này, mình khá thiện cảm với những thương hiệu như nestlé vì chú trọng nghiên cứu nè",https://www.facebook.com/groups/183774529022936/posts/2218126958921006/?comment_id=2218172522249783,https://www.facebook.com/groups/183774529022936/posts/2218126958921006/
2026-06-29T14:47:12.000Z,2218172685583100,2218172522249783,1,Nga Thuy,"ún nan cam bé tớ trước bón mà đỡ hẳn đó,mấy sữa tốt cho tiêu hóa & đề kháng thì ht con pt toàn diện tốt hơn nha",https://www.facebook.com/groups/183774529022936/posts/2218126958921006/?comment_id=2218172522249783&reply_comment_id=2218172685583100,https://www.facebook.com/groups/183774529022936/posts/2218126958921006/
2026-06-29T14:47:22.000Z,2218172808916421,2218172522249783,1,Trang Bảo,"do có đạm a2 hỗ trợ tiêu hóa cho bé đó, giúp con tiêu hóa tốt, giảm bón hơn so với đạm a1 trog sữa thường mà mẹ",https://www.facebook.com/groups/183774529022936/posts/2218126958921006/?comment_id=2218172522249783&reply_comment_id=2218172808916421,https://www.facebook.com/groups/183774529022936/posts/2218126958921006/
2026-06-29T14:47:28.000Z,2218172908916411,2218172522249783,1,Nga Thuy,đạm a2 trog nan cam còn đc chọn lọc từ giống bò thuần chủng châu âu nữa nên tốt lắm,https://www.facebook.com/groups/183774529022936/posts/2218126958921006/?comment_id=2218172522249783&reply_comment_id=2218172908916411,https://www.facebook.com/groups/183774529022936/posts/2218126958921006/
2026-06-29T14:50:38.000Z,2218176278916074,,0,Nga Thuy,"e thấy cu nhà e ti nan a2 con tiêu hóa tốt, lên cân đều nha, tk tham khảo xem nè😊, mình thích cách nestlé liên tục cập nhật những tiến bộ mới trong dinh dưỡng á",https://www.facebook.com/groups/183774529022936/posts/2218126958921006/?comment_id=2218176278916074,https://www.facebook.com/groups/183774529022936/posts/2218126958921006/
2026-06-29T14:51:05.000Z,2218176785582690,,0,Ngân Thị,"dòng sữa hỗ trợ bé khỏe mạnh tăng đề khág nhà mình đang cho bé ún nan cam nè, giờ được tăng lên 6hmo, bổ sung thêm hmo 3fl nên con đề kháng tốt hơn đó mom ơi😊, thấy nestlé âm thầm cải thiện chất lượng sản phẩm rất đáng ghi nhận á",https://www.facebook.com/groups/183774529022936/posts/2218126958921006/?comment_id=2218176785582690,https://www.facebook.com/groups/183774529022936/posts/2218126958921006/
2026-06-29T14:51:35.000Z,2218177185582650,2218176785582690,1,My Trà,"dòg này ưng lắm, sữa của nestle đảm bảo chất lượng nhé mẹ",https://www.facebook.com/groups/183774529022936/posts/2218126958921006/?comment_id=2218176785582690&reply_comment_id=2218177185582650,https://www.facebook.com/groups/183774529022936/posts/2218126958921006/
2026-06-29T14:51:44.000Z,2218177368915965,2218176785582690,1,Ngân Thị,"vâng, sữa này tiêu hóa khỏe, đề khág tốt nhờ có đạm a2, 6hmo và thêm lợi khuẩn kép b infantis vs b lactics hỗ trợ đó nè mom",https://www.facebook.com/groups/183774529022936/posts/2218126958921006/?comment_id=2218176785582690&reply_comment_id=2218177368915965,https://www.facebook.com/groups/183774529022936/posts/2218126958921006/
2026-06-29T14:55:01.000Z,2218180542248981,,0,Tâm Vũ,"e thấy nan a2 bé tiêu hóa tốt, êm bụng, lên cân đều nên nhỏ giờ đang ún, chưa đổi sữa lần nào này. c thử tham khảo xem, thấy nestlé âm thầm cải thiện chất lượng sản phẩm rất đáng ghi nhận á",https://www.facebook.com/groups/183774529022936/posts/2218126958921006/?comment_id=2218180542248981,https://www.facebook.com/groups/183774529022936/posts/2218126958921006/
2026-06-29T14:55:14.000Z,2218180742248961,2218180542248981,1,Ly Khánh,"mình cũng an tâm lắm mom, từ sau 1 tuổi là có bổ sung thêm sữa nước bên cạnh sữa bột cho bé luôn",https://www.facebook.com/groups/183774529022936/posts/2218126958921006/?comment_id=2218180542248981&reply_comment_id=2218180742248961,https://www.facebook.com/groups/183774529022936/posts/2218126958921006/
2026-06-29T14:55:21.000Z,2218180872248948,2218180542248981,1,Tâm Vũ,"sữa nước tiện cực kỳ, với công thức a2 kết hợp hmo kế thừa từ nhà nan nên mình duy trì cho bé dùng đều",https://www.facebook.com/groups/183774529022936/posts/2218126958921006/?comment_id=2218180542248981&reply_comment_id=2218180872248948,https://www.facebook.com/groups/183774529022936/posts/2218126958921006/
2026-06-29T14:55:29.000Z,2218180998915602,2218180542248981,1,Ly Khánh,"đúng á, thấy bụng bé khỏe hơn, người cứng cáp hơn, chiều cao với cân nặng cũng tăng trưởng đều theo từng tháng",https://www.facebook.com/groups/183774529022936/posts/2218126958921006/?comment_id=2218180542248981&reply_comment_id=2218180998915602,https://www.facebook.com/groups/183774529022936/posts/2218126958921006/
2026-06-29T14:55:53.000Z,2218181292248906,,0,Ngoc Anh,"mấy dòg đó con ti cũng ko cải thiện tiêu hóa đc mấy con vẫn chặt dạ cứ tầm 3 ngày mới đi đc, xong mk đổi qua nan a2 thụy sĩ thấy con cải thiện tiêu hóa tốt ngày ị đều 1 lần mà phân khéo lắm nên mk vote cho sữa nan a2 thụy sĩ thôi nhé, nghe chia sẻ về quy trình kiểm soát chất lượng thấy khá yên tâm nha",https://www.facebook.com/groups/183774529022936/posts/2218126958921006/?comment_id=2218181292248906,https://www.facebook.com/groups/183774529022936/posts/2218126958921006/
2026-06-29T14:56:30.000Z,2218181888915513,2218181292248906,1,Thu Minh,"chuẩn luôn mom, bé sau 1 tuổi dùng cả sữa bột lẫn sữa nước mà hợp tác dữ lắm, thấy tiện ghê luôn",https://www.facebook.com/groups/183774529022936/posts/2218126958921006/?comment_id=2218181292248906&reply_comment_id=2218181888915513,https://www.facebook.com/groups/183774529022936/posts/2218126958921006/
2026-06-29T14:56:42.000Z,2218182062248829,2218181292248906,1,Ngoc Anh,"mình cũng thích vì mỗi lần ra ngoài là có sữa nước rất gọn, thêm nữa nền tảng a2 cùng hmo kế thừa từ nhà nan khiến mình yên tâm hơn",https://www.facebook.com/groups/183774529022936/posts/2218126958921006/?comment_id=2218181292248906&reply_comment_id=2218182062248829,https://www.facebook.com/groups/183774529022936/posts/2218126958921006/
2026-06-29T14:56:50.000Z,2218182185582150,2218181292248906,1,Thu Minh,"thấy bé uống vào bụng dạ dễ chịu, khỏe mạnh hơn, chiều cao với cân nặng cũng tăng đều đặn đó nha, ghé con cưng mua nan lúc nào cũng hài lòng nè, tiện đường ghé qua là có ngay nhá",https://www.facebook.com/groups/183774529022936/posts/2218126958921006/?comment_id=2218181292248906&reply_comment_id=2218182185582150,https://www.facebook.com/groups/183774529022936/posts/2218126958921006/
2026-06-30T14:24:52.000Z,2219096005490768,,0,Trúc Quỳnh Nguyễn,"con em đang uống Nubone plus bụng dạ êm, cân nhích đều này",https://www.facebook.com/groups/183774529022936/posts/2218126958921006/?comment_id=2219096005490768,https://www.facebook.com/groups/183774529022936/posts/2218126958921006/
2026-06-30T14:35:59.000Z,2219104252156610,,0,Bảo Thanh,"Chọn sữa Nubone plus giúp con tiêu hóa ổn, tăng cân đều nha, sữa này bé mk out mượt hẳn nè",https://www.facebook.com/groups/183774529022936/posts/2218126958921006/?comment_id=2219104252156610,https://www.facebook.com/groups/183774529022936/posts/2218126958921006/
2026-06-30T14:41:01.000Z,2219108072156228,,0,Linh Tây,"Rcm mẹ sữa tăng cân Nubone plus ý, con em dùng ổn đó, êm bụng nữa",https://www.facebook.com/groups/183774529022936/posts/2218126958921006/?comment_id=2219108072156228,https://www.facebook.com/groups/183774529022936/posts/2218126958921006/
2026-06-30T14:44:31.000Z,2219110592155976,,0,Hà My,"Thử tham khảo sữa Nubone plus bé e đang uống xem c, e thấy con tiêu hóa tốt, bụng khỏe, mà dễ hấp thu",https://www.facebook.com/groups/183774529022936/posts/2218126958921006/?comment_id=2219110592155976,https://www.facebook.com/groups/183774529022936/posts/2218126958921006/
