Date,Comment_ID,Parent_ID,Level,Author,Content,Permalink,Post_URL
2026-04-11T13:45:36.000Z,2461555914343228,,0,Nhã Uyên,mom nào cho dùng uống sữa ap newzealand chia sẻ với ạ? Em đang cân nhắc vì nghe nói sữa ap new này vừa đề kháng tốt vừa tốt cho não,https://www.facebook.com/groups/804858320013004/posts/2458872884611531/?comment_id=2461555914343228,https://www.facebook.com/groups/804858320013004/posts/2458872884611531/
2026-04-11T13:45:48.000Z,2461556114343208,2461555914343228,1,Lê Thuý Ái,Nhã Uyên con nhà em dùng sữa Ap New Zealand thấy sữa nhạt thanh dễ dùng lắm. Con m uống cũng lâu lâu ấy,https://www.facebook.com/groups/804858320013004/posts/2458872884611531/?comment_id=2461555914343228&reply_comment_id=2461556114343208,https://www.facebook.com/groups/804858320013004/posts/2458872884611531/
2026-04-11T13:46:20.000Z,2461556451009841,,0,Xuan Lan,"tui chọn sữa ap nz vì con dùng hoạt bát, thông minh hơn, sữa còn giúp con đề kháng tốt các mom ạ",https://www.facebook.com/groups/804858320013004/posts/2458872884611531/?comment_id=2461556451009841,https://www.facebook.com/groups/804858320013004/posts/2458872884611531/
2026-04-11T13:46:37.000Z,2461556647676488,,0,Minh Việt,"đúng rồi, con dùng sữa ap nz vừa sáng dạ, kháu khỉnh lại con khỏe các mom nhỉ",https://www.facebook.com/groups/804858320013004/posts/2458872884611531/?comment_id=2461556647676488,https://www.facebook.com/groups/804858320013004/posts/2458872884611531/
2026-04-11T13:46:45.000Z,2461556724343147,,0,Ánh Bùi,"mình cho bé dùng sữa ap newzealand này tvia đề kháng tốt con khỏe lại hoạt bát, thông minh hơn đấy ạ",https://www.facebook.com/groups/804858320013004/posts/2458872884611531/?comment_id=2461556724343147,https://www.facebook.com/groups/804858320013004/posts/2458872884611531/
2026-04-11T13:46:54.000Z,2461556864343133,2461556724343147,1,Thiên Trần,"Ánh Bùi Bé yêu nhà e uống sữa ap newzealand thấy tăng cường đk, nhớ cũng lâu và dễ đi ngoài ko bón",https://www.facebook.com/groups/804858320013004/posts/2458872884611531/?comment_id=2461556724343147&reply_comment_id=2461556864343133,https://www.facebook.com/groups/804858320013004/posts/2458872884611531/
2026-04-11T13:47:04.000Z,2461556951009791,,0,Huyền Trang,em cho bé uống sữa Ap New Zealand thấy tăng cường đk và học rất nhanh nha mấy c. Cô ở lớp bảo con nhanh lắm,https://www.facebook.com/groups/804858320013004/posts/2458872884611531/?comment_id=2461556951009791,https://www.facebook.com/groups/804858320013004/posts/2458872884611531/
2026-04-11T13:47:18.000Z,2461557164343103,,0,Thanh Hằng Nguyễn,"sữa ap nzl này chứa synbiotic đặc chế nên con mình uống đều thấy miễn dịch khỏe, ít bệnh vặt hẳn nhé",https://www.facebook.com/groups/804858320013004/posts/2458872884611531/?comment_id=2461557164343103,https://www.facebook.com/groups/804858320013004/posts/2458872884611531/
2026-04-11T13:47:25.000Z,2461557237676429,,0,Hoàng Thanh Việt,"mom ơi, sữa ap new có synbiotic đặc chế hỗ trợ tăng đề kháng tốt nênkhỏe mạnh, sữa lại có dha cao nên con e thông minh nha",https://www.facebook.com/groups/804858320013004/posts/2458872884611531/?comment_id=2461557237676429,https://www.facebook.com/groups/804858320013004/posts/2458872884611531/
2026-04-11T13:47:36.000Z,2461557371009749,,0,Huongvy Nguyen,"sữa ap nz này bsung synbiotic đặc chế hỗ trợ tăng đề kháng, với có dha cao nên con dùng con khỏe lại dạn dĩ đấy ạ",https://www.facebook.com/groups/804858320013004/posts/2458872884611531/?comment_id=2461557371009749,https://www.facebook.com/groups/804858320013004/posts/2458872884611531/
2026-04-11T13:47:49.000Z,2461557497676403,,0,Nguyễn Gia Hân,k bt vị sữa ap new này dễ dùng k á?,https://www.facebook.com/groups/804858320013004/posts/2458872884611531/?comment_id=2461557497676403,https://www.facebook.com/groups/804858320013004/posts/2458872884611531/
2026-04-11T13:48:08.000Z,2461557757676377,2461557497676403,1,Trần Ngọc Hà,"Nguyễn Gia Hân bé nhà em dùng sữa ap nzl này vị nhạt thanh con thích, có synbiotic đặc chế giúp tăng đề kháng con dùng đỡ bệnh vặt nè, sữa còn có dha cao giúp bé dạn dĩ nha",https://www.facebook.com/groups/804858320013004/posts/2458872884611531/?comment_id=2461557497676403&reply_comment_id=2461557757676377,https://www.facebook.com/groups/804858320013004/posts/2458872884611531/
2026-04-11T13:48:16.000Z,2461557891009697,,0,Đặng Vân,"Con bsung sữa ap newzealand có synbiotic đặc chế giúp khỏe mạnh, ít bệnh vặt mà thông minh, sáng dạ nhờ dha cao nè",https://www.facebook.com/groups/804858320013004/posts/2458872884611531/?comment_id=2461557891009697,https://www.facebook.com/groups/804858320013004/posts/2458872884611531/
2026-04-11T13:48:25.000Z,2461558131009673,,0,Nguyễn Thị Bé,"công nhận dặm sữa ap newzealand thấy con nhanh nhạy, ra ngoài chơi rất dạn dĩ ưng lắm nha",https://www.facebook.com/groups/804858320013004/posts/2458872884611531/?comment_id=2461558131009673,https://www.facebook.com/groups/804858320013004/posts/2458872884611531/
2026-04-11T13:48:34.000Z,2461558241009662,,0,Nguyễn Vân Trang,"Mình cũng cho Suti uống sữa ap new giúp bé khỏe khoắn, nhanh nhẹn, nên học hỏi nhanh nữa",https://www.facebook.com/groups/804858320013004/posts/2458872884611531/?comment_id=2461558241009662,https://www.facebook.com/groups/804858320013004/posts/2458872884611531/
2026-04-11T13:48:43.000Z,2461558324342987,,0,Huỳnh Minh Phương,"Bống con nhà em uống sữa ap new này hàng ngày nên tăng miễn dịch, đỡ ốm vặt mà cũng hoạt bát, nhanh nhạy nha",https://www.facebook.com/groups/804858320013004/posts/2458872884611531/?comment_id=2461558324342987,https://www.facebook.com/groups/804858320013004/posts/2458872884611531/
2026-04-11T13:48:51.000Z,2461558384342981,,0,Nguyễn Hữu Hạnh,"sữa ap new có synbiotic đặc chế được chứng minh khoa học giúp con tăng đề kháng, ít bệnh vặt nha, sữa ap new này còn có bộ 5 dưỡng chất hỗ trợ phát triển trí não nha",https://www.facebook.com/groups/804858320013004/posts/2458872884611531/?comment_id=2461558384342981,https://www.facebook.com/groups/804858320013004/posts/2458872884611531/
2026-04-11T13:49:00.000Z,2461558494342970,,0,Trần Hoài An,"từ khi uống sữa ap nzl con mình khỏe khoắn, ít bệnh vặt hẳn đó, bé hợp vị nhạt thanh của sữa ap new này các mẹ ạ",https://www.facebook.com/groups/804858320013004/posts/2458872884611531/?comment_id=2461558494342970,https://www.facebook.com/groups/804858320013004/posts/2458872884611531/
2026-04-11T13:49:07.000Z,2461558577676295,,0,Nguyễn Thiện Nhân,"bạn Bim nhà em uống sữa ap nzl hàng ngày thấy nhanh nhẹn, con khỏe hơn trc nhiều đấy ạ",https://www.facebook.com/groups/804858320013004/posts/2458872884611531/?comment_id=2461558577676295,https://www.facebook.com/groups/804858320013004/posts/2458872884611531/
2026-04-11T13:49:15.000Z,2461558677676285,,0,Nguyễn Thị Ngọc Thi,"dạ con tui dùng sữa ap newzealand thấy khỏe khoắn, đỡ bệnh mà tư duy tốt nên bé kháu khỉnh lắm ạ, sữa ap new này bé sinh mổ dùng hợp nhá",https://www.facebook.com/groups/804858320013004/posts/2458872884611531/?comment_id=2461558677676285,https://www.facebook.com/groups/804858320013004/posts/2458872884611531/
2026-04-11T13:49:41.000Z,2461558957676257,,0,Chu Nhật Hạ,sữa ap new này có synbiotic đặc chế và dha tốt cho con lắm đó,https://www.facebook.com/groups/804858320013004/posts/2458872884611531/?comment_id=2461558957676257,https://www.facebook.com/groups/804858320013004/posts/2458872884611531/
2026-04-11T13:49:50.000Z,2461559051009581,,0,Đoàn Diệu An,"sữa Ap New Zealand bsung synbiotic đặc chế hỗ trợ tăng đề kháng á, sữa ap new này còn có dha cao giúp con sáng dạ hơn nha",https://www.facebook.com/groups/804858320013004/posts/2458872884611531/?comment_id=2461559051009581,https://www.facebook.com/groups/804858320013004/posts/2458872884611531/
2026-04-11T13:49:57.000Z,2461559147676238,,0,Nguyễn Hồng Vân,"Từ hồi dùng sữa ap newzealand thấy con học hỏi nhanh, biết tự mang giày và mặc áo luôn",https://www.facebook.com/groups/804858320013004/posts/2458872884611531/?comment_id=2461559147676238,https://www.facebook.com/groups/804858320013004/posts/2458872884611531/
2026-04-11T13:50:25.000Z,2461559601009526,,0,Nguyễn Hoàng Phụng,"sữa Ap New Zealand hỗ trợ con pt khỏe​, có hẳn công thức được chứng minh khoa học phù hợp trẻ sinh mổ",https://www.facebook.com/groups/804858320013004/posts/2458872884611531/?comment_id=2461559601009526,https://www.facebook.com/groups/804858320013004/posts/2458872884611531/
2026-04-11T13:50:32.000Z,2461559731009513,,0,Quỳnh Quỳnh,"sữa ap nz này bsung synbiotic đặc chế hỗ trợ tăng đề kháng nên khỏe mạnh, ít sụt sịt nha, sữa ap new này có dha cao giúp bé dạn dĩ đó",https://www.facebook.com/groups/804858320013004/posts/2458872884611531/?comment_id=2461559731009513,https://www.facebook.com/groups/804858320013004/posts/2458872884611531/
2026-04-11T13:50:41.000Z,2461559824342837,,0,Hồ Hà,"công nhận bé nhà tui dùng sữa ap new này thấy nhanh nhẹn mà khỏe khoắn, ít bệnh vặt hơn đấy các mẹ ạ",https://www.facebook.com/groups/804858320013004/posts/2458872884611531/?comment_id=2461559824342837,https://www.facebook.com/groups/804858320013004/posts/2458872884611531/
2026-04-11T13:50:57.000Z,2461559974342822,2461559824342837,1,Hồng Liên,"Hồ Hà sữa ap nzl này bsung synbiotic đặc chế đấy, con e uống đều nên tăng đk bé ít bệnh vặt các mẹ ạ",https://www.facebook.com/groups/804858320013004/posts/2458872884611531/?comment_id=2461559824342837&reply_comment_id=2461559974342822,https://www.facebook.com/groups/804858320013004/posts/2458872884611531/
2026-04-11T13:51:06.000Z,2461560081009478,,0,Xuân Thắm,"thấy cho con dùng sữa ap new này hợp lắm, bé thông minh, tăng miễn dịch,nên cũng đỡ bệnh vặt hơn nè",https://www.facebook.com/groups/804858320013004/posts/2458872884611531/?comment_id=2461560081009478,https://www.facebook.com/groups/804858320013004/posts/2458872884611531/
2026-04-11T13:51:22.000Z,2461560247676128,,0,Vũ Trọng Phụng,có phải sữa ap new này là dòng dành cho bé đẻ mổ ko các mom?,https://www.facebook.com/groups/804858320013004/posts/2458872884611531/?comment_id=2461560247676128,https://www.facebook.com/groups/804858320013004/posts/2458872884611531/
2026-04-11T13:51:36.000Z,2461560407676112,2461560247676128,1,Nguyễn Thu Đông,"Vũ Trọng Phụng con c dùng sữa ap new này đỡ ốm và kháu nữa, mừng lắm đó em ạ, tốt cho trẻ sinh mổ",https://www.facebook.com/groups/804858320013004/posts/2458872884611531/?comment_id=2461560247676128&reply_comment_id=2461560407676112,https://www.facebook.com/groups/804858320013004/posts/2458872884611531/
2026-04-11T13:51:44.000Z,2461560477676105,,0,Uyên Phương,"nhờ dùng dữa sữa ap new bạn Tôm nhà em con khỏe, ít bệnh vặt mà cũng nhanh nhẹn lắm, sữa ap new này tốt cho bé sinh mổ nhé các mom",https://www.facebook.com/groups/804858320013004/posts/2458872884611531/?comment_id=2461560477676105,https://www.facebook.com/groups/804858320013004/posts/2458872884611531/
2026-04-11T13:51:59.000Z,2461560627676090,,0,Thanh Bình,"Trộm vía bé uống sữa aptamil nzl thấy con tốt cho não, nhìn con chơi đùa rất có tư duy",https://www.facebook.com/groups/804858320013004/posts/2458872884611531/?comment_id=2461560627676090,https://www.facebook.com/groups/804858320013004/posts/2458872884611531/
2026-04-11T13:52:11.000Z,2461560787676074,2461560627676090,1,Đỗ Nhi,Thanh Bình bạn Phép nhà tui dùng sữa ap new hợp lắm. Chứ trc mua sữa cũ con hổng dùng,https://www.facebook.com/groups/804858320013004/posts/2458872884611531/?comment_id=2461560627676090&reply_comment_id=2461560787676074,https://www.facebook.com/groups/804858320013004/posts/2458872884611531/
2026-04-11T13:52:18.000Z,2461560897676063,,0,Nguyen Ngoc Canh,"cho con uống sữa ap new này thấy bé nhà mình sáng dạ mà con khỏe, đỡ khò khè nhé các mom",https://www.facebook.com/groups/804858320013004/posts/2458872884611531/?comment_id=2461560897676063,https://www.facebook.com/groups/804858320013004/posts/2458872884611531/
2026-04-11T13:52:26.000Z,2461560967676056,,0,Thương Hoài,"bé Tít nhà tui dùng đều sữa ap new này tvia con khỏe với nhanh nhạy lắm, đi lớp cô giáo khen con thông minh k nhút nhát nha",https://www.facebook.com/groups/804858320013004/posts/2458872884611531/?comment_id=2461560967676056,https://www.facebook.com/groups/804858320013004/posts/2458872884611531/
2026-04-11T13:52:35.000Z,2461561061009380,,0,Huệ Kim,con tui dùng sữa ap new được 8 tháng nay rồi bé nhanh nhẹn nên nhớ dai mà con khỏe hơn nha,https://www.facebook.com/groups/804858320013004/posts/2458872884611531/?comment_id=2461561061009380,https://www.facebook.com/groups/804858320013004/posts/2458872884611531/
2026-04-11T13:52:50.000Z,2461561221009364,,0,Thiên An,"từ ngày bé Dola nhà tui dùng sữa ap new này trộm vía thấy tăng miễn dịch, mà lại dạn dĩ, hoạt bát nha",https://www.facebook.com/groups/804858320013004/posts/2458872884611531/?comment_id=2461561221009364,https://www.facebook.com/groups/804858320013004/posts/2458872884611531/
2026-04-11T13:53:22.000Z,2461561541009332,,0,Chang Tây,"nhờ dùng sữa ap nzl bạn Tèo nhà tui khỏe khoắn nên đỡ khò khè, tư duy tốt hơn nữa các mẹ ạ",https://www.facebook.com/groups/804858320013004/posts/2458872884611531/?comment_id=2461561541009332,https://www.facebook.com/groups/804858320013004/posts/2458872884611531/
2026-04-11T13:53:30.000Z,2461561637675989,,0,Quyên Nguyễn,"m còn đắn đo quá, dòng sữa ap nz này có thành phần nào tốt vậy?",https://www.facebook.com/groups/804858320013004/posts/2458872884611531/?comment_id=2461561637675989,https://www.facebook.com/groups/804858320013004/posts/2458872884611531/
2026-04-11T13:53:41.000Z,2461561751009311,2461561637675989,1,Cao Hoang Giang,Quyên Nguyễn sữa ap new này bổ sung synbiotic đặc chế tăng đề kháng và dha cao nhất nhì dòng áp nên con tui dùng thấy sáng dạ hơn đó ạ,https://www.facebook.com/groups/804858320013004/posts/2458872884611531/?comment_id=2461561637675989&reply_comment_id=2461561751009311,https://www.facebook.com/groups/804858320013004/posts/2458872884611531/
2026-04-11T13:53:49.000Z,2461561824342637,,0,Minh Ánh,sữa ap new rất hợp bé mình nên con tăng đề khang và nhớ cũng lâu ​ lắm mấy c,https://www.facebook.com/groups/804858320013004/posts/2458872884611531/?comment_id=2461561824342637,https://www.facebook.com/groups/804858320013004/posts/2458872884611531/
2026-04-11T13:53:57.000Z,2461561907675962,,0,Hang Huynh,sữa ap nz này có chứa synbiotic đặc chế giúp đề kháng tốt và hàm lượng dha cao nên con dùng khỏe khoắn mà dạn dĩ nhé các mẹ,https://www.facebook.com/groups/804858320013004/posts/2458872884611531/?comment_id=2461561907675962,https://www.facebook.com/groups/804858320013004/posts/2458872884611531/
2026-04-11T13:54:05.000Z,2461562011009285,,0,Thiên Thanh,"Bé dùng sữa ap nz thấy con tiếp thu nhanh, mẹ chỉ cần nói qua là con hiểu ý ngay",https://www.facebook.com/groups/804858320013004/posts/2458872884611531/?comment_id=2461562011009285,https://www.facebook.com/groups/804858320013004/posts/2458872884611531/
2026-04-11T13:54:26.000Z,2461562224342597,,0,Phạm Thị Lan,Nhóc nhà mình uống sữa ap new tvia đỡ ốm học nhanh và tiêu hóa tốt hẳn,https://www.facebook.com/groups/804858320013004/posts/2458872884611531/?comment_id=2461562224342597,https://www.facebook.com/groups/804858320013004/posts/2458872884611531/
2026-04-11T13:54:33.000Z,2461562311009255,,0,Lâm Nhung,"từ bữa cho Mít ướt uống sữa ap nzl thấy khỏe mạnh, thông minh, mà cũng nhanh nhạy thật nhé các mom",https://www.facebook.com/groups/804858320013004/posts/2458872884611531/?comment_id=2461562311009255,https://www.facebook.com/groups/804858320013004/posts/2458872884611531/
2026-04-11T13:54:54.000Z,2461562494342570,,0,Hoàng Kim Ánh Tuyết,"công nhận con dùng sữa ap newzealand đều đặn nên tăng đk, ít bệnh vặt mà lại nhanh nhẹn, kháu khỉnh hơn đó",https://www.facebook.com/groups/804858320013004/posts/2458872884611531/?comment_id=2461562494342570,https://www.facebook.com/groups/804858320013004/posts/2458872884611531/
2026-04-11T13:55:00.000Z,2461562631009223,,0,Linh Khánh,Mầu nhà mình càng ngày càng khỏe mạnh nhờ bsung sữa ap nzl đều đặn đấy các mom ạ,https://www.facebook.com/groups/804858320013004/posts/2458872884611531/?comment_id=2461562631009223,https://www.facebook.com/groups/804858320013004/posts/2458872884611531/
2026-04-11T13:55:10.000Z,2461562784342541,,0,Hoàng Thị Bảo Yến,"Tũn nhà tui uống sữa ap new được hơn một năm rồi đó các mẹ ạ, thấy bé khỏe khoắn mà cũng hoạt bát hơn trc nhiều nha",https://www.facebook.com/groups/804858320013004/posts/2458872884611531/?comment_id=2461562784342541,https://www.facebook.com/groups/804858320013004/posts/2458872884611531/
2026-04-11T13:55:18.000Z,2461562907675862,,0,Nguyễn Bình An,"tvia cho dùng sữa ap nzl Mon nhà em khỏe khoắn mà tiếp thu nhanh hơn trc nhiều các mom ạ, sữa ap new này hợp bé đẻ mổ đó",https://www.facebook.com/groups/804858320013004/posts/2458872884611531/?comment_id=2461562907675862,https://www.facebook.com/groups/804858320013004/posts/2458872884611531/
2026-04-11T13:55:27.000Z,2461562987675854,,0,La Thi Phuong,sữa ap nz thích hợp trẻ sinh mổ lắm à c? e tò mò quá,https://www.facebook.com/groups/804858320013004/posts/2458872884611531/?comment_id=2461562987675854,https://www.facebook.com/groups/804858320013004/posts/2458872884611531/
2026-04-11T13:55:39.000Z,2461563241009162,2461562987675854,1,Dương Mỹ Duyên,"La Thi Phuong từ ngày dùng sữa ap new thấy khỏe mạnh, đỡ khò khè, mà thông minh hơn đó các mẹ, tốt cho trẻ sinh mổ",https://www.facebook.com/groups/804858320013004/posts/2458872884611531/?comment_id=2461562987675854&reply_comment_id=2461563241009162,https://www.facebook.com/groups/804858320013004/posts/2458872884611531/
2026-04-11T13:55:46.000Z,2461563301009156,,0,Dang Huyen Chau,"sữa ap new rất hợp bé sinh mổ nha, con c dùng từ lúc được 10 ngày cơ",https://www.facebook.com/groups/804858320013004/posts/2458872884611531/?comment_id=2461563301009156,https://www.facebook.com/groups/804858320013004/posts/2458872884611531/
2026-04-11T13:55:53.000Z,2461563387675814,,0,Thanh Thùy,"tui chọn sữa ap nzl vì thấy bé dùng sữa ap new này hàng ngày thông minh, nhanh nhẹn, khỏe khoắn hẳn đó",https://www.facebook.com/groups/804858320013004/posts/2458872884611531/?comment_id=2461563387675814,https://www.facebook.com/groups/804858320013004/posts/2458872884611531/
2026-04-11T13:56:03.000Z,2461563517675801,,0,Nhu Loan,"sữa ap new giúp nhóc nhà tui pt tốt, con thích vị sữa nhạt thanh lắm",https://www.facebook.com/groups/804858320013004/posts/2458872884611531/?comment_id=2461563517675801,https://www.facebook.com/groups/804858320013004/posts/2458872884611531/
2026-04-11T13:56:10.000Z,2461563601009126,,0,Chi Chi,"Bé nhà tui hợp sữa Ap New Zealand, dùng dễ hấp thu, mẹ thấy yên tâm",https://www.facebook.com/groups/804858320013004/posts/2458872884611531/?comment_id=2461563601009126,https://www.facebook.com/groups/804858320013004/posts/2458872884611531/
2026-04-11T13:57:20.000Z,2461564431009043,,0,Le Hieu,trộm vía từ khi uống sữa ap nzl con tui đỡ ốm vặt hơn nhờ sữa bs synbiotic đặc chế giúp tăng đề kháng đấy ạ,https://www.facebook.com/groups/804858320013004/posts/2458872884611531/?comment_id=2461564431009043,https://www.facebook.com/groups/804858320013004/posts/2458872884611531/
2026-04-11T13:57:25.000Z,2461564454342374,,0,Kim Tien,"từ ngày dùng sữa ap nzl bạn cà chua nhà em miễn dịch tốt, đỡ ốm vặt, mà dạn dĩ nên bé học hỏi nhanh nha",https://www.facebook.com/groups/804858320013004/posts/2458872884611531/?comment_id=2461564454342374,https://www.facebook.com/groups/804858320013004/posts/2458872884611531/
2026-04-11T13:57:32.000Z,2461564527675700,,0,Trương Thị Hạnh,"từ đợt dạn dĩ sữa ap new thấy con em tăng đề kháng, con khỏe,mà cũng nhanh nhạy lắm",https://www.facebook.com/groups/804858320013004/posts/2458872884611531/?comment_id=2461564527675700,https://www.facebook.com/groups/804858320013004/posts/2458872884611531/
2026-04-11T13:57:44.000Z,2461564664342353,,0,Quynh Anh,sữa ap new có giúp khỏe mạnh với lại tốt cho trí não học ko các chị? mình đang tìm hiểu nà,https://www.facebook.com/groups/804858320013004/posts/2458872884611531/?comment_id=2461564664342353,https://www.facebook.com/groups/804858320013004/posts/2458872884611531/
2026-04-11T13:57:58.000Z,2461564894342330,,0,Đỗ Khả Ngân,con e đẻ mổ dùng sữa ap newzealand đều đặn có synbiotic đặc chế hỗ trợ tăng đề kháng và dha cao nên con tui dạn dĩ lắm,https://www.facebook.com/groups/804858320013004/posts/2458872884611531/?comment_id=2461564894342330,https://www.facebook.com/groups/804858320013004/posts/2458872884611531/
2026-04-11T13:58:05.000Z,2461564964342323,,0,Hoàng Ngân Đặng,con tui uống sữa Ap New Zealand này đều ngày 3 cữ đấy mom,https://www.facebook.com/groups/804858320013004/posts/2458872884611531/?comment_id=2461564964342323,https://www.facebook.com/groups/804858320013004/posts/2458872884611531/
2026-04-11T13:58:10.000Z,2461565047675648,,0,Thuỷ Thanh,"Nhà tui cho bé dùng sữa ap newzealand miễn dịch tốt, khỏe khoắn với sáng dạ hơn các mẹ ạ",https://www.facebook.com/groups/804858320013004/posts/2458872884611531/?comment_id=2461565047675648,https://www.facebook.com/groups/804858320013004/posts/2458872884611531/
2026-04-11T13:58:16.000Z,2461565111008975,,0,Đỗ Mỹ Duyên,"từ ngày dùng sữa ap new giúp bé nhà em nhanh nhẹn, dạn dĩ, khỏe khoắn hơn nhé các mom",https://www.facebook.com/groups/804858320013004/posts/2458872884611531/?comment_id=2461565111008975,https://www.facebook.com/groups/804858320013004/posts/2458872884611531/
2026-04-11T13:58:33.000Z,2461565267675626,,0,Đỗ Thảo,"cho dùng sữa ap new thấy con nhà em khỏe khoắn, đỡ khò khè, dạn dĩ mà lại nhớ dai á",https://www.facebook.com/groups/804858320013004/posts/2458872884611531/?comment_id=2461565267675626,https://www.facebook.com/groups/804858320013004/posts/2458872884611531/
2026-04-11T13:58:40.000Z,2461565317675621,,0,Lê Yến Ly,sữa ap nzl này chứa synbiotic đặc chế con mình uống thấy miễn dịch tốt nên ít bệnh vặt nha các mẹ,https://www.facebook.com/groups/804858320013004/posts/2458872884611531/?comment_id=2461565317675621,https://www.facebook.com/groups/804858320013004/posts/2458872884611531/
2026-04-11T13:58:46.000Z,2461565391008947,,0,Cà Rốt,"con tui đang uống sữa ap new bé tăng miễn dịch, đỡ bệnh vặt mà cũng hoạt bát nha",https://www.facebook.com/groups/804858320013004/posts/2458872884611531/?comment_id=2461565391008947,https://www.facebook.com/groups/804858320013004/posts/2458872884611531/
2026-04-11T13:58:54.000Z,2461565487675604,,0,Nguyễn Thị Tiên,"mình cho bé uống sữa ap new thấy khỏe khoắn, tư duy tốt, chịu tốt cho trí não hơn nè",https://www.facebook.com/groups/804858320013004/posts/2458872884611531/?comment_id=2461565487675604,https://www.facebook.com/groups/804858320013004/posts/2458872884611531/
2026-04-11T13:59:03.000Z,2461565581008928,2461565487675604,1,Nguyễn Thị Thảo Ly,"Nguyễn Thị Tiên Vị sữa ap new nhạt thanh dễ dùng, con m dùng thấy ưng lắm",https://www.facebook.com/groups/804858320013004/posts/2458872884611531/?comment_id=2461565487675604&reply_comment_id=2461565581008928,https://www.facebook.com/groups/804858320013004/posts/2458872884611531/
2026-04-11T13:59:11.000Z,2461565634342256,,0,Hằng Thanh Thanh,"con mình uống sữa ap new có synbiotic đặc chế hỗ trợ tăng đề kháng lại có dha cao nên con sáng dạ,kháu khỉnh hơn nè",https://www.facebook.com/groups/804858320013004/posts/2458872884611531/?comment_id=2461565634342256,https://www.facebook.com/groups/804858320013004/posts/2458872884611531/
2026-04-11T13:59:18.000Z,2461565724342247,,0,Vy Vy,"dùng sữa ap newzealand này thấy con em con khỏe, ít khò khè với nhanh nhẹn, thông minh lắm ạ",https://www.facebook.com/groups/804858320013004/posts/2458872884611531/?comment_id=2461565724342247,https://www.facebook.com/groups/804858320013004/posts/2458872884611531/
2026-04-11T13:59:28.000Z,2461565827675570,,0,Nhi Hàn,"mình cũng thích bé uống sữa ap new này c ơi, tvia dạo này con thông minh lắm á",https://www.facebook.com/groups/804858320013004/posts/2458872884611531/?comment_id=2461565827675570,https://www.facebook.com/groups/804858320013004/posts/2458872884611531/
