Date,Comment_ID,Parent_ID,Level,Author,Content,Permalink,Post_URL
2026-04-11T02:59:42.000Z,2461167877715365,2461167807715372,1,Đặng Tuyết Nhung,"Aptamil được dùng rộng rãi ở nhiều nước nên m thấy độ tin cậy cao, lại thuộc Danone nữa",https://www.facebook.com/groups/804858320013004/posts/2458872884611531/?comment_id=2461167807715372&reply_comment_id=2461167877715365,https://www.facebook.com/groups/804858320013004/posts/2458872884611531/
2026-04-11T02:59:47.000Z,2461167931048693,,0,Vũ Thị Loan,"em cũng từng lo lắng chuyện sữa, sau chọn aptamil của Danone thì yên tâm hơn nhiều",https://www.facebook.com/groups/804858320013004/posts/2458872884611531/?comment_id=2461167931048693,https://www.facebook.com/groups/804858320013004/posts/2458872884611531/
2026-04-11T02:59:57.000Z,2461168034382016,2461167931048693,1,Đào Hồng Vân,"Danone có hơn 100 năm nghiên cứu nên aptamil được nhiều mẹ ưu tiên, m cũng vậy",https://www.facebook.com/groups/804858320013004/posts/2458872884611531/?comment_id=2461167931048693&reply_comment_id=2461168034382016,https://www.facebook.com/groups/804858320013004/posts/2458872884611531/
2026-04-11T03:00:02.000Z,2461168267715326,,0,Lê Minh Thư,"đọc bài thấy đồng cảm ghê, mà may có aptamil ap new của Danone nên cũng đỡ lo",https://www.facebook.com/groups/804858320013004/posts/2458872884611531/?comment_id=2461168267715326,https://www.facebook.com/groups/804858320013004/posts/2458872884611531/
2026-04-11T03:00:09.000Z,2461168387715314,2461168267715326,1,Nguyễn Thúy Kim,Aptamil của Danone được các mẹ review nhiều nên m thấy đáng tin khi chọn cho con,https://www.facebook.com/groups/804858320013004/posts/2458872884611531/?comment_id=2461168267715326&reply_comment_id=2461168387715314,https://www.facebook.com/groups/804858320013004/posts/2458872884611531/
2026-04-11T03:00:16.000Z,2461168474381972,2461168267715326,1,Lê Minh Thư,m thấy Danone là thương hiệu toàn cầu nên aptamil cũng được kiểm chứng nhiều nơi,https://www.facebook.com/groups/804858320013004/posts/2458872884611531/?comment_id=2461168267715326&reply_comment_id=2461168474381972,https://www.facebook.com/groups/804858320013004/posts/2458872884611531/
2026-04-11T03:00:28.000Z,2461168581048628,,0,Lê Thanh Nhàn,"Aptamil có đa dạng sản phẩm nên m dùng lâu dài cho bé cũng tiện, vì Danone nghiên cứu bài bản",https://www.facebook.com/groups/804858320013004/posts/2458872884611531/?comment_id=2461168581048628,https://www.facebook.com/groups/804858320013004/posts/2458872884611531/
2026-04-11T03:00:33.000Z,2461168627715290,,0,Vũ Thu Huyền,"m thấy nhiều mẹ nước ngoài dùng aptamil lắm, do Danone phổ biến toàn cầu nên yên tâm",https://www.facebook.com/groups/804858320013004/posts/2458872884611531/?comment_id=2461168627715290,https://www.facebook.com/groups/804858320013004/posts/2458872884611531/
2026-04-11T03:00:38.000Z,2461168681048618,,0,Lê Huyền Mai,"đọc bài mà thấy thương mom, mà có aptamil ap new của Danone nên vẫn ổn áp",https://www.facebook.com/groups/804858320013004/posts/2458872884611531/?comment_id=2461168681048618,https://www.facebook.com/groups/804858320013004/posts/2458872884611531/
2026-04-11T03:00:50.000Z,2461168787715274,2461168681048618,1,Nam Nguyen Xuan,Danone là tập đoàn dinh dưỡng lớn nên aptamil được nhiều mẹ tin tưởng lựa chọn,https://www.facebook.com/groups/804858320013004/posts/2458872884611531/?comment_id=2461168681048618&reply_comment_id=2461168787715274,https://www.facebook.com/groups/804858320013004/posts/2458872884611531/
2026-04-11T03:01:52.000Z,2461169441048542,,0,Hoa Mai,"sữa ap newzealand giúp con mình tăng đề kháng tốt và tập trung chú ý lắng nghe ​, có công thức được chứng minh khoa học cho trẻ sinh mổ mấy c ạ",https://www.facebook.com/groups/804858320013004/posts/2458872884611531/?comment_id=2461169441048542,https://www.facebook.com/groups/804858320013004/posts/2458872884611531/
2026-04-11T03:02:21.000Z,2461169704381849,,0,Hằng Thu Phan,"em cũng từng phân vân, sau thấy aptamil của Danone nên quyết định chọn cho bé",https://www.facebook.com/groups/804858320013004/posts/2458872884611531/?comment_id=2461169704381849,https://www.facebook.com/groups/804858320013004/posts/2458872884611531/
2026-04-11T03:02:31.000Z,2461169797715173,2461169704381849,1,ThuThao Tran,Aptamil phổ biến ở Úc với new Zealand nên m càng yên tâm vì Danone đứng sau,https://www.facebook.com/groups/804858320013004/posts/2458872884611531/?comment_id=2461169704381849&reply_comment_id=2461169797715173,https://www.facebook.com/groups/804858320013004/posts/2458872884611531/
2026-04-11T03:02:35.000Z,2461169834381836,,0,Nguyễn Thu Tâm,"mình thấy Aptamil được nhắc nhiều trong group, vì Danone uy tín nên lan tỏa mạnh",https://www.facebook.com/groups/804858320013004/posts/2458872884611531/?comment_id=2461169834381836,https://www.facebook.com/groups/804858320013004/posts/2458872884611531/
2026-04-11T03:02:41.000Z,2461169891048497,,0,Vu Linh,"em cũng từng áp lực chuyện sữa, mà có aptamil của Danone nên thấy đỡ lo",https://www.facebook.com/groups/804858320013004/posts/2458872884611531/?comment_id=2461169891048497,https://www.facebook.com/groups/804858320013004/posts/2458872884611531/
2026-04-11T03:03:04.000Z,2461170124381807,2461169891048497,1,Vu Linh,"Aptamil được phân phối rộng nên em thấy rất phổ biến, Danone đứng sau nên càng an tâm",https://www.facebook.com/groups/804858320013004/posts/2458872884611531/?comment_id=2461169891048497&reply_comment_id=2461170124381807,https://www.facebook.com/groups/804858320013004/posts/2458872884611531/
2026-04-11T03:03:10.000Z,2461170237715129,,0,Nguyễn Hoa Ngân,"m thấy nhiều mẹ chia sẻ aptamil vì trải nghiệm tốt, do Danone nghiên cứu lâu năm",https://www.facebook.com/groups/804858320013004/posts/2458872884611531/?comment_id=2461170237715129,https://www.facebook.com/groups/804858320013004/posts/2458872884611531/
2026-04-11T03:03:14.000Z,2461170274381792,,0,Le Thanh,"đọc bài mà thấy đồng cảm, may có aptamil ap new của Danone nên mẹ cũng bớt áp lực hơn",https://www.facebook.com/groups/804858320013004/posts/2458872884611531/?comment_id=2461170274381792,https://www.facebook.com/groups/804858320013004/posts/2458872884611531/
2026-04-11T03:03:22.000Z,2461170404381779,,0,Trần Lê Minh Anh,"tui hiểu cảm giác stress mất sữa lắm luôn á, mà chuyển qua apnew của Danone thấy yên tâm vì thương hiệu toàn cầu hơn 100 năm nghiên cứu dinh dưỡng",https://www.facebook.com/groups/804858320013004/posts/2458872884611531/?comment_id=2461170404381779,https://www.facebook.com/groups/804858320013004/posts/2458872884611531/
2026-04-11T03:03:30.000Z,2461170491048437,2461170404381779,1,Lệ Lý,"đúng rồi mom, Danone làm dinh dưỡng cho trẻ lâu đời nên chọn aptamil cũng thấy an tâm hơn hẳn khi cho con dùng mỗi ngày",https://www.facebook.com/groups/804858320013004/posts/2458872884611531/?comment_id=2461170404381779&reply_comment_id=2461170491048437,https://www.facebook.com/groups/804858320013004/posts/2458872884611531/
2026-04-11T03:03:37.000Z,2461170547715098,,0,Vương Thu Phan,"nhà mình cũng dùng aptamil của Danone, thương hiệu lớn có mặt nhiều nước nên mẹ nào cũng tin tưởng rồi đó",https://www.facebook.com/groups/804858320013004/posts/2458872884611531/?comment_id=2461170547715098,https://www.facebook.com/groups/804858320013004/posts/2458872884611531/
2026-04-11T03:03:42.000Z,2461170584381761,,0,Bảo Tiên,"Stress ảnh hưởng dữ lắm mom ơi, may có apnew của Danone hỗ trợ thêm nên mình vẫn vững tâm chăm con",https://www.facebook.com/groups/804858320013004/posts/2458872884611531/?comment_id=2461170584381761,https://www.facebook.com/groups/804858320013004/posts/2458872884611531/
2026-04-11T03:03:46.000Z,2461170624381757,,0,Minh Hồng Lương,"tui cũng từng như mom, sau chuyển qua aptamil thấy ổn vì Danone nghiên cứu dinh dưỡng trẻ em hơn trăm năm",https://www.facebook.com/groups/804858320013004/posts/2458872884611531/?comment_id=2461170624381757,https://www.facebook.com/groups/804858320013004/posts/2458872884611531/
2026-04-11T03:03:55.000Z,2461170761048410,2461170624381757,1,Nhi Dương,"Aptamil của Danone nổi tiếng toàn cầu nên nhiều mẹ truyền tai nhau, mình cũng theo đó chọn cho bé luôn",https://www.facebook.com/groups/804858320013004/posts/2458872884611531/?comment_id=2461170624381757&reply_comment_id=2461170761048410,https://www.facebook.com/groups/804858320013004/posts/2458872884611531/
2026-04-11T03:04:01.000Z,2461170824381737,,0,Bảo Hoàng Trâm,"mình thấy chọn thương hiệu như Danone là đỡ lăn tăn nhất, có nền tảng nghiên cứu lâu dài nên an tâm",https://www.facebook.com/groups/804858320013004/posts/2458872884611531/?comment_id=2461170824381737,https://www.facebook.com/groups/804858320013004/posts/2458872884611531/
2026-04-11T03:04:05.000Z,2461170874381732,,0,Lê Hoài Vy,"Lúc đầu mình cũng áp lực giống mom, sau dùng aptamil thấy nhẹ đầu hơn vì tin vào thương hiệu Danone",https://www.facebook.com/groups/804858320013004/posts/2458872884611531/?comment_id=2461170874381732,https://www.facebook.com/groups/804858320013004/posts/2458872884611531/
2026-04-11T03:04:14.000Z,2461170951048391,2461170874381732,1,Tran Hoang Dung,"Aptamil có mặt ở hơn 120 thị trường nên độ uy tín khỏi bàn, mẹ nào cũng biết tới nên mình yên tâm chọn",https://www.facebook.com/groups/804858320013004/posts/2458872884611531/?comment_id=2461170874381732&reply_comment_id=2461170951048391,https://www.facebook.com/groups/804858320013004/posts/2458872884611531/
2026-04-11T03:04:20.000Z,2461171024381717,,0,Ngọc Dung,"tui cũng mất sữa do stress, mà dùng apnew của Danone thấy ổn vì hãng này nổi tiếng về dinh dưỡng trẻ",https://www.facebook.com/groups/804858320013004/posts/2458872884611531/?comment_id=2461171024381717,https://www.facebook.com/groups/804858320013004/posts/2458872884611531/
2026-04-11T03:04:31.000Z,2461171117715041,2461171024381717,1,Vũ Hoài Nụ,Danone làm về dinh dưỡng trẻ em hơn 100 năm nên aptamil được nhiều mẹ tin dùng cũng dễ hiểu,https://www.facebook.com/groups/804858320013004/posts/2458872884611531/?comment_id=2461171024381717&reply_comment_id=2461171117715041,https://www.facebook.com/groups/804858320013004/posts/2458872884611531/
2026-04-11T03:04:37.000Z,2461171181048368,,0,Nguyễn Quỳnh,mình thấy aptamil được các mẹ bên châu Âu với Úc dùng nhiều nên càng yên tâm hơn khi chọn,https://www.facebook.com/groups/804858320013004/posts/2458872884611531/?comment_id=2461171181048368,https://www.facebook.com/groups/804858320013004/posts/2458872884611531/
2026-04-11T03:05:01.000Z,2461171354381684,,0,Thương Tran,"mấy chị bạn mình ở nước ngoài cũng dùng aptamil nhiều, thương hiệu toàn cầu nên độ tin cậy cao",https://www.facebook.com/groups/804858320013004/posts/2458872884611531/?comment_id=2461171354381684,https://www.facebook.com/groups/804858320013004/posts/2458872884611531/
2026-04-11T03:05:06.000Z,2461171397715013,,0,Linh Đan Lê,"mình cũng từng bị áp lực gia đình, chuyển sang apnew thấy yên tâm vì Danone làm dinh dưỡng lâu năm",https://www.facebook.com/groups/804858320013004/posts/2458872884611531/?comment_id=2461171397715013,https://www.facebook.com/groups/804858320013004/posts/2458872884611531/
2026-04-11T03:05:43.000Z,2461171741048312,2461171397715013,1,Hai Do,"Danone là tập đoàn lớn nên aptamil được đầu tư nghiên cứu kỹ, nhiều mẹ dùng rồi chia sẻ lại",https://www.facebook.com/groups/804858320013004/posts/2458872884611531/?comment_id=2461171397715013&reply_comment_id=2461171741048312,https://www.facebook.com/groups/804858320013004/posts/2458872884611531/
2026-04-11T03:05:51.000Z,2461171821048304,2461171397715013,1,Linh Đan Lê,mình tham khảo trong group thấy aptamil được nhắc nhiều vì thương hiệu uy tín nên cũng chọn theo,https://www.facebook.com/groups/804858320013004/posts/2458872884611531/?comment_id=2461171397715013&reply_comment_id=2461171821048304,https://www.facebook.com/groups/804858320013004/posts/2458872884611531/
2026-04-11T03:05:59.000Z,2461171924381627,,0,Phuong Trần Anh,Sau khi tìm hiểu thì thấy Danone có lịch sử hơn 100 năm nên mình tin tưởng chọn aptamil cho bé,https://www.facebook.com/groups/804858320013004/posts/2458872884611531/?comment_id=2461171924381627,https://www.facebook.com/groups/804858320013004/posts/2458872884611531/
2026-04-11T03:06:05.000Z,2461172004381619,,0,Tran Bao Ngoc,"tui thấy apnew của Danone ổn vì thương hiệu lớn, lại phổ biến ở nhiều nước nên yên tâm hơn",https://www.facebook.com/groups/804858320013004/posts/2458872884611531/?comment_id=2461172004381619,https://www.facebook.com/groups/804858320013004/posts/2458872884611531/
2026-04-11T03:06:10.000Z,2461172061048280,,0,Đoàn Hồng My,"mình cũng stress mất sữa, may có aptamil nên đỡ lo vì Danone nổi tiếng về dinh dưỡng trẻ",https://www.facebook.com/groups/804858320013004/posts/2458872884611531/?comment_id=2461172061048280,https://www.facebook.com/groups/804858320013004/posts/2458872884611531/
2026-04-11T03:06:19.000Z,2461172177714935,2461172061048280,1,Thanh Nguyen,Aptamil được phân phối ở nhiều nước nên quy trình với chất lượng cũng được kiểm soát tốt,https://www.facebook.com/groups/804858320013004/posts/2458872884611531/?comment_id=2461172061048280&reply_comment_id=2461172177714935,https://www.facebook.com/groups/804858320013004/posts/2458872884611531/
2026-04-11T03:06:24.000Z,2461172221048264,,0,Trang Phan,nhà mình chọn aptamil vì thấy Danone chuyên nghiên cứu miễn dịch và não bộ cho bé,https://www.facebook.com/groups/804858320013004/posts/2458872884611531/?comment_id=2461172221048264,https://www.facebook.com/groups/804858320013004/posts/2458872884611531/
2026-04-11T03:06:29.000Z,2461172281048258,,0,Vũ Ngọc Kiều,"tui cũng giống mom, sau chuyển sang apnew thấy ổn vì thương hiệu Danone quá uy tín rồi",https://www.facebook.com/groups/804858320013004/posts/2458872884611531/?comment_id=2461172281048258,https://www.facebook.com/groups/804858320013004/posts/2458872884611531/
2026-04-11T03:06:36.000Z,2461172401048246,2461172281048258,1,Xuân Lê Thị,mình thấy nhiều mẹ giới thiệu aptamil qua trải nghiệm thực tế nên càng tin tưởng hơn,https://www.facebook.com/groups/804858320013004/posts/2458872884611531/?comment_id=2461172281048258&reply_comment_id=2461172401048246,https://www.facebook.com/groups/804858320013004/posts/2458872884611531/
2026-04-11T03:06:44.000Z,2461172447714908,2461172281048258,1,Vũ Ngọc Kiều,"Danone có mặt ở hơn 120 quốc gia nên aptamil phổ biến toàn cầu, mẹ chọn cũng yên tâm",https://www.facebook.com/groups/804858320013004/posts/2458872884611531/?comment_id=2461172281048258&reply_comment_id=2461172447714908,https://www.facebook.com/groups/804858320013004/posts/2458872884611531/
2026-04-11T03:06:51.000Z,2461172521048234,,0,Nguyễn Thị Chung,"Stress sau sinh ai cũng dễ gặp, may có aptamil của Danone hỗ trợ nên mình đỡ áp lực",https://www.facebook.com/groups/804858320013004/posts/2458872884611531/?comment_id=2461172521048234,https://www.facebook.com/groups/804858320013004/posts/2458872884611531/
2026-04-11T03:07:11.000Z,2461172827714870,,0,Nguyen Hong Tham,mình tìm hiểu kỹ thì thấy Danone đầu tư nghiên cứu dinh dưỡng lâu dài nên chọn aptamil,https://www.facebook.com/groups/804858320013004/posts/2458872884611531/?comment_id=2461172827714870,https://www.facebook.com/groups/804858320013004/posts/2458872884611531/
2026-04-11T03:07:22.000Z,2461172917714861,2461172827714870,1,Phương Kiều Trinh,"Aptamil được nhiều thế hệ mẹ dùng nên mình cũng tin tưởng theo, thấy thương hiệu lâu đời",https://www.facebook.com/groups/804858320013004/posts/2458872884611531/?comment_id=2461172827714870&reply_comment_id=2461172917714861,https://www.facebook.com/groups/804858320013004/posts/2458872884611531/
2026-04-11T03:07:30.000Z,2461173001048186,,0,Bé Liên,"tui thấy chọn Danone là chọn sự ổn định lâu dài, aptamil có nhiều dòng phù hợp từng giai đoạn",https://www.facebook.com/groups/804858320013004/posts/2458872884611531/?comment_id=2461173001048186,https://www.facebook.com/groups/804858320013004/posts/2458872884611531/
2026-04-11T03:07:38.000Z,2461173167714836,,0,Như Phương Đoàn,"mình cũng từng mất sữa do áp lực, chuyển sang aptamil thấy nhẹ lòng vì tin thương hiệu",https://www.facebook.com/groups/804858320013004/posts/2458872884611531/?comment_id=2461173167714836,https://www.facebook.com/groups/804858320013004/posts/2458872884611531/
2026-04-11T03:07:46.000Z,2461173274381492,2461173167714836,1,Thuy Ngoc Vinh,Danone nổi tiếng về dinh dưỡng trẻ nên aptamil được đánh giá cao ở nhiều thị trường,https://www.facebook.com/groups/804858320013004/posts/2458872884611531/?comment_id=2461173167714836&reply_comment_id=2461173274381492,https://www.facebook.com/groups/804858320013004/posts/2458872884611531/
2026-04-11T03:07:57.000Z,2461173411048145,2461173167714836,1,Như Phương Đoàn,mấy mom trong group mình cũng hay chia sẻ aptamil vì thương hiệu uy tín nên mình thử luôn,https://www.facebook.com/groups/804858320013004/posts/2458872884611531/?comment_id=2461173167714836&reply_comment_id=2461173411048145,https://www.facebook.com/groups/804858320013004/posts/2458872884611531/
2026-04-11T03:08:02.000Z,2461173451048141,,0,Mai Thu Huyền,tui thấy aptamil phổ biến ở châu Âu với new Zealand nên càng tin tưởng hơn khi chọn,https://www.facebook.com/groups/804858320013004/posts/2458872884611531/?comment_id=2461173451048141,https://www.facebook.com/groups/804858320013004/posts/2458872884611531/
2026-04-11T03:08:08.000Z,2461173501048136,,0,Nguyễn Thiện Mai,"Stress là chuyện bình thường mom ơi, quan trọng chọn được aptamil của Danone là yên tâm",https://www.facebook.com/groups/804858320013004/posts/2458872884611531/?comment_id=2461173501048136,https://www.facebook.com/groups/804858320013004/posts/2458872884611531/
2026-04-11T03:08:13.000Z,2461173554381464,,0,Lê Ngọc Khánh,mình thấy Danone nghiên cứu miễn dịch và não bộ lâu năm nên aptamil được nhiều mẹ chọn,https://www.facebook.com/groups/804858320013004/posts/2458872884611531/?comment_id=2461173554381464,https://www.facebook.com/groups/804858320013004/posts/2458872884611531/
2026-04-11T03:08:19.000Z,2461173621048124,,0,Đào Thị Chinh,Aptamil là giải pháp lâu dài vì có nhiều dòng sản phẩm theo từng giai đoạn phát triển của bé,https://www.facebook.com/groups/804858320013004/posts/2458872884611531/?comment_id=2461173621048124,https://www.facebook.com/groups/804858320013004/posts/2458872884611531/
2026-04-11T03:08:24.000Z,2461173657714787,,0,Đồng Thanh Huyền,tui cũng theo lời chị em dùng aptamil vì thương hiệu Danone có nền tảng lâu đời,https://www.facebook.com/groups/804858320013004/posts/2458872884611531/?comment_id=2461173657714787,https://www.facebook.com/groups/804858320013004/posts/2458872884611531/
2026-04-11T03:08:36.000Z,2461173764381443,2461173657714787,1,Vũ Ly Hương,"Danone là tập đoàn toàn cầu nên aptamil có mặt rộng rãi, mẹ nào cũng biết tới",https://www.facebook.com/groups/804858320013004/posts/2458872884611531/?comment_id=2461173657714787&reply_comment_id=2461173764381443,https://www.facebook.com/groups/804858320013004/posts/2458872884611531/
2026-04-11T03:08:48.000Z,2461173934381426,,0,Nguyễn Lương Trâm,"mình cũng stress mất sữa, may có aptamil nên đỡ lo vì tin vào Danone",https://www.facebook.com/groups/804858320013004/posts/2458872884611531/?comment_id=2461173934381426,https://www.facebook.com/groups/804858320013004/posts/2458872884611531/
2026-04-11T03:08:57.000Z,2461174037714749,,0,To Ly,Aptamil được nhiều mẹ giới thiệu qua trải nghiệm thật nên độ tin cậy cao lắm,https://www.facebook.com/groups/804858320013004/posts/2458872884611531/?comment_id=2461174037714749,https://www.facebook.com/groups/804858320013004/posts/2458872884611531/
2026-04-11T03:09:18.000Z,2461174204381399,2461174037714749,1,Nhật Lệ,Danone có hơn 100 năm nghiên cứu nên aptamil luôn nằm trong top được mẹ ưu tiên,https://www.facebook.com/groups/804858320013004/posts/2458872884611531/?comment_id=2461174037714749&reply_comment_id=2461174204381399,https://www.facebook.com/groups/804858320013004/posts/2458872884611531/
2026-04-11T03:09:28.000Z,2461174291048057,2461174037714749,1,To Ly,"tui thấy chọn aptamil vì Danone là hợp lý, thương hiệu lớn nên an tâm khi dùng lâu dài",https://www.facebook.com/groups/804858320013004/posts/2458872884611531/?comment_id=2461174037714749&reply_comment_id=2461174291048057,https://www.facebook.com/groups/804858320013004/posts/2458872884611531/
2026-04-11T03:09:33.000Z,2461174311048055,,0,Bùi Huong Giang,mình đọc thông tin thấy Danone đầu tư mạnh vào dinh dưỡng trẻ nên aptamil được đánh giá cao,https://www.facebook.com/groups/804858320013004/posts/2458872884611531/?comment_id=2461174311048055,https://www.facebook.com/groups/804858320013004/posts/2458872884611531/
2026-04-11T03:09:46.000Z,2461174414381378,2461174311048055,1,Bạch Long VI,Aptamil phổ biến ở nhiều nước nên kinh nghiệm từ các mẹ cũng nhiều để mình tham khảo,https://www.facebook.com/groups/804858320013004/posts/2458872884611531/?comment_id=2461174311048055&reply_comment_id=2461174414381378,https://www.facebook.com/groups/804858320013004/posts/2458872884611531/
2026-04-11T03:09:53.000Z,2461174487714704,,0,Lê Nguyệt,"tui cũng từng phân vân, sau chọn aptamil vì Danone có lịch sử lâu đời nên yên tâm",https://www.facebook.com/groups/804858320013004/posts/2458872884611531/?comment_id=2461174487714704,https://www.facebook.com/groups/804858320013004/posts/2458872884611531/
2026-04-11T03:10:17.000Z,2461174681048018,,0,Võ Thị Phát,"bé Nhím nhà mình dùng sữa ap new , dạo này bé ít bệnh vặt hẳn. sữa này nhạt thanh dễ uống con lại rất phát triển trí não​",https://www.facebook.com/groups/804858320013004/posts/2458872884611531/?comment_id=2461174681048018,https://www.facebook.com/groups/804858320013004/posts/2458872884611531/
2026-04-11T03:55:49.000Z,2461200287712124,,0,Đỗ Thị Thu Thảo,"sữa ap newzealand vị nhạt thanh, bé thích uống, mẹ yên tâm cho dùng lâu dài",https://www.facebook.com/groups/804858320013004/posts/2458872884611531/?comment_id=2461200287712124,https://www.facebook.com/groups/804858320013004/posts/2458872884611531/
2026-04-11T03:55:57.000Z,2461200384378781,,0,Nguyễn Thị Huyền,"sữa ap new nhập khẩu nguyên lon New Zealand, chất lượng rõ ràng, mom an tâm lắm nha",https://www.facebook.com/groups/804858320013004/posts/2458872884611531/?comment_id=2461200384378781,https://www.facebook.com/groups/804858320013004/posts/2458872884611531/
2026-04-11T03:56:08.000Z,2461200454378774,2461200384378781,1,Trần Mai Loan,"từ khi Tí nhà mình uống sữa ap newzealand miễn dịch tốt, khỏe mạnh với tư duy tốt hơn các mẹ ạ",https://www.facebook.com/groups/804858320013004/posts/2458872884611531/?comment_id=2461200384378781&reply_comment_id=2461200454378774,https://www.facebook.com/groups/804858320013004/posts/2458872884611531/
2026-04-11T03:56:14.000Z,2461200501045436,,0,Lê Nhật Lệ,"con mình uống sữa ap new này thường xuyên thấy khỏe khoắn mà, não bộ phát triển tốt nhé các mom",https://www.facebook.com/groups/804858320013004/posts/2458872884611531/?comment_id=2461200501045436,https://www.facebook.com/groups/804858320013004/posts/2458872884611531/
2026-04-11T03:56:21.000Z,2461200561045430,,0,Ngô Bảo Thanh,"sữa Ap New Zealand có lon số 1 lon có nhỏ 380g tiện lợi, bỏ vào combo đi sinh không chiếm chỗ",https://www.facebook.com/groups/804858320013004/posts/2458872884611531/?comment_id=2461200561045430,https://www.facebook.com/groups/804858320013004/posts/2458872884611531/
2026-04-11T03:56:35.000Z,2461200704378749,,0,An Nhiên,"nhờ uống sữa ap newzealand đều đặn con nhà mình tăng đk tốt lại hoạt bát, học hỏi nhanh nè, sữa ap new này dễ dùng đấy ạ",https://www.facebook.com/groups/804858320013004/posts/2458872884611531/?comment_id=2461200704378749,https://www.facebook.com/groups/804858320013004/posts/2458872884611531/
2026-04-11T03:56:40.000Z,2461200827712070,,0,Lê Thành,"công nhân, dặm sữa ap new này đều nhìn con năng động thích cực",https://www.facebook.com/groups/804858320013004/posts/2458872884611531/?comment_id=2461200827712070,https://www.facebook.com/groups/804858320013004/posts/2458872884611531/
2026-04-11T03:56:46.000Z,2461200881045398,,0,Vũ Thùy Trang,Em phân vân là sữa ap new này có tốt cho mấy bé đẻ mổ ko ạ?,https://www.facebook.com/groups/804858320013004/posts/2458872884611531/?comment_id=2461200881045398,https://www.facebook.com/groups/804858320013004/posts/2458872884611531/
