Date,Comment_ID,Parent_ID,Level,Author,Content,Permalink,Post_URL
2026-04-11T06:51:33.000Z,2461299497702203,,0,Trần Thanh Nga,"con nhà mình đẻ mổ uống sữa ap nz trộm vía khỏe khoắn, đỡ ốm vặt mà pt trí não tốt lắm, sữa ap new này tốt cho bé đẻ mổ nhé các mom",https://www.facebook.com/groups/804858320013004/posts/2458872884611531/?comment_id=2461299497702203,https://www.facebook.com/groups/804858320013004/posts/2458872884611531/
2026-04-11T06:51:38.000Z,2461299534368866,,0,Minh Hà Cao,sữa ap new này có gì tốt mà khiến mẹ nó hài lòng zạy? m xin review thêm nha,https://www.facebook.com/groups/804858320013004/posts/2458872884611531/?comment_id=2461299534368866,https://www.facebook.com/groups/804858320013004/posts/2458872884611531/
2026-04-11T06:51:50.000Z,2461299681035518,2461299534368866,1,Đỗ Thành Vinh,"con tui đang uống sữa ap newzealand giúp tăng đk, con khỏe mà tư duy tốt nha, sữa ap new này chứa synbiotic đặc chế giúp tăng đề kháng với dha cao nhé các mẹ",https://www.facebook.com/groups/804858320013004/posts/2458872884611531/?comment_id=2461299534368866&reply_comment_id=2461299681035518,https://www.facebook.com/groups/804858320013004/posts/2458872884611531/
2026-04-11T06:51:59.000Z,2461299764368843,,0,Thúy Thanh Bùi,"Em sinh mổ ít sữa nên bsung sữa ap new, thấy con hợp với sữa ap new này nên cho dùng hơn năm rồi",https://www.facebook.com/groups/804858320013004/posts/2458872884611531/?comment_id=2461299764368843,https://www.facebook.com/groups/804858320013004/posts/2458872884611531/
2026-04-11T06:52:15.000Z,2461299917702161,,0,Nguyễn Thanh Ngọc,"bạn Bin con nhà tui cũng uống sữa ap new này thấy miễn dịch khỏe, đỡ bệnh vặt mà trí não nhanh nhạy nha",https://www.facebook.com/groups/804858320013004/posts/2458872884611531/?comment_id=2461299917702161,https://www.facebook.com/groups/804858320013004/posts/2458872884611531/
2026-04-11T06:52:23.000Z,2461299997702153,,0,Nguyễn Hảianh,"vị nhạt thanh dễ dùng á em, con c ún dòng sữa ap new này đều đặn nên êm bụng lắm",https://www.facebook.com/groups/804858320013004/posts/2458872884611531/?comment_id=2461299997702153,https://www.facebook.com/groups/804858320013004/posts/2458872884611531/
2026-04-11T06:52:38.000Z,2461300181035468,,0,Trịnh Thu Lan,"nhở uống sữa ap new này Bin nhà tui con khỏe, thông minh hơn nhờ có synbiotic đặc chế giúp tăng đk và hàm lượng dha cao nhé các mẹ",https://www.facebook.com/groups/804858320013004/posts/2458872884611531/?comment_id=2461300181035468,https://www.facebook.com/groups/804858320013004/posts/2458872884611531/
2026-04-11T06:52:50.000Z,2461300271035459,2461300181035468,1,Thành Lê Nam,"Mình ưng sữa ap new vì dễ pha á các mom. Thêm sữa vào nước ấm khoảng 40 độ, khuấy đều, và cho con dùng ngay",https://www.facebook.com/groups/804858320013004/posts/2458872884611531/?comment_id=2461300181035468&reply_comment_id=2461300271035459,https://www.facebook.com/groups/804858320013004/posts/2458872884611531/
2026-04-11T06:52:55.000Z,2461300307702122,,0,Lê Phương Mai,nhưng mà sữa ap new này dễ dùng và dễ pha hông?,https://www.facebook.com/groups/804858320013004/posts/2458872884611531/?comment_id=2461300307702122,https://www.facebook.com/groups/804858320013004/posts/2458872884611531/
2026-04-11T06:53:25.000Z,2461300604368759,,0,Vũ Lê Ngọc Minh,"Từ khi đc dùng sữa ap nz con nhà mình nhanh nhẹn, con khỏe, sáng dạ lắm ạ",https://www.facebook.com/groups/804858320013004/posts/2458872884611531/?comment_id=2461300604368759,https://www.facebook.com/groups/804858320013004/posts/2458872884611531/
2026-04-11T06:53:34.000Z,2461300651035421,,0,Thúy Nga Vũ,"Bé dùng sữa ap new thấy con dạn dĩ trong việc nhận biết các con vật, trộm vía học hỏi nhanh",https://www.facebook.com/groups/804858320013004/posts/2458872884611531/?comment_id=2461300651035421,https://www.facebook.com/groups/804858320013004/posts/2458872884611531/
2026-04-11T06:53:42.000Z,2461300747702078,,0,Thanh Nhàn Cao,bạn Ốc Sên nhà tui đẻ mổ uống sữa Ap New Zealand thấy tv lắm nha,https://www.facebook.com/groups/804858320013004/posts/2458872884611531/?comment_id=2461300747702078,https://www.facebook.com/groups/804858320013004/posts/2458872884611531/
2026-04-11T06:53:48.000Z,2461300874368732,,0,Minh Nga Vũ,"em thấy con dùng sữa ap newzealand hợp, tvia con khỏe, con kháu khỉnh sáng dạ lắm luôn",https://www.facebook.com/groups/804858320013004/posts/2458872884611531/?comment_id=2461300874368732,https://www.facebook.com/groups/804858320013004/posts/2458872884611531/
2026-04-11T06:53:55.000Z,2461300951035391,,0,Hải Minh Vũ,"nhà m chọn sữa ap nz vì bé tiêu hóa ổn, tăng đk tốt, con nhanh nhạy, khả năng ghi nhớ cũng tăng rõ",https://www.facebook.com/groups/804858320013004/posts/2458872884611531/?comment_id=2461300951035391,https://www.facebook.com/groups/804858320013004/posts/2458872884611531/
2026-04-11T06:54:04.000Z,2461301014368718,,0,Đào Phương Mai,mình cho bé Cốm dùng sữa Ap New Zealand do thấy vị sữa nhạt thanh dễ dùng,https://www.facebook.com/groups/804858320013004/posts/2458872884611531/?comment_id=2461301014368718,https://www.facebook.com/groups/804858320013004/posts/2458872884611531/
2026-04-11T06:54:12.000Z,2461301097702043,,0,hải Nguyễn,"Bé chị hợp sữa ap nz, miễn dịch khỏe, tvia đỡ bệnh vặt, hoạt bát và nhanh nhẹn lắm mình ơi",https://www.facebook.com/groups/804858320013004/posts/2458872884611531/?comment_id=2461301097702043,https://www.facebook.com/groups/804858320013004/posts/2458872884611531/
2026-04-11T06:54:23.000Z,2461301221035364,,0,Trung Mỹ Hà Kien,"sữa ap new có vị nhạt thanh, bé nhà tui mê từ lần đầu",https://www.facebook.com/groups/804858320013004/posts/2458872884611531/?comment_id=2461301221035364,https://www.facebook.com/groups/804858320013004/posts/2458872884611531/
2026-04-11T06:54:47.000Z,2461301471035339,,0,Nguyễn Huấn,"Công nhận sữa ap nzl tốt cho trí não, con biết phân biệt màu sắc sớm hơn hẳn các bạn",https://www.facebook.com/groups/804858320013004/posts/2458872884611531/?comment_id=2461301471035339,https://www.facebook.com/groups/804858320013004/posts/2458872884611531/
2026-04-11T06:54:57.000Z,2461301591035327,,0,Đỗ Minh Tiến,"tvia cho dùng sữa ap nz giúp bé khỏe mạnh, hoạt bát, nên học hỏi nhanh nữa",https://www.facebook.com/groups/804858320013004/posts/2458872884611531/?comment_id=2461301591035327,https://www.facebook.com/groups/804858320013004/posts/2458872884611531/
2026-04-11T06:55:04.000Z,2461301691035317,,0,Vi Mai,Cá nhà em uống sữa Ap New Zealand ngày 3 cữ gần năm nay. sữa ap new này công nhận tốt cho bé đẻ mổ lắm,https://www.facebook.com/groups/804858320013004/posts/2458872884611531/?comment_id=2461301691035317,https://www.facebook.com/groups/804858320013004/posts/2458872884611531/
2026-04-11T06:57:18.000Z,2461302931035193,,0,Nguyễn Thu Liên,"Con nhà mình dùng sữa ap nz giúp hoạt bát, mà lại con khỏe nữa các mẹ ạ",https://www.facebook.com/groups/804858320013004/posts/2458872884611531/?comment_id=2461302931035193,https://www.facebook.com/groups/804858320013004/posts/2458872884611531/
2026-04-11T06:57:36.000Z,2461303127701840,,0,Nguyễn Hương Hương,"Dòng sữa ap nzl này vị nhạt thanh , nhóc nhà tui uống được hỗ trợ tăng miễn dịch ít bệnh tốt lắm luôn <3",https://www.facebook.com/groups/804858320013004/posts/2458872884611531/?comment_id=2461303127701840,https://www.facebook.com/groups/804858320013004/posts/2458872884611531/
2026-04-11T06:58:00.000Z,2461303317701821,,0,Đặng Thành Vân Nam,"thấy bạn bè toàn khen sữa ap new này, em thử cho dùng uống và đúng là con khỏe, nhớ lâu cực",https://www.facebook.com/groups/804858320013004/posts/2458872884611531/?comment_id=2461303317701821,https://www.facebook.com/groups/804858320013004/posts/2458872884611531/
2026-04-11T06:58:11.000Z,2461303447701808,,0,Nguyễn Khánh Toàn,"con tui uống sữa ap nz này có synbiotic đặc chế giúp tăng đk, con khỏe nè, sữa ap new này còn có dha cao giúp bé thông minh hơn nha",https://www.facebook.com/groups/804858320013004/posts/2458872884611531/?comment_id=2461303447701808,https://www.facebook.com/groups/804858320013004/posts/2458872884611531/
2026-04-11T06:58:16.000Z,2461303511035135,,0,Lê Thu Hằng,"sữa ap new rất hợp với bé mình, vị nhạt thanh dễ chịu, con hợp tác dùng lắm",https://www.facebook.com/groups/804858320013004/posts/2458872884611531/?comment_id=2461303511035135,https://www.facebook.com/groups/804858320013004/posts/2458872884611531/
2026-04-11T06:58:27.000Z,2461303617701791,2461303511035135,1,Trúc Lam Thân,dòng sữa ap newzealand này này có phải nhập khẩu từ New Zealand không các mum? cho m rv nha,https://www.facebook.com/groups/804858320013004/posts/2458872884611531/?comment_id=2461303511035135&reply_comment_id=2461303617701791,https://www.facebook.com/groups/804858320013004/posts/2458872884611531/
2026-04-11T06:58:36.000Z,2461303691035117,2461303511035135,1,Lê Thu Hằng,"Từ ngày cho con dùng sữa ap nz thấy khỏe khoắn, mà thông minh, dạn dĩ thật nhé các mom, sữa đc nhập khẩu nguyên lon tại new Zealand",https://www.facebook.com/groups/804858320013004/posts/2458872884611531/?comment_id=2461303511035135&reply_comment_id=2461303691035117,https://www.facebook.com/groups/804858320013004/posts/2458872884611531/
2026-04-11T06:58:44.000Z,2461303791035107,,0,Nguyễn Thanh,"Mèo nhà tui dùng sữa ap newzealand thấy con học hỏi nhanh, vừa xem tivi là múa theo y hệt",https://www.facebook.com/groups/804858320013004/posts/2458872884611531/?comment_id=2461303791035107,https://www.facebook.com/groups/804858320013004/posts/2458872884611531/
2026-04-11T06:58:54.000Z,2461303911035095,,0,Vũ Hạnh,"Nhà em cho Bốp dùng sữa ap new này đều đặn nên con khỏe, hoạt bát,nhanh nhẹn hơn đó",https://www.facebook.com/groups/804858320013004/posts/2458872884611531/?comment_id=2461303911035095,https://www.facebook.com/groups/804858320013004/posts/2458872884611531/
2026-04-11T06:59:05.000Z,2461304027701750,,0,Hương Vũ,"mình cho con dùng sữa ap new tốt cho bé đẻ mổ, con thích vị sữa nhạt thanh",https://www.facebook.com/groups/804858320013004/posts/2458872884611531/?comment_id=2461304027701750,https://www.facebook.com/groups/804858320013004/posts/2458872884611531/
2026-04-11T06:59:34.000Z,2461304267701726,,0,Nguyễn THúy,"sữa ap new này DHA cao, hỗ trợ não bộ, con nhớ dai, miễn dịch khỏe, nhìn con nhanh nhạy rõ",https://www.facebook.com/groups/804858320013004/posts/2458872884611531/?comment_id=2461304267701726,https://www.facebook.com/groups/804858320013004/posts/2458872884611531/
2026-04-11T06:59:42.000Z,2461304361035050,,0,Nguyễn Huệ,"con mình dùng sữa ap nz giúp đề kháng tốt, đỡ bệnh vặt,với lại có khả năng ghi nhớ tốt hơn dấy",https://www.facebook.com/groups/804858320013004/posts/2458872884611531/?comment_id=2461304361035050,https://www.facebook.com/groups/804858320013004/posts/2458872884611531/
2026-04-11T06:59:53.000Z,2461304504368369,,0,Nguyễn Nam,sữa ap new tốt cho bé đẻ mổ thật nhen mấy bà. Con t dùng ưng lắm nè,https://www.facebook.com/groups/804858320013004/posts/2458872884611531/?comment_id=2461304504368369,https://www.facebook.com/groups/804858320013004/posts/2458872884611531/
2026-04-11T07:01:48.000Z,2461305654368254,2461304504368369,1,Lê Hải Minh,thấy bảo trẻ sinh mổ uống sữa ap new tốt đúng hem?,https://www.facebook.com/groups/804858320013004/posts/2458872884611531/?comment_id=2461304504368369&reply_comment_id=2461305654368254,https://www.facebook.com/groups/804858320013004/posts/2458872884611531/
2026-04-11T07:01:57.000Z,2461305724368247,2461304504368369,1,Nguyễn Nam,"dòng sữa ap nz này pha nhanh tan đấy, con e dùng sữa ap new này hàng ngày nên khỏe mạnh mà sáng dạ ghê các mẹ ạ, tốt cho trẻ sinh mổ lắm",https://www.facebook.com/groups/804858320013004/posts/2458872884611531/?comment_id=2461304504368369&reply_comment_id=2461305724368247,https://www.facebook.com/groups/804858320013004/posts/2458872884611531/
2026-04-11T07:02:03.000Z,2461305781034908,,0,Mai Thị Lý,con tui uống sữa ap new thấy đi ngoài đều ko bị bón,https://www.facebook.com/groups/804858320013004/posts/2458872884611531/?comment_id=2461305781034908,https://www.facebook.com/groups/804858320013004/posts/2458872884611531/
2026-04-11T07:02:14.000Z,2461305914368228,,0,Anh Hoa Mai,"nhờ bổ sung sữa ap nz này thấy con sáng dạ mà con khỏe, đỡ khò khè nhé các mom",https://www.facebook.com/groups/804858320013004/posts/2458872884611531/?comment_id=2461305914368228,https://www.facebook.com/groups/804858320013004/posts/2458872884611531/
2026-04-11T07:02:27.000Z,2461306061034880,,0,Lê Hà Nguyên,con nhà mình dùng sữa ap new hằng ngày nên con dạo này pt tốt hẳn ăn ngon ngủ ngon,https://www.facebook.com/groups/804858320013004/posts/2458872884611531/?comment_id=2461306061034880,https://www.facebook.com/groups/804858320013004/posts/2458872884611531/
2026-04-11T07:02:33.000Z,2461306147701538,,0,Lê Thu Hằng,"bạn Mèo nhà tui uống sữa ap newzealand này thấy con khỏe, ít khò khè với hoạt bát, thông minh lắm ạ",https://www.facebook.com/groups/804858320013004/posts/2458872884611531/?comment_id=2461306147701538,https://www.facebook.com/groups/804858320013004/posts/2458872884611531/
2026-04-11T07:02:50.000Z,2461306317701521,,0,Thanh Huyền,"con tui dùng sữa ap new này thấy con khỏe, nhanh nhạy,với lại bé tiếp thu nhanh hơn đấy",https://www.facebook.com/groups/804858320013004/posts/2458872884611531/?comment_id=2461306317701521,https://www.facebook.com/groups/804858320013004/posts/2458872884611531/
2026-04-11T07:19:21.000Z,2461315647700588,,0,Đỗ Vân Hậu,"mình thấy sữa ap nz ổn, con đỡ bệnh vặt, tăng miễn dịch, phát triển trí não tốt hẳn mom ơi",https://www.facebook.com/groups/804858320013004/posts/2458872884611531/?comment_id=2461315647700588,https://www.facebook.com/groups/804858320013004/posts/2458872884611531/
2026-04-11T07:19:29.000Z,2461315721033914,2461315647700588,1,Ân Giang Hoàng,"Trộm vía bé dùng sữa ap nz thấy khả năng ghi nhớ tốt, mẹ dặn gì con cũng nhớ kỹ",https://www.facebook.com/groups/804858320013004/posts/2458872884611531/?comment_id=2461315647700588&reply_comment_id=2461315721033914,https://www.facebook.com/groups/804858320013004/posts/2458872884611531/
2026-04-11T07:19:37.000Z,2461315791033907,2461315647700588,1,Đỗ Vân Hậu,"dùng sữa ap nz, khỏe khoắn, tăng đề kháng, tiếp thu nhanh và tư duy tốt đấy, sữa ap new này đúng là tốt thiệt",https://www.facebook.com/groups/804858320013004/posts/2458872884611531/?comment_id=2461315647700588&reply_comment_id=2461315791033907,https://www.facebook.com/groups/804858320013004/posts/2458872884611531/
2026-04-11T07:19:44.000Z,2461315894367230,,0,Minh Đoàn Quang,"sữa ap new này có vị nhạt thanh, bé c hợp tác hú lắm. Con tv êm bụng tiêu hóa tốt nè em",https://www.facebook.com/groups/804858320013004/posts/2458872884611531/?comment_id=2461315894367230,https://www.facebook.com/groups/804858320013004/posts/2458872884611531/
2026-04-11T07:20:00.000Z,2461316064367213,,0,Trung Đàm Quyên,"Nhà mình cho bé dùng sữa ap newzealand tvia đỡ bệnh vặt mà hoạt bát, kháu khỉnh ghê các mẹ ạ",https://www.facebook.com/groups/804858320013004/posts/2458872884611531/?comment_id=2461316064367213,https://www.facebook.com/groups/804858320013004/posts/2458872884611531/
2026-04-11T07:20:13.000Z,2461316181033868,,0,Uyên Vũ Tố,"Hoa Mai sữa ap newzealand tốt nhébà, con t đẻ mổ dùng ổn lắm",https://www.facebook.com/groups/804858320013004/posts/2458872884611531/?comment_id=2461316181033868,https://www.facebook.com/groups/804858320013004/posts/2458872884611531/
2026-04-11T07:20:22.000Z,2461316277700525,,0,Trần Ân Thanh,"Thấy bé uống sữa ap new phản xạ rất tốt, con học hỏi nhanh mọi thứ xung quanh",https://www.facebook.com/groups/804858320013004/posts/2458872884611531/?comment_id=2461316277700525,https://www.facebook.com/groups/804858320013004/posts/2458872884611531/
2026-04-11T07:20:29.000Z,2461316357700517,,0,Chi An Lê,"công nhận con dùng sữa ap nz có dưỡng chất synbiotic đặc chế hỗ trợ đề kháng tốt với sữa ap new này còn có dha cao giúp con nhanh nhẹn, nhanh nhạy nữa",https://www.facebook.com/groups/804858320013004/posts/2458872884611531/?comment_id=2461316357700517,https://www.facebook.com/groups/804858320013004/posts/2458872884611531/
2026-04-11T07:20:45.000Z,2461316571033829,,0,Huỳnh Thảo Vinh,"Nhà em cho bạn Kẹo sinh mổ dùng sữa ap new này giúp tăng miễn dịch, ít bệnh vặt, nhanh nhẹn, dạn dĩ nha",https://www.facebook.com/groups/804858320013004/posts/2458872884611531/?comment_id=2461316571033829,https://www.facebook.com/groups/804858320013004/posts/2458872884611531/
2026-04-11T07:20:51.000Z,2461316621033824,,0,Lan Lâm Hoàng,"Nhờ chịu ti sữa ap newzealand này có synbiotic đặc chế hỗ trợ tăng đk nên khỏe khoắn,ít bệnh vặt mà hoạt bát hơn nhờ có dha cao nha",https://www.facebook.com/groups/804858320013004/posts/2458872884611531/?comment_id=2461316621033824,https://www.facebook.com/groups/804858320013004/posts/2458872884611531/
2026-04-11T07:21:03.000Z,2461316771033809,2461316621033824,1,Duyên Lưu Linh,"M cũng đang cho con theo sữa ap nz, bé con khỏe, nhanh nhẹn và hoạt bát lắm",https://www.facebook.com/groups/804858320013004/posts/2458872884611531/?comment_id=2461316621033824&reply_comment_id=2461316771033809,https://www.facebook.com/groups/804858320013004/posts/2458872884611531/
2026-04-11T07:21:17.000Z,2461316937700459,,0,Lê Thảo Linh,"Công nhận sữa ap newzealand giúp bé tư duy tốt, con biết xếp đồ chơi theo kích cỡ rồi",https://www.facebook.com/groups/804858320013004/posts/2458872884611531/?comment_id=2461316937700459,https://www.facebook.com/groups/804858320013004/posts/2458872884611531/
2026-04-11T07:21:23.000Z,2461316977700455,,0,Dương Tuệ Lâm,"e cho bạn Sóc uống sữa ap newzealand này tăng đề kháng, đỡ bệnh vặt, mà dạn dĩ với kháu khỉnh nè",https://www.facebook.com/groups/804858320013004/posts/2458872884611531/?comment_id=2461316977700455,https://www.facebook.com/groups/804858320013004/posts/2458872884611531/
2026-04-11T07:21:34.000Z,2461317144367105,,0,Đỗ Quỳnh Thương,"bé nhà tui uống sữa ap nz giúp miễn dịch khỏe, ít sụt sịt, lại học hỏi nhanh hơn đó mấy mom",https://www.facebook.com/groups/804858320013004/posts/2458872884611531/?comment_id=2461317144367105,https://www.facebook.com/groups/804858320013004/posts/2458872884611531/
2026-04-11T07:21:58.000Z,2461317417700411,,0,Phương Lâm Thiên,"con uống sữa ap new này trvia con hoạt bát, nhanh nhạy, con khỏe thiệt đấy các mom ạ",https://www.facebook.com/groups/804858320013004/posts/2458872884611531/?comment_id=2461317417700411,https://www.facebook.com/groups/804858320013004/posts/2458872884611531/
2026-04-11T07:22:06.000Z,2461317484367071,,0,Ðường Mai Hải,"từ khi dùng sữa ap nz này đều đặn, tvia khỏe khoắn mà nhanh nhạy hơn nè, nhờ sữa ap new này có synbiotic đặc chế giúp đề kháng tốt và dha cao nha",https://www.facebook.com/groups/804858320013004/posts/2458872884611531/?comment_id=2461317484367071,https://www.facebook.com/groups/804858320013004/posts/2458872884611531/
2026-04-11T07:22:22.000Z,2461317627700390,,0,Thanh Đào Chi,"tui cho con dùng sữa ap newzealand có synbiotic đặc chế giúp tăng đề kháng, ít bệnh vặt mà hoạt bát hơn nhờ có hàm lượng dha cao nè",https://www.facebook.com/groups/804858320013004/posts/2458872884611531/?comment_id=2461317627700390,https://www.facebook.com/groups/804858320013004/posts/2458872884611531/
2026-04-11T07:22:27.000Z,2461317677700385,,0,Trang Thảo Yến,"dùng sữa ap nz giúp con tui đề kháng tốt ít bệnh vặt lại nhanh nhạy, hoạt bát vì sữa ap new này có synbiotic đặc chế giúp tăng đk với có dha cao nhá",https://www.facebook.com/groups/804858320013004/posts/2458872884611531/?comment_id=2461317677700385,https://www.facebook.com/groups/804858320013004/posts/2458872884611531/
2026-04-11T07:22:36.000Z,2461317761033710,,0,Hải Trịnh Phương,"sữa ap new này vị nhạt thanh dễ dùng, con tui kén sữa vậy mà mê lun nhoa",https://www.facebook.com/groups/804858320013004/posts/2458872884611531/?comment_id=2461317761033710,https://www.facebook.com/groups/804858320013004/posts/2458872884611531/
2026-04-11T07:22:44.000Z,2461317837700369,,0,Hà Uyên Lương,"nhờ dùng sữa ap nz bạn Nhím nhà mình con khỏe, sáng dạ, thông minh lắm các mom ạ",https://www.facebook.com/groups/804858320013004/posts/2458872884611531/?comment_id=2461317837700369,https://www.facebook.com/groups/804858320013004/posts/2458872884611531/
2026-04-11T07:22:52.000Z,2461317927700360,,0,Dương Lan Vịnh,"cho sữa ap new vào nước sôi ở 40 độ, lắc đều cho con dùng ngay nè đấy mẹ nó, không lo vón đâu nghen",https://www.facebook.com/groups/804858320013004/posts/2458872884611531/?comment_id=2461317927700360,https://www.facebook.com/groups/804858320013004/posts/2458872884611531/
2026-04-11T07:23:10.000Z,2461318124367007,2461317927700360,1,Dương Lan Vịnh,"con tui dùng sữa ap nz bé miễn dịch khỏe, nên đỡ bệnh vặt mà thấ bé cũng nhanh nhẹn hơn đấy",https://www.facebook.com/groups/804858320013004/posts/2458872884611531/?comment_id=2461317927700360&reply_comment_id=2461318124367007,https://www.facebook.com/groups/804858320013004/posts/2458872884611531/
2026-04-11T07:23:26.000Z,2461318317700321,,0,Lục Bích Quân,"từ khi con tui uống sữa ap nz thấy nhanh nhạy, khỏe mạnh hơn nhiều đó cacs mom ạ",https://www.facebook.com/groups/804858320013004/posts/2458872884611531/?comment_id=2461318317700321,https://www.facebook.com/groups/804858320013004/posts/2458872884611531/
2026-04-11T07:23:41.000Z,2461318464366973,,0,Chu Hải Nam,sữa Ap New Zealand này nhập khẩuđảm bảo quá c nhờ,https://www.facebook.com/groups/804858320013004/posts/2458872884611531/?comment_id=2461318464366973,https://www.facebook.com/groups/804858320013004/posts/2458872884611531/
2026-04-11T07:23:49.000Z,2461318544366965,,0,Trần Phúc Tâm,nhờ bổ sung sữa ap newzealand có synbiotic đặc chế giúp tăng đk con t đỡ bệnh vặt lại có hàm lượng dha cao giúp con kháu khỉnh hơn đấy,https://www.facebook.com/groups/804858320013004/posts/2458872884611531/?comment_id=2461318544366965,https://www.facebook.com/groups/804858320013004/posts/2458872884611531/
2026-04-11T07:23:59.000Z,2461318774366942,,0,La Phương Ngọc,"tui cho con dùng sữa ap newzealand đc 15th rồi trộm vía tháy khỏe khoắn, ít bệnh vặt mà nhanh nhạy hơn nhiều nha",https://www.facebook.com/groups/804858320013004/posts/2458872884611531/?comment_id=2461318774366942,https://www.facebook.com/groups/804858320013004/posts/2458872884611531/
2026-04-11T07:24:24.000Z,2461319047700248,,0,Nguyệt Trịnh Mộng,"Bé Na nhà mình uống sữa ap new hơn tháng, thấy não bộ phát triển, con sáng dạ, nói chuyện hiểu nhanh hơn trước",https://www.facebook.com/groups/804858320013004/posts/2458872884611531/?comment_id=2461319047700248,https://www.facebook.com/groups/804858320013004/posts/2458872884611531/
2026-04-11T07:24:42.000Z,2461319231033563,,0,Lê Hải An,"nhà tui cho con dùng sữa ap nz thấy đề kháng tốt, đỡ bệnh, với lại thông minh nữa đó các mẹ",https://www.facebook.com/groups/804858320013004/posts/2458872884611531/?comment_id=2461319231033563,https://www.facebook.com/groups/804858320013004/posts/2458872884611531/
2026-04-11T07:24:52.000Z,2461319341033552,2461319231033563,1,Huỳnh Thanh Trang,"dòng sữa ap nz này vị nhạt thanh dễ dùng đó, con e uống sữa ap new này thấy khỏe mạnh, đỡ ốm vặt mà kháu khỉnh ghê nha",https://www.facebook.com/groups/804858320013004/posts/2458872884611531/?comment_id=2461319231033563&reply_comment_id=2461319341033552,https://www.facebook.com/groups/804858320013004/posts/2458872884611531/
2026-04-11T07:25:00.000Z,2461319431033543,2461319231033563,1,Lê Hải An,"nhà tui cho Bin con uống sữa ap new này thấy tư duy tốt, con khỏe, mà đỡ bệnh vặt hẳn đó",https://www.facebook.com/groups/804858320013004/posts/2458872884611531/?comment_id=2461319231033563&reply_comment_id=2461319431033543,https://www.facebook.com/groups/804858320013004/posts/2458872884611531/
2026-04-11T07:25:08.000Z,2461319541033532,,0,Phương Lan Bùi,M chọn được sữa tốt như sữa ap newzealand thì còn gì bằng. Sữa thanh dễ dùng quá nè <3,https://www.facebook.com/groups/804858320013004/posts/2458872884611531/?comment_id=2461319541033532,https://www.facebook.com/groups/804858320013004/posts/2458872884611531/
