Date,Comment_ID,Parent_ID,Level,Author,Content,Permalink,Post_URL
2026-04-27T12:55:49.000Z,2475362266295926,,0,Po Ta Ba,T mua sữa m à con t dùng ko.hợp thì t toàn mang tặng chứ ko.pass,https://www.facebook.com/groups/804858320013004/posts/2474572323041587/?comment_id=2475362266295926,https://www.facebook.com/groups/804858320013004/posts/2474572323041587/
2026-05-11T16:16:30.000Z,2487881075044045,,0,mẹ_của_thỏ1,e có lon sữa optimom god vừa bóc sáng nay pha 1 lần con không chịu uống mẹ nào cần e cho nhé,https://www.facebook.com/groups/804858320013004/posts/2474572323041587/?comment_id=2487881075044045,https://www.facebook.com/groups/804858320013004/posts/2474572323041587/
2026-05-30T14:19:08.000Z,2505026633329489,,0,Nguyễn Thủy,"Em cần pass bellamy organic a2 số 1 đã dùng 5 muỗng vừa mua ở Mẹ ơi 1319k date tháng 2/2028 pass giá yêu thương 700k cho nhanh gọn ạ, các mẹ ủn mông cho e pass nhanh e lấy xèng mua lại sữa cũ cho thằng cò nhà e với 😅",https://www.facebook.com/groups/804858320013004/posts/2474572323041587/?comment_id=2505026633329489,https://www.facebook.com/groups/804858320013004/posts/2474572323041587/
2026-05-30T23:03:28.000Z,2505378583294294,,0,Anonymous participant 971,Cho e hỏi chút sau sinh các mom dùng sp nào để trị thâm nách vậy e dùng nhiều loại r mà ko ổn,https://www.facebook.com/groups/804858320013004/posts/2474572323041587/?comment_id=2505378583294294,https://www.facebook.com/groups/804858320013004/posts/2474572323041587/
2026-07-05T11:11:42.000Z,2538236606675158,,0,Kim Yến,Em pass lon này 400k dùng vài lần con không hợp tác. Pass lại vì kinh tế chứ ko phải cứ uống sữa đắt là ko mua pass lại ạ. Ai cần ib em gửi hóa đơn đầy đủ ạ,https://www.facebook.com/groups/804858320013004/posts/2474572323041587/?comment_id=2538236606675158,https://www.facebook.com/groups/804858320013004/posts/2474572323041587/
