Date,Comment_ID,Parent_ID,Level,Author,Content,Permalink,Post_URL
2025-10-18T14:42:10.000Z,798931603134896,,0,Sữa Bỉm Lộc Phát,Lỗi sinh khí,https://www.facebook.com/groups/271915735836488/posts/798928343135222/?comment_id=798931603134896,https://www.facebook.com/groups/271915735836488/posts/798928343135222/
2025-10-18T15:12:21.000Z,798952423132814,,0,Huy Chien,Kiểm tra cách bảo quản . Xem hướng dẫn xem để ở bao nhiêu độ c,https://www.facebook.com/groups/271915735836488/posts/798928343135222/?comment_id=798952423132814,https://www.facebook.com/groups/271915735836488/posts/798928343135222/
2025-10-18T23:49:18.000Z,799243409770382,,0,Hằng Trần,Bình thường mà mom.,https://www.facebook.com/groups/271915735836488/posts/798928343135222/?comment_id=799243409770382,https://www.facebook.com/groups/271915735836488/posts/798928343135222/
2025-10-19T05:05:25.000Z,799441029750620,,0,My Anh Mart,"Sữa hỏng là bình thg có j đâu b, nó khác j b nấu món j đấy mà b bảo quản chưa đúng cách thì nó hỏng nhanh hay lâu thôi, nó có phải là tiên đâu b, đồ khô còn hỏng đc nữa là đồ nước, hỏng b gọi lên cty họ có giải quyết đổi hàng cho b mà",https://www.facebook.com/groups/271915735836488/posts/798928343135222/?comment_id=799441029750620,https://www.facebook.com/groups/271915735836488/posts/798928343135222/
2025-10-24T00:09:43.000Z,803741855987204,,0,Chuc Ly Nguyen,Tự phình to ra là sửa hết hang đó bạn,https://www.facebook.com/groups/271915735836488/posts/798928343135222/?comment_id=803741855987204,https://www.facebook.com/groups/271915735836488/posts/798928343135222/
