Date,Comment_ID,Parent_ID,Level,Author,Content,Permalink,Post_URL
2026-05-12T04:16:24.000Z,27301449389448327,,0,Đào Hiền,cảm thấy k thơm tanh như mùi sắt,https://www.facebook.com/groups/reviewsuacongthuc/posts/27295339030059363/?comment_id=27301449389448327,https://www.facebook.com/groups/reviewsuacongthuc/posts/27295339030059363/
2026-05-12T04:50:23.000Z,27301740116085921,,0,CharmingRhino2387,"Biomil Plus siêu tốt nha mom, là dòng sữa sinh học, mát. Được chế biến ngay trong vòng 24h sau khi thu sữa, đảm bảo độ tươi nguyên nhất của nguyên liệu, với tỉ lệ đạm Whey/Casein là 60/40 giúp trẻ tiêu hóa dễ dàng đó mom. Sp bổ sung sắt và canxi hữu cơ nên nhiều mom sẽ thấy hơi tanh ạ🥰",https://www.facebook.com/groups/reviewsuacongthuc/posts/27295339030059363/?comment_id=27301740116085921,https://www.facebook.com/groups/reviewsuacongthuc/posts/27295339030059363/
2026-05-12T05:55:24.000Z,27302304159362850,27301740116085921,1,Đặng Hoa,CharmingRhino2387 mom đg dùng cho bé con ạ e đg phân vân k pt chọn thay sữa nào cho con lun ý,https://www.facebook.com/groups/reviewsuacongthuc/posts/27295339030059363/?comment_id=27301740116085921&reply_comment_id=27302304159362850,https://www.facebook.com/groups/reviewsuacongthuc/posts/27295339030059363/
2026-05-12T11:17:20.000Z,27305039749089291,27302304159362850,2,CharmingRhino2387,"Đặng Hoa sữa này tốt đó mom, mom có thể tham khảo cho bé nhà mình uống thử ạ😊😊",https://www.facebook.com/groups/reviewsuacongthuc/posts/27295339030059363/?comment_id=27301740116085921&reply_comment_id=27305039749089291,https://www.facebook.com/groups/reviewsuacongthuc/posts/27295339030059363/
2026-05-12T15:22:46.000Z,27307418705518062,27302304159362850,2,Đặng Hoa,CharmingRhino2387 Dạ e cảm ơn mom nha,https://www.facebook.com/groups/reviewsuacongthuc/posts/27295339030059363/?comment_id=27301740116085921&reply_comment_id=27307418705518062,https://www.facebook.com/groups/reviewsuacongthuc/posts/27295339030059363/
2026-05-16T14:48:04.000Z,27361425043450761,,0,Thuỷ Tây,sữa này ok nha,https://www.facebook.com/groups/reviewsuacongthuc/posts/27295339030059363/?comment_id=27361425043450761,https://www.facebook.com/groups/reviewsuacongthuc/posts/27295339030059363/
