Date,Comment_ID,Parent_ID,Level,Author,Content,Permalink,Post_URL
2026-06-28T05:30:42.000Z,1729763205114933,,0,Thu Kiều,"bé mk uống nan a2 thấy tiêu hóa ổn mà đề kháng cũng khỏe, giờ còn bổ sung thêm 1hmo từ 6hmo lên 6hmo nên hỗ trợ đề kháng tốt hơn nè , mình thích cách nestlé liên tục cập nhật những tiến bộ mới trong dinh dưỡng á",https://www.facebook.com/groups/939853694105892/posts/1726441662113754/?comment_id=1729763205114933,https://www.facebook.com/groups/939853694105892/posts/1726441662113754/
2026-06-28T05:30:54.000Z,1729763351781585,1729763205114933,1,Thu Kiều,"bé khỏe bụg cứng cáp lắm, sữa của nhà nestle chất lượng đảm bảo nghen",https://www.facebook.com/groups/939853694105892/posts/1726441662113754/?comment_id=1729763205114933&reply_comment_id=1729763351781585,https://www.facebook.com/groups/939853694105892/posts/1726441662113754/
2026-06-28T06:51:02.000Z,1729816761776244,,0,Thanh Trà Lê,"rv cho mẹ nan cam nhé, bé mk uống thấy tiêu hóa ổn, đề kháng khỏe, nay sữa còn cải tiến từ 6hmo lên 6hmo đấy nhé, nan a2 có nhiều điểm khiến mình cảm thấy yên tâm đó nha",https://www.facebook.com/groups/939853694105892/posts/1726441662113754/?comment_id=1729816761776244,https://www.facebook.com/groups/939853694105892/posts/1726441662113754/
2026-06-28T06:51:11.000Z,1729816865109567,1729816761776244,1,Thanh Hương,"Thanh Trà Lê dùng nan này bé tiêu tốt, dung nạp đều nhờ bổ sung lợi khuẩn kép b infantis & b. lactics nè",https://www.facebook.com/groups/939853694105892/posts/1726441662113754/?comment_id=1729816761776244&reply_comment_id=1729816865109567,https://www.facebook.com/groups/939853694105892/posts/1726441662113754/
2026-06-28T06:51:16.000Z,1729816918442895,1729816761776244,1,Thanh Trà Lê,"cũng có đề kháng tốt hơn hẳn do có tận 6hmo đó,sữa tốt cho tiêu hoá & đề kháng là nền tảng vững chắc giúp bé phát triển toàn diện nhen mẹ ơi nan này của thương hiệu nestle hơn 155 năm",https://www.facebook.com/groups/939853694105892/posts/1726441662113754/?comment_id=1729816761776244&reply_comment_id=1729816918442895,https://www.facebook.com/groups/939853694105892/posts/1726441662113754/
2026-06-28T07:59:02.000Z,1729886475102606,,0,Ánh Bùi Trâm,"mẹ bỉm chọn cho con dòng sữa mát nan a2 thụy sĩ đi nè bé tớ ti đi ngoài đều đặn, mình khá thiện cảm với nan a2 vì có nguồn gốc từ thụy sĩ á",https://www.facebook.com/groups/939853694105892/posts/1726441662113754/?comment_id=1729886475102606,https://www.facebook.com/groups/939853694105892/posts/1726441662113754/
2026-06-28T07:59:14.000Z,1729886608435926,1729886475102606,1,Nhi Tâm,"phân khéo là do hệ tiêu hóa của con khỏe đó, nhờ tp đạm a2 giúp con tiêu hóa tốt",https://www.facebook.com/groups/939853694105892/posts/1726441662113754/?comment_id=1729886475102606&reply_comment_id=1729886608435926,https://www.facebook.com/groups/939853694105892/posts/1726441662113754/
2026-06-28T07:59:22.000Z,1729886688435918,1729886475102606,1,Ánh Bùi Trâm,"vị sữa nan thì chưa thấy con chê luôn, đi làm để nhà cho bà chăm mà sữa dễ tan dễ pha nên bà cũng nhàn ,sữa tốt cho tiêu hoá với đề kháng thì đây là nền tảng cho bé pt toàn diện đó ạ",https://www.facebook.com/groups/939853694105892/posts/1726441662113754/?comment_id=1729886475102606&reply_comment_id=1729886688435918,https://www.facebook.com/groups/939853694105892/posts/1726441662113754/
2026-06-28T07:59:25.000Z,1729886741769246,1729886475102606,1,Nhi Tâm,"đúng á mk thấy con khỏe mạnh, lại ham chơi, nên con bé hân nhà tớ cũng lên",https://www.facebook.com/groups/939853694105892/posts/1726441662113754/?comment_id=1729886475102606&reply_comment_id=1729886741769246,https://www.facebook.com/groups/939853694105892/posts/1726441662113754/
