Date,Comment_ID,Parent_ID,Level,Author,Content,Permalink,Post_URL
2026-06-28T02:56:46.000Z,1729656161792304,,0,Đức Lương,"dòng nan cam cứ yên tâm dùng đi mom, bé uống tiêu êm khỏe mạnh lắm, nay sữa lại tăg từ 6hmo lên 6hmo nên hỗ trợ đề kháng bé tốt hơn đó nhen mẹ ơi , điều mình ấn tượng là nestlé vẫn không ngừng cập nhật các nghiên cứu mới nha",https://www.facebook.com/groups/939853694105892/posts/1726435528781034/?comment_id=1729656161792304,https://www.facebook.com/groups/939853694105892/posts/1726435528781034/
2026-06-28T02:56:52.000Z,1729656225125631,1729656161792304,1,Phương Lê,"bé uống sữa này cũng khỏe bụng hơn nhiều, vì có bổ sung lợi khuẩn kép b infantis & b. lactics giúp tiêu hóa êm và hấp thu đều nhé",https://www.facebook.com/groups/939853694105892/posts/1726435528781034/?comment_id=1729656161792304&reply_comment_id=1729656225125631,https://www.facebook.com/groups/939853694105892/posts/1726435528781034/
2026-06-28T02:56:56.000Z,1729656255125628,1729656161792304,1,Đức Lương,"sữa cao cấp của nhà nestle đúng là chất lượng khỏi bàn luôn mom nhé ,mấy sữa tốt cho tiêu hóa vs đề kháng ht cho con pt toàn diện tốt hơn đấy ạ💪 sự lựa chọn an tâm với hơn 155 năm kinh nghiệm nè mẹ ơi",https://www.facebook.com/groups/939853694105892/posts/1726435528781034/?comment_id=1729656161792304&reply_comment_id=1729656255125628,https://www.facebook.com/groups/939853694105892/posts/1726435528781034/
2026-06-28T02:56:59.000Z,1729656291792291,1729656161792304,1,Phương Lê,"mk ưng í với thành phần 6hmo có trong nan giúp con đỡ ốm vặt linh tinh nên con bé nay khỏe, cứng cáp hơn nè",https://www.facebook.com/groups/939853694105892/posts/1726435528781034/?comment_id=1729656161792304&reply_comment_id=1729656291792291,https://www.facebook.com/groups/939853694105892/posts/1726435528781034/
2026-06-28T02:57:09.000Z,1729656405125613,,0,Danh Thành,"em cũng đang cho bé dùg nan a2, thấy con khỏe hơn cứng cáp hơn, nay cải tiến từ 6hmo lên 6hmo tốt cho đề kháng lắm nhé, cảm giác thương hiệu đang cố gắng tạo sự an tâm cho người dùng á",https://www.facebook.com/groups/939853694105892/posts/1726435528781034/?comment_id=1729656405125613,https://www.facebook.com/groups/939853694105892/posts/1726435528781034/
2026-06-28T02:57:18.000Z,1729656508458936,1729656405125613,1,Hà Thanh,dòng này đúng là tốt cho tiêu hóa hơn nữa do sữa bổ sung lợi khuẩn kép b infantis & b. lactics nghen,https://www.facebook.com/groups/939853694105892/posts/1726435528781034/?comment_id=1729656405125613&reply_comment_id=1729656508458936,https://www.facebook.com/groups/939853694105892/posts/1726435528781034/
2026-06-28T02:57:22.000Z,1729656528458934,1729656405125613,1,Danh Thành,có tận 6hmo nên con khỏe đề kháng trvia cứng cáp lắm nè nghen,https://www.facebook.com/groups/939853694105892/posts/1726435528781034/?comment_id=1729656405125613&reply_comment_id=1729656528458934,https://www.facebook.com/groups/939853694105892/posts/1726435528781034/
2026-06-28T02:57:24.000Z,1729656565125597,1729656405125613,1,Hà Thanh,"e bé xinh nhà mk trộm vía tháng này con tăng cân được hẳn 8 lạng, đi ngoài dễ dàng giảm tình trạng vón cục nè",https://www.facebook.com/groups/939853694105892/posts/1726435528781034/?comment_id=1729656405125613&reply_comment_id=1729656565125597,https://www.facebook.com/groups/939853694105892/posts/1726435528781034/
2026-06-28T02:57:27.000Z,1729656588458928,1729656405125613,1,Danh Thành,ngoài ra nan a2 còn có cả 6hmo giúp con miễn dịch khỏe hơn đó,https://www.facebook.com/groups/939853694105892/posts/1726435528781034/?comment_id=1729656405125613&reply_comment_id=1729656588458928,https://www.facebook.com/groups/939853694105892/posts/1726435528781034/
2026-06-28T02:57:53.000Z,1729656811792239,,0,Thu Huệ,"từ hồi con ún nan a2 thụy sĩ thấy con khỏe hơn, ít ốm vặt, nay mẫu mới cải tiến từ 5hmo lên 6hmo càng hỗ trợ tốt hơn nữa, mình khá thích những sản phẩm có nền tảng khoa học rõ ràng nè",https://www.facebook.com/groups/939853694105892/posts/1726435528781034/?comment_id=1729656811792239,https://www.facebook.com/groups/939853694105892/posts/1726435528781034/
2026-06-28T02:57:59.000Z,1729656855125568,1729656811792239,1,Phan Thu Huyền,dùng nan này bụng dạ cũng êm hơn do sữa có lợi khuẩn kép b infantis vs b lactics htr,https://www.facebook.com/groups/939853694105892/posts/1726435528781034/?comment_id=1729656811792239&reply_comment_id=1729656855125568,https://www.facebook.com/groups/939853694105892/posts/1726435528781034/
2026-06-28T02:58:04.000Z,1729656915125562,1729656811792239,1,Thu Huệ,"vâng, nan này đến từ hãng sữa nestle chất lượng khỏi cần lo nghĩ",https://www.facebook.com/groups/939853694105892/posts/1726435528781034/?comment_id=1729656811792239&reply_comment_id=1729656915125562,https://www.facebook.com/groups/939853694105892/posts/1726435528781034/
2026-06-28T02:59:15.000Z,1729657651792155,,0,Hồ Binh,"mom tham khảo nan a2 nha, con ún khỏe đề kháng, nay còn bổ sung thêm hmo 3fl hỗ trợ tăng đề kháng lên 6hmo đấy, nan a2 được phát triển từ nền tảng khoa học của nestlé nên mình thấy đáng tin nha",https://www.facebook.com/groups/939853694105892/posts/1726435528781034/?comment_id=1729657651792155,https://www.facebook.com/groups/939853694105892/posts/1726435528781034/
2026-06-28T02:59:21.000Z,1729657701792150,1729657651792155,1,Hoa Tùng,dòng này xài bé êm bụng do có bs cả lợi khuẩn kép b infantis vs b lactics nữa💪,https://www.facebook.com/groups/939853694105892/posts/1726435528781034/?comment_id=1729657651792155&reply_comment_id=1729657701792150,https://www.facebook.com/groups/939853694105892/posts/1726435528781034/
2026-06-28T02:59:31.000Z,1729657771792143,1729657651792155,1,Hồ Binh,"vâng. dùng nan này bé khỏe bụng cứng cáp mà, sữa có tận 6hmo cơ",https://www.facebook.com/groups/939853694105892/posts/1726435528781034/?comment_id=1729657651792155&reply_comment_id=1729657771792143,https://www.facebook.com/groups/939853694105892/posts/1726435528781034/
2026-06-28T02:59:45.000Z,1729657895125464,,0,Hoàng Hải Hà,"xài nan a2 thụy sĩ con ít ốm vặt hẳn, nay cải tiến từ 5hmo lên 6hmo hỗ trợ đề kháng tốt hơn nữa đó, cảm giác thương hiệu này luôn cố gắng làm tốt hơn mỗi ngày nè",https://www.facebook.com/groups/939853694105892/posts/1726435528781034/?comment_id=1729657895125464,https://www.facebook.com/groups/939853694105892/posts/1726435528781034/
2026-06-28T02:59:54.000Z,1729658005125453,1729657895125464,1,Vy Trà,dòng này có lợi khuẩn kép b infantis vs b lactics tăng cường khả năng htro tiêu hóa đề kháng khỏe hơn,https://www.facebook.com/groups/939853694105892/posts/1726435528781034/?comment_id=1729657895125464&reply_comment_id=1729658005125453,https://www.facebook.com/groups/939853694105892/posts/1726435528781034/
2026-06-28T03:00:07.000Z,1729658128458774,,0,Ánh Trâm,"cho bé dùng nan a2 thụy sĩ nha, dòng này giúp hệ tiêu hóa khỏe mạnh, hạn chế ốm vặt, sữa chất lượng đáng để chọn lắm mom nghen nè, nestlé có lịch sử nghiên cứu lâu năm nên mình khá yên tâm nha",https://www.facebook.com/groups/939853694105892/posts/1726435528781034/?comment_id=1729658128458774,https://www.facebook.com/groups/939853694105892/posts/1726435528781034/
2026-06-28T03:00:17.000Z,1729658225125431,1729658128458774,1,Ánh Trâm,"ừ t thấy hợp lý nè, sữa nước với nền tảng sữa a2 thuần khiết và hmo kế thừa từ nhà nan nên tạo cảm giác khá liền mạch mạch",https://www.facebook.com/groups/939853694105892/posts/1726435528781034/?comment_id=1729658128458774&reply_comment_id=1729658225125431,https://www.facebook.com/groups/939853694105892/posts/1726435528781034/
2026-06-28T03:00:39.000Z,1729658435125410,,0,Tiến Tân,"bé nhà mìh cũng đang dùng nan cam, thấy con bụng khỏe, tiêu hóa ổn, mà ít bị bệnh vặt hẳn đó mẹ💪, nan a2 nhập khẩu từ thụy sĩ nên mình có cảm giác khá yên tâm nè",https://www.facebook.com/groups/939853694105892/posts/1726435528781034/?comment_id=1729658435125410,https://www.facebook.com/groups/939853694105892/posts/1726435528781034/
2026-06-28T03:00:44.000Z,1729658501792070,1729658435125410,1,Thân Nguyễn,"có giai đoạn bé chỉ ăn khi đúng món thích, đổi món là từ chối ngay nên phải điều chỉnh dần dần. nan a2 với sữa nước a2 vẫn giữ đều đặn đặn",https://www.facebook.com/groups/939853694105892/posts/1726435528781034/?comment_id=1729658435125410&reply_comment_id=1729658501792070,https://www.facebook.com/groups/939853694105892/posts/1726435528781034/
2026-06-28T03:00:47.000Z,1729658541792066,1729658435125410,1,Tiến Tân,"cái này quen luôn, sữa nước được phát triển trên nền tảng a2 và hmo kế thừa từ nhà nan nên thấy khá yên tâm tin tưởng tưởng",https://www.facebook.com/groups/939853694105892/posts/1726435528781034/?comment_id=1729658435125410&reply_comment_id=1729658541792066,https://www.facebook.com/groups/939853694105892/posts/1726435528781034/
2026-06-28T03:00:50.000Z,1729658625125391,1729658435125410,1,Thân Nguyễn,"nhìn tổng thể con khỏe, phát triển thể chất ổn định đẹp mắt mắt 😄, shopee mall nestlé đúng là chân ái nè, vừa tiện vừa được nhiều ưu đãi nha",https://www.facebook.com/groups/939853694105892/posts/1726435528781034/?comment_id=1729658435125410&reply_comment_id=1729658625125391,https://www.facebook.com/groups/939853694105892/posts/1726435528781034/
