Date,Comment_ID,Parent_ID,Level,Author,Content,Permalink,Post_URL
2026-06-28T05:29:46.000Z,1729762518448335,,0,Thu Kiều,"từ khi con được 2 tuần mk bị tắc tia sữa nên cho bé dùng nan a2 thụy sĩ tới giờ, thấy con ít ốm vặt mà nay còn cải tiến từ 6hmo lên đến 6hmo nè👍 , mình thấy xuất xứ của nan a2 là một trong những yếu tố đáng quan tâm nha",https://www.facebook.com/groups/939853694105892/posts/1726441182113802/?comment_id=1729762518448335,https://www.facebook.com/groups/939853694105892/posts/1726441182113802/
2026-06-28T05:30:00.000Z,1729762665114987,1729762518448335,1,Thu Kiều,đề kháng cũng khỏe hẳn nhờ có tận đủ 6hmo đó mẹ ơi,https://www.facebook.com/groups/939853694105892/posts/1726441182113802/?comment_id=1729762518448335&reply_comment_id=1729762665114987,https://www.facebook.com/groups/939853694105892/posts/1726441182113802/
2026-06-28T06:50:42.000Z,1729816501776270,,0,Thanh Trà Lê,"mình đang cho bé ún nan a2 từ thụy sĩ, thấy con khỏe hẳn ra, giờ còn cải tiến từ 5hmo lên 6hmo nên đề kháng lại tốt hơn nữa👶, cảm giác sữa được kiểm soát nghiêm ngặt nên mình an tâm hơn",https://www.facebook.com/groups/939853694105892/posts/1726441182113802/?comment_id=1729816501776270,https://www.facebook.com/groups/939853694105892/posts/1726441182113802/
2026-06-28T06:50:49.000Z,1729816581776262,1729816501776270,1,Thanh Hương,"Thanh Trà Lê sưa cao cấp nhà nestle đúng là chất lượng lắm, bé cứng cáp khỏe bụng",https://www.facebook.com/groups/939853694105892/posts/1726441182113802/?comment_id=1729816501776270&reply_comment_id=1729816581776262,https://www.facebook.com/groups/939853694105892/posts/1726441182113802/
2026-06-28T06:50:54.000Z,1729816651776255,1729816501776270,1,Thanh Trà Lê,bụng con khỏe là do có lợi khuẩn kép b infantis vs b lactics htr tiêu hóa,https://www.facebook.com/groups/939853694105892/posts/1726441182113802/?comment_id=1729816501776270&reply_comment_id=1729816651776255,https://www.facebook.com/groups/939853694105892/posts/1726441182113802/
2026-06-28T07:58:39.000Z,1729886218435965,,0,Nhi Tâm,"bé mình ún nan cam bụng khoẻ, tiêu đều, đề kháng tốt, ít ốm vặt, mẹ tham khảo thêm nhé, nan a2 nhập khẩu từ thụy sĩ nên tạo cảm giác tin cậy hơn á",https://www.facebook.com/groups/939853694105892/posts/1726441182113802/?comment_id=1729886218435965,https://www.facebook.com/groups/939853694105892/posts/1726441182113802/
2026-06-28T07:58:45.000Z,1729886275102626,1729886218435965,1,Ánh Bùi Trâm,"Nhi Tâmnan a2 nhà mình hợp nên giữ lâu dài, còn sữa nước a2 thì tiện lắm, lúc nào cần là có liền, nhất là khi đi ra ra ngoài",https://www.facebook.com/groups/939853694105892/posts/1726441182113802/?comment_id=1729886218435965&reply_comment_id=1729886275102626,https://www.facebook.com/groups/939853694105892/posts/1726441182113802/
2026-06-28T07:58:49.000Z,1729886321769288,1729886218435965,1,Nhi Tâm,"ừ đúng rồi mom, sữa nước với nền tảng a2 và hmo kế thừa từ nhà nan nên dùng song song thấy khá ổn áp áp",https://www.facebook.com/groups/939853694105892/posts/1726441182113802/?comment_id=1729886218435965&reply_comment_id=1729886321769288,https://www.facebook.com/groups/939853694105892/posts/1726441182113802/
2026-06-28T07:58:53.000Z,1729886381769282,1729886218435965,1,Ánh Bùi Trâm,nhìn con khỏe với năng động hơn rõ luôn á mình ơi thật 🥰,https://www.facebook.com/groups/939853694105892/posts/1726441182113802/?comment_id=1729886218435965&reply_comment_id=1729886381769282,https://www.facebook.com/groups/939853694105892/posts/1726441182113802/
