Date,Comment_ID,Parent_ID,Level,Author,Content,Permalink,Post_URL
2026-06-28T01:22:48.000Z,1729590358465551,,0,Nguyễn Thọ,"nên chọn nan a2 giống mk nè, con khỏe từ trong ra ngoài nha mom, nay sữa tăng lượng hmo lên 6hmo giúp đề kháng bé khỏe hơn nhiều nè , thuỵ sĩ là quốc gia mình luôn tin về chất lượng sản phẩm",https://www.facebook.com/groups/939853694105892/posts/1726433362114584/?comment_id=1729590358465551,https://www.facebook.com/groups/939853694105892/posts/1726433362114584/
2026-06-28T01:22:58.000Z,1729590445132209,1729590358465551,1,Nguyễn Thọ,bé nhà em uống thấy đề kháng ổn mà tiêu hóa cũng khỏe hơn do sữa có bổ sung lợi khuẩn kép b infantis & b. lactics đó nha nè,https://www.facebook.com/groups/939853694105892/posts/1726433362114584/?comment_id=1729590358465551&reply_comment_id=1729590445132209,https://www.facebook.com/groups/939853694105892/posts/1726433362114584/
2026-06-28T01:23:11.000Z,1729590585132195,,0,Hạ Đan,"em cho con uống sữa nan cam thấy con bụng êm, ít ốm vặt khi giao mùa đó, nay sữa còn dc nâng từ 6hmo lên 6hmo nữa chứ đó, mình thích cách nestlé liên tục cải tiến sản phẩm đó nha",https://www.facebook.com/groups/939853694105892/posts/1726433362114584/?comment_id=1729590585132195,https://www.facebook.com/groups/939853694105892/posts/1726433362114584/
2026-06-28T01:23:17.000Z,1729590655132188,1729590585132195,1,Thu Huệ,bé hấp thu tốt hơn do sữa này có bs lợi khuẩn kép b infantis & b. lactics nữa nè,https://www.facebook.com/groups/939853694105892/posts/1726433362114584/?comment_id=1729590585132195&reply_comment_id=1729590655132188,https://www.facebook.com/groups/939853694105892/posts/1726433362114584/
2026-06-28T01:23:20.000Z,1729590688465518,1729590585132195,1,Hạ Đan,đúng là có 6hmo nên giúp bé khỏe đề kháng hơn hẳn đó mom,https://www.facebook.com/groups/939853694105892/posts/1726433362114584/?comment_id=1729590585132195&reply_comment_id=1729590688465518,https://www.facebook.com/groups/939853694105892/posts/1726433362114584/
2026-06-28T01:23:22.000Z,1729590728465514,1729590585132195,1,Thu Huệ,con ti nan cam vừa tăng cân tốt lại ko có lo con bị bón đâu nha🤔,https://www.facebook.com/groups/939853694105892/posts/1726433362114584/?comment_id=1729590585132195&reply_comment_id=1729590728465514,https://www.facebook.com/groups/939853694105892/posts/1726433362114584/
2026-06-28T01:23:24.000Z,1729590751798845,1729590585132195,1,Hạ Đan,"e dùng thấy con cũng tiêu êm nữa đấy, sưa có lợi khuẩn kép b infantis vs b lactics htro",https://www.facebook.com/groups/939853694105892/posts/1726433362114584/?comment_id=1729590585132195&reply_comment_id=1729590751798845,https://www.facebook.com/groups/939853694105892/posts/1726433362114584/
2026-06-28T01:23:26.000Z,1729590778465509,1729590585132195,1,Thu Huệ,"cùng 6hmo nên con đề khág tốt mẹ chăm nhàn lắm đó,mấy sữa tốt cho tiêu hóa & đề kháng thì ht con pt toàn diện tốt hơn nha💪",https://www.facebook.com/groups/939853694105892/posts/1726433362114584/?comment_id=1729590585132195&reply_comment_id=1729590778465509,https://www.facebook.com/groups/939853694105892/posts/1726433362114584/
2026-06-28T01:23:34.000Z,1729590835132170,,0,Trần Linh Nhi,"bé mình cũng dùng nan a2 thụy sĩ từ lâu con khỏe mạnh lắm nha, nay có thêm 6hmo tốt cho đề kháng hơn nữa nhá, nestlé là tập đoàn lớn nên mình tin là quy trình sản xuất sữa sẽ được kiểm soát chặt chẽ hơn",https://www.facebook.com/groups/939853694105892/posts/1726433362114584/?comment_id=1729590835132170,https://www.facebook.com/groups/939853694105892/posts/1726433362114584/
2026-06-28T01:23:43.000Z,1729590991798821,1729590835132170,1,Trần Linh Nhi,sữa dc nhà nestle nhập từ thụy sĩ về chất lượng lắm đó,https://www.facebook.com/groups/939853694105892/posts/1726433362114584/?comment_id=1729590835132170&reply_comment_id=1729590991798821,https://www.facebook.com/groups/939853694105892/posts/1726433362114584/
2026-06-28T01:23:52.000Z,1729591025132151,,0,Hồ Hồng Thắm,"thử mua nan a2 cho con ún, thấy Na giảm ốm vặt hơn trước, sữa này mới ra công thưc cải tiến 5hmo lên 6hmo giúp đề kháng bé tốt đó, mình thấy nan a2 được đầu tư khá bài bản từ phía nestlé á",https://www.facebook.com/groups/939853694105892/posts/1726433362114584/?comment_id=1729591025132151,https://www.facebook.com/groups/939853694105892/posts/1726433362114584/
2026-06-28T01:24:10.000Z,1729591211798799,1729591025132151,1,Yến Nhi,ún sữa này thấy con tiêu hóa tốt hơn khi sữa cải tiến bsung thêm lợi khuẩn chuyên biệt b.infantis & 1hmo 3fl đấy,https://www.facebook.com/groups/939853694105892/posts/1726433362114584/?comment_id=1729591025132151&reply_comment_id=1729591211798799,https://www.facebook.com/groups/939853694105892/posts/1726433362114584/
2026-06-28T01:24:12.000Z,1729591221798798,1729591025132151,1,Hồ Hồng Thắm,"bởi m tin dùng hơn cho con để có hệ tiêu hóa, đkhang tốt đó mom, với chọn sữa nestle đảm bảo uy tín nhá",https://www.facebook.com/groups/939853694105892/posts/1726433362114584/?comment_id=1729591025132151&reply_comment_id=1729591221798798,https://www.facebook.com/groups/939853694105892/posts/1726433362114584/
2026-06-28T01:24:24.000Z,1729591325132121,,0,Minh Lý,"em tin và chọn nan a2 cho con ti lâu nay nè mom, con tiêu hoá nhanh, hấp thu tốt nha, nay sữa còn được cải tiến lên tận 6hmo giúp con tăng đề kháng khoẻ, con cứng cáp và ít ốm hơn, điều mình ấn tượng là nestlé vẫn không ngừng cập nhật các nghiên cứu mới nha",https://www.facebook.com/groups/939853694105892/posts/1726433362114584/?comment_id=1729591325132121,https://www.facebook.com/groups/939853694105892/posts/1726433362114584/
2026-06-28T01:24:31.000Z,1729591405132113,,0,Hạ Thị Dương,"dùng nan a2 thụy sĩgiúp con tiêu hóa ổn, hấp thu tốt, cứng cáp hơn nhờ đạm a2, 6hmo và lợi khuẩn kép b infantis & b lactis hỗ trợ nha mẹ, mình có xu hướng tin tưởng các sản phẩm được nghiên cứu lâu dài hơn nè",https://www.facebook.com/groups/939853694105892/posts/1726433362114584/?comment_id=1729591405132113,https://www.facebook.com/groups/939853694105892/posts/1726433362114584/
2026-06-28T01:24:38.000Z,1729591478465439,1729591405132113,1,Bảo Châu,"nhà mình có những hôm bé chỉ thích ăn đúng một vài món quen, đổi món là từ chối ngay. hiện tại vẫn duy trì nan a2 cùng sữa nước a2 đều đặn đặn",https://www.facebook.com/groups/939853694105892/posts/1726433362114584/?comment_id=1729591405132113&reply_comment_id=1729591478465439,https://www.facebook.com/groups/939853694105892/posts/1726433362114584/
2026-06-28T01:24:40.000Z,1729591505132103,1729591405132113,1,Hạ Thị Dương,"mình cũng chọn vì điểm này nè, sữa nước được phát triển trên nền tảng sữa a2 thuần khiết và hmo kế thừa từ chính nhà nan nên khá yên tâm",https://www.facebook.com/groups/939853694105892/posts/1726433362114584/?comment_id=1729591405132113&reply_comment_id=1729591505132103,https://www.facebook.com/groups/939853694105892/posts/1726433362114584/
2026-06-28T01:24:42.000Z,1729591528465434,1729591405132113,1,Bảo Châu,"trộm vía con phát triển thể chất đều, nhìn người gọn và chắc hơn ngày xưa xưa 😄",https://www.facebook.com/groups/939853694105892/posts/1726433362114584/?comment_id=1729591405132113&reply_comment_id=1729591528465434,https://www.facebook.com/groups/939853694105892/posts/1726433362114584/
2026-06-28T03:56:40.000Z,1729704295120824,,0,Tráng Đoàn Công,"💕 em xin chào các mom ạ 💕 ☀️ e up Mã Giảm giá, deal sữa & bỉm rẻ giá hời Shopee mỗi ngày. ☀️ em có con nhỏ cũng biết nuôi con bỉm , sữa rất tốn kém ... ☀️ Tham khảo nhóm để mua sắm tiết kiệm cho mình hơn mỗi ngày nhé ạ 💖",https://www.facebook.com/groups/939853694105892/posts/1726433362114584/?comment_id=1729704295120824,https://www.facebook.com/groups/939853694105892/posts/1726433362114584/
