Date,Comment_ID,Parent_ID,Level,Author,Content,Permalink,Post_URL
2026-06-29T05:49:34.000Z,1730663061691614,,0,Ba Quang Huy,"công nhận nan cam giúp đề kháng bé tốt hơn hẳn, nay còn cải tiến từ 6hmo lên 6hmo nữa đấy nhé , thấy nestlé âm thầm cải thiện chất lượng sản phẩm rất đáng ghi nhận á",https://www.facebook.com/groups/939853694105892/posts/1730635441694376/?comment_id=1730663061691614,https://www.facebook.com/groups/939853694105892/posts/1730635441694376/
2026-06-29T05:49:41.000Z,1730663251691595,1730663061691614,1,Minh Dương,"vâng, có tận 6hmo nên hỗ trợ đề kháng khỏe rõ luôn đó mom ơi ,sữa tốt cho tiêu hoá vs đề kháng, chính là nền tảng vững chắc giúp bé phát triển toàn diện đó mom ơi",https://www.facebook.com/groups/939853694105892/posts/1730635441694376/?comment_id=1730663061691614&reply_comment_id=1730663251691595,https://www.facebook.com/groups/939853694105892/posts/1730635441694376/
2026-06-29T05:49:47.000Z,1730663335024920,1730663061691614,1,Ba Quang Huy,tiêu hóa cũng ổn định hơn nhờ sữa bổ sung lợi khuẩn kép b infantis & b. lactics nữa mẹ ơi,https://www.facebook.com/groups/939853694105892/posts/1730635441694376/?comment_id=1730663061691614&reply_comment_id=1730663335024920,https://www.facebook.com/groups/939853694105892/posts/1730635441694376/
2026-06-29T05:49:52.000Z,1730663365024917,1730663061691614,1,Minh Dương,cho con ti thấy con khỏe bụng khỏe người pt tốt lắm mom nhé,https://www.facebook.com/groups/939853694105892/posts/1730635441694376/?comment_id=1730663061691614&reply_comment_id=1730663365024917,https://www.facebook.com/groups/939853694105892/posts/1730635441694376/
2026-06-29T05:50:03.000Z,1730663491691571,,0,Nguyen Minh,"bún nhà em con ti nan a2 thấy con tiêu hoá khoẻ, con hấp thu tốt và sữa có công thức cải tiến từ 6hmo lên 6hmo giúp con tăng thêm dưỡng chất htr con đề kháng khoẻ nha, mẹ nên thử đi nè, nan a2 có nhiều điểm khiến mình cảm thấy yên tâm đó nha",https://www.facebook.com/groups/939853694105892/posts/1730635441694376/?comment_id=1730663491691571,https://www.facebook.com/groups/939853694105892/posts/1730635441694376/
2026-06-29T05:50:12.000Z,1730663548358232,1730663491691571,1,Jasmin Vũ,"công nhận nha, sữa uy tín và chất lượng lắm nha sauwx là dòng sữa chĩnh hãng nhà nestle và có thương hiệu tới 155 năm mẹ an tâm cho con ti đi nghen nè",https://www.facebook.com/groups/939853694105892/posts/1730635441694376/?comment_id=1730663491691571&reply_comment_id=1730663548358232,https://www.facebook.com/groups/939853694105892/posts/1730635441694376/
2026-06-29T05:50:18.000Z,1730663611691559,1730663491691571,1,Nguyen Minh,"sữa có bổ sung lọi khuẩn chuyên biệt b infantis với 1hmo 3fl giúp con tiêu hoá ổn áp, con hấp thu và khoẻ miễn dịch nhé",https://www.facebook.com/groups/939853694105892/posts/1730635441694376/?comment_id=1730663491691571&reply_comment_id=1730663611691559,https://www.facebook.com/groups/939853694105892/posts/1730635441694376/
2026-06-29T05:50:23.000Z,1730663661691554,1730663491691571,1,Jasmin Vũ,"con chịu sữa là do sữa này dễ ti nè, sữa nhạt thanh con thích nè❤️",https://www.facebook.com/groups/939853694105892/posts/1730635441694376/?comment_id=1730663491691571&reply_comment_id=1730663661691554,https://www.facebook.com/groups/939853694105892/posts/1730635441694376/
2026-06-29T05:50:27.000Z,1730663708358216,1730663491691571,1,Nguyen Minh,"ưm, đạm này tương tự đạm trog sữa mẹ nên htro tiêu hóa con hiệu quả hơn đấy mom",https://www.facebook.com/groups/939853694105892/posts/1730635441694376/?comment_id=1730663491691571&reply_comment_id=1730663708358216,https://www.facebook.com/groups/939853694105892/posts/1730635441694376/
2026-06-29T05:50:35.000Z,1730663798358207,1730663491691571,1,Jasmin Vũ,"chuẩn luôn, con tiêu hóa khỏe, ít ốm vặt hơn do sữa có tận 6hmo đó m",https://www.facebook.com/groups/939853694105892/posts/1730635441694376/?comment_id=1730663491691571&reply_comment_id=1730663798358207,https://www.facebook.com/groups/939853694105892/posts/1730635441694376/
2026-06-29T05:50:42.000Z,1730663891691531,,0,Lê Mạnh Bằng,"hay mom thử sữa nan cam như mình nè, sữa này giúp con khỏe cả tiêu hóa và đề kháng nhé, sữa cso đạm a2, 6hmo và lợi khuẩn kép b. infantis & b. lactis nên bé uống vào bụng khỏe con khỏe mạh hơn hẳn đó mom, nestlé có nhiều năm nghiên cứu dinh dưỡng nên mình khá tin tưởng á",https://www.facebook.com/groups/939853694105892/posts/1730635441694376/?comment_id=1730663891691531,https://www.facebook.com/groups/939853694105892/posts/1730635441694376/
2026-06-29T05:50:50.000Z,1730663961691524,1730663891691531,1,Ngọc Minh,"con ún nan này thây con hợp sữa khỏe bụg, khỏe người lắm đấy mom ơi",https://www.facebook.com/groups/939853694105892/posts/1730635441694376/?comment_id=1730663891691531&reply_comment_id=1730663961691524,https://www.facebook.com/groups/939853694105892/posts/1730635441694376/
2026-06-29T05:50:55.000Z,1730663995024854,1730663891691531,1,Lê Mạnh Bằng,con khỏe bụg đi tiêu đều hấp thu cugx dễ dàng đấy mom nha,https://www.facebook.com/groups/939853694105892/posts/1730635441694376/?comment_id=1730663891691531&reply_comment_id=1730663995024854,https://www.facebook.com/groups/939853694105892/posts/1730635441694376/
2026-06-29T05:51:00.000Z,1730664038358183,1730663891691531,1,Ngọc Minh,"đkháng khỏe nên con khỏe mạnh thấy con đỡ hẳn ốm vặt luôn đấy mom nhé,sữa tốt cho tiêu hóa & đề kháng thì ht bé pt toàn diện tốt hơn nè",https://www.facebook.com/groups/939853694105892/posts/1730635441694376/?comment_id=1730663891691531&reply_comment_id=1730664038358183,https://www.facebook.com/groups/939853694105892/posts/1730635441694376/
2026-06-29T05:51:10.000Z,1730664148358172,,0,Vũ Hà Linh,"mẹ t/khảo nan a2 cho bé nha, sữa này vừa hỗ trợ tiêu hóa vừa tăng đề kháng tốt đó mom, nhờ công thức đạm a2 kết hợp 6hmo cùng lợi khuẩn kép b infantis & b lactis mẹ, mình khá thiện cảm với nan a2 vì có nguồn gốc từ thụy sĩ á",https://www.facebook.com/groups/939853694105892/posts/1730635441694376/?comment_id=1730664148358172,https://www.facebook.com/groups/939853694105892/posts/1730635441694376/
2026-06-29T05:51:17.000Z,1730664238358163,1730664148358172,1,Đinh Oanh,"nên dùg nan này thấy bé hấp thu khỏe, bụng êm, con cứng cáp hơn nhiều luôn đó",https://www.facebook.com/groups/939853694105892/posts/1730635441694376/?comment_id=1730664148358172&reply_comment_id=1730664238358163,https://www.facebook.com/groups/939853694105892/posts/1730635441694376/
2026-06-29T05:51:23.000Z,1730664268358160,1730664148358172,1,Vũ Hà Linh,"phải nha, bé uốg nan này thấy con khỏe từ bên trong ra bên ngoài đúng ý mẹ đó😊",https://www.facebook.com/groups/939853694105892/posts/1730635441694376/?comment_id=1730664148358172&reply_comment_id=1730664268358160,https://www.facebook.com/groups/939853694105892/posts/1730635441694376/
2026-06-29T05:51:36.000Z,1730664395024814,,0,Hải Lê Hoàng,"thế thử tham khảo nan cam xem c, bé e ti con tiêu êm, bụng khỏe, tăng cân đều, mình chọn sữa nan a2 vì có nền tảng lâu đời từ nestlé nên cảm giác an toàn hơn",https://www.facebook.com/groups/939853694105892/posts/1730635441694376/?comment_id=1730664395024814,https://www.facebook.com/groups/939853694105892/posts/1730635441694376/
2026-06-29T05:51:44.000Z,1730664475024806,1730664395024814,1,Vũ Hà,"mình thích cách hai dòng nan a2 và sữa nước a2 htrợ nhau một bên là cữ sữa quen thuộc ở nhà, một bên là giải pháp tiện lợi khi ra ngoài",https://www.facebook.com/groups/939853694105892/posts/1730635441694376/?comment_id=1730664395024814&reply_comment_id=1730664475024806,https://www.facebook.com/groups/939853694105892/posts/1730635441694376/
2026-06-29T05:51:49.000Z,1730664515024802,1730664395024814,1,Hải Lê Hoàng,riêng sữa nước có nền tảng đạm a2 và hmo nên mình khá an yên tâm,https://www.facebook.com/groups/939853694105892/posts/1730635441694376/?comment_id=1730664395024814&reply_comment_id=1730664515024802,https://www.facebook.com/groups/939853694105892/posts/1730635441694376/
2026-06-29T05:51:53.000Z,1730664545024799,1730664395024814,1,Vũ Hà,trộm vía bé tăng trưởng đều đặn từ cân nặng tới chiều chiều cao,https://www.facebook.com/groups/939853694105892/posts/1730635441694376/?comment_id=1730664395024814&reply_comment_id=1730664545024799,https://www.facebook.com/groups/939853694105892/posts/1730635441694376/
2026-06-29T05:52:05.000Z,1730664648358122,,0,Lê Minh Trường,"sữa nan a2 được nhập nguyên lon từ thụy sĩ có đạm a2 kết hợp với 6hmo và lợi khuẩn kép b infantis vs b lactics gúp con khỏe cả tiêu hóa và miễn dịch nha, m thử đi, sữa nan a2 mình chọn vì xuất xứ rõ ràng từ thuỵ sĩ nên an tâm hơn",https://www.facebook.com/groups/939853694105892/posts/1730635441694376/?comment_id=1730664648358122,https://www.facebook.com/groups/939853694105892/posts/1730635441694376/
2026-06-29T05:52:15.000Z,1730664715024782,1730664648358122,1,Trịnh Vũ Minh Nguyệt,con mình thuộc dạng bé vận động suốt ngày nên ngoài nan a2 mình cho uống thêm sữa nước a2 vào bữa phụ thấy khá phù hợp luôn luôn,https://www.facebook.com/groups/939853694105892/posts/1730635441694376/?comment_id=1730664648358122&reply_comment_id=1730664715024782,https://www.facebook.com/groups/939853694105892/posts/1730635441694376/
2026-06-29T05:52:21.000Z,1730664785024775,1730664648358122,1,Lê Minh Trường,sữa nước có nền tảng đạm a2 với hmo kế thừa từ nhà nan uy tín nha mom,https://www.facebook.com/groups/939853694105892/posts/1730635441694376/?comment_id=1730664648358122&reply_comment_id=1730664785024775,https://www.facebook.com/groups/939853694105892/posts/1730635441694376/
2026-06-29T05:52:25.000Z,1730664828358104,1730664648358122,1,Trịnh Vũ Minh Nguyệt,"dạo này nhìn bé dường như cao ráo hẳn ra nè 😍, shopee mall nestlé là lựa chọn số 1 của mình nè, tiện lợi mà giá tốt nữa nhá",https://www.facebook.com/groups/939853694105892/posts/1730635441694376/?comment_id=1730664648358122&reply_comment_id=1730664828358104,https://www.facebook.com/groups/939853694105892/posts/1730635441694376/
