Date,Comment_ID,Parent_ID,Level,Author,Content,Permalink,Post_URL
2026-06-29T13:12:12.000Z,1730953938329193,,0,Hồ Xuân Vân,"chia sẻ cùng mom sữa nan a2 thụy sĩ nha, bé mk uống gần năm nay rõ cứng cáp hẳn, giờ sữa còn tăng lên 6hmo nên hỗ trợ đề kháng tốt hơn nữa đó mom , thấy sự cải tiến liên tục là điều rất tích cực nha",https://www.facebook.com/groups/939853694105892/posts/1730582631699657/?comment_id=1730953938329193,https://www.facebook.com/groups/939853694105892/posts/1730582631699657/
2026-06-29T13:12:23.000Z,1730954044995849,1730953938329193,1,Phương Thanh,tiêu hóa con cũng khỏe đều nhờ có lợi khuẩn kép b. infantis & b. lactics nữa đó mom,https://www.facebook.com/groups/939853694105892/posts/1730582631699657/?comment_id=1730953938329193&reply_comment_id=1730954044995849,https://www.facebook.com/groups/939853694105892/posts/1730582631699657/
2026-06-29T13:12:26.000Z,1730954091662511,1730953938329193,1,Hồ Xuân Vân,"dòng này an tâm lắm, sữa của nestle thương hiệu lâu năm nên tin tưởng nhé",https://www.facebook.com/groups/939853694105892/posts/1730582631699657/?comment_id=1730953938329193&reply_comment_id=1730954091662511,https://www.facebook.com/groups/939853694105892/posts/1730582631699657/
2026-06-29T13:12:32.000Z,1730954124995841,1730953938329193,1,Phương Thanh,nhờ con được bổ sung đạm a2 vừa đủ tốt cho tiêu hóa của con đó mẹ,https://www.facebook.com/groups/939853694105892/posts/1730582631699657/?comment_id=1730953938329193&reply_comment_id=1730954124995841,https://www.facebook.com/groups/939853694105892/posts/1730582631699657/
2026-06-29T13:12:41.000Z,1730954234995830,,0,Nguyễn Lệ Khanh,"dòng nan cam mk đang dùng cho con nè, tiêu hóa đề kháng ổn khỏe hẳn, nay còn dc tăng từ 6hmo lên 6hmo nên hỗ trợ đề kháng bé tốt hơn nữa, thấy thương hiệu chủ động rà soát quy trình là điều tích cực nha",https://www.facebook.com/groups/939853694105892/posts/1730582631699657/?comment_id=1730954234995830,https://www.facebook.com/groups/939853694105892/posts/1730582631699657/
2026-06-29T13:12:49.000Z,1730954321662488,1730954234995830,1,Van Huyen,"sữa cao cấp nhà nestle đúng là chất lượng chuẩn đảm bảo lăm, nhà này có hơn 155 năm ls, sữa tốt cho tiêu hoá & đề kháng thì đây là nền tảng cho bé pt toàn diện đó ạ😊",https://www.facebook.com/groups/939853694105892/posts/1730582631699657/?comment_id=1730954234995830&reply_comment_id=1730954321662488,https://www.facebook.com/groups/939853694105892/posts/1730582631699657/
2026-06-29T13:12:52.000Z,1730954364995817,1730954234995830,1,Nguyễn Lệ Khanh,con uống hấp thu tốt hơn bụng khỏe hơn do thêm lợi khuẩn kép b. Infantis & b. lactics đều đó kinh nghiệm hơn một thế kỷ rưỡi chăm sóc mẹ và bé cơ đấy,https://www.facebook.com/groups/939853694105892/posts/1730582631699657/?comment_id=1730954234995830&reply_comment_id=1730954364995817,https://www.facebook.com/groups/939853694105892/posts/1730582631699657/
2026-06-29T13:12:55.000Z,1730954428329144,1730954234995830,1,Van Huyen,"cũng yên tâm hơn hẳn bé cứ ti mê thun thút, căng no lại đánh 1 giấc say đến sáng k thấy ì èo mẹ nữa",https://www.facebook.com/groups/939853694105892/posts/1730582631699657/?comment_id=1730954234995830&reply_comment_id=1730954428329144,https://www.facebook.com/groups/939853694105892/posts/1730582631699657/
2026-06-29T13:12:58.000Z,1730954488329138,1730954234995830,1,Nguyễn Lệ Khanh,dòg này là sữa đầu tiên có kết hợp cả 3 dưỡng chất quý này đấy mom,https://www.facebook.com/groups/939853694105892/posts/1730582631699657/?comment_id=1730954234995830&reply_comment_id=1730954488329138,https://www.facebook.com/groups/939853694105892/posts/1730582631699657/
2026-06-29T13:13:01.000Z,1730954504995803,1730954234995830,1,Van Huyen,có đạm a2 tương đương vs đạm trong sữa mẹ phù hợp vs tiêu hóa giúp con dễ tiêu hóa hấp thu và hạn chế các vde của tiêu hóa,https://www.facebook.com/groups/939853694105892/posts/1730582631699657/?comment_id=1730954234995830&reply_comment_id=1730954504995803,https://www.facebook.com/groups/939853694105892/posts/1730582631699657/
2026-06-29T13:13:10.000Z,1730954601662460,1730954234995830,1,Nguyễn Lệ Khanh,có đạm a2 tương đương vs đạm trong sữa mẹ phù hợp vs tiêu hóa giúp con dễ tiêu hóa hấp thu và hạn chế các vde của tiêu hóa,https://www.facebook.com/groups/939853694105892/posts/1730582631699657/?comment_id=1730954234995830&reply_comment_id=1730954601662460,https://www.facebook.com/groups/939853694105892/posts/1730582631699657/
2026-06-29T13:13:18.000Z,1730954721662448,,0,Trần Toản,"dùng nan cam đúng là chả có lo lăng nhé, thấy con ít ốm hẳn, tiêu hóa thì khỏe hơn nha, nhờ bộ ba đạm a2, 6hmo và lợi khuẩn kép b. infantis & b. lactis htro, mình khá ấn tượng với định hướng phát triển lâu dài của thương hiệu nè",https://www.facebook.com/groups/939853694105892/posts/1730582631699657/?comment_id=1730954721662448,https://www.facebook.com/groups/939853694105892/posts/1730582631699657/
2026-06-29T13:13:28.000Z,1730954858329101,1730954721662448,1,Trần Lam Giang,"dr, trong sữa có đạm a2 + 6hmo giúp phần trăm lượng hmo tương đương sữa mẹ, giúp tăng lợi ích đề kháng nhờ cơ chế cộng hưởng cùng lợi khuẩn b. Infantis nên tốt cho tiêu hóa và đề kháng bé",https://www.facebook.com/groups/939853694105892/posts/1730582631699657/?comment_id=1730954721662448&reply_comment_id=1730954858329101,https://www.facebook.com/groups/939853694105892/posts/1730582631699657/
2026-06-29T13:13:37.000Z,1730954958329091,1730954721662448,1,Trần Toản,"nên mẹ an tâm cho con ún nan này con khỏe từ bên trong ra bên ngoài ,mấy sữa mà tốt cho tiêu hóa ,đề kháng thì ht con pt toàn diện tốt hơn nha😊",https://www.facebook.com/groups/939853694105892/posts/1730582631699657/?comment_id=1730954721662448&reply_comment_id=1730954958329091,https://www.facebook.com/groups/939853694105892/posts/1730582631699657/
2026-06-29T13:13:47.000Z,1730955098329077,,0,Thu Nga Võ,"con nhà mình dùng nan a2 nên giao mùa con vẫn khỏe, tiêu hóa tốt hơn hẳn nha, dòng này có đạm a2, 6hmo và lợi khuẩn kép b. infantis & b. lactis giúp con tiêu hóa đề kháng khỏe cả, mình biết đến nan a2 trước tiên vì sản phẩm được nhập khẩu từ thụy sĩ á",https://www.facebook.com/groups/939853694105892/posts/1730582631699657/?comment_id=1730955098329077,https://www.facebook.com/groups/939853694105892/posts/1730582631699657/
2026-06-29T13:13:55.000Z,1730955181662402,1730955098329077,1,Long Nam Hoàng,"dùng nan này thấy con cũng hợp tác nữa đấy mom nha, con đều cữ ti thun thút luôn",https://www.facebook.com/groups/939853694105892/posts/1730582631699657/?comment_id=1730955098329077&reply_comment_id=1730955181662402,https://www.facebook.com/groups/939853694105892/posts/1730582631699657/
2026-06-29T13:14:00.000Z,1730955244995729,1730955098329077,1,Thu Nga Võ,cũng do nan này dc loại bỏ mùi dầu cá nên sữa thơm vị nhạt dễ ún lắm mom,https://www.facebook.com/groups/939853694105892/posts/1730582631699657/?comment_id=1730955098329077&reply_comment_id=1730955244995729,https://www.facebook.com/groups/939853694105892/posts/1730582631699657/
2026-06-29T13:14:42.000Z,1730955778329009,,0,Huỳnh Phượng Bích,"mk đổi sang nan a2 thụy sĩ cho bé, trộm vía giờ đề kháng tốt lắm, nay sữa cải tiến từ 6hmo lên 6hmo đấy, tham khảo xem nhé , đọc thêm thông tin mới thấy quy trình sản xuất rất bài bản nha",https://www.facebook.com/groups/939853694105892/posts/1730582631699657/?comment_id=1730955778329009,https://www.facebook.com/groups/939853694105892/posts/1730582631699657/
2026-06-29T13:14:49.000Z,1730955828329004,1730955778329009,1,Minh Thuy,nhà mìh có giai đoạn bé thích tự xúc ăn dù rơi vãi khắp nơi nhưng mình vẫn để con tự trải nghiệm. hiện tại nan a2 cùng sữa nước a2 vẫn là lựa chọn mình duy trì cho bé mỗi ngày đều đặn hằng ngày mỗi ngày,https://www.facebook.com/groups/939853694105892/posts/1730582631699657/?comment_id=1730955778329009&reply_comment_id=1730955828329004,https://www.facebook.com/groups/939853694105892/posts/1730582631699657/
2026-06-29T13:15:43.000Z,1730956551662265,1730955778329009,1,Huỳnh Phượng Bích,"công nhận luôn, sữa nước với nền tảng a2 và hmo kế thừa từ nhà nan là điểm khiến mình khá yên tâm sử dụng ngay cho bé",https://www.facebook.com/groups/939853694105892/posts/1730582631699657/?comment_id=1730955778329009&reply_comment_id=1730956551662265,https://www.facebook.com/groups/939853694105892/posts/1730582631699657/
2026-06-29T13:15:54.000Z,1730956691662251,1730955778329009,1,Minh Thuy,"nhìn tổng thể con cứng cáp, khỏe khoắn và phát triển cân đối hơn nhiều 😍 thấy rõ luôn mẹ nó",https://www.facebook.com/groups/939853694105892/posts/1730582631699657/?comment_id=1730955778329009&reply_comment_id=1730956691662251,https://www.facebook.com/groups/939853694105892/posts/1730582631699657/
2026-06-29T13:16:02.000Z,1730956781662242,,0,Đoàn Diệu Thúy,"mạnh dạn xai sữa nan a2 nè, dòng này tót cho tiêu hoa đề kháng khỏe nhé, sữa nay dc tăng lên 6hmo giúp bé tăng đề kháng tốt hơn, mình thích cách thương hiệu liên tục nâng chuẩn sản xuất á",https://www.facebook.com/groups/939853694105892/posts/1730582631699657/?comment_id=1730956781662242,https://www.facebook.com/groups/939853694105892/posts/1730582631699657/
2026-06-29T13:16:15.000Z,1730956921662228,1730956781662242,1,Liên Hoàng,bé nhà mình rất mê những trò chơi liên quan đến nước nên cuối tuần nào cũng đòi ra công viên. mình vẫn duy trì nan a2 kết hợp sữa nước a2 để đồng hành cùng giai đoạn phát triển hiện tại của con nhà mình bây giờ sau này,https://www.facebook.com/groups/939853694105892/posts/1730582631699657/?comment_id=1730956781662242&reply_comment_id=1730956921662228,https://www.facebook.com/groups/939853694105892/posts/1730582631699657/
2026-06-29T13:16:19.000Z,1730956941662226,1730956781662242,1,Đoàn Diệu Thúy,"riêng điểm này mình đánh giá cao nè, sữa nước được phát triển trên nền tảng a2 và hmo kế thừa từ nhà nan đồng bộ hoàn hảo chất lượng",https://www.facebook.com/groups/939853694105892/posts/1730582631699657/?comment_id=1730956781662242&reply_comment_id=1730956941662226,https://www.facebook.com/groups/939853694105892/posts/1730582631699657/
2026-06-29T13:16:22.000Z,1730956991662221,1730956781662242,1,Liên Hoàng,"hiện tại chiều cao tiến triển khá đều, cân nặng cũng tăng trưởng ổn áp 🥰 đều đặn và tốt hơn, mình cứ tiện đường là ghé con cưng mua nan thôi nè, phục vụ nhiệt tình lắm luôn nha",https://www.facebook.com/groups/939853694105892/posts/1730582631699657/?comment_id=1730956781662242&reply_comment_id=1730956991662221,https://www.facebook.com/groups/939853694105892/posts/1730582631699657/
