Date,Comment_ID,Parent_ID,Level,Author,Content,Permalink,Post_URL
2026-06-29T07:07:11.000Z,1730708318353755,,0,Minh Hường Nguyễn,"mách cho mẹ tk sữa nan cam nhé, bé nhà mk uống thấy khỏe khoắn lắm, nay sữa tăng lên 6hmo nên đề kháng tốt hơn đó nhé , đọc thông tin thấy quy trình được xây dựng khá bài bản nha",https://www.facebook.com/groups/939853694105892/posts/1730406638383923/?comment_id=1730708318353755,https://www.facebook.com/groups/939853694105892/posts/1730406638383923/
2026-06-29T07:07:22.000Z,1730708371687083,1730708318353755,1,Mai Adela,"uk, sữa còn bổ sung thêm lợi khuẩn kép b infantis & b. lactics giúp bé hấp thu tốt, khỏe mạnh từ bên trong nữa",https://www.facebook.com/groups/939853694105892/posts/1730406638383923/?comment_id=1730708318353755&reply_comment_id=1730708371687083,https://www.facebook.com/groups/939853694105892/posts/1730406638383923/
2026-06-29T07:07:28.000Z,1730708425020411,1730708318353755,1,Minh Hường Nguyễn,"dòng này đúng là hỗ trợ bé khỏe từ trong ra ngoài luôn, sữa cao cấp của nhà nestle đó chọn nan là chọn hơn 155 năm uy tín toàn cầu luôn đấy",https://www.facebook.com/groups/939853694105892/posts/1730406638383923/?comment_id=1730708318353755&reply_comment_id=1730708425020411,https://www.facebook.com/groups/939853694105892/posts/1730406638383923/
2026-06-29T07:07:36.000Z,1730708495020404,1730708318353755,1,Mai Adela,hệ tiêu hóa tốt đường ruột khỏe nên hấp thu được hết dinh dưỡng cần thiết,https://www.facebook.com/groups/939853694105892/posts/1730406638383923/?comment_id=1730708318353755&reply_comment_id=1730708495020404,https://www.facebook.com/groups/939853694105892/posts/1730406638383923/
2026-06-29T07:07:43.000Z,1730708561687064,,0,Kiều Tuệ,"gt cho mom sữa nan cam con ti từ đợt mới sinh tới giờ hệ tiêu hóa con ptr khỏe mạnh cũng nhờ có thành phần đạm a2 htr nên con ăn ti hấp thụ được nhỉnh kim đều, đọc thông tin xong cảm thấy yên tâm hơn nhiều nè",https://www.facebook.com/groups/939853694105892/posts/1730406638383923/?comment_id=1730708561687064,https://www.facebook.com/groups/939853694105892/posts/1730406638383923/
2026-06-29T07:07:52.000Z,1730708655020388,1730708561687064,1,Thương Hoài,"con ti bụng khỏe re đi ngoài cũng dễ dàng ko sợ bị táo ,sữa tốt cho tiêu hoá & đề kháng, chính là nền tảng vững chắc giúp bé phát triển toàn diện😊",https://www.facebook.com/groups/939853694105892/posts/1730406638383923/?comment_id=1730708561687064&reply_comment_id=1730708655020388,https://www.facebook.com/groups/939853694105892/posts/1730406638383923/
2026-06-29T07:07:57.000Z,1730708701687050,1730708561687064,1,Kiều Tuệ,"um, nan a2 còn htr cả đề kháng nhờ bs thành phần 6hmo nữa",https://www.facebook.com/groups/939853694105892/posts/1730406638383923/?comment_id=1730708561687064&reply_comment_id=1730708701687050,https://www.facebook.com/groups/939853694105892/posts/1730406638383923/
2026-06-29T07:08:09.000Z,1730708838353703,1730708561687064,1,Thy Lâm,thành phần này gần giống trong sữa mẹ giúp con khỏe đề kháng nên trv trở trời con bớt ốm vặt hơn,https://www.facebook.com/groups/939853694105892/posts/1730406638383923/?comment_id=1730708561687064&reply_comment_id=1730708838353703,https://www.facebook.com/groups/939853694105892/posts/1730406638383923/
2026-06-29T07:08:12.000Z,1730708848353702,1730708561687064,1,Thương Hoài,"công thức nay cải tiến lên 6hmo, giúp nhân đôi dưỡng chất hỗ trợ đề kháng, nên bé cứng cáp hơn hẳn so với trước",https://www.facebook.com/groups/939853694105892/posts/1730406638383923/?comment_id=1730708561687064&reply_comment_id=1730708848353702,https://www.facebook.com/groups/939853694105892/posts/1730406638383923/
2026-06-29T07:08:20.000Z,1730708925020361,1730708561687064,1,Thy Lâm,"đúng rồi mẹ, ngoài ra còn có lợi khuẩn chuyên biệt b infantis, giúp tiêu thụ 6hmo, tạo hiệu ứng cộng hưởng, hỗ trợ tối ưu cả tiêu hoá lẫn đề kháng cho bé, mấy sữa tốt cho tiêu hoá & đề kháng là nền tảng giúp bé phát triển toàn diện đó mẹ nuôi con khoa học với kinh nghiệm hơn 155 năm chứ còn gì nữa",https://www.facebook.com/groups/939853694105892/posts/1730406638383923/?comment_id=1730708561687064&reply_comment_id=1730708925020361,https://www.facebook.com/groups/939853694105892/posts/1730406638383923/
2026-06-29T07:08:32.000Z,1730709068353680,1730708561687064,1,Linh Diệp,"nan này chất lượng lắm, là sữa chính hãng nestle, nhập khẩu trực tiếp từ thuỵ sĩ nên yên tâm nguồn gốc",https://www.facebook.com/groups/939853694105892/posts/1730406638383923/?comment_id=1730708561687064&reply_comment_id=1730709068353680,https://www.facebook.com/groups/939853694105892/posts/1730406638383923/
2026-06-29T07:09:11.000Z,1730709441686976,,0,Miên Cẩm,"bé mk uống nan cam thấy tiêu ổn, bụng khoẻ, đề kháng tốt, ít bệnh vặt, mẹ tham khảo nha💪, mình đánh giá cao sự nghiêm túc trong việc kiểm soát từng khâu nha",https://www.facebook.com/groups/939853694105892/posts/1730406638383923/?comment_id=1730709441686976,https://www.facebook.com/groups/939853694105892/posts/1730406638383923/
2026-06-29T07:09:20.000Z,1730709581686962,,0,Hưng Thủy,"nan cam hỗ trợ tốt cả tiêu hoá lẫn đề kháng cho bé đó mẹ, con uống bụng êm, dễ tiêu, ít ốm vặt , nestlé cho mình cảm giác là thương hiệu luôn chú trọng nghiên cứu á",https://www.facebook.com/groups/939853694105892/posts/1730406638383923/?comment_id=1730709581686962,https://www.facebook.com/groups/939853694105892/posts/1730406638383923/
2026-06-29T07:09:35.000Z,1730709711686949,1730709581686962,1,Minh Hải,"giờ công thức được nâng cấp 6hmo, giúp nhân đôi dưỡng chất hỗ trợ miễn dịch cho bé mẹ👶",https://www.facebook.com/groups/939853694105892/posts/1730406638383923/?comment_id=1730709581686962&reply_comment_id=1730709711686949,https://www.facebook.com/groups/939853694105892/posts/1730406638383923/
2026-06-29T07:09:43.000Z,1730709788353608,,0,Trà Châu,"mẹ thử nan a2 cho con ti như cún nhà tui đi nhé con nhẹ bụng và đề kháng khoẻ sữa mới được cải tiến từ 5hmo lên 6hmo nên ok lắm nha, nan a2 có sự đồng hành từ nền tảng khoa học của nestlé nên khá yên tâm nha",https://www.facebook.com/groups/939853694105892/posts/1730406638383923/?comment_id=1730709788353608,https://www.facebook.com/groups/939853694105892/posts/1730406638383923/
2026-06-29T07:09:50.000Z,1730709878353599,1730709788353608,1,Lan An,"mìh để nan a2 là sữa chính, còn sữa nước a2 thì kiểu bổ sung linh hoạt trong ngày, hôm nào thiếu thời gian là thấy tiện rõ luôn ấy chứ",https://www.facebook.com/groups/939853694105892/posts/1730406638383923/?comment_id=1730709788353608&reply_comment_id=1730709878353599,https://www.facebook.com/groups/939853694105892/posts/1730406638383923/
2026-06-29T07:09:55.000Z,1730709945020259,1730709788353608,1,Trà Châu,"đúg luôn, sữa nước a2 nền a2 và hmo kế thừa từ nhà nan nên cảm giác dùng song song khá đồng bộ với dòng sữa bột",https://www.facebook.com/groups/939853694105892/posts/1730406638383923/?comment_id=1730709788353608&reply_comment_id=1730709945020259,https://www.facebook.com/groups/939853694105892/posts/1730406638383923/
2026-06-29T07:10:04.000Z,1730710031686917,1730709788353608,1,Lan An,"nhìn con pht triển thể chất đều, thấy rõ luôn á mẹ nó 😄",https://www.facebook.com/groups/939853694105892/posts/1730406638383923/?comment_id=1730709788353608&reply_comment_id=1730710031686917,https://www.facebook.com/groups/939853694105892/posts/1730406638383923/
2026-06-29T07:10:16.000Z,1730710151686905,,0,Hải Hương,"dặm sữa nan a2 thụy sĩ cho đề kháng bé khỏe mạnh nha. sữa này đang cải tiến từ 5hmo lên 6hmo đề kháng khỏe hơn, nan a2 vừa có xuất xứ thụy sĩ vừa có sự hậu thuẫn từ nestlé nên khá yên tâm á",https://www.facebook.com/groups/939853694105892/posts/1730406638383923/?comment_id=1730710151686905,https://www.facebook.com/groups/939853694105892/posts/1730406638383923/
2026-06-29T07:10:30.000Z,1730710311686889,1730710151686905,1,Bùi Mai Hiền,"mình quen nan a2 rồi nên thêm sữa nước a2 vào thấy dễ theo nhịp sinh hoạt hơn, không phải lúc nào cũng lo chuẩn bị sữa bột khi ra ngoài chơi đâu",https://www.facebook.com/groups/939853694105892/posts/1730406638383923/?comment_id=1730710151686905&reply_comment_id=1730710311686889,https://www.facebook.com/groups/939853694105892/posts/1730406638383923/
2026-06-29T07:10:39.000Z,1730710425020211,1730710151686905,1,Hải Hương,"m cũng thấy vậy á, sữa nước với nền tảng a2 và hmo kế thừa từ nhà nan nên khi đi cùng nan a2 khá liền mạch ăn ý",https://www.facebook.com/groups/939853694105892/posts/1730406638383923/?comment_id=1730710151686905&reply_comment_id=1730710425020211,https://www.facebook.com/groups/939853694105892/posts/1730406638383923/
2026-06-29T07:10:43.000Z,1730710458353541,1730710151686905,1,Bùi Mai Hiền,"trộmvía con khỏe và lanh lợi hơn rõ luôn hẳn nha 🥰, kidsplaza tư vấn chọn loại nan phù hợp cho bé rất có tâm nè, mình ưng lắm nhá",https://www.facebook.com/groups/939853694105892/posts/1730406638383923/?comment_id=1730710151686905&reply_comment_id=1730710458353541,https://www.facebook.com/groups/939853694105892/posts/1730406638383923/
