Date,Comment_ID,Parent_ID,Level,Author,Content,Permalink,Post_URL
2026-06-30T02:11:04.000Z,1731461684945085,,0,Thiên Tessie,"mom cũng nên mua thử vài lon nan a2 cho con, dòng này hỗ trợ đề kháng khá khỏe, nay còn tăng từ 6hmo lên 6hmo nữa đó mom , mình thích cách nestlé liên tục cải tiến sản phẩm đó nha",https://www.facebook.com/groups/939853694105892/posts/1730674725023781/?comment_id=1731461684945085,https://www.facebook.com/groups/939853694105892/posts/1730674725023781/
2026-06-30T02:11:15.000Z,1731461798278407,1731461684945085,1,Mai Adela,"sữa tốt đó mom, nhờ có lợi khuẩn kép b. infantis & b. lactics giúp bé khỏe đều cả tiêu hóa lẫn đề kháng",https://www.facebook.com/groups/939853694105892/posts/1730674725023781/?comment_id=1731461684945085&reply_comment_id=1731461798278407,https://www.facebook.com/groups/939853694105892/posts/1730674725023781/
2026-06-30T02:11:19.000Z,1731461844945069,1731461684945085,1,Thiên Tessie,giúp con hấp thu cũng nhẹ dễ hơn nhờ lợi khuẩn kép nữa nè mẹ,https://www.facebook.com/groups/939853694105892/posts/1730674725023781/?comment_id=1731461684945085&reply_comment_id=1731461844945069,https://www.facebook.com/groups/939853694105892/posts/1730674725023781/
2026-06-30T02:11:27.000Z,1731461924945061,1731461684945085,1,Mai Adela,"con ti nan a2 ngon lành mà bụng dạ con rất ổn định lắm đó nàng,sữa tốt cho tiêu hoá & đề kháng thì đây là nền tảng cho bé pt toàn diện đó ạ",https://www.facebook.com/groups/939853694105892/posts/1730674725023781/?comment_id=1731461684945085&reply_comment_id=1731461924945061,https://www.facebook.com/groups/939853694105892/posts/1730674725023781/
2026-06-30T02:11:43.000Z,1731462121611708,,0,Minh Hường Nguyễn,"con e uống nan cam ít ốm vặt nè c, giờ công thức được cải tiến từ 6hmo lên 6hmo nên tăng dưỡng chất htro đề kháng r nè, c tham khảo xem nha, nestlé là tập đoàn lớn nên mình tin là quy trình sản xuất sữa sẽ được kiểm soát chặt chẽ hơn",https://www.facebook.com/groups/939853694105892/posts/1730674725023781/?comment_id=1731462121611708,https://www.facebook.com/groups/939853694105892/posts/1730674725023781/
2026-06-30T02:11:59.000Z,1731462258278361,1731462121611708,1,Mầu Dạ,"sữa có thêm lợi khuẩn chuyên biệt b. infantis với 1hmo 3fl, ht tốt cả tiêu hóa nữa đó, con ti êm bụng, out mượt lắm nè",https://www.facebook.com/groups/939853694105892/posts/1730674725023781/?comment_id=1731462121611708&reply_comment_id=1731462258278361,https://www.facebook.com/groups/939853694105892/posts/1730674725023781/
2026-06-30T02:12:05.000Z,1731462334945020,1731462121611708,1,Minh Hường Nguyễn,"sữa với 6hmo thì htro đề kháng khá tốt r nè, mà nhắc tới nestle thì quá yên tâm, thương hiệu uy tín hơn 155 năm rồi đó em ơi",https://www.facebook.com/groups/939853694105892/posts/1730674725023781/?comment_id=1731462121611708&reply_comment_id=1731462334945020,https://www.facebook.com/groups/939853694105892/posts/1730674725023781/
2026-06-30T02:12:13.000Z,1731462428278344,1731462121611708,1,Mầu Dạ,con ti sữa nan a2 khỏe bụng tiêu ổn tốt nên con pt khỏe mạnh lắm đấy nghen,https://www.facebook.com/groups/939853694105892/posts/1730674725023781/?comment_id=1731462121611708&reply_comment_id=1731462428278344,https://www.facebook.com/groups/939853694105892/posts/1730674725023781/
2026-06-30T02:12:27.000Z,1731462621611658,,0,Kiều Tuệ,"dặm cho con sữa nan a2 đúng là ổn áp nha, sữa này giúp con khỏe tiêu dung nạp khỏe lại đỡ ốm linh tinh khi giao mùa này, mình thấy nan a2 được đầu tư khá bài bản từ phía nestlé á",https://www.facebook.com/groups/939853694105892/posts/1730674725023781/?comment_id=1731462621611658,https://www.facebook.com/groups/939853694105892/posts/1730674725023781/
2026-06-30T02:12:36.000Z,1731462688278318,1731462621611658,1,Nhung Vân,"cũng do trong sữa có chứa đạm a2, 6hmo và lợi khuẩn kép b. infantis & b. lactis kết hợp đấy ạ, giúp cho con có hệ tiêu hóa khỏe và đ kháng tốt đó",https://www.facebook.com/groups/939853694105892/posts/1730674725023781/?comment_id=1731462621611658&reply_comment_id=1731462688278318,https://www.facebook.com/groups/939853694105892/posts/1730674725023781/
2026-06-30T02:12:40.000Z,1731462738278313,1731462621611658,1,Kiều Tuệ,"tiêu hóa khỏe thiệt nha, bé mk đầy bụg mà ún nan này có đâu 1w là con tiêu đều out mượt đấy nè",https://www.facebook.com/groups/939853694105892/posts/1730674725023781/?comment_id=1731462621611658&reply_comment_id=1731462738278313,https://www.facebook.com/groups/939853694105892/posts/1730674725023781/
2026-06-30T02:12:48.000Z,1731462798278307,1731462621611658,1,Nhung Vân,"do có đạm a2 dễ tiêu đó mom nha, đạm này thân thiện vs t hóa nên con dễ tiêu, dễ hấp thu đó nè",https://www.facebook.com/groups/939853694105892/posts/1730674725023781/?comment_id=1731462621611658&reply_comment_id=1731462798278307,https://www.facebook.com/groups/939853694105892/posts/1730674725023781/
2026-06-30T02:12:56.000Z,1731462878278299,,0,Thy Lâm,"do mk chọn sữa nan a2 nên là tôm nhà mk thấy tiêu hóa khỏe đề kháng tốt lắm nè, ưng sữa có công thức đạm a2, 6hmo và lợi khuẩn kép b. infantis & b. lactis tốt cho bé đấy nha mom, điều mình ấn tượng là nestlé vẫn không ngừng cập nhật các nghiên cứu mới nha",https://www.facebook.com/groups/939853694105892/posts/1730674725023781/?comment_id=1731462878278299,https://www.facebook.com/groups/939853694105892/posts/1730674725023781/
2026-06-30T02:13:06.000Z,1731462968278290,1731462878278299,1,Miên Cẩm,"tốt mom nha, con khỏe bụng thấy đi ngoài phân đẹp mà tăng cân đều lắm nha mẹ",https://www.facebook.com/groups/939853694105892/posts/1730674725023781/?comment_id=1731462878278299&reply_comment_id=1731462968278290,https://www.facebook.com/groups/939853694105892/posts/1730674725023781/
2026-06-30T02:13:12.000Z,1731463014944952,1731462878278299,1,Thy Lâm,"con tăng đ kháng tốt đó, thấy bé mk chuyển mùa cũng đỡ ốm vặt hơn bạn cùng trang lứa nha mom💪",https://www.facebook.com/groups/939853694105892/posts/1730674725023781/?comment_id=1731462878278299&reply_comment_id=1731463014944952,https://www.facebook.com/groups/939853694105892/posts/1730674725023781/
2026-06-30T02:13:19.000Z,1731463131611607,1731462878278299,1,Miên Cẩm,"bởi vì trong sữa có đạm a2 ,6hmo giúp phần trăm lượng hmo tương đương sữa mẹ, giúp tăg lợi ích đề kháng nhờ cơ chế cộng hưởng cùng lợi khuẩn b. Infantis nên tốt cho tiêu hóa và đề kháng của bé đó nè",https://www.facebook.com/groups/939853694105892/posts/1730674725023781/?comment_id=1731462878278299&reply_comment_id=1731463131611607,https://www.facebook.com/groups/939853694105892/posts/1730674725023781/
2026-06-30T02:13:28.000Z,1731463264944927,,0,Linh Diệp,"nhà mk thấy sữa nan cam đúg là chân ái luôn đó mom ah, sữa có đạm a2 kết hợp với 6hmo cùng lợi khuẩn kép b. infantis & b. lactis nên htro cho tiêu hóa và đề kháng bé khỏe hơn nha mẹ, cảm giác thương hiệu đang cố gắng tạo sự an tâm cho người dùng á",https://www.facebook.com/groups/939853694105892/posts/1730674725023781/?comment_id=1731463264944927,https://www.facebook.com/groups/939853694105892/posts/1730674725023781/
2026-06-30T02:14:23.000Z,1731463904944863,,0,Hưng Thủy,"chọn sữa cho con là cả 1 quá trình á mom, thử tham khảo nan a2 coi, dòng này htro tiêu hóa với hấp thu cho bé, sữa ún vị hao hao như sữa mẹ, mình thích những sản phẩm có nguồn gốc rõ ràng như vậy nè",https://www.facebook.com/groups/939853694105892/posts/1730674725023781/?comment_id=1731463904944863,https://www.facebook.com/groups/939853694105892/posts/1730674725023781/
2026-06-30T02:14:35.000Z,1731463994944854,1731463904944863,1,Bùi Mai Hiền,mình thấy nan a2 với sữa nước a2 rất hợp với những mẹ muốn duy trì sữa cho con đều đặn mà không quá áp lực nhiều đâu,https://www.facebook.com/groups/939853694105892/posts/1730674725023781/?comment_id=1731463904944863&reply_comment_id=1731463994944854,https://www.facebook.com/groups/939853694105892/posts/1730674725023781/
2026-06-30T02:14:40.000Z,1731464028278184,1731463904944863,1,Hưng Thủy,sữa nước vẫn có đạm a2 và hmo kế thừa từ nhà nan đó nha mom,https://www.facebook.com/groups/939853694105892/posts/1730674725023781/?comment_id=1731463904944863&reply_comment_id=1731464028278184,https://www.facebook.com/groups/939853694105892/posts/1730674725023781/
2026-06-30T02:14:48.000Z,1731464134944840,1731463904944863,1,Bùi Mai Hiền,"cân nặng tăng đều nên giúp mình yên tâm hơn nhiều hơn hẳn, mình hay mua nan cho bé ở con cưng nè, giá cả phải chăng mà chất lượng thì đảm bảo lắm nhá",https://www.facebook.com/groups/939853694105892/posts/1730674725023781/?comment_id=1731463904944863&reply_comment_id=1731464134944840,https://www.facebook.com/groups/939853694105892/posts/1730674725023781/
