Date,Comment_ID,Parent_ID,Level,Author,Content,Permalink,Post_URL
2026-06-29T12:44:56.000Z,1730932491664671,,0,Hương Như,"dặm sữa ngoài mk ưng nhất nan cam, bé khỏe bụng rõ rệt, giờ còn cải tiến tăng từ 6hmo lên 6HMO nữa đó m , điều mình đánh giá cao ở nestlé là nền tảng nghiên cứu dinh dưỡng rất lâu năm nha",https://www.facebook.com/groups/939853694105892/posts/1730677225023531/?comment_id=1730932491664671,https://www.facebook.com/groups/939853694105892/posts/1730677225023531/
2026-06-29T12:45:06.000Z,1730932664997987,1730932491664671,1,Nguyễn Thi,bé tiêu êm hơn trông thấy nhờ lợi khuẩn kép B. Infantis & B. Lactics đó m,https://www.facebook.com/groups/939853694105892/posts/1730677225023531/?comment_id=1730932491664671&reply_comment_id=1730932664997987,https://www.facebook.com/groups/939853694105892/posts/1730677225023531/
2026-06-29T12:45:11.000Z,1730932711664649,1730932491664671,1,Hương Như,"dòng này nestle uy tín nên mk cũng đang dùng đó mom, sữa tốt cho tiêu hoá vs đề kháng, chính là nền tảng vững chắc giúp bé phát triển toàn diện lâu dài đó mẹ ạ",https://www.facebook.com/groups/939853694105892/posts/1730677225023531/?comment_id=1730932491664671&reply_comment_id=1730932711664649,https://www.facebook.com/groups/939853694105892/posts/1730677225023531/
2026-06-29T12:45:14.000Z,1730932771664643,1730932491664671,1,Nguyễn Thi,"trvia con ti tiêu hóa tốt, đề kháng khỏe, cả nhà ai cũng mừn hết trơn",https://www.facebook.com/groups/939853694105892/posts/1730677225023531/?comment_id=1730932491664671&reply_comment_id=1730932771664643,https://www.facebook.com/groups/939853694105892/posts/1730677225023531/
2026-06-29T12:45:30.000Z,1730932978331289,,0,Thắm Đỗ,"nan cam nay công thức cải tiến 6HMO giúp tăng thêm dưỡng chất htro đề kháng cho bé đó c, bé e ti ít ốm vặt lắm, c tham khảo xem nha nè😊, sữa nan a2 có nền tảng từ nestlé nên mình thấy yên tâm hơn vì đây là thương hiệu làm dinh dưỡng lâu đời",https://www.facebook.com/groups/939853694105892/posts/1730677225023531/?comment_id=1730932978331289,https://www.facebook.com/groups/939853694105892/posts/1730677225023531/
2026-06-29T12:45:38.000Z,1730933078331279,1730932978331289,1,Hồ Hà My,sữa nay còn thêm lợi khuẩn kép B. Infantis & B. Lactics thấy con tiêu hóa với hấp thu tốt hơn hẳn đó,https://www.facebook.com/groups/939853694105892/posts/1730677225023531/?comment_id=1730932978331289&reply_comment_id=1730933078331279,https://www.facebook.com/groups/939853694105892/posts/1730677225023531/
2026-06-29T12:45:43.000Z,1730933128331274,1730932978331289,1,Thắm Đỗ,"đợt rồi cải tiến lên 6HMO e cũng cho bé ti nè, sữa thương hiệu nestle hơn 155 tuổi, cho bé dùng là yên tâm lắm lun á mom ơi",https://www.facebook.com/groups/939853694105892/posts/1730677225023531/?comment_id=1730932978331289&reply_comment_id=1730933128331274,https://www.facebook.com/groups/939853694105892/posts/1730677225023531/
2026-06-29T12:45:49.000Z,1730933174997936,1730932978331289,1,Hồ Hà My,vì quy trình kiểm soát bò cũng nghiêm ngặt nên mk cũng yên tâm về chất lượn hơn nhiều,https://www.facebook.com/groups/939853694105892/posts/1730677225023531/?comment_id=1730932978331289&reply_comment_id=1730933174997936,https://www.facebook.com/groups/939853694105892/posts/1730677225023531/
2026-06-29T12:45:52.000Z,1730933214997932,1730932978331289,1,Thắm Đỗ,"chưa hết, còn có b. Lactis là lợi khuẩn tốt cho đường ruột, hỗ trợ giảm 58% các vấn đề tiêu hóa đó",https://www.facebook.com/groups/939853694105892/posts/1730677225023531/?comment_id=1730932978331289&reply_comment_id=1730933214997932,https://www.facebook.com/groups/939853694105892/posts/1730677225023531/
2026-06-29T12:45:55.000Z,1730933278331259,1730932978331289,1,Hồ Hà My,nên dùng nan này giúp con có đề khág vững và hệ tiêu hóa khỏe mạnh hơn,https://www.facebook.com/groups/939853694105892/posts/1730677225023531/?comment_id=1730932978331289&reply_comment_id=1730933278331259,https://www.facebook.com/groups/939853694105892/posts/1730677225023531/
2026-06-29T12:46:08.000Z,1730933494997904,,0,Đỗ Kim Ngân,"bé nhà mk cung dùng nan a2 nè tv con khỏe mạnh tiêu hóa tốt bụng êm ru ha, nestlé là thương hiệu lớn nên mình nghĩ sữa sẽ có quy trình nghiên cứu bài bản hơn",https://www.facebook.com/groups/939853694105892/posts/1730677225023531/?comment_id=1730933494997904,https://www.facebook.com/groups/939853694105892/posts/1730677225023531/
2026-06-29T12:46:20.000Z,1730933654997888,1730933494997904,1,Đỗ Kim Ngân,"đúng là con dùng nan này khỏe từ trong ra ngoài luôn, nên mẹ yên tâm dùng nhé",https://www.facebook.com/groups/939853694105892/posts/1730677225023531/?comment_id=1730933494997904&reply_comment_id=1730933654997888,https://www.facebook.com/groups/939853694105892/posts/1730677225023531/
2026-06-29T12:46:44.000Z,1730933934997860,,0,Hân Gia,"tớ thấy sữa nan a2 thụy sĩ dùng ổn áp đó mom nha, nan này vừa giúp bé tiêu hóa tốt vừa hỗ trợ đề kháng hiệu quả đó mom, nan a2 làm mình chú ý nhờ xuất xứ thụy sĩ và uy tín nghiên cứu của nestlé nè",https://www.facebook.com/groups/939853694105892/posts/1730677225023531/?comment_id=1730933934997860,https://www.facebook.com/groups/939853694105892/posts/1730677225023531/
2026-06-29T12:46:58.000Z,1730934148331172,1730933934997860,1,Hân Gia,"cùng với đó, sữa còn có b. Lactis – lợi khuẩn tốt cho đường ruột, giúp giảm 58% các vấn đề về tiêu hóa",https://www.facebook.com/groups/939853694105892/posts/1730677225023531/?comment_id=1730933934997860&reply_comment_id=1730934148331172,https://www.facebook.com/groups/939853694105892/posts/1730677225023531/
2026-06-29T12:47:15.000Z,1730934494997804,,0,Quân Dương,"nan cam bé e đang ún e thấy ổn áp, con tiêu hóa tốt, bụng con khỏe, đề kháng tốt nè, tham khảo xem, mình đánh giá cao việc kiểm soát từ đầu vào đến đầu ra nha",https://www.facebook.com/groups/939853694105892/posts/1730677225023531/?comment_id=1730934494997804,https://www.facebook.com/groups/939853694105892/posts/1730677225023531/
2026-06-29T12:47:22.000Z,1730934614997792,1730934494997804,1,Ngân Lê,bé nhà mình thuộc team ham chơi hơn ham ăn 😅 nên ngoài nan a2 mình vẫn cẩn thận cho uống thêm sữa nước a2 vào những lúc cần bổ sung nhanh chóng cho con,https://www.facebook.com/groups/939853694105892/posts/1730677225023531/?comment_id=1730934494997804&reply_comment_id=1730934614997792,https://www.facebook.com/groups/939853694105892/posts/1730677225023531/
2026-06-29T12:47:29.000Z,1730934734997780,1730934494997804,1,Quân Dương,sữa nước có nền tảng đạm a2 cùng hmo kế thừa từ nhà nan đó mom nha m,https://www.facebook.com/groups/939853694105892/posts/1730677225023531/?comment_id=1730934494997804&reply_comment_id=1730934734997780,https://www.facebook.com/groups/939853694105892/posts/1730677225023531/
2026-06-29T12:47:34.000Z,1730934791664441,1730934494997804,1,Ngân Lê,trộm vía cân nặng bé không bị tụt như mình từng lo lắng đâu,https://www.facebook.com/groups/939853694105892/posts/1730677225023531/?comment_id=1730934494997804&reply_comment_id=1730934791664441,https://www.facebook.com/groups/939853694105892/posts/1730677225023531/
2026-06-29T12:47:54.000Z,1730935034997750,,0,Vũ Quỳnh,"tham khảo nan cam coi c, dòng này sữa ún con tiêu hóa tốt, đề kháng khỏe do tp có 6hmo kết hợp đạm a2, mình khá an tâm với các sản phẩm có xuất xứ thụy sĩ á",https://www.facebook.com/groups/939853694105892/posts/1730677225023531/?comment_id=1730935034997750,https://www.facebook.com/groups/939853694105892/posts/1730677225023531/
2026-06-29T12:48:02.000Z,1730935121664408,1730935034997750,1,Công Hậu,"mình thấy sau 1 tuổi việc duy trì nan a2 kết hợp sữa nước a2 giúp mẹ cẩn thận chủ động hơn hẳn. nhất là những ngày chạy lịch học, lịch chơi của con mỗi ngày",https://www.facebook.com/groups/939853694105892/posts/1730677225023531/?comment_id=1730935034997750&reply_comment_id=1730935121664408,https://www.facebook.com/groups/939853694105892/posts/1730677225023531/
2026-06-29T12:48:07.000Z,1730935164997737,1730935034997750,1,Vũ Quỳnh,sữa nước có nền tảng a2 với hmo nên mình khá tin tưởng nhiều hơn hẳn,https://www.facebook.com/groups/939853694105892/posts/1730677225023531/?comment_id=1730935034997750&reply_comment_id=1730935164997737,https://www.facebook.com/groups/939853694105892/posts/1730677225023531/
2026-06-29T12:48:10.000Z,1730935208331066,1730935034997750,1,Công Hậu,"chiều cao với cân nặng của con cũng phát triển đều đặn hơn, kidsplaza hay có quà tặng kèm khi mua nan cho bé nè, bé nhà mình thích lắm luôn nhá",https://www.facebook.com/groups/939853694105892/posts/1730677225023531/?comment_id=1730935034997750&reply_comment_id=1730935208331066,https://www.facebook.com/groups/939853694105892/posts/1730677225023531/
