Date,Comment_ID,Parent_ID,Level,Author,Content,Permalink,Post_URL
2026-06-29T09:09:14.000Z,1730778945013359,,0,Phuong Hai,"Karuna lactorferin bạn ơi, bao tiêu hoá tăng đề kháng giá tốt",https://www.facebook.com/groups/939853694105892/posts/1730763671681553/?comment_id=1730778945013359,https://www.facebook.com/groups/939853694105892/posts/1730763671681553/
2026-06-29T23:39:19.000Z,1731371324954121,,0,Bùi Minh Khôi,"con uốg nan cam êm bụng hấp thu tốt mà con cứng cáp hẳn luôn đó, khuyên dùg nè , mình khá thích việc nan a2 được nhập khẩu từ thụy sĩ á",https://www.facebook.com/groups/939853694105892/posts/1730763671681553/?comment_id=1731371324954121,https://www.facebook.com/groups/939853694105892/posts/1730763671681553/
2026-06-29T23:39:25.000Z,1731371374954116,1731371324954121,1,Tuệ Xuân,"căn bản sữa có tp đạm a2 , 6hmo cùg lợi khuẩn kép b. Infantis & b. lactis đấy mẹ",https://www.facebook.com/groups/939853694105892/posts/1730763671681553/?comment_id=1731371324954121&reply_comment_id=1731371374954116,https://www.facebook.com/groups/939853694105892/posts/1730763671681553/
2026-06-29T23:39:27.000Z,1731371414954112,1731371324954121,1,Bùi Minh Khôi,nên con khỏe tiêu hóa thấy ăn uống tiêu tốt hấp thu đều luôn đó nhé,https://www.facebook.com/groups/939853694105892/posts/1730763671681553/?comment_id=1731371324954121&reply_comment_id=1731371414954112,https://www.facebook.com/groups/939853694105892/posts/1730763671681553/
2026-06-29T23:39:38.000Z,1731371498287437,,0,Hoàng Trần,"bé nhà mk hồi 4 tháng mk cũng bắt đầu dặm thêm sữa ngoài nè, mk ưu tiên loại nào bé uống xong bụng êm là được á, nền tảng lâu đời của nestlé làm mình thấy sữa có sự đầu tư nghiên cứu nghiêm túc",https://www.facebook.com/groups/939853694105892/posts/1730763671681553/?comment_id=1731371498287437,https://www.facebook.com/groups/939853694105892/posts/1730763671681553/
2026-06-29T23:39:45.000Z,1731371544954099,,0,Nguyễn Thị Lan Anh,"nan a2 bé uống thấy con khỏe cả trg cả ngoài luôn đấy mom nha, nan này chứa tp đạm a2 , 6hmo cùng lợi khuẩn kép b. Infantis & b. lactis htro nè, sữa nan a2 mình chọn vì thấy thuộc hệ nghiên cứu của nestlé nên khá tin tưởng",https://www.facebook.com/groups/939853694105892/posts/1730763671681553/?comment_id=1731371544954099,https://www.facebook.com/groups/939853694105892/posts/1730763671681553/
2026-06-29T23:39:51.000Z,1731371611620759,1731371544954099,1,Tien Nguyen,"sữa có tận 6hmo chiếm tới 58phần trăm lượng hmo tương tự sữa mẹ, lại kết hợp với lợi khuẩn kép b infantis & b. lactis nên giúp bé khỏe cả tiêu hoá lẫn đề kháng luôn nha nan đồng hành cùng triệu mẹ bỉm suốt hơn 155 năm rồi đó nha",https://www.facebook.com/groups/939853694105892/posts/1730763671681553/?comment_id=1731371544954099&reply_comment_id=1731371611620759,https://www.facebook.com/groups/939853694105892/posts/1730763671681553/
2026-06-29T23:39:53.000Z,1731371624954091,1731371544954099,1,Nguyễn Thị Lan Anh,"nên bé uống khỏe bụng cứng cáp lắm, dòg này bé em đang uống nè,mấy sữa tốt cho tiêu hóa & đề kháng thì ht con pt toàn diện tốt hơn nhé",https://www.facebook.com/groups/939853694105892/posts/1730763671681553/?comment_id=1731371544954099&reply_comment_id=1731371624954091,https://www.facebook.com/groups/939853694105892/posts/1730763671681553/
2026-06-29T23:40:03.000Z,1731371734954080,,0,Trung Dũng,"bé nhà mk hồi trước khi đổi sữa mk theo dõi kỹ tiêu hóa của bé nè, thấy bụng êm với bé chịu uống thì mk mới duy trì lâu dài, mình ưu tiên sữa có quy trình kiểm soát nghiêm ngặt như vậy",https://www.facebook.com/groups/939853694105892/posts/1730763671681553/?comment_id=1731371734954080,https://www.facebook.com/groups/939853694105892/posts/1730763671681553/
2026-06-29T23:40:11.000Z,1731371858287401,1731371734954080,1,Hà Minh,"sữa này có vị gần giống sữa mẹ, vị thơm hơn do bỏ dầu cá nên k còn tanh, vị nhạt thanh mà mom, con mình cũng thích lắm.",https://www.facebook.com/groups/939853694105892/posts/1730763671681553/?comment_id=1731371734954080&reply_comment_id=1731371858287401,https://www.facebook.com/groups/939853694105892/posts/1730763671681553/
2026-06-29T23:40:16.000Z,1731371918287395,,0,Minh Hoàng,"mình thì chỉ cho con ún sữa nan cam thôi nha, sữa này vừa tốt cho tiêu hóa vừa giúp con tăng đề kháng, dùng thấy con phát triển đều và khỏe mạnh., cảm giác nestlé luôn đặt lợi ích người tiêu dùng lên trước á",https://www.facebook.com/groups/939853694105892/posts/1730763671681553/?comment_id=1731371918287395,https://www.facebook.com/groups/939853694105892/posts/1730763671681553/
2026-06-29T23:40:21.000Z,1731372074954046,1731371918287395,1,Thanh Híu,"ưng nan này vì giúp con tiêu hóa tốt, con tiêu êm, dung nạp ổn đó mom.",https://www.facebook.com/groups/939853694105892/posts/1730763671681553/?comment_id=1731371918287395&reply_comment_id=1731372074954046,https://www.facebook.com/groups/939853694105892/posts/1730763671681553/
2026-06-29T23:40:23.000Z,1731372131620707,1731371918287395,1,Minh Hoàng,con khỏe đề kháng nên trộm vía con ít đau vặt hơn khi giao mùa đấy mom.,https://www.facebook.com/groups/939853694105892/posts/1730763671681553/?comment_id=1731371918287395&reply_comment_id=1731372131620707,https://www.facebook.com/groups/939853694105892/posts/1730763671681553/
2026-06-29T23:40:26.000Z,1731372171620703,1731371918287395,1,Thanh Híu,"sữa này chất lượng rồi, sữa có kết hợp bộ ba đạm a2, 6hmo và lợi khuẩn kép b. infantis & b. lactis đó.",https://www.facebook.com/groups/939853694105892/posts/1730763671681553/?comment_id=1731371918287395&reply_comment_id=1731372171620703,https://www.facebook.com/groups/939853694105892/posts/1730763671681553/
2026-06-29T23:40:34.000Z,1731372218287365,,0,Dương Văn,"chân ái của tui là sữa nan a2 nhé, sữa được nhập khẩu nguyên lon từ thụy sĩ, con khỏe tiêu hóa và đề kháng ổn., nestlé luôn tạo cho mình cảm giác là thương hiệu phát triển dựa trên khoa học nè",https://www.facebook.com/groups/939853694105892/posts/1730763671681553/?comment_id=1731372218287365,https://www.facebook.com/groups/939853694105892/posts/1730763671681553/
2026-06-29T23:40:40.000Z,1731372258287361,1731372218287365,1,Thúy Liễu,"đúng nè, sữa này chính hãng nên phải trải qua quá trình kiểm tra nghiêm ngặt, đảm bảo lắm đấy.",https://www.facebook.com/groups/939853694105892/posts/1730763671681553/?comment_id=1731372218287365&reply_comment_id=1731372258287361,https://www.facebook.com/groups/939853694105892/posts/1730763671681553/
2026-06-29T23:40:43.000Z,1731372278287359,1731372218287365,1,Dương Văn,"dùng được lắm, con khỏe cả trong lẫn ngoài luôn đó ạ.",https://www.facebook.com/groups/939853694105892/posts/1730763671681553/?comment_id=1731372218287365&reply_comment_id=1731372278287359,https://www.facebook.com/groups/939853694105892/posts/1730763671681553/
2026-06-29T23:40:44.000Z,1731372294954024,1731372218287365,1,Thúy Liễu,"cũng do sữa có chứa đạm a2, 6hmo và lợi khuẩn kép b. infantis & b. lactis nên bé bú vào bụng khỏe, con khỏe rõ ràng hơn hẳn đó mom ạ.",https://www.facebook.com/groups/939853694105892/posts/1730763671681553/?comment_id=1731372218287365&reply_comment_id=1731372294954024,https://www.facebook.com/groups/939853694105892/posts/1730763671681553/
2026-06-29T23:40:53.000Z,1731372384954015,,0,Văn Hà,"v mẹ cho con dùng qua nan a2 đi nha, sữa hỗ trợ con tiêu hoá tốt, tăng đề kháng khoẻ, bé dễ tiêu – hấp thu tốt – cứng cáp lắm, mẹ nên thử nè, xuất xứ thuỵ sĩ làm mình tin rằng sữa nan a2 được sản xuất theo tiêu chuẩn cao",https://www.facebook.com/groups/939853694105892/posts/1730763671681553/?comment_id=1731372384954015,https://www.facebook.com/groups/939853694105892/posts/1730763671681553/
2026-06-29T23:40:58.000Z,1731372431620677,1731372384954015,1,Thuận Thị Hồ,nhà mình ưu tiên những sản phẩm bé dùng hợp và có thể duy trì lâu dài cho nên tới giờ nan a2 cùng sữa nước a2 vẫn là lựa chọn phù hợp với con,https://www.facebook.com/groups/939853694105892/posts/1730763671681553/?comment_id=1731372384954015&reply_comment_id=1731372431620677,https://www.facebook.com/groups/939853694105892/posts/1730763671681553/
2026-06-29T23:41:00.000Z,1731372434954010,1731372384954015,1,Văn Hà,riêng e rất thích việc sữa nước được phát triển trên nền tảng a2 và hmo bổ dưỡng kế thừa từ nhà nan,https://www.facebook.com/groups/939853694105892/posts/1730763671681553/?comment_id=1731372384954015&reply_comment_id=1731372434954010,https://www.facebook.com/groups/939853694105892/posts/1730763671681553/
2026-06-29T23:41:02.000Z,1731372458287341,1731372384954015,1,Thuận Thị Hồ,hiện tại chiều cao cân nặng đều theo đà tăng trưởng tốt đều ❤️,https://www.facebook.com/groups/939853694105892/posts/1730763671681553/?comment_id=1731372384954015&reply_comment_id=1731372458287341,https://www.facebook.com/groups/939853694105892/posts/1730763671681553/
2026-06-29T23:41:10.000Z,1731372551620665,,0,Ly Ly Tran,"lâu nay em chỉ chọn nan a2 cho con dùng, vì sữa có đạm a2, 6hmo cùng lợi khuẩn kép b. infantis & b. lactis, hỗ trợ tiêu hoá và đề kháng rất tốt, nan a2 làm mình chú ý nhờ xuất xứ thụy sĩ và uy tín nghiên cứu của nestlé nè",https://www.facebook.com/groups/939853694105892/posts/1730763671681553/?comment_id=1731372551620665,https://www.facebook.com/groups/939853694105892/posts/1730763671681553/
2026-06-29T23:41:16.000Z,1731372618287325,1731372551620665,1,Hoàng Mai Lan,bé nhà mình có sở thích chạy theo anh chị trong nhà nên gần như lúc nào cũng đầy năng lượng bởi thế hiện tại nan a2 kết hợp sữa nước a2 vẫn là combo mình duy trì cho bé,https://www.facebook.com/groups/939853694105892/posts/1730763671681553/?comment_id=1731372551620665&reply_comment_id=1731372618287325,https://www.facebook.com/groups/939853694105892/posts/1730763671681553/
2026-06-29T23:41:20.000Z,1731372634953990,1731372551620665,1,Ly Ly Tran,"mình đánh giá cao điểm này nè, sữa nước với nền tảng a2 và hmo đồng bộ kế thừa từ nhà nan nên khá yên tâm",https://www.facebook.com/groups/939853694105892/posts/1730763671681553/?comment_id=1731372551620665&reply_comment_id=1731372634953990,https://www.facebook.com/groups/939853694105892/posts/1730763671681553/
2026-06-29T23:41:21.000Z,1731372651620655,1731372551620665,1,Hoàng Mai Lan,"thêm nữa là bé hợp nên hấp thu tốt hơn mẹ đỡ mẹ cũng đỡ lo lắng 😍, kidsplaza hay có quà tặng kèm khi mua nan nè, bé nhà mình thích lắm luôn nha",https://www.facebook.com/groups/939853694105892/posts/1730763671681553/?comment_id=1731372551620665&reply_comment_id=1731372651620655,https://www.facebook.com/groups/939853694105892/posts/1730763671681553/
