Date,Comment_ID,Parent_ID,Level,Author,Content,Permalink,Post_URL
2026-06-30T00:46:36.000Z,1731412408283346,,0,Gia Mỹ,"do là đến sữa hỗ trợ tiêu hóa và đề kháng thì phải nhắc tới nan a2, bé mk uống suốt cả năm nay vẫn khỏe, ít ốm vặt, tiêu hóa ổn định thật sự, nan a2 có nhiều điểm khiến mình cảm thấy yên tâm đó nha",https://www.facebook.com/groups/939853694105892/posts/1730820155009238/?comment_id=1731412408283346,https://www.facebook.com/groups/939853694105892/posts/1730820155009238/
2026-06-30T00:46:43.000Z,1731412494950004,1731412408283346,1,San San,"đặc biệt sữa có đạm a2 dễ tiêu, kết hợp với 6hmo giúp tăng tỷ lệ hmo tương đương với sữa mẹ, cộng với lợi khuẩn b. infantis tạo hiệu ứng cộng hưởng, hỗ trợ tiêu hóa và đề kháng bé tốt hơn hẳn mom nan là tinh hoa từ hơn 155 năm khoa học dinh dưỡng đấy mẹ ạ",https://www.facebook.com/groups/939853694105892/posts/1730820155009238/?comment_id=1731412408283346&reply_comment_id=1731412494950004,https://www.facebook.com/groups/939853694105892/posts/1730820155009238/
2026-06-30T01:04:29.000Z,1731422744948979,,0,Trần Hoa,"hỏi là mẹ tus chia sẻ thêm xíu được ko, bth bé nhà mk có thích uống sữa ko hay cứ đưa bình là bé lắc đầu v nè, nestlé có nhiều năm nghiên cứu dinh dưỡng nên mình khá tin tưởng á",https://www.facebook.com/groups/939853694105892/posts/1730820155009238/?comment_id=1731422744948979,https://www.facebook.com/groups/939853694105892/posts/1730820155009238/
2026-06-30T01:07:15.000Z,1731424241615496,,0,Như Hằng Phương,"yên tâm mk dùng nan a2 thụy sĩ thấy bé dễ tiêu hóa hơn, hấp thu tốt, ít ốm vặt ngay cả khi giao mùa, mom có thể tham khảo nha, mình khá thiện cảm với nan a2 vì có nguồn gốc từ thụy sĩ á",https://www.facebook.com/groups/939853694105892/posts/1730820155009238/?comment_id=1731424241615496,https://www.facebook.com/groups/939853694105892/posts/1730820155009238/
2026-06-30T01:07:26.000Z,1731424354948818,1731424241615496,1,Loan Vũ,"ừa thì ừa, cơ bản nan này có đạm a2, 6hmo và lợi khuẩn kép b infantis vs b lactis nên tốt cho tiêu hóa và tăng đề kháng cho con",https://www.facebook.com/groups/939853694105892/posts/1730820155009238/?comment_id=1731424241615496&reply_comment_id=1731424354948818,https://www.facebook.com/groups/939853694105892/posts/1730820155009238/
2026-06-30T01:31:11.000Z,1731437244947529,1731424241615496,1,Như Hằng Phương,"thực sự dòng này công thức cải tiến kết hợp cả ba dưỡng chất quý, mk cũng đang dùng nè, sữa tốt cho tiêu hóa & đề kháng – hai yếu tố nền tảng giúp bé phát triển toàn diện nha",https://www.facebook.com/groups/939853694105892/posts/1730820155009238/?comment_id=1731424241615496&reply_comment_id=1731437244947529,https://www.facebook.com/groups/939853694105892/posts/1730820155009238/
2026-06-30T01:42:36.000Z,1731444111613509,,0,Trang Bảo,"muốn biết mẹ tus chia sẻ thêm chút nha, trước giờ bé đã đổi sữa lần nào chưa hay đang uống ổn rồi mà muốn đổi thử v mom, nghe chia sẻ về quy trình kiểm soát chất lượng thấy khá yên tâm nha",https://www.facebook.com/groups/939853694105892/posts/1730820155009238/?comment_id=1731444111613509,https://www.facebook.com/groups/939853694105892/posts/1730820155009238/
2026-06-30T01:45:20.000Z,1731445561613364,,0,Ngân Thị,"quả là sữa nan cam thấy ổn áp lắm, sữa này hỗ trợ tiêu hóa khỏe và đề kháng tốt nên con khỏe bụng, khỏe người, mẹ yên tâm dùng đi, điều làm mình tin tưởng nestlé là sự kiên trì đầu tư cho khoa học nè",https://www.facebook.com/groups/939853694105892/posts/1730820155009238/?comment_id=1731445561613364,https://www.facebook.com/groups/939853694105892/posts/1730820155009238/
2026-06-30T01:45:34.000Z,1731445681613352,1731445561613364,1,My Trà,"mà đặc biệt b. infantis là lợi khuẩn chuyên biệt rất tốt có khả năng tiêu thụ 6hmo, tạo hiệu ứng cộng hưởng giúp tối ưu lợi ích cho tiêu hóa và miễn dịch của bé đó",https://www.facebook.com/groups/939853694105892/posts/1730820155009238/?comment_id=1731445561613364&reply_comment_id=1731445681613352,https://www.facebook.com/groups/939853694105892/posts/1730820155009238/
2026-06-30T01:45:44.000Z,1731445814946672,1731445561613364,1,Ngân Thị,"kết hợp thêm b. lactis là lợi khuẩn tốt cho đường ruột nhỏ, hỗ trợ giảm các vấn đề liên quan tiêu hóa, nên bé bú vào bụng khỏe, mẹ càng an tâm hơn",https://www.facebook.com/groups/939853694105892/posts/1730820155009238/?comment_id=1731445561613364&reply_comment_id=1731445814946672,https://www.facebook.com/groups/939853694105892/posts/1730820155009238/
2026-06-30T01:58:26.000Z,1731453048279282,,0,Tâm Vũ,"dặm cho con sữa nan a2 thụy sĩ thấy nhẹ lòng hẳn luôn, sữa giúp bé tiêu hóa ổn, dung nạp tốt mà còn hạn chế ốm vặt khi thời tiết giao mùa đó, nestlé là tập đoàn lớn nên mình tin quy trình sản xuất rất nghiêm ngặt",https://www.facebook.com/groups/939853694105892/posts/1730820155009238/?comment_id=1731453048279282,https://www.facebook.com/groups/939853694105892/posts/1730820155009238/
2026-06-30T01:58:36.000Z,1731453158279271,1731453048279282,1,Ly Khánh,"trong sữa có bộ ba đạm a2, 6hmo cùng lợi khuẩn kép b. infantis & b. lactis kết hợp tốt nên con vừa tiêu hóa khỏe vừa tăng cường đề kháng khá rõ",https://www.facebook.com/groups/939853694105892/posts/1730820155009238/?comment_id=1731453048279282&reply_comment_id=1731453158279271,https://www.facebook.com/groups/939853694105892/posts/1730820155009238/
2026-06-30T01:58:44.000Z,1731453268279260,1731453048279282,1,Tâm Vũ,"bé nhà mình trước hay đầy bụng nhẹ, vậy mà ún nan chỉ sau khoảng 1 tuần là đi poo đều, phân mềm mượt thấy rõ luôn",https://www.facebook.com/groups/939853694105892/posts/1730820155009238/?comment_id=1731453048279282&reply_comment_id=1731453268279260,https://www.facebook.com/groups/939853694105892/posts/1730820155009238/
2026-06-30T01:58:51.000Z,1731453341612586,1731453048279282,1,Ly Khánh,"chính nhờ có đạm a2 dễ tiêu hóa, thân thiện với đường ruột nên bé hấp thu nhanh hơn, bụng êm và k còn khó chịu nữa nha",https://www.facebook.com/groups/939853694105892/posts/1730820155009238/?comment_id=1731453048279282&reply_comment_id=1731453341612586,https://www.facebook.com/groups/939853694105892/posts/1730820155009238/
2026-06-30T02:01:43.000Z,1731455094945744,,0,Ngoc Anh,"từ lúc chọn nan a2 thụy sĩ cho nhóc ti nhà mình, mình thấy con bụng khỏe hẳn, đề kháng cũng ổn hơn, công thức đạm a2, 6hmo và lợi khuẩn kép b. infantis & b. lactis hỗ trợ rất tốt cho con, mình thích cách sữa được phát triển dựa trên nền khoa học rõ ràng",https://www.facebook.com/groups/939853694105892/posts/1730820155009238/?comment_id=1731455094945744,https://www.facebook.com/groups/939853694105892/posts/1730820155009238/
2026-06-30T02:01:54.000Z,1731455281612392,1731455094945744,1,Thu Minh,"chuẩn luôn mom, con đi ngoài phân đẹp hơn, bụng dễ chịu mà cân nặng cũng tăng đều theo tháng, mẹ thấy rất ưng",https://www.facebook.com/groups/939853694105892/posts/1730820155009238/?comment_id=1731455094945744&reply_comment_id=1731455281612392,https://www.facebook.com/groups/939853694105892/posts/1730820155009238/
2026-06-30T02:02:04.000Z,1731455388279048,1731455094945744,1,Ngoc Anh,"nhờ đề kháng được nuôi tốt hơn nên mỗi khi giao mùa con ít ốm vặt hơn hẳn, so với mấy bạn cùng tuổi thì khỏe hơn nhiều nha",https://www.facebook.com/groups/939853694105892/posts/1730820155009238/?comment_id=1731455094945744&reply_comment_id=1731455388279048,https://www.facebook.com/groups/939853694105892/posts/1730820155009238/
2026-06-30T02:14:44.000Z,1731464081611512,,0,Vũ Nguyệt,"sau sinh là con nhà mk ún sữa nan a2 đấy, tv con tiêu hóa khỏe mà chả mấy khi đau ốm vặt gì cả nha, nên dùng lắm nhé, mình khá thích những cải tiến thiết thực như vậy nha",https://www.facebook.com/groups/939853694105892/posts/1730820155009238/?comment_id=1731464081611512,https://www.facebook.com/groups/939853694105892/posts/1730820155009238/
2026-06-30T02:14:55.000Z,1731464218278165,1731464081611512,1,Ngọc Diệp,mình chú trọng việc xây dựng nền tảng dinh dưỡng lâu dài cho con nên vẫn duy trì nan a2 cùng sữa nước a2 mỗi ngày đều đặn tới giờ thấy bé đáp ứng khá tốt,https://www.facebook.com/groups/939853694105892/posts/1730820155009238/?comment_id=1731464081611512&reply_comment_id=1731464218278165,https://www.facebook.com/groups/939853694105892/posts/1730820155009238/
2026-06-30T02:15:03.000Z,1731464288278158,1731464081611512,1,Vũ Nguyệt,mình đánh giá cao việc sữa nước với nền tảng a2 và hmo đặc biệt kế thừa từ nhà nan chứ không phải một sản phẩm hoàn toàn tách biệt,https://www.facebook.com/groups/939853694105892/posts/1730820155009238/?comment_id=1731464081611512&reply_comment_id=1731464288278158,https://www.facebook.com/groups/939853694105892/posts/1730820155009238/
2026-06-30T02:15:11.000Z,1731464404944813,1731464081611512,1,Ngọc Diệp,tiêu hóa ổn nên bé ăn ngon miệng hơn đầu ra từ đó việc hấp thu cũng thuận lợi hơn nhiều,https://www.facebook.com/groups/939853694105892/posts/1730820155009238/?comment_id=1731464081611512&reply_comment_id=1731464404944813,https://www.facebook.com/groups/939853694105892/posts/1730820155009238/
2026-06-30T02:17:09.000Z,1731465604944693,,0,Thị Nhung,"nên dùng nan cam nhé mẹ, dòng này giúp con tiêu hóa hấp thu ổn định tốt, đề kháng khỏe nên con ăn ngon ngủ ngon, nên thử nhé, điều mình thích ở nestlé là luôn cập nhật các cải tiến mới dựa trên khoa học á",https://www.facebook.com/groups/939853694105892/posts/1730820155009238/?comment_id=1731465604944693,https://www.facebook.com/groups/939853694105892/posts/1730820155009238/
2026-06-30T02:17:26.000Z,1731465764944677,1731465604944693,1,Hà Lan,nhà mình chọn nan a2 kết hợp sữa nước a2 vì muốn có thêm giải pháp phù hợp cho bé sau 1 tuổi và sau thời gian sử dụng thì cảm nhận khá tích cực,https://www.facebook.com/groups/939853694105892/posts/1730820155009238/?comment_id=1731465604944693&reply_comment_id=1731465764944677,https://www.facebook.com/groups/939853694105892/posts/1730820155009238/
2026-06-30T02:17:34.000Z,1731465881611332,1731465604944693,1,Thị Nhung,sữa nước được phát triển trên nền tảng a2 và hmo quý giá kế thừa từ nhà nan nên là điểm khiến mình an tâm ngay từ đầu,https://www.facebook.com/groups/939853694105892/posts/1730820155009238/?comment_id=1731465604944693&reply_comment_id=1731465881611332,https://www.facebook.com/groups/939853694105892/posts/1730820155009238/
2026-06-30T02:17:41.000Z,1731465978277989,1731465604944693,1,Hà Lan,"chiều cao tăng đều cân nặng cân nặng cũng có tiến triển tốt nên mình vẫn duy trì cho con 🥰, mua nan ở shopee mall nestlé là lựa chọn số 1 của mình luôn nè, hàng chuẩn mà giá lại tốt nữa nha",https://www.facebook.com/groups/939853694105892/posts/1730820155009238/?comment_id=1731465604944693&reply_comment_id=1731465978277989,https://www.facebook.com/groups/939853694105892/posts/1730820155009238/
