Date,Comment_ID,Parent_ID,Level,Author,Content,Permalink,Post_URL
2026-04-29T21:51:53.000Z,4711288512461376,,0,Hoàng Cẩm Kiên,"mẹ nên đổi sang nan supreme như mk nè, qua sữa này con ăn uống hấp thu được lên cân đều con có lực khỏe mạnh ko mấy khi hay ốm vặt đâu",https://www.facebook.com/groups/riviesuacongthuc/posts/4705307599726134/?comment_id=4711288512461376,https://www.facebook.com/groups/riviesuacongthuc/posts/4705307599726134/
2026-04-29T21:52:00.000Z,4711288655794695,4711288512461376,1,Hoàng Cẩm Kiên,tp 5hmo là tp có nhiều trong sữa mẹ nên là con miễn dịch tốt lắm,https://www.facebook.com/groups/riviesuacongthuc/posts/4705307599726134/?comment_id=4711288512461376&reply_comment_id=4711288655794695,https://www.facebook.com/groups/riviesuacongthuc/posts/4705307599726134/
2026-04-29T21:52:43.000Z,4711289299127964,,0,Trịnh Ái Hiền,"nên đổi qua nan sup xem nhé, con uống ptr khỏe mạnh luôn là có lực lắm đấy nè",https://www.facebook.com/groups/riviesuacongthuc/posts/4705307599726134/?comment_id=4711289299127964,https://www.facebook.com/groups/riviesuacongthuc/posts/4705307599726134/
2026-04-29T21:52:54.000Z,4711289482461279,4711289299127964,1,Hy Ka Ngô,Trịnh Ái Hiền con ti khỏe nở nang ít thấy vấn đề ho hắng nhé,https://www.facebook.com/groups/riviesuacongthuc/posts/4705307599726134/?comment_id=4711289299127964&reply_comment_id=4711289482461279,https://www.facebook.com/groups/riviesuacongthuc/posts/4705307599726134/
2026-04-29T21:52:56.000Z,4711289515794609,4711289299127964,1,Trịnh Ái Hiền,sữa bs 5hmo htr miễn dịch tốt tăng đề kháng vô cùng thik lắm mẹ,https://www.facebook.com/groups/riviesuacongthuc/posts/4705307599726134/?comment_id=4711289299127964&reply_comment_id=4711289515794609,https://www.facebook.com/groups/riviesuacongthuc/posts/4705307599726134/
