Date,Comment_ID,Parent_ID,Level,Author,Content,Permalink,Post_URL
2026-05-10T04:54:49.000Z,4721446784778882,,0,Ngân Bình Hoàng,"tớ thấy bản thân mình dùng nan optipro plus cho bé một thời gian thấy tiêu hóa cải thiện rõ, bé ăn chơi khỏe và cân nặng tăng đều ổn định",https://www.facebook.com/groups/riviesuacongthuc/posts/4715659498690944/?comment_id=4721446784778882,https://www.facebook.com/groups/riviesuacongthuc/posts/4715659498690944/
2026-05-10T04:54:57.000Z,4721446864778874,4721446784778882,1,Trương Linh Hảo,"Ngân Bình Hoàng ủa mà dòng này nghe ổn quá, trong sữa có những gì vậy mom mách tớ",https://www.facebook.com/groups/riviesuacongthuc/posts/4715659498690944/?comment_id=4721446784778882&reply_comment_id=4721446864778874,https://www.facebook.com/groups/riviesuacongthuc/posts/4715659498690944/
2026-05-10T04:54:59.000Z,4721446894778871,4721446784778882,1,Ngân Bình Hoàng,mẹ ơi nan hỗ trợ tiêu hóa tốt nhờ có lợi khuẩn bifidus bl nên bé dễ tiêu và hấp thu tốt hơn cực kỳ,https://www.facebook.com/groups/riviesuacongthuc/posts/4715659498690944/?comment_id=4721446784778882&reply_comment_id=4721446894778871,https://www.facebook.com/groups/riviesuacongthuc/posts/4715659498690944/
2026-05-10T04:55:01.000Z,4721446924778868,4721446784778882,1,Trương Linh Hảo,"may quá tốt quá, vậy nên mua ở đâu cho yên tâm mom cho chuẩn",https://www.facebook.com/groups/riviesuacongthuc/posts/4715659498690944/?comment_id=4721446784778882&reply_comment_id=4721446924778868,https://www.facebook.com/groups/riviesuacongthuc/posts/4715659498690944/
2026-05-10T04:55:03.000Z,4721446948112199,4721446784778882,1,Ngân Bình Hoàng,yên tâm nhé mình thấy mua ở kids plaza hoặc đặt trên tiktok shop cũng khá đảm bảo đó mom chuẩn xịn,https://www.facebook.com/groups/riviesuacongthuc/posts/4715659498690944/?comment_id=4721446784778882&reply_comment_id=4721446948112199,https://www.facebook.com/groups/riviesuacongthuc/posts/4715659498690944/
2026-05-10T04:55:12.000Z,4721447088112185,,0,Bùi Bảo Thiện,"trộm vía bé nhà mình đang uống nan thụy sĩ đó mom, sữa có đạm optipro nên bé tiêu hóa ổn, hấp thu tốt nên nhìn trộm vía bụ bẫm hơn phổng phao",https://www.facebook.com/groups/riviesuacongthuc/posts/4715659498690944/?comment_id=4721447088112185,https://www.facebook.com/groups/riviesuacongthuc/posts/4715659498690944/
2026-05-10T04:55:19.000Z,4721447178112176,4721447088112185,1,Lam Khuê Hoàng,"Bùi Bảo Thiện vui ghê từ khi chuyển sang nan thấy bụng bé dễ chịu hơn nhiều, không còn quấy do khó tiêu nữa nhàn mẹ",https://www.facebook.com/groups/riviesuacongthuc/posts/4715659498690944/?comment_id=4721447088112185&reply_comment_id=4721447178112176,https://www.facebook.com/groups/riviesuacongthuc/posts/4715659498690944/
2026-05-10T04:55:24.000Z,4721447238112170,,0,Bích Loan Ngô,"riêng tui tui là thích nan optipro plus nhất đó mom, vì tỉ lệ đạm whey/casein gần giống sữa mẹ nên bé tiêu hóa tốt và tăng cân đều tăm tắp",https://www.facebook.com/groups/riviesuacongthuc/posts/4715659498690944/?comment_id=4721447238112170,https://www.facebook.com/groups/riviesuacongthuc/posts/4715659498690944/
2026-05-10T04:55:31.000Z,4721447301445497,4721447238112170,1,Lê Hoa Tuyết,"Bích Loan Ngô ủa mà sữa này tốt thật mom, hình như còn hỗ trợ đề kháng nữa đúng không hả mẹ",https://www.facebook.com/groups/riviesuacongthuc/posts/4715659498690944/?comment_id=4721447238112170&reply_comment_id=4721447301445497,https://www.facebook.com/groups/riviesuacongthuc/posts/4715659498690944/
2026-05-10T04:55:34.000Z,4721447324778828,4721447238112170,1,Bích Loan Ngô,đúng rồi đó trong sữa có tới 5hmo nên bé uống ít bị ốm vặt hơn vững vàng,https://www.facebook.com/groups/riviesuacongthuc/posts/4715659498690944/?comment_id=4721447238112170&reply_comment_id=4721447324778828,https://www.facebook.com/groups/riviesuacongthuc/posts/4715659498690944/
2026-05-10T04:55:41.000Z,4721447454778815,,0,Phan Hạnh Vi,"tin tớ đi mình thích nan plus vì sữa giúp bé hấp thu tốt nên cân nặng tăng theo chuẩn who, mình cho bé dùng từ sau sinh luôn chân ái",https://www.facebook.com/groups/riviesuacongthuc/posts/4715659498690944/?comment_id=4721447454778815,https://www.facebook.com/groups/riviesuacongthuc/posts/4715659498690944/
2026-05-10T04:55:53.000Z,4721447611445466,,0,Ngô Bảo Trang,"nhà mình đang cho bé dặm nan thụy sĩ đó mom, thấy bé đi ngoài đều phân đẹp, hấp thu ổn nên nhìn con cũng khỏe mạnh hơn",https://www.facebook.com/groups/riviesuacongthuc/posts/4715659498690944/?comment_id=4721447611445466,https://www.facebook.com/groups/riviesuacongthuc/posts/4715659498690944/
2026-05-10T04:55:58.000Z,4721447694778791,4721447611445466,1,Kim Kha Võ,"Ngô Bảo Trang m thấy chứng nhận chất lượng trong qr của nan khá hữu ích, đọc xong hiểu thêm là sản phẩm đã được kiểm tra thực tế về thành phần",https://www.facebook.com/groups/riviesuacongthuc/posts/4715659498690944/?comment_id=4721447611445466&reply_comment_id=4721447694778791,https://www.facebook.com/groups/riviesuacongthuc/posts/4715659498690944/
2026-05-10T04:56:02.000Z,4721447741445453,4721447611445466,1,Ngô Bảo Trang,"đúng á mom, kiểu hãng cho m tự xem nên cảm giác đáng tin hơn nhiều",https://www.facebook.com/groups/riviesuacongthuc/posts/4715659498690944/?comment_id=4721447611445466&reply_comment_id=4721447741445453,https://www.facebook.com/groups/riviesuacongthuc/posts/4715659498690944/
