Date,Comment_ID,Parent_ID,Level,Author,Content,Permalink,Post_URL
2026-05-19T03:49:47.000Z,4730627467194147,,0,Nguyễn Hợp,"nhắc đến dòng sữa hỗ trợ tiêu hóa và đề kháng thì thực sự phải nhắc tới nan a2, bé mk đã uống cả năm nay vẫn thấy khỏe, ít bị ốm vặt, tiêu hóa cực ổn định thật đó mẹ",https://www.facebook.com/groups/riviesuacongthuc/posts/4717451665178394/?comment_id=4730627467194147,https://www.facebook.com/groups/riviesuacongthuc/posts/4717451665178394/
2026-05-19T03:49:57.000Z,4730627643860796,4730627467194147,1,Bùi Thuận,"sữa hiện có đạm a2 dễ tiêu kết hợp cùng với 6hmo giúp cho phần trăm lượng hmo luôn tương đồng với sữa mẹ, cộng thêm với lợi khuẩn b infantis giúp tạo hiệu ứng cộng hưởng, hỗ trợ cho tiêu hóa và đề kháng bé tốt hơn mẹ ơi nuôi con khoa học với kinh nghiệm hơn 155 năm chứ còn gì nữa",https://www.facebook.com/groups/riviesuacongthuc/posts/4717451665178394/?comment_id=4730627467194147&reply_comment_id=4730627643860796,https://www.facebook.com/groups/riviesuacongthuc/posts/4717451665178394/
2026-05-19T03:50:05.000Z,4730627810527446,4730627467194147,1,Nguyễn Hợp,"dùng nan này thấy bé luôn khỏe, tiêu hóa rất tốt, hấp thu đều và tv khỏe mạnh lắm mom nè",https://www.facebook.com/groups/riviesuacongthuc/posts/4717451665178394/?comment_id=4730627467194147&reply_comment_id=4730627810527446,https://www.facebook.com/groups/riviesuacongthuc/posts/4717451665178394/
2026-05-19T03:50:22.000Z,4730628010527426,,0,Thảo Vân,"mk cho dùng nan a2 thụy sĩ thấy bé cực dễ tiêu hóa, hấp thu rất tốt, ít bị ốm vặt ngay cả vào khi giao mùa, mom hoàn toàn có thể tham khảo nè nhé",https://www.facebook.com/groups/riviesuacongthuc/posts/4717451665178394/?comment_id=4730628010527426,https://www.facebook.com/groups/riviesuacongthuc/posts/4717451665178394/
2026-05-19T03:50:31.000Z,4730628113860749,4730628010527426,1,Ngô Giang,"về cơ bản nan này hiện có đạm a2, 6hmo và lợi khuẩn kép b infantis vs b lactis nên cực tốt cho tiêu hóa và giúp tăng đề kháng của bé m",https://www.facebook.com/groups/riviesuacongthuc/posts/4717451665178394/?comment_id=4730628010527426&reply_comment_id=4730628113860749,https://www.facebook.com/groups/riviesuacongthuc/posts/4717451665178394/
2026-05-19T03:51:31.000Z,4730629143860646,4730628010527426,1,Thảo Vân,"bản này là công thức cải tiến có kết hợp cả ba dưỡng chất cực quý này đó mom, mk hiện cũng đang dùng đây",https://www.facebook.com/groups/riviesuacongthuc/posts/4717451665178394/?comment_id=4730628010527426&reply_comment_id=4730629143860646,https://www.facebook.com/groups/riviesuacongthuc/posts/4717451665178394/
2026-05-19T03:51:40.000Z,4730629227193971,,0,Nguyễn Hồng,kinh nghiệm của mk chính là nếu bé hiện đang bị tiêu chảy thì mom cũng thực sự nên theo dõi thêm về tiêu hóa trc khi quyết định đổi sữa nha,https://www.facebook.com/groups/riviesuacongthuc/posts/4717451665178394/?comment_id=4730629227193971,https://www.facebook.com/groups/riviesuacongthuc/posts/4717451665178394/
2026-05-19T03:51:46.000Z,4730629310527296,,0,Vũ Hiền,"sữa nan cam thấy dùng ổn áp lắm, sữa này giúp hỗ trợ tiêu hóa khỏe và đề kháng cực tốt nên con khỏe bụng lại khỏe mạnh, mẹ hãy yên tâm nha",https://www.facebook.com/groups/riviesuacongthuc/posts/4717451665178394/?comment_id=4730629310527296,https://www.facebook.com/groups/riviesuacongthuc/posts/4717451665178394/
2026-05-19T03:52:03.000Z,4730629510527276,,0,Nguyễn Nụ,"đọc được bài của mom thấy thực sự giống mk hồi tập đầu ghê luôn nè. cho mk hỏi thêm chút chính là bé nhà mom hiện nay được mấy tháng rồi v ạ, đang cho bú mẹ hoàn toàn hay là chuẩn bị dặm thêm sữa ngoài cho con á",https://www.facebook.com/groups/riviesuacongthuc/posts/4717451665178394/?comment_id=4730629510527276,https://www.facebook.com/groups/riviesuacongthuc/posts/4717451665178394/
2026-05-19T03:52:11.000Z,4730629570527270,,0,Nguyễn Thu Ánh,cũng từng có tgian con mk hay đi ngoài khó làm mk lo lắng lắm luôn 😭 cứ luôn phải để ý kỹ bỉm của con suốt,https://www.facebook.com/groups/riviesuacongthuc/posts/4717451665178394/?comment_id=4730629570527270,https://www.facebook.com/groups/riviesuacongthuc/posts/4717451665178394/
2026-05-19T03:52:17.000Z,4730629617193932,,0,Huyền Diệu,"nan a2 thuỵ sĩ bé e hiện đang uống thấy oke nè, bé tiêu hoá rất khoẻ, đề kháng vững, ít bị ốm vặt, mẹ rất ưng đó",https://www.facebook.com/groups/riviesuacongthuc/posts/4717451665178394/?comment_id=4730629617193932,https://www.facebook.com/groups/riviesuacongthuc/posts/4717451665178394/
2026-05-19T03:52:43.000Z,4730629913860569,4730629617193932,1,Huyền Diệu,"nào là hiện có giấy chứng nhận chất lượng, giấy đky sản phẩm, thêm chứng nhận fssc 22000 hay bản chứng nhận iso 9001:2015 đó mẹ nhé",https://www.facebook.com/groups/riviesuacongthuc/posts/4717451665178394/?comment_id=4730629617193932&reply_comment_id=4730629913860569,https://www.facebook.com/groups/riviesuacongthuc/posts/4717451665178394/
2026-05-19T03:52:58.000Z,4730630050527222,,0,Quỳnh Chi,"bé nhà mk hiện ti nan a2 thuỵ sĩ, bụng rất êm, tiêu đều, đề kháng luôn khoẻ nên lúc trở trời rất ít khi bị ốm vặt lắm, mẹ hãy tìm hiểu thử cho bé",https://www.facebook.com/groups/riviesuacongthuc/posts/4717451665178394/?comment_id=4730630050527222,https://www.facebook.com/groups/riviesuacongthuc/posts/4717451665178394/
2026-05-19T03:53:04.000Z,4730630120527215,4730630050527222,1,Đặng Vân,nay mk thấy hiện có lô sữa có thêm mã qr nữa hả mẹ nhỉ,https://www.facebook.com/groups/riviesuacongthuc/posts/4717451665178394/?comment_id=4730630050527222&reply_comment_id=4730630120527215,https://www.facebook.com/groups/riviesuacongthuc/posts/4717451665178394/
2026-05-19T03:53:09.000Z,4730630153860545,4730630050527222,1,Quỳnh Chi,"đúng r mom, nay sữa hiện đang cải tiến có thêm mã qr mới giúp mk kiểm tra thông tin cực nhanh, nhìn vào là thấy rất đáng tin hơn đó mẹ",https://www.facebook.com/groups/riviesuacongthuc/posts/4717451665178394/?comment_id=4730630050527222&reply_comment_id=4730630153860545,https://www.facebook.com/groups/riviesuacongthuc/posts/4717451665178394/
2026-05-19T03:53:12.000Z,4730630203860540,4730630050527222,1,Đặng Vân,tui cx đã thử check mà thấy hiện có cái gì mà chứng nhận iso 9001:2015 đó mẹ,https://www.facebook.com/groups/riviesuacongthuc/posts/4717451665178394/?comment_id=4730630050527222&reply_comment_id=4730630203860540,https://www.facebook.com/groups/riviesuacongthuc/posts/4717451665178394/
2026-05-19T03:53:53.000Z,4730630610527166,,0,Cúc Hoàng,"bé nhà em từ trc cũng hơi còi như bé nhà mom đó, nhưng từ khi đổi qua dùng sữa nan cam thấy con tiêu rất êm mà thấy con tăng cân cực ổn định lắm đấy, mẹ hãy thử đi nhé",https://www.facebook.com/groups/riviesuacongthuc/posts/4717451665178394/?comment_id=4730630610527166,https://www.facebook.com/groups/riviesuacongthuc/posts/4717451665178394/
2026-05-19T03:53:59.000Z,4730630700527157,4730630610527166,1,Phan Tuyến Đại,em thấy mã qr trên nan mà hiện nhiều mom chỉ nói thấy yên tâm thôi chứ thực sự em vẫn chưa hiểu rõ lắm,https://www.facebook.com/groups/riviesuacongthuc/posts/4717451665178394/?comment_id=4730630610527166&reply_comment_id=4730630700527157,https://www.facebook.com/groups/riviesuacongthuc/posts/4717451665178394/
2026-05-19T03:54:05.000Z,4730630773860483,4730630610527166,1,Cúc Hoàng,tại vì ở trong đó hiện có các loại giấy tờ cực cụ thể nên mọi người mới nói thấy yên tâm á nhen,https://www.facebook.com/groups/riviesuacongthuc/posts/4717451665178394/?comment_id=4730630610527166&reply_comment_id=4730630773860483,https://www.facebook.com/groups/riviesuacongthuc/posts/4717451665178394/
2026-05-20T10:58:21.000Z,4732029063720654,,0,Trần Thái Thiên,"con như này là con mẫn cảm thôi đó mom, dùng cho con sữa nan vàng là con cải thiện đấy, sữa này đặc biệt htro tốt cho mấy vde này nha",https://www.facebook.com/groups/riviesuacongthuc/posts/4717451665178394/?comment_id=4732029063720654,https://www.facebook.com/groups/riviesuacongthuc/posts/4717451665178394/
2026-05-20T10:58:27.000Z,4732029153720645,4732029063720654,1,Võ Hạ Nguyên,cơ bản sữa có đạm whey thủy phân 1 phần tốt cho con đấy mom nhé,https://www.facebook.com/groups/riviesuacongthuc/posts/4717451665178394/?comment_id=4732029063720654&reply_comment_id=4732029153720645,https://www.facebook.com/groups/riviesuacongthuc/posts/4717451665178394/
2026-05-20T10:58:30.000Z,4732029187053975,4732029063720654,1,Trần Thái Thiên,"dr, bởi đạm whey thủy phân 1 phần dc chứng minh giúp giảm một nửanguy cơ mẫn cảm da đấy mom nhé",https://www.facebook.com/groups/riviesuacongthuc/posts/4717451665178394/?comment_id=4732029063720654&reply_comment_id=4732029187053975,https://www.facebook.com/groups/riviesuacongthuc/posts/4717451665178394/
2026-05-20T10:58:31.000Z,4732029210387306,4732029063720654,1,Võ Hạ Nguyên,"đạm whey thủy phân 1 phần này nên con dễ tiêu hóa, hấp thu và từ đó giúp ngăn ngừa nguy cơ mẫn cảm đấy",https://www.facebook.com/groups/riviesuacongthuc/posts/4717451665178394/?comment_id=4732029063720654&reply_comment_id=4732029210387306,https://www.facebook.com/groups/riviesuacongthuc/posts/4717451665178394/
2026-05-20T10:58:33.000Z,4732029287053965,4732029063720654,1,Trần Thái Thiên,dùng cho con trvia da dẻ con nhẵn mịn trông cưng hẳn nha,https://www.facebook.com/groups/riviesuacongthuc/posts/4717451665178394/?comment_id=4732029063720654&reply_comment_id=4732029287053965,https://www.facebook.com/groups/riviesuacongthuc/posts/4717451665178394/
2026-05-20T10:58:41.000Z,4732029350387292,,0,Vi Trân Bùi,"giống y chang bé mình đây, như này là con mẫn cảm da nhé, mẹ cho con dung nan sup đấy, ưu tiên htro mấy vde này nha",https://www.facebook.com/groups/riviesuacongthuc/posts/4717451665178394/?comment_id=4732029350387292,https://www.facebook.com/groups/riviesuacongthuc/posts/4717451665178394/
2026-05-20T10:58:49.000Z,4732029477053946,4732029350387292,1,Trịnh Tuyết Hoa,con uống thấy da dẻ con hồng hào mình an tâm lắm đấy mom nhé,https://www.facebook.com/groups/riviesuacongthuc/posts/4717451665178394/?comment_id=4732029350387292&reply_comment_id=4732029477053946,https://www.facebook.com/groups/riviesuacongthuc/posts/4717451665178394/
2026-05-20T10:58:54.000Z,4732029557053938,,0,Nguyễn Bích Hạnh,"em thấy chọn sữa chính hãng bao giờ cũng yên tâm hơn, như nan sup bé nhà em uống khỏe mạnh, phát triển tốt lắm đó nhen",https://www.facebook.com/groups/riviesuacongthuc/posts/4717451665178394/?comment_id=4732029557053938,https://www.facebook.com/groups/riviesuacongthuc/posts/4717451665178394/
2026-05-20T10:59:00.000Z,4732029657053928,4732029557053938,1,Võ Hạ Nguyên,"đúng rồi đó, nan này do nestle nhập khẩu nguyên lon từ đức nên đảm bảo an toàn lắm mom",https://www.facebook.com/groups/riviesuacongthuc/posts/4717451665178394/?comment_id=4732029557053938&reply_comment_id=4732029657053928,https://www.facebook.com/groups/riviesuacongthuc/posts/4717451665178394/
2026-05-20T10:59:02.000Z,4732029680387259,4732029557053938,1,Nguyễn Bích Hạnh,"phải ha, sữa chuẩn chính hãng từ đức mà còn có mã qr nữa, mẹ quét cái là biết ngay chất lượng luôn nhen",https://www.facebook.com/groups/riviesuacongthuc/posts/4717451665178394/?comment_id=4732029557053938&reply_comment_id=4732029680387259,https://www.facebook.com/groups/riviesuacongthuc/posts/4717451665178394/
2026-05-20T10:59:05.000Z,4732029713720589,4732029557053938,1,Võ Hạ Nguyên,"vậy mới yên tâm dùng cho bé, chứ nan nga dạng xách tay thì nguồn gốc sao cũng khó mà kiểm chứng nha",https://www.facebook.com/groups/riviesuacongthuc/posts/4717451665178394/?comment_id=4732029557053938&reply_comment_id=4732029713720589,https://www.facebook.com/groups/riviesuacongthuc/posts/4717451665178394/
2026-05-20T10:59:08.000Z,4732029740387253,4732029557053938,1,Nguyễn Bích Hạnh,"ưa, còn nan sup mà mẹ mua ở concung thì chuẩn uy tín luôn, khỏi lo hàng giả hàng nhái nhen",https://www.facebook.com/groups/riviesuacongthuc/posts/4717451665178394/?comment_id=4732029557053938&reply_comment_id=4732029740387253,https://www.facebook.com/groups/riviesuacongthuc/posts/4717451665178394/
2026-05-20T10:59:24.000Z,4732029973720563,,0,Trịnh Yên Thảo,"nên tăg sức đề khág cho con mẹ nhé, dùng nan sup nè, sữa có tận 5hmo đó",https://www.facebook.com/groups/riviesuacongthuc/posts/4717451665178394/?comment_id=4732029973720563,https://www.facebook.com/groups/riviesuacongthuc/posts/4717451665178394/
2026-05-20T10:59:36.000Z,4732030190387208,4732029973720563,1,Trịnh Yên Thảo,"tiện lắm ý, có giấy đăng ký sản phẩm nguồn gốc rõ ràng, đã được kiểm duyệt kỹ nên dùng cho bé cũng đỡ lo",https://www.facebook.com/groups/riviesuacongthuc/posts/4717451665178394/?comment_id=4732029973720563&reply_comment_id=4732030190387208,https://www.facebook.com/groups/riviesuacongthuc/posts/4717451665178394/
2026-06-09T12:28:58.000Z,4753021801621380,,0,Lê Thị Thu Huyền,Bao bì sữa hươu cao cổ nhìn xịn xò mà giá tốt nữa mua ở sthi tiện lắm bác ui :D,https://www.facebook.com/groups/riviesuacongthuc/posts/4717451665178394/?comment_id=4753021801621380,https://www.facebook.com/groups/riviesuacongthuc/posts/4717451665178394/
2026-06-09T12:30:05.000Z,4753023338287893,,0,Nghiêm Thị Hạnh,Bé nhà e h đang ún sữa hươu cao cổ nà trvia chiều cao nhích kim đều mà ko bị nóng,https://www.facebook.com/groups/riviesuacongthuc/posts/4717451665178394/?comment_id=4753023338287893,https://www.facebook.com/groups/riviesuacongthuc/posts/4717451665178394/
2026-06-09T12:31:08.000Z,4753024594954434,,0,Hoàng Hà Liên,Bé mình dùng grow abot thấy ăn uống tốt hơn nhìu lanh lẹ hoạt bát lắm nha mom,https://www.facebook.com/groups/riviesuacongthuc/posts/4717451665178394/?comment_id=4753024594954434,https://www.facebook.com/groups/riviesuacongthuc/posts/4717451665178394/
2026-06-09T12:33:48.000Z,4753027931620767,,0,Đoàn Vân Trang,"Thử đổi qua Abbott Grow cho bé đi bà, vị ngọt thanh dễ uống mà nhiều đạm con ptrien tốt lắm",https://www.facebook.com/groups/riviesuacongthuc/posts/4717451665178394/?comment_id=4753027931620767,https://www.facebook.com/groups/riviesuacongthuc/posts/4717451665178394/
2026-06-09T12:39:52.000Z,4753033861620174,,0,Nguyễn Hoàng Cẩm Ly,con em cug hay bón mà dặm thêm sữa Abbott Grow vô thấy ptrien thể lực tốt hẳn luôn 🥰,https://www.facebook.com/groups/riviesuacongthuc/posts/4717451665178394/?comment_id=4753033861620174,https://www.facebook.com/groups/riviesuacongthuc/posts/4717451665178394/
2026-06-09T13:00:59.000Z,4753053044951589,,0,Phan Xuân Hoàng,abot grow uy tín lắm nha mẹ nó ơi tui đọc 7749 review r mới dám cho con ún á,https://www.facebook.com/groups/riviesuacongthuc/posts/4717451665178394/?comment_id=4753053044951589,https://www.facebook.com/groups/riviesuacongthuc/posts/4717451665178394/
2026-06-09T13:01:14.000Z,4753053444951549,,0,Trần Thị Hồng Hạnh,"mình chọn sữa hươu abbott vì thương hiệu nổi tiếng yên tâm cực, con tvia cứng cáp lắm í 🥰",https://www.facebook.com/groups/riviesuacongthuc/posts/4717451665178394/?comment_id=4753053444951549,https://www.facebook.com/groups/riviesuacongthuc/posts/4717451665178394/
2026-06-09T13:01:22.000Z,4753053648284862,,0,Dương Anh,"grow abot vị thơm ngon ko bị ngấy đâu, bé nhà tui thích sữa này lắm ún tì tì luôn :3",https://www.facebook.com/groups/riviesuacongthuc/posts/4717451665178394/?comment_id=4753053648284862,https://www.facebook.com/groups/riviesuacongthuc/posts/4717451665178394/
2026-06-09T13:01:58.000Z,4753054944951399,,0,Hà Kim Thắng,mình ưu tiên thương hiệu lớn nên chọn sữa Abbott Grow nguồn gốc rõ ràng yên tâm lắm mom ạ,https://www.facebook.com/groups/riviesuacongthuc/posts/4717451665178394/?comment_id=4753054944951399,https://www.facebook.com/groups/riviesuacongthuc/posts/4717451665178394/
2026-06-09T13:02:28.000Z,4753056024951291,,0,Hồ Nhân,Sữa hươu abbott này nổi tiếng xưa h r tin dùng lắm lun mn ơi ptrien chiều cao siu đỉnh :3,https://www.facebook.com/groups/riviesuacongthuc/posts/4717451665178394/?comment_id=4753056024951291,https://www.facebook.com/groups/riviesuacongthuc/posts/4717451665178394/
2026-06-09T13:03:50.000Z,4753058984950995,,0,Mai Công Hà,mình ưu tiên thương hiệu lớn nên chọn sữa Abbott Grow nguồn gốc rõ ràng yên tâm lắm mom ạ,https://www.facebook.com/groups/riviesuacongthuc/posts/4717451665178394/?comment_id=4753058984950995,https://www.facebook.com/groups/riviesuacongthuc/posts/4717451665178394/
2026-06-09T13:04:01.000Z,4753059238284303,,0,Thân Dũng,mình ưu tiên thương hiệu lớn nên chọn sữa Abbott Grow nguồn gốc rõ ràng yên tâm lắm mom ạ,https://www.facebook.com/groups/riviesuacongthuc/posts/4717451665178394/?comment_id=4753059238284303,https://www.facebook.com/groups/riviesuacongthuc/posts/4717451665178394/
2026-06-09T14:12:47.000Z,4753124691611091,,0,Vân Toản,"con nhà mình trvia hợp sữa Abbott Grow nên lanh lẹ hoạt bát lắm, sữa mát nên đi ngoài mượt cực",https://www.facebook.com/groups/riviesuacongthuc/posts/4717451665178394/?comment_id=4753124691611091,https://www.facebook.com/groups/riviesuacongthuc/posts/4717451665178394/
2026-06-09T14:45:31.000Z,4753155294941364,,0,Ái Châu,"bé bón thì mom thử sữa hươu abbott đi, có hệ chất xơ FOS với Inulin hỗ trợ tiêu hóa tốt lắm á",https://www.facebook.com/groups/riviesuacongthuc/posts/4717451665178394/?comment_id=4753155294941364,https://www.facebook.com/groups/riviesuacongthuc/posts/4717451665178394/
2026-06-09T14:46:00.000Z,4753155774941316,,0,Hương Trà,"con nhà t uống abbott grow trộm vía đi ngoài mượt cực, sữa mát ko lo bón đâu nha",https://www.facebook.com/groups/riviesuacongthuc/posts/4717451665178394/?comment_id=4753155774941316,https://www.facebook.com/groups/riviesuacongthuc/posts/4717451665178394/
2026-06-09T14:46:34.000Z,4753156378274589,4753155774941316,1,Lâm Ngọc Bội Hà,dạ đúng rùi sữa hươu abbott vị nhạt thanh dễ ún mà bụng dạ con êm nữa áa,https://www.facebook.com/groups/riviesuacongthuc/posts/4717451665178394/?comment_id=4753155774941316&reply_comment_id=4753156378274589,https://www.facebook.com/groups/riviesuacongthuc/posts/4717451665178394/
2026-06-09T14:47:13.000Z,4753156968274530,,0,Xuân My,"Sữa hươu cao cổ có FOS giúp phân tơi xốp lắm, bé nhà tui dùng 2 năm r k bón bao h",https://www.facebook.com/groups/riviesuacongthuc/posts/4717451665178394/?comment_id=4753156968274530,https://www.facebook.com/groups/riviesuacongthuc/posts/4717451665178394/
2026-06-09T14:47:44.000Z,4753157721607788,,0,Lan Chi,"mom cho con ún sữa hươu quốc dân xem s, tphan inulin giúp hệ vi sinh ptrien tốt bé tiêu hóa ok lắm á",https://www.facebook.com/groups/riviesuacongthuc/posts/4717451665178394/?comment_id=4753157721607788,https://www.facebook.com/groups/riviesuacongthuc/posts/4717451665178394/
2026-06-09T14:49:02.000Z,4753158834941010,,0,Trịnh Nguyễn Ngọc Thư,"Bé bón tội nhỉ, thử sữa hươu abbott liền ik mom, sữa này mát mà nhìu dưỡng chất giúp con nhích kim đều á",https://www.facebook.com/groups/riviesuacongthuc/posts/4717451665178394/?comment_id=4753158834941010,https://www.facebook.com/groups/riviesuacongthuc/posts/4717451665178394/
2026-06-09T14:49:30.000Z,4753159258274301,,0,Hồng Ngọc,"chọn abbott grow nè, tkhảo loại này xem sao chớ bé nhà e uống phân đẹp lắm lun áa",https://www.facebook.com/groups/riviesuacongthuc/posts/4717451665178394/?comment_id=4753159258274301,https://www.facebook.com/groups/riviesuacongthuc/posts/4717451665178394/
2026-06-09T14:49:57.000Z,4753159584940935,,0,Uyên Châu,"Sữa hươu cao cổ chuẩn xịn của Mỹ lun, có FOS bổ sung chất xơ nên bón ko còn là nỗi lo đâu nè :)))",https://www.facebook.com/groups/riviesuacongthuc/posts/4717451665178394/?comment_id=4753159584940935,https://www.facebook.com/groups/riviesuacongthuc/posts/4717451665178394/
2026-06-09T14:50:30.000Z,4753160061607554,4753159584940935,1,Trần Mỹ Ngọc,Uyên Châu chuẩn mom ơi sữa hươu abbott là chân á cho mấy bé hay bón á =)),https://www.facebook.com/groups/riviesuacongthuc/posts/4717451665178394/?comment_id=4753159584940935&reply_comment_id=4753160061607554,https://www.facebook.com/groups/riviesuacongthuc/posts/4717451665178394/
2026-06-09T14:51:11.000Z,4753160631607497,,0,Nguyễn Hoàng Hạ Lan,"e cũng đag cho bé dùng sữa hươu quốc dân, trvia sữa thơm dễ ún con chịu hợp tác lắm",https://www.facebook.com/groups/riviesuacongthuc/posts/4717451665178394/?comment_id=4753160631607497,https://www.facebook.com/groups/riviesuacongthuc/posts/4717451665178394/
2026-06-09T14:52:03.000Z,4753161348274092,,0,Hồ Phương Nga,"Mua sữa hươu abbott đi bác, sữa này nổi tiếng giúp bé cao lớn mà tiêu hóa lại cực kì ổn áp nha",https://www.facebook.com/groups/riviesuacongthuc/posts/4717451665178394/?comment_id=4753161348274092,https://www.facebook.com/groups/riviesuacongthuc/posts/4717451665178394/
2026-06-09T14:52:37.000Z,4753161811607379,,0,Nguyễn Bảo Trân,"tui đọc 7749 review r mới chốt abbott grow á, sữa mát ko gây nóng nên bé đi ngoài ok lắm :v",https://www.facebook.com/groups/riviesuacongthuc/posts/4717451665178394/?comment_id=4753161811607379,https://www.facebook.com/groups/riviesuacongthuc/posts/4717451665178394/
2026-06-09T14:53:07.000Z,4753162214940672,,0,Bảo Nhi,"Bé nhà tui ún sữa hươu cao cổ trvia bụng dạ tốt, ko thấy bón hay nôn trớ gì cả nha mn",https://www.facebook.com/groups/riviesuacongthuc/posts/4717451665178394/?comment_id=4753162214940672,https://www.facebook.com/groups/riviesuacongthuc/posts/4717451665178394/
2026-06-09T14:53:43.000Z,4753162711607289,,0,Nguyễn Tường Ánh,"sữa hươu abbott có hàm lượng fos cao hỗ trợ tiêu hóa siu đỉnh, mom mua cho con dùng thử xem sao ạa",https://www.facebook.com/groups/riviesuacongthuc/posts/4717451665178394/?comment_id=4753162711607289,https://www.facebook.com/groups/riviesuacongthuc/posts/4717451665178394/
2026-06-09T14:54:13.000Z,4753163101607250,,0,Hà Trang,"Dùng abbott grow là yên tâm nhất r, thương hiệu lâu đời mà chất lượng chuẩn Mỹ nên tin dùng lắm nha 🥰",https://www.facebook.com/groups/riviesuacongthuc/posts/4717451665178394/?comment_id=4753163101607250,https://www.facebook.com/groups/riviesuacongthuc/posts/4717451665178394/
2026-06-09T14:54:53.000Z,4753163584940535,,0,Nguyễn Kiều Oanh,"bé nhà t hay bón mà đổi qua sữa hươu quốc dân cái là đi ngoài mượt lun, mom tkhảo thử xem s nhé",https://www.facebook.com/groups/riviesuacongthuc/posts/4717451665178394/?comment_id=4753163584940535,https://www.facebook.com/groups/riviesuacongthuc/posts/4717451665178394/
2026-06-09T14:55:29.000Z,4753164131607147,,0,Hà Mai,"Bột sữa hươu abbott mịn tơi ko vón cục, vị ngọt thanh giống sữa mẹ nên bé nhà tui thik lắm á",https://www.facebook.com/groups/riviesuacongthuc/posts/4717451665178394/?comment_id=4753164131607147,https://www.facebook.com/groups/riviesuacongthuc/posts/4717451665178394/
2026-06-09T14:56:30.000Z,4753165018273725,,0,Nguyễn Hà Vy,"thử sữa hươu abbott đi mom ơi, sữa giàu canxi giúp xương chắc khỏe mà vẫn đảm bảo tiêu hóa tốt nha",https://www.facebook.com/groups/riviesuacongthuc/posts/4717451665178394/?comment_id=4753165018273725,https://www.facebook.com/groups/riviesuacongthuc/posts/4717451665178394/
2026-06-09T14:57:22.000Z,4753165811606979,,0,Trần Ngọc Khánh,"Giá sữa hươu cao cổ hợp lý mà chất lượng xịn xò, xứng đáng để đầu tư cho con phát triển toàn diện á",https://www.facebook.com/groups/riviesuacongthuc/posts/4717451665178394/?comment_id=4753165811606979,https://www.facebook.com/groups/riviesuacongthuc/posts/4717451665178394/
2026-06-09T14:57:51.000Z,4753166268273600,,0,Nguyễn Ngọc Ánh,sữa hươu quốc dân vẫn là crush quốc dân của mẹ bỉm vì giúp bé cao lớn thông minh mà ko lo táo bón :d,https://www.facebook.com/groups/riviesuacongthuc/posts/4717451665178394/?comment_id=4753166268273600,https://www.facebook.com/groups/riviesuacongthuc/posts/4717451665178394/
2026-06-09T15:05:41.000Z,4753172838272943,,0,Minh Quang,"Có mẹ nào cho bé dùng abot grow chưa cho e xin review vụ tiêu hóa với ạ, đang định đổi cho con 🤔",https://www.facebook.com/groups/riviesuacongthuc/posts/4717451665178394/?comment_id=4753172838272943,https://www.facebook.com/groups/riviesuacongthuc/posts/4717451665178394/
