Date,Comment_ID,Parent_ID,Level,Author,Content,Permalink,Post_URL
2026-06-10T01:27:24.000Z,4753625971560963,,0,Tuờng Lâm,"Bé bón thì cứ sữa hươu abbott mà nhích thôi mom, tvia con hấp thu tốt ăn ngon ngủ kỹ lắm ạa",https://www.facebook.com/groups/riviesuacongthuc/posts/4717451665178394/?comment_id=4753625971560963,https://www.facebook.com/groups/riviesuacongthuc/posts/4717451665178394/
2026-06-10T03:42:47.000Z,4753727091550851,,0,An Nhiên,"abot grow hỗ trợ tiêu hoá tốt lắm á, bé nhà t dùng thấy ko bị táo bón gì đâu nè",https://www.facebook.com/groups/riviesuacongthuc/posts/4717451665178394/?comment_id=4753727091550851,https://www.facebook.com/groups/riviesuacongthuc/posts/4717451665178394/
2026-06-10T04:01:52.000Z,4753741654882728,,0,VI Hướng,Trộm día bé nhà t từ khi xài sữa hươu cao cổ là bụng dạ êm ru ko thấy nôn trớ gì hết á,https://www.facebook.com/groups/riviesuacongthuc/posts/4717451665178394/?comment_id=4753741654882728,https://www.facebook.com/groups/riviesuacongthuc/posts/4717451665178394/
2026-06-10T04:34:06.000Z,4753766258213601,,0,Ngoc Lan,mom thử sữa hươu cao cổ đi trvia bé nhà e ún tiêu hóa mượt lắm ko lo táo đâu ạa 😍,https://www.facebook.com/groups/riviesuacongthuc/posts/4717451665178394/?comment_id=4753766258213601,https://www.facebook.com/groups/riviesuacongthuc/posts/4717451665178394/
2026-06-10T08:35:00.000Z,4753941548196072,,0,Tiến Đạt,sữa Abbott Grow vị nhạt ngon vừa miệng bé nhà tớ lắm ko bị ngấy như mấy loại khác đâu nà,https://www.facebook.com/groups/riviesuacongthuc/posts/4717451665178394/?comment_id=4753941548196072,https://www.facebook.com/groups/riviesuacongthuc/posts/4717451665178394/
2026-06-10T10:58:30.000Z,4754044924852401,,0,Tuấn Tú,Bé nhà tui dùng sữa hươu abbott thấy đi ngoài ok lắm m mua cho con thử liền đi,https://www.facebook.com/groups/riviesuacongthuc/posts/4717451665178394/?comment_id=4754044924852401,https://www.facebook.com/groups/riviesuacongthuc/posts/4717451665178394/
2026-06-10T12:18:52.000Z,4754110714845822,,0,Tiến Đạt,Sữa thơm ko tanh tí nào bé nhà e hợp sữa Abbott Grow lắm ún thun thút lun ^^,https://www.facebook.com/groups/riviesuacongthuc/posts/4717451665178394/?comment_id=4754110714845822,https://www.facebook.com/groups/riviesuacongthuc/posts/4717451665178394/
2026-06-10T15:21:15.000Z,4754271434829750,,0,Vân Khánh,Sữa thơm ko tanh tí nào bé nhà e hợp sữa Abbott Grow lắm ún thun thút lun ^^,https://www.facebook.com/groups/riviesuacongthuc/posts/4717451665178394/?comment_id=4754271434829750,https://www.facebook.com/groups/riviesuacongthuc/posts/4717451665178394/
2026-06-10T15:38:16.000Z,4754285888161638,,0,Vân Khánh,Sữa thơm ko tanh tí nào bé nhà e hợp sữa Abbott Grow lắm ún thun thút lun ^^,https://www.facebook.com/groups/riviesuacongthuc/posts/4717451665178394/?comment_id=4754285888161638,https://www.facebook.com/groups/riviesuacongthuc/posts/4717451665178394/
2026-06-10T16:52:15.000Z,4754346514822242,,0,Hồ Thục Trang,Sữa thơm ko tanh tí nào bé nhà e hợp sữa Abbott Grow lắm ún thun thút lun ^^,https://www.facebook.com/groups/riviesuacongthuc/posts/4717451665178394/?comment_id=4754346514822242,https://www.facebook.com/groups/riviesuacongthuc/posts/4717451665178394/
2026-06-10T16:54:00.000Z,4754347914822102,,0,Nguyễn Khánh,Sữa thơm ko tanh tí nào bé nhà e hợp sữa Abbott Grow lắm ún thun thút lun ^^,https://www.facebook.com/groups/riviesuacongthuc/posts/4717451665178394/?comment_id=4754347914822102,https://www.facebook.com/groups/riviesuacongthuc/posts/4717451665178394/
