Date,Comment_ID,Parent_ID,Level,Author,Content,Permalink,Post_URL
2026-06-19T21:06:50.000Z,4763736950549865,,0,Thu Thuy Nguyen,"mấy tháng nay mình cũng cho bé uống nan plus, thấy bé hợp sữa nên ăn ngủ đều và tiêu hóa ổn hơn, hồi mới sinh bé mk tham khảo rất nhiều hội nhóm, thấy nhiều mẹ đánh giá tốt nên tìm hiểu thêm về nan plus",https://www.facebook.com/groups/riviesuacongthuc/posts/4760915247498702/?comment_id=4763736950549865,https://www.facebook.com/groups/riviesuacongthuc/posts/4760915247498702/
2026-06-19T21:06:59.000Z,4763737087216518,4763736950549865,1,Dinh Dang,trong sữa nan này có thành phần gì hỗ trợ tiêu hóa cho bé vậy mom,https://www.facebook.com/groups/riviesuacongthuc/posts/4760915247498702/?comment_id=4763736950549865&reply_comment_id=4763737087216518,https://www.facebook.com/groups/riviesuacongthuc/posts/4760915247498702/
2026-06-19T21:07:02.000Z,4763737117216515,4763736950549865,1,Thu Thuy Nguyen,do có đạm optipro gần giống đạm trong sữa mẹ nên hỗ trợ hệ tiêu hóa của bé khá tốt đó,https://www.facebook.com/groups/riviesuacongthuc/posts/4760915247498702/?comment_id=4763736950549865&reply_comment_id=4763737117216515,https://www.facebook.com/groups/riviesuacongthuc/posts/4760915247498702/
2026-06-19T21:07:04.000Z,4763737137216513,4763736950549865,1,Dinh Dang,bé uống nan này có tăng cân ổn không mom,https://www.facebook.com/groups/riviesuacongthuc/posts/4760915247498702/?comment_id=4763736950549865&reply_comment_id=4763737137216513,https://www.facebook.com/groups/riviesuacongthuc/posts/4760915247498702/
2026-06-19T21:07:11.000Z,4763737210549839,4763736950549865,1,Thu Thuy Nguyen,"bé tiêu hóa tốt nên hấp thu cũng ổn, nhờ vậy cân nặng tăng khá đều theo chuẩn",https://www.facebook.com/groups/riviesuacongthuc/posts/4760915247498702/?comment_id=4763736950549865&reply_comment_id=4763737210549839,https://www.facebook.com/groups/riviesuacongthuc/posts/4760915247498702/
2026-06-19T21:07:17.000Z,4763737307216496,,0,Nguyễn Diệu,"bé nhà mình cũng đang dùng nan thụy sĩ đó mom, sữa có đạm optipro nên hỗ trợ tiêu hóa, bé dễ hấp thu nên bú đều làm mình cũng yên tâm hơn, hồi mới có con mk rất hay hỏi kinh nghiệm các mẹ khác, sau cùng vẫn tự tìm hiểu thêm rồi chọn nan plus",https://www.facebook.com/groups/riviesuacongthuc/posts/4760915247498702/?comment_id=4763737307216496,https://www.facebook.com/groups/riviesuacongthuc/posts/4760915247498702/
2026-06-19T21:07:24.000Z,4763737380549822,4763737307216496,1,Hằng Bùi Thanh,bé hợp sữa thì mẹ chăm cũng đỡ vất vả nhiều đó,https://www.facebook.com/groups/riviesuacongthuc/posts/4760915247498702/?comment_id=4763737307216496&reply_comment_id=4763737380549822,https://www.facebook.com/groups/riviesuacongthuc/posts/4760915247498702/
2026-06-19T21:07:29.000Z,4763737423883151,,0,Thanh Ngan,"mom thử cho bé dùng nan plus xem, sữa có lợi khuẩn bifidus bl nên hỗ trợ tiêu hóa khá tốt, vị lại thanh nhẹ giống sữa mẹ nên bé dễ làm quen, mk đọc về đạm optipro xong thấy cũng khá hay á",https://www.facebook.com/groups/riviesuacongthuc/posts/4760915247498702/?comment_id=4763737423883151,https://www.facebook.com/groups/riviesuacongthuc/posts/4760915247498702/
2026-06-19T21:07:34.000Z,4763737483883145,4763737423883151,1,Hoàng Thị Hồng Minh,dùng nan này còn hỗ trợ cả đề kháng cho bé nữa đó mom,https://www.facebook.com/groups/riviesuacongthuc/posts/4760915247498702/?comment_id=4763737423883151&reply_comment_id=4763737483883145,https://www.facebook.com/groups/riviesuacongthuc/posts/4760915247498702/
2026-06-19T21:07:40.000Z,4763737573883136,4763737423883151,1,Thanh Ngan,"đúng rồi, trong sữa có 5hmo nên giúp tăng cường đề kháng cho bé khá tốt đó mom ơi",https://www.facebook.com/groups/riviesuacongthuc/posts/4760915247498702/?comment_id=4763737423883151&reply_comment_id=4763737573883136,https://www.facebook.com/groups/riviesuacongthuc/posts/4760915247498702/
2026-06-19T21:07:44.000Z,4763737630549797,,0,Đặng Minh,"mom đã nghe tới sữa nan plus chưa nè, bé nhà mình uống thấy bú khá đều, sữa có tỉ lệ đạm whey/casein gần giống sữa mẹ nên hỗ trợ tiêu hóa tốt, bé khỏe bụng đó, mk không hay đổi sữa, nhưng trước khi chọn nan plus thì tìm hiểu kỹ lắm rùi á",https://www.facebook.com/groups/riviesuacongthuc/posts/4760915247498702/?comment_id=4763737630549797,https://www.facebook.com/groups/riviesuacongthuc/posts/4760915247498702/
2026-06-19T21:07:50.000Z,4763737677216459,4763737630549797,1,Nguyễn Thu Hoài,"sữa này dùng thấy khá ưng đó, dòng của nestle luôn",https://www.facebook.com/groups/riviesuacongthuc/posts/4760915247498702/?comment_id=4763737630549797&reply_comment_id=4763737677216459,https://www.facebook.com/groups/riviesuacongthuc/posts/4760915247498702/
2026-06-19T21:07:53.000Z,4763737703883123,4763737630549797,1,Đặng Minh,"đúng rồi mom, nan do nestle nhập khẩu nên mình cũng yên tâm khi cho con dùng",https://www.facebook.com/groups/riviesuacongthuc/posts/4760915247498702/?comment_id=4763737630549797&reply_comment_id=4763737703883123,https://www.facebook.com/groups/riviesuacongthuc/posts/4760915247498702/
2026-06-19T21:07:55.000Z,4763737740549786,4763737630549797,1,Nguyễn Thu Hoài,với lại dòng này mua cũng khá tiện nữa,https://www.facebook.com/groups/riviesuacongthuc/posts/4760915247498702/?comment_id=4763737630549797&reply_comment_id=4763737740549786,https://www.facebook.com/groups/riviesuacongthuc/posts/4760915247498702/
2026-06-19T21:07:59.000Z,4763737803883113,4763737630549797,1,Đặng Minh,"mình thấy trên các gian hàng chính hãng của nestle trên sàn thương mại điện tử đều có bán đó mom , bé nhà mk hợp sữa này nên mk giữ luôn không đổi nữa",https://www.facebook.com/groups/riviesuacongthuc/posts/4760915247498702/?comment_id=4763737630549797&reply_comment_id=4763737803883113,https://www.facebook.com/groups/riviesuacongthuc/posts/4760915247498702/
