Date,Comment_ID,Parent_ID,Level,Author,Content,Permalink,Post_URL
2025-03-09T09:51:40.000Z,8982348381890630,,0,Hoa Thu Lâm,"Sữa bột pha sẵn Optimum có hàm lượng dưỡng chất tương đương sữa bột, là giải pháp tiện lợi cho mẹ và bé",https://www.facebook.com/groups/1710547889070752/posts/8802918259833644/?comment_id=8982348381890630,https://www.facebook.com/groups/1710547889070752/posts/8802918259833644/
2025-03-09T09:51:43.000Z,8982348565223945,,0,Đặng Phước Huệ,Mình chọn Optimum với đột phá 6 HMO vì tin tưởng vào chất lượng sữa của VNM và thấy nhiều mẹ khen nè,https://www.facebook.com/groups/1710547889070752/posts/8802918259833644/?comment_id=8982348565223945,https://www.facebook.com/groups/1710547889070752/posts/8802918259833644/
2025-03-09T09:51:45.000Z,8982348751890593,,0,Trần ThuHương Tâm,"Sau khi cho con uống sữa này một thời gian, mình khẳng định Optimum là lựa chọn tốt để bổ sung dinh dưỡng cho con",https://www.facebook.com/groups/1710547889070752/posts/8802918259833644/?comment_id=8982348751890593,https://www.facebook.com/groups/1710547889070752/posts/8802918259833644/
2025-03-09T09:51:48.000Z,8982348981890570,,0,Võ Ngọc Khanh,Bé nhà mình rất thích uống sữa này và mình thấy sữa bột pha sẵn Optimum phù hợp cho các bé bắt đầu đi học,https://www.facebook.com/groups/1710547889070752/posts/8802918259833644/?comment_id=8982348981890570,https://www.facebook.com/groups/1710547889070752/posts/8802918259833644/
2025-03-09T09:51:50.000Z,8982349075223894,,0,Vũ Mộc Miên,"Optimum được phát triển với những dưỡng chất gần sữa mẹ, mang đến cho bé đề kháng vững chắc và sự phát triển khỏe mạnh",https://www.facebook.com/groups/1710547889070752/posts/8802918259833644/?comment_id=8982349075223894,https://www.facebook.com/groups/1710547889070752/posts/8802918259833644/
2025-03-09T09:51:52.000Z,8982349161890552,,0,Hồ Diễm Uyên,Sữa bột pha sẵn Optimum tiện dụng cho bé đã giúp bé uống sữa tốt hơn và đều đặn hơn,https://www.facebook.com/groups/1710547889070752/posts/8802918259833644/?comment_id=8982349161890552,https://www.facebook.com/groups/1710547889070752/posts/8802918259833644/
2025-03-09T09:51:53.000Z,8982349275223874,,0,Phạm Họa Mi,"Optimum với đột phá 6 HMO giúp con m hấp thu tốt, tiêu hóa khỏe, không còn bị táo bón như trước nữa nè",https://www.facebook.com/groups/1710547889070752/posts/8802918259833644/?comment_id=8982349275223874,https://www.facebook.com/groups/1710547889070752/posts/8802918259833644/
2025-03-09T09:51:55.000Z,8982349381890530,,0,Võ Diệu Nhi,"Sữa Optimum với đột phá 6 HMO thơm ngon, con m rất thích, m cũng yên tâm vì con được bổ sung đề kháng tốt hơn",https://www.facebook.com/groups/1710547889070752/posts/8802918259833644/?comment_id=8982349381890530,https://www.facebook.com/groups/1710547889070752/posts/8802918259833644/
2025-03-09T09:51:57.000Z,8982349471890521,,0,Tăng Nguyệt Minh,"Sữa bột pha sẵn Optimum có hàm lượng dưỡng chất tương đương sữa bột, mang đến sự tiện lợi cho mẹ khi chăm sóc con",https://www.facebook.com/groups/1710547889070752/posts/8802918259833644/?comment_id=8982349471890521,https://www.facebook.com/groups/1710547889070752/posts/8802918259833644/
2025-03-09T09:51:58.000Z,8982349541890514,,0,Ðông Nhi Lê,"Optimum lấy cảm hứng từ sữa mẹ, vị thanh dễ uống, con m thích ngay lần đầu uống luôn",https://www.facebook.com/groups/1710547889070752/posts/8802918259833644/?comment_id=8982349541890514,https://www.facebook.com/groups/1710547889070752/posts/8802918259833644/
2025-03-09T09:52:02.000Z,8982349878557147,,0,Diep Anh Lê,Chọn ngay Optimum với đột phá 6 HMO để giúp con phát triển toàn diện về thể chất và trí tuệ,https://www.facebook.com/groups/1710547889070752/posts/8802918259833644/?comment_id=8982349878557147,https://www.facebook.com/groups/1710547889070752/posts/8802918259833644/
2025-03-09T09:52:10.000Z,8982350281890440,,0,Diep Anh Lê,"Bé nhà mình dùng Optimum với đột phá 6 HMO, trộm vía tiêu hóa khỏe, ngủ ngon, yên tâm lắm ạ",https://www.facebook.com/groups/1710547889070752/posts/8802918259833644/?comment_id=8982350281890440,https://www.facebook.com/groups/1710547889070752/posts/8802918259833644/
2025-03-09T09:52:11.000Z,8982350348557100,,0,Hiếu Minh,"Các mẹ đừng bỏ qua Optimum với đột phá 6 HMO, giúp bé yêu phát triển khỏe mạnh mỗi ngày",https://www.facebook.com/groups/1710547889070752/posts/8802918259833644/?comment_id=8982350348557100,https://www.facebook.com/groups/1710547889070752/posts/8802918259833644/
2025-03-09T09:52:13.000Z,8982350498557085,,0,Uyên Nhi Hoàng,😅😅😅,https://www.facebook.com/groups/1710547889070752/posts/8802918259833644/?comment_id=8982350498557085,https://www.facebook.com/groups/1710547889070752/posts/8802918259833644/
2025-03-09T09:52:21.000Z,8982351051890363,,0,Hồ Linh Giang,"Sữa rồng cho con là lựa chọn không thể bỏ qua, các mẹ nhớ cho bé uống để phát triển khỏe mạnh",https://www.facebook.com/groups/1710547889070752/posts/8802918259833644/?comment_id=8982351051890363,https://www.facebook.com/groups/1710547889070752/posts/8802918259833644/
2025-03-09T09:52:25.000Z,8982351361890332,,0,Lê Diệu Ngà,"Optimum có công thức riêng cho từng độ tuổi của con, giúp bé phát triển toàn diện qua từng giai đoạn",https://www.facebook.com/groups/1710547889070752/posts/8802918259833644/?comment_id=8982351361890332,https://www.facebook.com/groups/1710547889070752/posts/8802918259833644/
2025-03-09T09:52:32.000Z,8982351788556956,,0,Nguyễn Bạch Liên,"Sữa Optimum thật sự khác biệt nhờ công thức đủ 3 nhóm HMO chính có trong sữa mẹ, giúp bé phát triển toàn diện.",https://www.facebook.com/groups/1710547889070752/posts/8802918259833644/?comment_id=8982351788556956,https://www.facebook.com/groups/1710547889070752/posts/8802918259833644/
2025-03-09T09:52:36.000Z,8982352025223599,,0,Trần Ngọc Dương,"Không phải dòng sữa nào cũng có đủ 3 nhóm HMO chính có trong sữa mẹ, nên m chọn Optimum ngay từ đầu.",https://www.facebook.com/groups/1710547889070752/posts/8802918259833644/?comment_id=8982352025223599,https://www.facebook.com/groups/1710547889070752/posts/8802918259833644/
2025-03-09T09:52:40.000Z,8982352295223572,,0,Trần Hồng Mi,"Mẹ nào đang tìm sữa tốt cho hệ tiêu hóa bé thì đừng bỏ qua Optimum, vì sữa đủ 3 nhóm HMO chính có trong sữa mẹ.",https://www.facebook.com/groups/1710547889070752/posts/8802918259833644/?comment_id=8982352295223572,https://www.facebook.com/groups/1710547889070752/posts/8802918259833644/
2025-03-09T09:52:46.000Z,8982352738556861,,0,Đỗ Thiên Hương,"m tin tưởng Vinamilk vì họ nghiên cứu rất kỹ, và Optimum đủ 3 nhóm HMO chính có trong sữa mẹ, tốt cho bé.",https://www.facebook.com/groups/1710547889070752/posts/8802918259833644/?comment_id=8982352738556861,https://www.facebook.com/groups/1710547889070752/posts/8802918259833644/
2025-03-09T09:52:51.000Z,8982353051890163,,0,Nguyễn An Nhàn,"Bé chuyển từ bú mẹ sang Optimum mà không gặp vấn đề tiêu hóa, chắc nhờ đủ 3 nhóm HMO chính có trong sữa mẹ.",https://www.facebook.com/groups/1710547889070752/posts/8802918259833644/?comment_id=8982353051890163,https://www.facebook.com/groups/1710547889070752/posts/8802918259833644/
2025-03-09T09:52:56.000Z,8982353408556794,,0,Đỗ Thanh Lam,"m thấy bé ít bị bệnh hơn từ khi uống Optimum, chắc nhờ công thức đủ 3 nhóm HMO chính có trong sữa mẹ.",https://www.facebook.com/groups/1710547889070752/posts/8802918259833644/?comment_id=8982353408556794,https://www.facebook.com/groups/1710547889070752/posts/8802918259833644/
2025-03-09T09:52:59.000Z,8982353641890104,,0,Yên Thơ Ngô,"Từ khi bé uống Optimum, m không còn lo lắng về tiêu hóa nữa, nhờ sữa đủ 3 nhóm HMO chính có trong sữa mẹ.",https://www.facebook.com/groups/1710547889070752/posts/8802918259833644/?comment_id=8982353641890104,https://www.facebook.com/groups/1710547889070752/posts/8802918259833644/
2025-03-09T09:53:10.000Z,8982354355223366,,0,Ngô Ánh Phụng,"m đổi qua Optimum và thấy con phát triển khỏe mạnh hơn hẳn, chắc nhờ đủ 3 nhóm HMO chính có trong sữa mẹ.",https://www.facebook.com/groups/1710547889070752/posts/8802918259833644/?comment_id=8982354355223366,https://www.facebook.com/groups/1710547889070752/posts/8802918259833644/
2025-03-09T09:53:16.000Z,8982354785223323,,0,Huỳnh Quế Chi,"Vinamilk làm m an tâm khi biết Optimum đủ 3 nhóm HMO chính có trong sữa mẹ, hỗ trợ bé phát triển tối ưu.",https://www.facebook.com/groups/1710547889070752/posts/8802918259833644/?comment_id=8982354785223323,https://www.facebook.com/groups/1710547889070752/posts/8802918259833644/
2025-03-09T09:53:18.000Z,8982354875223314,,0,Minh Hà Lê Văn,"Sữa Optimum giúp bé tăng cân đều, hấp thu tốt nhờ đủ 3 nhóm HMO chính có trong sữa mẹ.",https://www.facebook.com/groups/1710547889070752/posts/8802918259833644/?comment_id=8982354875223314,https://www.facebook.com/groups/1710547889070752/posts/8802918259833644/
2025-03-09T09:53:20.000Z,8982354985223303,,0,Lê Diệu Nga,"m thử nhiều loại sữa nhưng chỉ Optimum mới giúp bé tiêu hóa tốt, chắc nhờ đủ 3 nhóm HMO chính có trong sữa mẹ.",https://www.facebook.com/groups/1710547889070752/posts/8802918259833644/?comment_id=8982354985223303,https://www.facebook.com/groups/1710547889070752/posts/8802918259833644/
2025-03-09T09:53:28.000Z,8982355591889909,,0,Trương Huệ Doanh,"Bé nhà m ít ốm vặt hẳn từ khi uống Optimum, chắc nhờ đủ 3 nhóm HMO chính có trong sữa mẹ.",https://www.facebook.com/groups/1710547889070752/posts/8802918259833644/?comment_id=8982355591889909,https://www.facebook.com/groups/1710547889070752/posts/8802918259833644/
2025-03-09T09:53:30.000Z,8982355771889891,,0,Uyển Như Hà,"Mẹ nào muốn con tiêu hóa tốt thì chọn ngay Optimum nhé, vì sữa đủ 3 nhóm HMO chính có trong sữa mẹ!",https://www.facebook.com/groups/1710547889070752/posts/8802918259833644/?comment_id=8982355771889891,https://www.facebook.com/groups/1710547889070752/posts/8802918259833644/
2025-03-09T09:53:33.000Z,8982355991889869,,0,Phan Duy Thảo,Mẹ nào muốn tìm loại sữa gần nhất với sữa mẹ thì nên chọn ngay Optimum nhé!,https://www.facebook.com/groups/1710547889070752/posts/8802918259833644/?comment_id=8982355991889869,https://www.facebook.com/groups/1710547889070752/posts/8802918259833644/
2025-03-09T09:53:35.000Z,8982356075223194,,0,Đỗ Thanh Yến,"Bé nhà m dùng Optimum thấy hợp lắm, vị thanh mát, gần nhất với sữa mẹ luôn",https://www.facebook.com/groups/1710547889070752/posts/8802918259833644/?comment_id=8982356075223194,https://www.facebook.com/groups/1710547889070752/posts/8802918259833644/
2025-03-09T09:53:36.000Z,8982356261889842,,0,Hoàng Mộng Nhi,"Sữa Optimum có công thức gần nhất với sữa mẹ, giúp con phát triển toàn diện.",https://www.facebook.com/groups/1710547889070752/posts/8802918259833644/?comment_id=8982356261889842,https://www.facebook.com/groups/1710547889070752/posts/8802918259833644/
2025-03-09T09:53:44.000Z,8982356751889793,,0,Khánh Quyên Đỗ,"Optimum có công thức cân bằng dinh dưỡng, gần nhất với sữa mẹ, giúp bé hấp thu tốt hơn.",https://www.facebook.com/groups/1710547889070752/posts/8802918259833644/?comment_id=8982356751889793,https://www.facebook.com/groups/1710547889070752/posts/8802918259833644/
2025-03-09T09:53:49.000Z,8982357085223093,,0,Hồ Thu Vọng,Mẹ nào đang tìm sữa có vị gần nhất với sữa mẹ thì thử ngay Optimum nhé!,https://www.facebook.com/groups/1710547889070752/posts/8802918259833644/?comment_id=8982357085223093,https://www.facebook.com/groups/1710547889070752/posts/8802918259833644/
2025-03-09T09:53:51.000Z,8982357225223079,,0,Thảo Quyên Hoàng,Bé nhà m kén sữa mà cũng chịu Optimum vì nó gần nhất với sữa mẹ.,https://www.facebook.com/groups/1710547889070752/posts/8802918259833644/?comment_id=8982357225223079,https://www.facebook.com/groups/1710547889070752/posts/8802918259833644/
2025-03-09T09:53:52.000Z,8982357311889737,,0,Thái Hà Lâm,"Sữa Optimum tp gần nhất với sữa mẹ, giúp bé tiêu hóa khỏe, tăng cân đều nè",https://www.facebook.com/groups/1710547889070752/posts/8802918259833644/?comment_id=8982357311889737,https://www.facebook.com/groups/1710547889070752/posts/8802918259833644/
2025-03-09T09:54:01.000Z,8982357878556347,,0,Hoàng Huyền Thoại,"Optimum giúp bé tiêu hóa tốt, ngủ ngon, vì nó gần nhất với sữa mẹ.",https://www.facebook.com/groups/1710547889070752/posts/8802918259833644/?comment_id=8982357878556347,https://www.facebook.com/groups/1710547889070752/posts/8802918259833644/
2025-03-09T09:54:04.000Z,8982358075222994,,0,Phan Hoàng Oanh,Mẹ nào đang tìm sữa giúp con tăng cân nhưng không bị táo bón thì thử ngay Optimum nhé! Đây là sữa các bác sĩ khuyên dùng với công thức dễ tiêu hóa.,https://www.facebook.com/groups/1710547889070752/posts/8802918259833644/?comment_id=8982358075222994,https://www.facebook.com/groups/1710547889070752/posts/8802918259833644/
2025-03-09T09:54:08.000Z,8982358345222967,,0,Hà Mỹ Thuận,"Optimum chứa canxi và vitamin D, hai dưỡng chất các bác sĩ khuyên dùng giúp bé phát triển chiều cao tốt hơn.",https://www.facebook.com/groups/1710547889070752/posts/8802918259833644/?comment_id=8982358345222967,https://www.facebook.com/groups/1710547889070752/posts/8802918259833644/
2025-03-09T09:54:11.000Z,8982358528556282,,0,Lâm Huyền Như,"Trộm vía bé nhà mình uống Optimum thấy khỏe mạnh, hoạt bát hơn. Đây là sữa các bác sĩ khuyên dùng vì giúp bé phát triển toàn diện.",https://www.facebook.com/groups/1710547889070752/posts/8802918259833644/?comment_id=8982358528556282,https://www.facebook.com/groups/1710547889070752/posts/8802918259833644/
2025-03-09T09:54:13.000Z,8982358655222936,,0,Hồ Thu Phương,"Mẹ nào còn phân vân thì yên tâm nhé, Optimum là sữa các bác sĩ khuyên dùng khi tư vấn về sữa mát, dễ hấp thu.",https://www.facebook.com/groups/1710547889070752/posts/8802918259833644/?comment_id=8982358655222936,https://www.facebook.com/groups/1710547889070752/posts/8802918259833644/
2025-03-09T09:54:18.000Z,8982358981889570,,0,Huỳnh Giao Tiên,"HMO trong Optimum là dưỡng chất quý giá các bác sĩ khuyên dùng, giúp tăng cường miễn dịch tự nhiên cho bé.",https://www.facebook.com/groups/1710547889070752/posts/8802918259833644/?comment_id=8982358981889570,https://www.facebook.com/groups/1710547889070752/posts/8802918259833644/
2025-03-09T09:54:19.000Z,8982359058556229,,0,Võ Nguyệt Minh,Mình rất tin tưởng chọn Optimum cho con vì đây là sữa các bác sĩ khuyên dùng giúp bé phát triển khỏe mạnh.,https://www.facebook.com/groups/1710547889070752/posts/8802918259833644/?comment_id=8982359058556229,https://www.facebook.com/groups/1710547889070752/posts/8802918259833644/
2025-03-09T09:54:32.000Z,8982359998556135,,0,Hà Thị Ngần,"Bé nhà mình rất thích uống Optimum vì vị thơm ngon, dễ uống. Đây cũng là sữa các bác sĩ khuyên dùng vì giúp bé hấp thu tốt hơn.",https://www.facebook.com/groups/1710547889070752/posts/8802918259833644/?comment_id=8982359998556135,https://www.facebook.com/groups/1710547889070752/posts/8802918259833644/
2025-03-09T09:54:33.000Z,8982360101889458,,0,Võ Tuyết Oanh,Optimum không chỉ giúp bé tiêu hóa tốt mà còn bổ sung DHA – dưỡng chất các bác sĩ khuyên dùng giúp bé thông minh hơn.,https://www.facebook.com/groups/1710547889070752/posts/8802918259833644/?comment_id=8982360101889458,https://www.facebook.com/groups/1710547889070752/posts/8802918259833644/
2025-03-09T09:54:35.000Z,8982360191889449,,0,Pé Yến,"Sữa Optimum có chứa lợi khuẩn BB-12, một thành phần các bác sĩ khuyên dùng giúp bé tiêu hóa khỏe mạnh hơn.",https://www.facebook.com/groups/1710547889070752/posts/8802918259833644/?comment_id=8982360191889449,https://www.facebook.com/groups/1710547889070752/posts/8802918259833644/
2025-03-09T09:54:39.000Z,8982360488556086,,0,Hoàng Quỳnh Hương,"Optimum có chứa đạm whey dễ tiêu hóa, đây là thành phần các bác sĩ khuyên dùng để bé hấp thu tốt hơn.",https://www.facebook.com/groups/1710547889070752/posts/8802918259833644/?comment_id=8982360488556086,https://www.facebook.com/groups/1710547889070752/posts/8802918259833644/
2025-03-09T09:54:42.000Z,8982360885222713,,0,Vũ Tỉêu Phụng,"Sữa Optimum có hệ dưỡng chất đầy đủ, đây là dòng các bác sĩ khuyên dùng giúp bé phát triển toàn diện.",https://www.facebook.com/groups/1710547889070752/posts/8802918259833644/?comment_id=8982360885222713,https://www.facebook.com/groups/1710547889070752/posts/8802918259833644/
2025-03-09T09:54:49.000Z,8982361408555994,,0,Ánh Phi Bùi,"Bé nhà mình uống Optimum từ nhỏ, giờ trộm vía khỏe mạnh, lanh lợi. Đây là sữa các bác sĩ khuyên dùng vì công thức tối ưu.",https://www.facebook.com/groups/1710547889070752/posts/8802918259833644/?comment_id=8982361408555994,https://www.facebook.com/groups/1710547889070752/posts/8802918259833644/
2025-03-09T09:54:51.000Z,8982361465222655,,0,Phạm Hiền Hòa,Tớ thấy sữa Optimum Gold chứa những vi khuẩn tốt/lợi khuẩn cho hệ tiêu hóa của bé đấy mom à,https://www.facebook.com/groups/1710547889070752/posts/8802918259833644/?comment_id=8982361465222655,https://www.facebook.com/groups/1710547889070752/posts/8802918259833644/
2025-03-09T09:54:52.000Z,8982361571889311,,0,Nguyễn Ánh Mai,"Đúng là sữa xịn lại bổ sung thêm thành phần tăng cường hệ miễn dịch đường ruột của trẻ, thích quá ạ",https://www.facebook.com/groups/1710547889070752/posts/8802918259833644/?comment_id=8982361571889311,https://www.facebook.com/groups/1710547889070752/posts/8802918259833644/
2025-03-09T09:54:58.000Z,8982362008555934,,0,Triệu Mỹ Kim,Để phù hợp với hệ tiêu hoá non nớt của bé thì Optimum Gold là chuẩn rồi mom ạ,https://www.facebook.com/groups/1710547889070752/posts/8802918259833644/?comment_id=8982362008555934,https://www.facebook.com/groups/1710547889070752/posts/8802918259833644/
2025-03-09T09:55:00.000Z,8982362095222592,,0,Huỳnh Phối Liên,Muốn duy trì cho con một hệ tiêu hóa khoẻ mạnh mình tin dùng Optimum Gold nè các mom,https://www.facebook.com/groups/1710547889070752/posts/8802918259833644/?comment_id=8982362095222592,https://www.facebook.com/groups/1710547889070752/posts/8802918259833644/
2025-03-09T09:55:01.000Z,8982362218555913,,0,Nghi Dung Võ,Sữa Optimum Gold hỗ trợ tiêu hóa khoẻ mạnh để con hấp thu tối đa các dưỡng chất được nạp vào đó ạ,https://www.facebook.com/groups/1710547889070752/posts/8802918259833644/?comment_id=8982362218555913,https://www.facebook.com/groups/1710547889070752/posts/8802918259833644/
2025-03-09T09:55:06.000Z,8982362491889219,,0,Dương Trúc Quỳnh,"Mình để ý từ ngày đổi sang sữa Optimum Gold bé ăn tiêu tốt hơn ý, thấy bé ăn được nhiều hơn đó mom",https://www.facebook.com/groups/1710547889070752/posts/8802918259833644/?comment_id=8982362491889219,https://www.facebook.com/groups/1710547889070752/posts/8802918259833644/
2025-03-09T09:55:08.000Z,8982362578555877,,0,Đỗ Lê Nhung,"Mấy tháng nay bé không bị chướng bụng, ăn dễ tiêu hơn là do mình đổi sang Optimum Gold đó ạ",https://www.facebook.com/groups/1710547889070752/posts/8802918259833644/?comment_id=8982362578555877,https://www.facebook.com/groups/1710547889070752/posts/8802918259833644/
2025-03-09T09:55:10.000Z,8982362705222531,,0,Huỳnh Phối Liên,"Uống Optimum Gold bé đi phân đều đặn, không bị táo bón nữa đâu ạ",https://www.facebook.com/groups/1710547889070752/posts/8802918259833644/?comment_id=8982362705222531,https://www.facebook.com/groups/1710547889070752/posts/8802918259833644/
2025-03-09T09:55:11.000Z,8982362828555852,,0,Tú Trinh Huỳnh,"Uống Optimum Gold bé không hay trớ, không hay bị nôn nên mình quyết ko đổi sữa ạ",https://www.facebook.com/groups/1710547889070752/posts/8802918259833644/?comment_id=8982362828555852,https://www.facebook.com/groups/1710547889070752/posts/8802918259833644/
2025-03-09T09:55:23.000Z,8982363588555776,,0,Yên Ðan Dương,"Trước giờ mình vẫn cho bé uống Optimum Gold, trộm vía bé đi tốt, khuôn đẹp, ko bị táo ạ",https://www.facebook.com/groups/1710547889070752/posts/8802918259833644/?comment_id=8982363588555776,https://www.facebook.com/groups/1710547889070752/posts/8802918259833644/
2025-03-09T09:55:25.000Z,8982363695222432,,0,Lê Duy Nguyện,"Từ bữa đổi qua Optimum Gold thấy bé ăn ngon miệng, không kén ăn như trước nữa các mom ạ",https://www.facebook.com/groups/1710547889070752/posts/8802918259833644/?comment_id=8982363695222432,https://www.facebook.com/groups/1710547889070752/posts/8802918259833644/
2025-03-09T09:55:31.000Z,8982364068555728,,0,Ái Khanh Ngô,🤎💞💕💕🖤,https://www.facebook.com/groups/1710547889070752/posts/8802918259833644/?comment_id=8982364068555728,https://www.facebook.com/groups/1710547889070752/posts/8802918259833644/
2025-03-09T09:55:34.000Z,8982364288555706,,0,Ái Linh Nguyễn,"Muốn bé tiêu hóa tốt, không gặp vấn đề về dạ dày, ruột, các mẹ chuyển qua sữa Optimum Gold nhé",https://www.facebook.com/groups/1710547889070752/posts/8802918259833644/?comment_id=8982364288555706,https://www.facebook.com/groups/1710547889070752/posts/8802918259833644/
2025-03-09T09:55:41.000Z,8982364808555654,,0,Thủy Tâm Đào,"Nhờ uống Optimum Gold bé có hệ tiêu hóa hoạt động ổn định, không gây khó chịu, con ngoan ko quấy khóc nữa ạ",https://www.facebook.com/groups/1710547889070752/posts/8802918259833644/?comment_id=8982364808555654,https://www.facebook.com/groups/1710547889070752/posts/8802918259833644/
2025-03-09T09:55:54.000Z,8982365741888894,,0,Ái Khanh Ngô,Trong sữa Optimum Gold có chứa 2 tỷ lợi khuẩn và chất xơ hòa tan để hỗ trợ tiêu hóa tốt cho con đấy ạ,https://www.facebook.com/groups/1710547889070752/posts/8802918259833644/?comment_id=8982365741888894,https://www.facebook.com/groups/1710547889070752/posts/8802918259833644/
2025-03-09T09:56:03.000Z,8982366251888843,,0,Diễm Phúc Thái,"optimum Gold có chứa đạm whey alpha-lactalbumin dễ tiêu hóa, hỗ trợ bé tăng cân mẹ nhé",https://www.facebook.com/groups/1710547889070752/posts/8802918259833644/?comment_id=8982366251888843,https://www.facebook.com/groups/1710547889070752/posts/8802918259833644/
2025-03-09T09:56:05.000Z,8982366408555494,,0,Kiều Nguyệt Ngô,"E mới tìm hiểu thấy Optimum Gold có chứa đạm whey giúp dung nạp dưỡng chất tốt, bé tiêu hóa hấp thu được tốt hơn nha",https://www.facebook.com/groups/1710547889070752/posts/8802918259833644/?comment_id=8982366408555494,https://www.facebook.com/groups/1710547889070752/posts/8802918259833644/
2025-03-09T09:56:09.000Z,8982366638555471,,0,Gia Linh Phạm,Sữa Optimum Gold chứa những vi khuẩn tốt/lợi khuẩn giúp đường ruột của con khỏe hơn mẹ nhé,https://www.facebook.com/groups/1710547889070752/posts/8802918259833644/?comment_id=8982366638555471,https://www.facebook.com/groups/1710547889070752/posts/8802918259833644/
2025-03-09T09:56:12.000Z,8982366888555446,,0,Trần Mậu Xuân,"Mình thấy bé nhà mình dễ tiêu hóa, dễ hấp thu hơn khi đổi sang Optimum Gold đó mom",https://www.facebook.com/groups/1710547889070752/posts/8802918259833644/?comment_id=8982366888555446,https://www.facebook.com/groups/1710547889070752/posts/8802918259833644/
2025-03-09T09:56:36.000Z,8982368901888578,,0,Hà Thục Khanh,🌈🌈,https://www.facebook.com/groups/1710547889070752/posts/8802918259833644/?comment_id=8982368901888578,https://www.facebook.com/groups/1710547889070752/posts/8802918259833644/
2025-03-09T09:56:57.000Z,8982370231888445,,0,Lâm Thúy Hà,"Có mẹ nào muốn bé không bị táo bón hay tiêu chảy, tiêu hóa tốt rinh ngay Optimum Gold nha",https://www.facebook.com/groups/1710547889070752/posts/8802918259833644/?comment_id=8982370231888445,https://www.facebook.com/groups/1710547889070752/posts/8802918259833644/
2025-03-09T09:56:59.000Z,8982370341888434,,0,Lâm Thúy Hà,🌻🌻🌻,https://www.facebook.com/groups/1710547889070752/posts/8802918259833644/?comment_id=8982370341888434,https://www.facebook.com/groups/1710547889070752/posts/8802918259833644/
2025-03-09T09:57:04.000Z,8982370658555069,,0,Song Như Bùi,"Các mẹ ơi muốn bé có chế độ ăn uống ổn định, không bị rối loạn tiêu hóa,ruột hãy dùng Optimum Gold nha",https://www.facebook.com/groups/1710547889070752/posts/8802918259833644/?comment_id=8982370658555069,https://www.facebook.com/groups/1710547889070752/posts/8802918259833644/
