Date,Comment_ID,Parent_ID,Level,Author,Content,Permalink,Post_URL
2025-03-07T15:02:32.000Z,8972075476251254,8830698617055608,1,Diệu Linh,Huỳnh Nguyễn cải tiến nhìu đấy ạ,https://www.facebook.com/groups/1710547889070752/posts/8802918259833644/?comment_id=8830698617055608&reply_comment_id=8972075476251254,https://www.facebook.com/groups/1710547889070752/posts/8802918259833644/
2025-03-09T09:47:35.000Z,8982331468558988,,0,Nguyễn Diễm Phúc,"Được bác sĩ tư vấn nên mình mua Optimum Gold hỗ trợ giảm tình trạng rối loạn tiêu hóa cho bé, trộm vía con hợp sữa lắm!",https://www.facebook.com/groups/1710547889070752/posts/8802918259833644/?comment_id=8982331468558988,https://www.facebook.com/groups/1710547889070752/posts/8802918259833644/
2025-03-09T09:47:36.000Z,8982331551892313,,0,Trịnh Trương Duyên,"Từ ngày uống Optimum Gold hỗ trợ giảm tình trạng rối loạn tiêu hóa, bé nhà mình không còn bị đầy hơi, mẹ rất yên tâm.",https://www.facebook.com/groups/1710547889070752/posts/8802918259833644/?comment_id=8982331551892313,https://www.facebook.com/groups/1710547889070752/posts/8802918259833644/
2025-03-09T09:47:40.000Z,8982331821892286,,0,Nhã Thanh Huỳnh,"nhờ Optimum Gold dễ tiêu hóa, dễ hấp thụ, con uống được hơn tháng không còn bị táo bón hay đau bụng vặt nữa.",https://www.facebook.com/groups/1710547889070752/posts/8802918259833644/?comment_id=8982331821892286,https://www.facebook.com/groups/1710547889070752/posts/8802918259833644/
2025-03-09T09:47:45.000Z,8982332111892257,,0,Xuân Nghi Lý,"Hỗ trợ tiêu hóa tốt, giúp bé hấp thu dinh dưỡng hiệu quả, mẹ nào chưa thử thì nên mua Optimum Gold hỗ trợ giảm tình trạng rối loạn tiêu hóa ngay nhé!",https://www.facebook.com/groups/1710547889070752/posts/8802918259833644/?comment_id=8982332111892257,https://www.facebook.com/groups/1710547889070752/posts/8802918259833644/
2025-03-09T09:47:49.000Z,8982332368558898,,0,Ngọc Ái Doãn,"Bé nhà mình dùng Optimum Gold hỗ trợ giảm tình trạng rối loạn tiêu hóa, trộm vía không còn bị đầy bụng, tiêu hóa tốt hơn hẳn.",https://www.facebook.com/groups/1710547889070752/posts/8802918259833644/?comment_id=8982332368558898,https://www.facebook.com/groups/1710547889070752/posts/8802918259833644/
2025-03-09T09:47:56.000Z,8982332735225528,,0,Lê Tâm Nguyệt,"Nhiều mẹ khen sữa này giúp tiêu hóa khỏe, mình mua thử và thấy đúng thật, Optimum Gold hỗ trợ giảm tình trạng rối loạn tiêu hóa hiệu quả lắm!",https://www.facebook.com/groups/1710547889070752/posts/8802918259833644/?comment_id=8982332735225528,https://www.facebook.com/groups/1710547889070752/posts/8802918259833644/
2025-03-09T09:47:57.000Z,8982332795225522,,0,Mai Chi Phan,"Từ khi uống Optimum Gold hỗ trợ giảm tình trạng rối loạn tiêu hóa, con ăn uống ngon miệng hơn, không còn sợ uống sữa như trước.",https://www.facebook.com/groups/1710547889070752/posts/8802918259833644/?comment_id=8982332795225522,https://www.facebook.com/groups/1710547889070752/posts/8802918259833644/
2025-03-09T09:48:07.000Z,8982333505225451,,0,Dung Dong,"Optimum Gold hỗ trợ giảm tình trạng rối loạn tiêu hóa, từ ngày con uống, mẹ đỡ lo lắng hơn rất nhiều về vấn đề tiêu hóa của bé.",https://www.facebook.com/groups/1710547889070752/posts/8802918259833644/?comment_id=8982333505225451,https://www.facebook.com/groups/1710547889070752/posts/8802918259833644/
2025-03-09T09:48:10.000Z,8982333745225427,,0,Hà Yến Uyên,"Trước đây con hay bị đầy hơi, từ ngày dùng Optimum Gold phù hợp để hỗ trợ cho các bé gặp vấn đề tiêu hóa, bé tiêu hóa khỏe hơn nhiều.",https://www.facebook.com/groups/1710547889070752/posts/8802918259833644/?comment_id=8982333745225427,https://www.facebook.com/groups/1710547889070752/posts/8802918259833644/
2025-03-09T09:48:13.000Z,8982333905225411,,0,Ngân Hà Võ,"Từ khi dùng Optimum Gold phù hợp để hỗ trợ cho các bé gặp vấn đề tiêu hóa, con không còn đau bụng vặt hay quấy khóc ban đêm nữa.",https://www.facebook.com/groups/1710547889070752/posts/8802918259833644/?comment_id=8982333905225411,https://www.facebook.com/groups/1710547889070752/posts/8802918259833644/
2025-03-09T09:48:14.000Z,8982334025225399,,0,Trần Ðan Thu,"Sữa dễ uống, dễ hấp thu, nhờ Optimum Gold phù hợp để hỗ trợ cho các bé gặp vấn đề tiêu hóa, con mình ăn ngon miệng hơn.",https://www.facebook.com/groups/1710547889070752/posts/8802918259833644/?comment_id=8982334025225399,https://www.facebook.com/groups/1710547889070752/posts/8802918259833644/
2025-03-09T09:48:16.000Z,8982334131892055,,0,Oanh Dinh,Mình rất hài lòng khi thấy con tiêu hóa khỏe mạnh hơn nhờ Optimum Gold phù hợp để hỗ trợ cho các bé gặp vấn đề tiêu hóa.,https://www.facebook.com/groups/1710547889070752/posts/8802918259833644/?comment_id=8982334131892055,https://www.facebook.com/groups/1710547889070752/posts/8802918259833644/
2025-03-09T09:48:21.000Z,8982334565225345,,0,Lê Diệu Ngà,"Tiêu hóa khỏe thì con mới hấp thu tốt, Optimum Gold phù hợp để hỗ trợ cho các bé gặp vấn đề tiêu hóa, mẹ nào chưa thử thì nên mua ngay nhé!",https://www.facebook.com/groups/1710547889070752/posts/8802918259833644/?comment_id=8982334565225345,https://www.facebook.com/groups/1710547889070752/posts/8802918259833644/
2025-03-09T09:48:23.000Z,8982334681892000,,0,Hồ Khánh Quỳnh,"Nhiều mẹ review tốt về Optimum Gold phù hợp để hỗ trợ cho các bé gặp vấn đề tiêu hóa, mình thử và thấy con tiêu hóa khỏe hơn thật.",https://www.facebook.com/groups/1710547889070752/posts/8802918259833644/?comment_id=8982334681892000,https://www.facebook.com/groups/1710547889070752/posts/8802918259833644/
2025-03-09T09:48:31.000Z,8982335271891941,,0,Đặng Phương Thảo,"Được nhiều mẹ giới thiệu Optimum Gold phù hợp để hỗ trợ cho các bé gặp vấn đề tiêu hóa, mình dùng thử và thấy bé hấp thu tốt hơn hẳn.",https://www.facebook.com/groups/1710547889070752/posts/8802918259833644/?comment_id=8982335271891941,https://www.facebook.com/groups/1710547889070752/posts/8802918259833644/
2025-03-09T09:48:41.000Z,8982336025225199,,0,Dương Tuệ Lâm,"Bé hấp thu tốt hơn, tiêu hóa khỏe mạnh nhờ Optimum Gold phù hợp để hỗ trợ cho các bé gặp vấn đề tiêu hóa, mẹ nào chưa thử thì nên cân nhắc nhé!",https://www.facebook.com/groups/1710547889070752/posts/8802918259833644/?comment_id=8982336025225199,https://www.facebook.com/groups/1710547889070752/posts/8802918259833644/
2025-03-09T09:48:45.000Z,8982336238558511,,0,Gia Thy Lê,Mình yên tâm hơn khi thấy con tiêu hóa ổn định hơn nhờ Optimum Gold phù hợp để hỗ trợ cho các bé gặp vấn đề tiêu hóa.,https://www.facebook.com/groups/1710547889070752/posts/8802918259833644/?comment_id=8982336238558511,https://www.facebook.com/groups/1710547889070752/posts/8802918259833644/
2025-03-09T09:48:52.000Z,8982337115225090,,0,Lâm Diệu Bình,😏🤓,https://www.facebook.com/groups/1710547889070752/posts/8802918259833644/?comment_id=8982337115225090,https://www.facebook.com/groups/1710547889070752/posts/8802918259833644/
2025-03-09T09:48:55.000Z,8982337358558399,,0,Lâm Diệu Bình,"Hỗ trợ tiêu hóa tốt, giúp con ít bị đầy bụng, mẹ nào đang loay hoay chọn sữa thì thử ngay Optimum Gold phù hợp để hỗ trợ cho các bé gặp vấn đề tiêu hóa nhé!",https://www.facebook.com/groups/1710547889070752/posts/8802918259833644/?comment_id=8982337358558399,https://www.facebook.com/groups/1710547889070752/posts/8802918259833644/
2025-03-09T09:48:56.000Z,8982337401891728,,0,Linh Lan Phan,"Được bác sĩ dinh dưỡng khuyên dùng Optimum Gold phù hợp để hỗ trợ cho các bé gặp vấn đề tiêu hóa, mình tin tưởng và thấy bé tiêu hóa tốt hơn.",https://www.facebook.com/groups/1710547889070752/posts/8802918259833644/?comment_id=8982337401891728,https://www.facebook.com/groups/1710547889070752/posts/8802918259833644/
2025-03-09T09:48:58.000Z,8982337495225052,,0,Thúy Hương Ngô,"Lúc đầu mình cũng lo con không hợp, nhưng nhờ Optimum Gold phù hợp để hỗ trợ cho các bé gặp vấn đề tiêu hóa, bé tiêu hóa ổn định, tăng cân đều.",https://www.facebook.com/groups/1710547889070752/posts/8802918259833644/?comment_id=8982337495225052,https://www.facebook.com/groups/1710547889070752/posts/8802918259833644/
2025-03-09T09:49:03.000Z,8982337811891687,,0,Hoàng Phương Ngô,"Thấy các mom trong hội bỉm sữa khen Optimum Gold phù hợp để hỗ trợ cho các bé gặp vấn đề tiêu hóa, mình mua thử và kết quả rất tốt!",https://www.facebook.com/groups/1710547889070752/posts/8802918259833644/?comment_id=8982337811891687,https://www.facebook.com/groups/1710547889070752/posts/8802918259833644/
2025-03-09T09:49:07.000Z,8982338105224991,,0,Ngô Thủy Hồng,"Đổi sữa bao nhiêu lần không hợp, may mà gặp Optimum Gold phù hợp để hỗ trợ cho các bé gặp vấn đề tiêu hóa, giờ con ăn uống ngon miệng hơn.",https://www.facebook.com/groups/1710547889070752/posts/8802918259833644/?comment_id=8982338105224991,https://www.facebook.com/groups/1710547889070752/posts/8802918259833644/
2025-03-09T09:49:08.000Z,8982338211891647,,0,Lê Phương An,"Mình lo con không hấp thu đủ dưỡng chất, may mà có Optimum Gold phù hợp để hỗ trợ cho các bé gặp vấn đề tiêu hóa, giờ bé phát triển ổn định.",https://www.facebook.com/groups/1710547889070752/posts/8802918259833644/?comment_id=8982338211891647,https://www.facebook.com/groups/1710547889070752/posts/8802918259833644/
2025-03-09T09:49:10.000Z,8982338291891639,,0,Phí Vân Ly,"Sữa này dễ uống, không quá ngọt, giúp con tiêu hóa khỏe hơn, mẹ nào có bé hay bị táo bón thử ngay Optimum Gold phù hợp để hỗ trợ cho các bé gặp vấn đề tiêu hóa nhé!",https://www.facebook.com/groups/1710547889070752/posts/8802918259833644/?comment_id=8982338291891639,https://www.facebook.com/groups/1710547889070752/posts/8802918259833644/
2025-03-09T09:49:13.000Z,8982338461891622,,0,Huỳnh Diễm Trang,"Optimum Gold phù hợp để hỗ trợ cho các bé gặp vấn đề tiêu hóa, nay con mình tiêu hóa tốt hơn, ít ốm vặt, mẹ yên tâm hơn hẳn.",https://www.facebook.com/groups/1710547889070752/posts/8802918259833644/?comment_id=8982338461891622,https://www.facebook.com/groups/1710547889070752/posts/8802918259833644/
2025-03-09T09:49:15.000Z,8982338588558276,,0,Quỳnh Dương,"Mình rất ấn tượng với công thức của Optimum Gold phù hợp để hỗ trợ cho các bé gặp vấn đề tiêu hóa, thực sự giúp bé tiêu hóa tốt hơn.",https://www.facebook.com/groups/1710547889070752/posts/8802918259833644/?comment_id=8982338588558276,https://www.facebook.com/groups/1710547889070752/posts/8802918259833644/
2025-03-09T09:49:17.000Z,8982338695224932,,0,Cam Van Anh,"Chỉ sau 1 tháng dùng Optimum Gold phù hợp để hỗ trợ cho các bé gặp vấn đề tiêu hóa, mình thấy con ít đầy hơi hơn hẳn.",https://www.facebook.com/groups/1710547889070752/posts/8802918259833644/?comment_id=8982338695224932,https://www.facebook.com/groups/1710547889070752/posts/8802918259833644/
2025-03-09T09:49:19.000Z,8982338811891587,,0,Phan Thảo Trân,"Bé mình trước đây uống sữa hay bị chướng bụng, giờ uống Optimum Gold phù hợp để hỗ trợ cho các bé gặp vấn đề tiêu hóa thì đỡ hẳn.",https://www.facebook.com/groups/1710547889070752/posts/8802918259833644/?comment_id=8982338811891587,https://www.facebook.com/groups/1710547889070752/posts/8802918259833644/
2025-03-09T09:49:23.000Z,8982339058558229,,0,Nguyen Ngoc Lan,🌝🌝🌝,https://www.facebook.com/groups/1710547889070752/posts/8802918259833644/?comment_id=8982339058558229,https://www.facebook.com/groups/1710547889070752/posts/8802918259833644/
2025-03-09T09:49:25.000Z,8982339151891553,,0,Nguyen Ngoc Lan,"Con ngủ ngon hơn, không còn bị đau bụng vặt từ khi uống Optimum Gold phù hợp để hỗ trợ cho các bé gặp vấn đề tiêu hóa.",https://www.facebook.com/groups/1710547889070752/posts/8802918259833644/?comment_id=8982339151891553,https://www.facebook.com/groups/1710547889070752/posts/8802918259833644/
2025-03-09T09:49:27.000Z,8982339291891539,,0,Thúy Vi Hoàng,"Optimum Gold phù hợp để hỗ trợ cho các bé gặp vấn đề tiêu hóa, mẹ nào còn băn khoăn chọn sữa thì nên thử ngay!",https://www.facebook.com/groups/1710547889070752/posts/8802918259833644/?comment_id=8982339291891539,https://www.facebook.com/groups/1710547889070752/posts/8802918259833644/
2025-03-09T09:49:30.000Z,8982339471891521,,0,Nguyễn Ánh Hương,"Bác sĩ có khuyên mình thử Optimum Gold phù hợp để hỗ trợ cho các bé gặp vấn đề tiêu hóa, kết quả làm mình rất hài lòng.",https://www.facebook.com/groups/1710547889070752/posts/8802918259833644/?comment_id=8982339471891521,https://www.facebook.com/groups/1710547889070752/posts/8802918259833644/
2025-03-09T09:49:31.000Z,8982339655224836,,0,Vân Khánh Lê,Bé không còn quấy khóc vì đầy hơi từ khi chuyển qua Optimum Gold phù hợp để hỗ trợ cho các bé gặp vấn đề tiêu hóa.,https://www.facebook.com/groups/1710547889070752/posts/8802918259833644/?comment_id=8982339655224836,https://www.facebook.com/groups/1710547889070752/posts/8802918259833644/
2025-03-09T09:49:43.000Z,8982340315224770,,0,Bùi Phương Thủy,"Trước đây mỗi lần bé uống sữa xong là bị ọc, giờ chuyển sang Optimum Gold phù hợp để hỗ trợ cho các bé gặp vấn đề tiêu hóa thì không còn nữa.",https://www.facebook.com/groups/1710547889070752/posts/8802918259833644/?comment_id=8982340315224770,https://www.facebook.com/groups/1710547889070752/posts/8802918259833644/
2025-03-09T09:49:45.000Z,8982340435224758,,0,Sơn Ca Ngô,"Chọn sữa quan trọng lắm, mình đã tìm hiểu kỹ và quyết định chọn Optimum Gold phù hợp để hỗ trợ cho các bé gặp vấn đề tiêu hóa.",https://www.facebook.com/groups/1710547889070752/posts/8802918259833644/?comment_id=8982340435224758,https://www.facebook.com/groups/1710547889070752/posts/8802918259833644/
2025-03-09T09:49:46.000Z,8982340548558080,,0,Vũ Yến Nhi,"Bé có vẻ thích vị của sữa này, từ ngày uống Optimum Gold phù hợp để hỗ trợ cho các bé gặp vấn đề tiêu hóa, con chịu hợp tác hơn hẳn.",https://www.facebook.com/groups/1710547889070752/posts/8802918259833644/?comment_id=8982340548558080,https://www.facebook.com/groups/1710547889070752/posts/8802918259833644/
2025-03-09T09:49:50.000Z,8982340785224723,,0,Phạm Hạnh Chi,"Không chỉ tiêu hóa tốt hơn, con còn lanh lợi, hoạt bát hơn từ khi dùng Optimum Gold phù hợp để hỗ trợ cho các bé gặp vấn đề tiêu hóa.",https://www.facebook.com/groups/1710547889070752/posts/8802918259833644/?comment_id=8982340785224723,https://www.facebook.com/groups/1710547889070752/posts/8802918259833644/
2025-03-09T09:49:52.000Z,8982340958558039,,0,Nga Lâm,"Được chị đồng nghiệp giới thiệu Optimum Gold phù hợp để hỗ trợ cho các bé gặp vấn đề tiêu hóa, mình dùng thử và thấy rất hiệu quả.",https://www.facebook.com/groups/1710547889070752/posts/8802918259833644/?comment_id=8982340958558039,https://www.facebook.com/groups/1710547889070752/posts/8802918259833644/
2025-03-09T09:49:54.000Z,8982341091891359,,0,Nguyễn Thu Sương,"Bé không còn biếng ăn, hấp thu tốt hơn từ khi uống Optimum Gold phù hợp để hỗ trợ cho các bé gặp vấn đề tiêu hóa, mẹ cực kỳ yên tâm.",https://www.facebook.com/groups/1710547889070752/posts/8802918259833644/?comment_id=8982341091891359,https://www.facebook.com/groups/1710547889070752/posts/8802918259833644/
2025-03-09T09:49:56.000Z,8982341225224679,,0,Phương Thùy Phan,"Hỗ trợ tiêu hóa tốt, giúp bé tăng cân khỏe mạnh, Optimum Gold phù hợp để hỗ trợ cho các bé gặp vấn đề tiêu hóa là lựa chọn mình tin tưởng.",https://www.facebook.com/groups/1710547889070752/posts/8802918259833644/?comment_id=8982341225224679,https://www.facebook.com/groups/1710547889070752/posts/8802918259833644/
2025-03-09T09:50:09.000Z,8982342125224589,,0,Hồ Thúy Hà,"Nếu mẹ nào đang tìm sữa giúp con tiêu hóa tốt hơn, thì Optimum Gold phù hợp để hỗ trợ cho các bé gặp vấn đề tiêu hóa là lựa chọn hoàn hảo.",https://www.facebook.com/groups/1710547889070752/posts/8802918259833644/?comment_id=8982342125224589,https://www.facebook.com/groups/1710547889070752/posts/8802918259833644/
2025-03-09T09:50:11.000Z,8982342298557905,,0,Nguyễn Bạch Trà,"Không còn cảnh bé khóc vì đau bụng sau khi uống sữa, Optimum Gold phù hợp để hỗ trợ cho các bé gặp vấn đề tiêu hóa đúng là cứu tinh của mẹ!",https://www.facebook.com/groups/1710547889070752/posts/8802918259833644/?comment_id=8982342298557905,https://www.facebook.com/groups/1710547889070752/posts/8802918259833644/
2025-03-09T09:50:20.000Z,8982343025224499,,0,Hồ Thùy Dương,"Bé uống sữa xong không còn ọc sữa như trước, đúng là Optimum Gold phù hợp để hỗ trợ cho các bé gặp vấn đề tiêu hóa rất hợp với con.",https://www.facebook.com/groups/1710547889070752/posts/8802918259833644/?comment_id=8982343025224499,https://www.facebook.com/groups/1710547889070752/posts/8802918259833644/
2025-03-09T09:50:36.000Z,8982344131891055,,0,Thư Lan Phan,"Nhiều loại sữa làm con bị khó tiêu, nhưng Optimum Gold phù hợp để hỗ trợ cho các bé gặp vấn đề tiêu hóa lại giúp con tiêu hóa khỏe mạnh.",https://www.facebook.com/groups/1710547889070752/posts/8802918259833644/?comment_id=8982344131891055,https://www.facebook.com/groups/1710547889070752/posts/8802918259833644/
2025-03-09T09:50:37.000Z,8982344205224381,,0,Đỗ Thanh Hoa,"Hệ tiêu hóa khỏe thì con mới phát triển tốt, nhờ Optimum Gold phù hợp để hỗ trợ cho các bé gặp vấn đề tiêu hóa, con ăn ngon hơn, ngủ tốt hơn.",https://www.facebook.com/groups/1710547889070752/posts/8802918259833644/?comment_id=8982344205224381,https://www.facebook.com/groups/1710547889070752/posts/8802918259833644/
2025-03-09T09:50:40.000Z,8982344505224351,,0,Nguyễn Ngọc,"Không còn nỗi lo con bị đầy hơi mỗi ngày, mẹ nào có bé gặp vấn đề tiêu hóa thì thử ngay Optimum Gold phù hợp để hỗ trợ cho các bé gặp vấn đề tiêu hóa.",https://www.facebook.com/groups/1710547889070752/posts/8802918259833644/?comment_id=8982344505224351,https://www.facebook.com/groups/1710547889070752/posts/8802918259833644/
2025-03-09T09:50:42.000Z,8982344458557689,,0,Hồ Hạ My,"Mình thấy sự khác biệt rõ rệt sau khi đổi sang Optimum Gold phù hợp để hỗ trợ cho các bé gặp vấn đề tiêu hóa, bé nhà mình hấp thu tốt hơn nhiều!",https://www.facebook.com/groups/1710547889070752/posts/8802918259833644/?comment_id=8982344458557689,https://www.facebook.com/groups/1710547889070752/posts/8802918259833644/
2025-03-09T09:50:47.000Z,8982344808557654,,0,Dương Tuyết Mai,"Không ngờ sữa lại ảnh hưởng đến tiêu hóa của bé nhiều đến vậy, Optimum Gold phù hợp để hỗ trợ cho các bé gặp vấn đề tiêu hóa, mẹ nào cũng nên thử.",https://www.facebook.com/groups/1710547889070752/posts/8802918259833644/?comment_id=8982344808557654,https://www.facebook.com/groups/1710547889070752/posts/8802918259833644/
2025-03-09T09:50:48.000Z,8982344928557642,,0,Phạm Vũ Linh,❣️❣️,https://www.facebook.com/groups/1710547889070752/posts/8802918259833644/?comment_id=8982344928557642,https://www.facebook.com/groups/1710547889070752/posts/8802918259833644/
2025-03-09T09:50:51.000Z,8982345161890952,,0,Ngô Thủy Quỳnh,"Bé chịu uống sữa mà không còn bị đau bụng hay đầy hơi, Optimum Gold phù hợp để hỗ trợ cho các bé gặp vấn đề tiêu hóa đúng là lựa chọn đúng đắn!",https://www.facebook.com/groups/1710547889070752/posts/8802918259833644/?comment_id=8982345161890952,https://www.facebook.com/groups/1710547889070752/posts/8802918259833644/
2025-03-09T09:50:55.000Z,8982345428557592,,0,Lê Mỹ Trang,"Thấy con vui vẻ, không còn quấy khóc vì đau bụng, mẹ biết rằng Optimum Gold phù hợp để hỗ trợ cho các bé gặp vấn đề tiêu hóa là sự lựa chọn đúng.",https://www.facebook.com/groups/1710547889070752/posts/8802918259833644/?comment_id=8982345428557592,https://www.facebook.com/groups/1710547889070752/posts/8802918259833644/
2025-03-09T09:50:59.000Z,8982345711890897,,0,Lan Vy Phan,"Tiêu hóa khỏe mạnh là nền tảng để con phát triển tốt hơn, nhờ Optimum Gold phù hợp để hỗ trợ cho các bé gặp vấn đề tiêu hóa, mẹ không còn lo lắng.",https://www.facebook.com/groups/1710547889070752/posts/8802918259833644/?comment_id=8982345711890897,https://www.facebook.com/groups/1710547889070752/posts/8802918259833644/
2025-03-09T09:51:05.000Z,8982346071890861,,0,Trần Ánh Lệ,"Uống sữa mà không lo đầy bụng, khó tiêu, mình thực sự ưng ý với Optimum Gold phù hợp để hỗ trợ cho các bé gặp vấn đề tiêu hóa.",https://www.facebook.com/groups/1710547889070752/posts/8802918259833644/?comment_id=8982346071890861,https://www.facebook.com/groups/1710547889070752/posts/8802918259833644/
2025-03-09T09:51:08.000Z,8982346325224169,,0,Võ Ngọc Quế,"Các mẹ nên thử ngay Optimum Gold phù hợp để hỗ trợ cho các bé gặp vấn đề tiêu hóa, mình thấy con ăn ngon, ngủ tốt hơn từ khi đổi sữa.",https://www.facebook.com/groups/1710547889070752/posts/8802918259833644/?comment_id=8982346325224169,https://www.facebook.com/groups/1710547889070752/posts/8802918259833644/
2025-03-09T09:51:12.000Z,8982346515224150,,0,Trần Chi Mai,"Không chỉ tốt cho hệ tiêu hóa, Optimum Gold phù hợp để hỗ trợ cho các bé gặp vấn đề tiêu hóa còn giúp con phát triển trí não nữa!",https://www.facebook.com/groups/1710547889070752/posts/8802918259833644/?comment_id=8982346515224150,https://www.facebook.com/groups/1710547889070752/posts/8802918259833644/
2025-03-09T09:51:17.000Z,8982346858557449,,0,Phạm Hải Yến,"Nhờ Optimum Gold phù hợp để hỗ trợ cho các bé gặp vấn đề tiêu hóa, con không còn bị táo bón hay tiêu chảy, mẹ yên tâm vô cùng.",https://www.facebook.com/groups/1710547889070752/posts/8802918259833644/?comment_id=8982346858557449,https://www.facebook.com/groups/1710547889070752/posts/8802918259833644/
2025-03-09T09:51:21.000Z,8982347128557422,,0,Bách Hy Lê,"Lựa chọn sữa cho con rất quan trọng, may mà mình tìm được Optimum Gold phù hợp để hỗ trợ cho các bé gặp vấn đề tiêu hóa, bé hợp sữa và phát triển tốt!",https://www.facebook.com/groups/1710547889070752/posts/8802918259833644/?comment_id=8982347128557422,https://www.facebook.com/groups/1710547889070752/posts/8802918259833644/
2025-03-09T09:51:28.000Z,8982347578557377,,0,Minh Khuê Vũ,"Trộm vía bé dùng Optimum với đột phá 6 HMO rất hợp, tiêu hóa tốt, ít bị bón lắm nha",https://www.facebook.com/groups/1710547889070752/posts/8802918259833644/?comment_id=8982347578557377,https://www.facebook.com/groups/1710547889070752/posts/8802918259833644/
2025-03-09T09:51:30.000Z,8982347715224030,,0,Lâm Mỹ Tâm,"Thử cho con uống sữa này một thời gian, mình nhận thấy Optimum là lựa chọn tốt để bổ sung dinh dưỡng cho con",https://www.facebook.com/groups/1710547889070752/posts/8802918259833644/?comment_id=8982347715224030,https://www.facebook.com/groups/1710547889070752/posts/8802918259833644/
2025-03-09T09:51:31.000Z,8982347795224022,,0,Mai Anh Phan,"Các mẹ đừng quên, Optimum có nhiều HMO nhất thị trường, giúp bé yêu phát triển mạnh mẽ mỗi ngày",https://www.facebook.com/groups/1710547889070752/posts/8802918259833644/?comment_id=8982347795224022,https://www.facebook.com/groups/1710547889070752/posts/8802918259833644/
2025-03-09T09:51:37.000Z,8982348221890646,,0,Đỗ Trà Giang,Bé nhà mình bắt đầu thích uống sữa hơn từ khi đổi sang sữa bột pha sẵn Optimum tiện dụng cho bé,https://www.facebook.com/groups/1710547889070752/posts/8802918259833644/?comment_id=8982348221890646,https://www.facebook.com/groups/1710547889070752/posts/8802918259833644/
2025-03-09T09:51:39.000Z,8982348281890640,,0,Mai Anh Phan,"Mẹ nào đang tìm sữa tăng đề kháng cho con thì thử ngay Optimum với đột phá 6 HMO, bé mình dùng thấy hiệu quả rõ rệt lun",https://www.facebook.com/groups/1710547889070752/posts/8802918259833644/?comment_id=8982348281890640,https://www.facebook.com/groups/1710547889070752/posts/8802918259833644/
